頁碼,內容類型,內容
301,Judges,"Judges: CHRISTOPHER C. CONNER, United States District Judge."
301,Opinion by,Opinion by: CHRISTOPHER C. CONNER
309,Counsel,"Counsel: William F. Gallagher, with whom were William J. Sweeney and, on the brief, Hugh D. Hughes and R. 
Bartley  [***4] Halloran, for the appellant (plaintiff).
Jeffrey J. Mirman, with whom were John F. Droney, Jr., and, on the brief, Kurt F. Zimmerman and Leonard K. 
Atkinson, for the appellee (named defendant).
Jeffrey J. White, with whom were Craig A. Raabe and, on the brief, Edward J. Heath and Jamie M. Landry, for the 
appellee (defendant city of Bridgeport).
Ira B. Grudberg, with whom were Christian Young and, on the brief, Trisha M. Morris, for the appellees (defendant 
Crescent Avenue Development Company, LLC, et al.).
Hubert J. Santos, with whom were Jeffrey R. Hellman and, on the brief, Sandra Snaden Kuwaye, for the appellees 
(defendant Charles J. Willinger, Jr., et al.)."
309,Judges,"Judges: Palmer, Zarella, DiPentima, Lavine and Beach, Js. PALMER, J. In this opinion the other justices 
concurred."
309,Opinion by,Opinion by: PALMER
320,Counsel,"Counsel: Carl W. Hittinger argued the cause for appellant. With him on the briefs was Earl J. Silbert.
Mark S. Hegedus, Attorney, Federal Trade Commission, argued the cause for appellee. With him on the brief were 
Willard K. Tom, General Counsel, David C. Shonka, Principal Deputy General Counsel, John F. Daly, Deputy 
General Counsel, and Leslie Rice Melman, Assistant General Counsel.
R. Craig Lawrence, Assistant U.S. Attorney, entered an appearance."
320,Judges,"Judges: Before: SENTELLE, Chief Judge, GINSBURG,* Circuit Judge, and WILLIAMS, Senior Circuit Judge."
320,Opinion by,Opinion by: GINSBURG
328,Counsel,"Counsel: Scott E. Perwin of Kenny Nachwalter et al., Miami, for appellants.
Cristina Alonso and Charles M. Rosenberg of Carlton Fields, P.A., Miami, and Daniel G. Swanson of Gibson Dunn 
& Crutcher, LLP, Los Angeles, CA, for appellees, International Paint, Ltd. and International Paint, LLC.
A. Rodger Traynor, Jr., Ronald B. Ravikoff and Francisco A. Rodriguez of Akerman Senterfitt, Miami, for appellee, 
Donovan Marine, Inc.
Charles A. Morehead, III of Moody, Jones, Ingino & Morehead, P.A., Plantation, for appellee, East Coast Marine 
Distributors, Inc."
329,Judges,"Judges: CIKLIN, J. MAY, C.J., and STEVENSON, J., concur."
329,Opinion by,Opinion by: CIKLIN
359,Counsel,"Counsel:  [*1] For Stephen Collins, Plaintiff: Steven A. Asher, LEAD ATTORNEY, Weinstein Kitchenoff & Asher 
LLC, Philadelphia, PA.
For Nicholas L. Jenkins, Plaintiff: Steve W. Berman, LEAD ATTORNEY, PRO HAC VICE, Hagens Berman Sobol 
Shapiro LLP, Seattle, WA.
For John C. Gornik, Plaintiff: Andrew B. Bullion, LEAD ATTORNEY, Hausfeld LLP, Washington, DC.
For Susana Saldana, Plaintiff: Manuel Juan Dominguez, LEAD ATTORNEY, Cohen Milstein Sellers & Toll, Palm 
Beach Gardens, FL; James Christopher Magid, Berman DeValerio, San Francisco, CA.
For Ian Reynell, Plaintiff: Manuel Juan Dominguez, LEAD ATTORNEY, Cohen Milstein Sellers & Toll, Palm Beach 
Gardens, FL.
For Teresa Willstaedt, Plaintiff: Lee Albert, LEAD ATTORNEY, Murray Frank LLP, New York, NY; Mary Jane 
Edelstein Fait, Wolf Haldenstein Adler Freeman Herz LLP, Chicago, IL.
For Matthew Graham, Plaintiff: Stephen Michael Garcia, LEAD ATTORNEY, Garcia Law Firm, Long Beach, CA.
For Anne R. Rossi, Plaintiff: Joseph C. Kohn, LEAD ATTORNEY, Kohn Swift & Graf P.C., Philadelphia, PA.
For Kenneth R. Manyin, Plaintiff: David B. Krauss, LEAD ATTORNEY, Law Office of David B. Krauss, New York, 
NY; Eugene A. Spector, Spector Roseman Kodroff &  [*2] Willis, PC, Philadelphia, PA.
For Alfred T. Martini, Plaintiff: Craig C. Corbitt, LEAD ATTORNEY, Zelle Hofmann Voelbel & Mason LLP, San 
Francisco, CA; Michael Paul Lehmann, LEAD ATTORNEY, Hausfeld LLP, San Francisco, CA; William Timothy 
Needham, Janssen Malloy Needham Morrison Reinholsten Crowley & Griego, Eureka, CA.
For Michael McNamara,Johanna Douglass, Jane Vargas, Denis Farinelli, David Farinelli, Judy Dale Wolff, James 
Penrose, Monica Penrose, J. Michael Kelley, Marsha A. Kelley, J. Merrick Kelley, Valerie Coleman, Patricia Santini, 

 
Albert Santini, Benjamin Lazare, Heather Proulx, Yoshido Matsuda, Frank Bowling, Mary Bruce, Carmine Galotta, 
Franca Gargiulo, Hilda Icho, Hormoz Youkhanel, Azita Youkhanel, Emily Jerman, Plaintiff: Christopher Lovell, 
LEAD ATTORNEY, Lovell Stewart Halebian LLP, New York, NY.
For Gabrielle Blythin, Peter Blythin, Brad Grulke, Tiana Gutierrez, Ryan McGovern, Plaintiff: Marvin Alan Miller, 
LEAD ATTORNEY, Miller Law LLC, Chicago, IL.
For Mark Levy, Sarah Rosenberg, Plaintiff: Bonny E. Sweeney, David W. Mitchell, LEAD ATTORNEY, Coughlin 
Stoia Geller Rudman & Robbins LLP, San Diego, CA; Christopher M. Burke, LEAD ATTORNEY, Scott + Scott LLP, 
San Diego, CA;  [*3] Robert M. Rothman, LEAD ATTORNEY, Coughlin Stoia Geller Rudman & Robbins LLP, 
Melville, NY.
For Corinne Weber, Plaintiff: Guido Saveri, LEAD ATTORNEY, Cadio R. Zirpoli, Richard Alexander Saveri, Saveri 
& Saveri, Inc., San Francisco, CA.
For Kambiz Pahlavan, Plaintiff: Bruce Lee Simon, LEAD ATTORNEY, Pearson, Simon, Warshaw & Penny, LLP, 
San Francisco, CA; Henry A. Cirillo, Smith Dollar PC, Santa Rosa, CA.
For Corissa A. McDill, Plaintiff: Allan Steyer, LEAD ATTORNEY, Steyer Lowenthal Boodrookas Alvarez & Smith 
LLP, San Francisco, CA; Daniel D. Owen, Shughart Thomson & Kilroy, P.C., Kansas City, MO.
For John Fadden, Plaintiff: James S. Shedden, LEAD ATTORNEY, Schad, Diamond & Shedden, P.C., Chicago, IL; 
Steven J. Tomiello, Beeler, Schad & Diamond, P.C., Chicago, IL.
For Mary Ann McGrath, Plaintiff: James S. Shedden, LEAD ATTORNEY, Schad, Diamond & Shedden, P.C., 
Chicago, IL.
For Charles Chin, Plaintiff: Matthew Eric Van Tine, LEAD ATTORNEY, Miller Law LLC, Chicago, IL; Guri Ademi, 
Ademi & O'Reilly LLP, Cudahy, WI.
For Supriya Mantri, Marcia Szelewski, Plaintiff: Matthew Eric Van Tine, LEAD ATTORNEY, Miller Law LLC, 
Chicago, IL.
Deborah Holley, Plaintiff, Pro se.
For Trevor Hughes, Plaintiff:  [*4] Eric H. Gibbs, LEAD ATTORNEY, Girard Gibbs LLP, San Francisco, CA.
For Brian Bank, Plaintiff: Adam C. Belsky, LEAD ATTORNEY, Gross & Belsky LLP, San Francisco, CA.
Susan Bartholomew, Plaintiff, Pro se.
For Barry Golin, McIntyre Group, Ltd., Erin L. Davis, Plaintiff: John T. King, LEAD ATTORNEY, The Furth Firm, San 
Francisco, CA; Henry A. Cirillo, Smith Dollar PC, Santa Rosa, CA.
For Nancy J. Anderson, Plaintiff: Michael David Liberty, LEAD ATTORNEY, Law Office of Michael D. Liberty, 
Burlingame, CA.
For Anthony J. Crafter, Plaintiff: Derek G. Howard, LEAD ATTORNEY, Minami Tamaki LLP, San Francisco, CA.
For Andros S. Georgiou, Sophia Georgiou, Steven A. Georgiou, Plaintiff: Clinton Paul Walker, LEAD ATTORNEY, 
Damrell, Nelson, Schrimp, Pallios, Pache, Modesto, CA; Fred A. Silva, Kathy Lee Monday, Damrell, Nelson, 
Schrimp, Pallios, Pacher & Silva, Modesto, CA.
For Biron Gymnastics Inc., Plaintiff: Craig C. Corbitt, LEAD ATTORNEY, Zelle Hofmann Voelbel & Mason LLP, San 
Francisco, CA.
For Michael Olmert, Plaintiff: Blake M. Harper, LEAD ATTORNEY, Hulett Harper Stewart LLP, San Diego, CA; 
Robert B. Weiser, The Weiser Law Firm, P.C., Wayne, PA.
For Michael R. Carlson, Plaintiff: Amy M. Hoven, LEAD  [*5] ATTORNEY, Kennedy Watts Arellano Ricks, Portland, 
OR; Richard D. Greenfield, Greenfield & Goodman LLC, New York, NY.
2011 U.S. Dist. LEXIS 148547, *2

 
For Ronald H. Cowan, Plaintiff: Richard J. Simons, LEAD ATTORNEY, Furtado Jaspovice & Simons, Hayward, CA; 
Jennie Lee Anderson, Andrus Anderson LLP, San Francisco, CA; Micha Star Liberty, Liberty Law Office, Oakland, 
CA.
For Melissa Harris, Plaintiff: Jon T. King, LEAD ATTORNEY, Hausfeld LLP, San Francisco, CA; Garrett D. 
Blanchfield, Jr., Reinhardt Wendorf & Blanchfield, St. Paul, MN; Henry A. Cirillo, Smith Dollar PC, Santa Rosa, CA.
For Jorge Bell, Anthony M. Page, Melissa Burton, Daniel Vesely, Bernadette Lockmanese, Plaintiff: Craig C. 
Corbitt, LEAD ATTORNEY, Zelle Hofmann Voelbel & Mason LLP, San Francisco, CA; Jon T. King, LEAD 
ATTORNEY, Hausfeld LLP, San Francisco, CA.
For Deborah Holley, Plaintiff: Christopher Charles Moscone, LEAD ATTORNEY, Moscone,Emblidge & Quadra, 
LLp, San Francisco, CA.
For Cynthia Dillon, Plaintiff: Cadio R. Zirpoli, LEAD ATTORNEY, Saveri & Saveri, Inc., San Francisco, CA; W. 
Joseph Bruckner, LEAD ATTORNEY, Lockridge Grindal Nauen P.L.L.P, Minneapolis, MN.
For Reid R. Hardingham, Plaintiff: Bruce Lee Simon, LEAD ATTORNEY, Pearson, Simon, Warshaw  [*6] & Penny, 
LLP, San Francisco, CA; Jon T. King, LEAD ATTORNEY, Hausfeld LLP, San Francisco, CA; Andrew B. Bullion, 
Hausfeld, LLP, Washington, DC; Henry A. Cirillo, Smith Dollar PC, Santa Rosa, CA.
For Cameron Elizabeth Taylor, Mark Woodcock, Plaintiff: Bruce Lee Simon, LEAD ATTORNEY, Pearson, Simon, 
Warshaw & Penny, LLP, San Francisco, CA; Donald L. Pereleman, Fine Kaplan and Black, R.P.C., Philadelphia, 
PA; Stewart L. Cowen, Cohen Placitella & Roth, P.C., Philadelphia, PA.
For Nicole Mills, Plaintiff: Jon T. King, LEAD ATTORNEY, Hausfeld LLP, San Francisco, CA; Christian M. Sande, 
Lockridge Grindal Nauen & Holstein PLLP, Minneapolis, MN; Dylan J. McFarland, Heins Mills & Olson, P.L.C., 
Minneapolis, MN; Henry A. Cirillo, Smith Dollar PC, Santa Rosa, CA.
For Vartan Dermijian, Plaintiff: Joseph Richard Saveri, LEAD ATTORNEY, Eric B. Fastiff, Lieff, Cabraser, Heiman & 
Bernstein, LLP, San Francisco, CA; Mario Nunzio Alioto, LEAD ATTORNEY, Trump Alioto Trump & Prescott LLP, 
San Francisco, CA; Sherman Kassof, Law Offices of Sherman Kassof, Lafayette, CA.
For Nancy Corzine, Plaintiff: Christopher T. Heffelfinger, LEAD ATTORNEY, Berman DeValerio, Palm Beach 
Gardens, FL.
For Emily Hecht, Plaintiff:  [*7] Marvin Alan Miller, Miller Law LLC, Chicago, IL; Michael Glenn McLellan, 
Finkelstein, Thompson & Loughran, Washington, DC; Mila F Bartos, Finkelstein Thompson LLP, Washington, DC; 
Rosemary M. Rivas, Finkelstein Thompson LLP, San Francisco, CA.
For Joseph Szlavik, Plaintiff: Charles J. Piven, Brower Piven, Baltimore, MD.
For Sherrie Marco, Betsee Finlee, Gunter Thiede, Plaintiff: Melissa Meeker Harnett, LEAD ATTORNEY, 
Wasserman Comden Casselman & Esensten, L.L.P., Tarzana, CA.
For Ann S. Carney, Richard D. Carney, Alison Carney, Trevor Carney, Colin Carney, Matthew Carney, Plaintiff: 
Christopher Lovell, Lovell Stewart Halebian LLP, New York, NY; Marvin Alan Miller, Miller Law LLC, Chicago, IL.
For Jon Wayman, Plaintiff: Hollis L. Salzman, Labaton Sucharow LLP, New York, NY; Marvin Alan Miller, Miller Law 
LLC, Chicago, IL.
For John Hardy, Plaintiff: Jayne Arnold Goldstein, Shepherd, Finkelman, Miller & Shah, LLP, Weston, FL.
For Eric Miller, Plaintiff: Merrill G. Davidoff, Berger & Montague, P.C., Philadelphia, PA.
For Mr. Edward H. Shipley, Plaintiff: Roberta D. Liebenberg, LEAD ATTORNEY, Fine Kaplan and Black, RPC, 
Philadelphia, PA; James E. Beasley, Jr., Slade Hayes McLaughlin, The Beasley  [*8] Firm, LLC, Philadelphia, PA.
For All Plaintiffs, Plaintiff: Steven Noel Williams, Stuart George Gross, LEAD ATTORNEY, Cotchett, Pitre & 
McCarthy, LLP, Burlingame, CA; Andrew B. Bullion, Hilary Kathleen Ratway, Hausfeld, LLP, Washington, DC; 
Daniel A. Small, Cohen Milstein Sellers & Toll PLLC, Washington, DC; James Christopher Magid, Berman 
DeValerio, San Francisco, CA.
2011 U.S. Dist. LEXIS 148547, *5

 
For Tammy D. Comeaux, Plaintiff: Richard Lyle Coffman, Beaumont, TX.
For Beth El-Demerdash, Thomas M. Hastings, Mohamed El-Demerdash, Joshua Van Meter, Sherry Fischer, Dawn 
Sederholm, Plaintiff: Marvin Alan Miller, Miller Law LLC, Chicago, IL.
For Andrew Napoletano, Plaintiff: Daniel D'Angelo, Gilman and Pastor, LLP, Boston, MA; David Pastor, Gilman & 
Pastor, Boston, MA.
For Jacob Weiss, Plaintiff: Stephen E. Connoll, Faruqi & Faruqi, LLP, Huntingdon Valley, PA.
For Lawrence Wick, Alvin Lilly, Nancy Corzine, Frederick Corzine, Victoria Montana, Dennis Hart, Plaintiff: Joseph 
J. Tabacco, Jr., Berman DeValerio, San Francisco, CA.
For Shephali J. Patel, Andrew D. Carlson, Plaintiff: James E. Miller, Shepherd, Finkelman, Miller & Shah, LLC, 
Chester, CT.
For Bruce Diamond, Plaintiff: Gerald J. Rodos, Jeffrey B. Gittleman, Lisa M.  [*9] Lamb, Barrack Rodos & Bacine, 
Philadelphia, PA.
For Athena Oliff, Plaintiff: Wyatt B. Durrette, Jr., DurretteBradshaw, Richmond, VA.
For Mindy Martin, Plaintiff: Manuel Juan Dominguez, Cohen Milstein Sellers & Toll, Palm Beach Gardens, FL.
For Brett Cass, Plaintiff: Kevin Bruce Love, Hanzman Criden & Love, P.A., South Miami, FL.
For Fillippo Boccara, Ajay Baharani, Plaintiff: Joe R. Whatley, Jr., Whatley Drake & Kallas LLC, New York, NY; 
Miguel Manuel de La O, de la O, Marko, Magoinick & Leyton, Miami, FL.
For Michelle Mazzocco, Plaintiff: Craig L. Briskin, PRO HAC VICE, Mehri & Skalet, PLLC, Wasington, DC.
For Kimberly Nelson, Plaintiff: Hollis L. Salzman, Labaton Sucharow LLP, New York, NY.
For Corrine Lin, Plaintiff: Marian P. Rosner, Wolf Popper LLP, New York, NY.
For Marie Shaw, Roberta Frances Pope Sladkus, Plaintiff: Alexander H. Schmidt, Wolf Haldenstein Adler Freeman 
& Herz LLP, New York, NY.
For Ruth Strachman, Plaintiff: Jeffrey S. Abraham, Abraham Fruchter & Twersky LLP, New York, NY.
For Monica R. Hustead, Plaintiff: Jason Allen Zweig, Kaplan Fox & Kilsheimer LLP, New York, NY.
For Brigitte Feinberg, Plaintiff: Oren S. Giskan, Giskan Solotaroff Anderson &  [*10] Stewart LLP, New York, NY.
For Lisa Steinberg, Mitchell Benson, Plaintiff: David B. Krauss, Law Office of David B. Krauss, New York, NY.
For Michael Gardener, Plaintiff: David Jaroslawicz, Jaroslawicz & Jaros, New York, NY.
For Tamara Sears, Plaintiff: Robert A. Skirnick, Meredith Cohen Greenfogel & Skirnick, P.C., New York, NY.
For Barbara Holt, Plaintiff: Ira Neil Richards, PRO HAC VICE, Trujillo Rodriguez & Richards LLC, Philadelphia, PA; 
Robert A. Skirnick, Meredith Cohen Greenfogel & Skirnick, P.C., New York, NY.
For Richard Fitter, Plaintiff: Robert N. Kapla, Kaplan Kilsheimer & Fox LLP, New York, NY.
For Anjali Jain, Plaintiff: Beverly Tse, David E. Kovel, Kirby McInerney LLP, New York, NY.
For Frederick Waters, Maureen Ann Waters, Plaintiff: Christopher L. Lebsock, Hausfeld LLP, San Francisco, CA; 
Linda Phyllis Nussbaum, Grant & Eisenhofer P.A., New York, NY.
For Christopher H. Finegan, Plaintiff: Kenneth G. Wals, Kirby McInerney LLP, New York, NY.
For Julian Hamilton Barns, Plaintiff: Jill S. Abrams, Abbey Spanier Rodd Abrams & Paradis, LLP, New York, NY.
For Mark Levy, Plaintiff: Robert M. Rothman, Coughlin Stoia Geller Rudman & Robbins LLP, Melville, NY.
For Rebecca Kastin, Plaintiff:  [*11] Michael Robert Reese, Reese Richman LLP, New York, NY.
For Jessica S Eliav, Plaintiff: Susan Gilah Kupfer, Glancy Binkow & Goldberg LLP, San Francisco, CA.
2011 U.S. Dist. LEXIS 148547, *8

 
For Michael Molinaro, Plaintiff: Jeffrey A. Miller, Westerman Ball Ederer Miller & Sharfsterin, LLP, Mineola, NY.
For Dominique Kendrick, Kevin Serafin, Neil Smith, Margaret Myles, Aaron J. Peasley, Plaintiff: Merrick Scott 
Rayle, Lovell Stewart Halebian LLP, Pacific Grove, CA.
For Kristin Meanwell, Richard Meanwell, Plaintiff: Daniel E. Gustafson, PRO HAC VICE, Daniel C. Hedlund, 
Gustafson Gluek PLLC, Minneapolis, MN; Dianne M. Nast, Roda & Nast PC, Lancaster, PA; Jason S. Cowart, 
Pomerantz Haudek Block Grossman & Gross LLP, New York, NY; Jason Kilene, Minneapolis, MN.
For Susan Brennan, on behalf of herself and all others similarly situated, Plaintiff: Craig C. Corbitt, LEAD 
ATTORNEY, Zelle Hofmann Voelbel & Mason LLP, San Francisco, CA; Jon T. King, LEAD ATTORNEY, Hausfeld 
LLP, San Francisco, CA.
For Charles Amamgbo, Plaintiff: Reginald Von Terrell, LEAD ATTORNEY, The Terrell Group, Richmond, CA.
For Ben Lee, Tae Ki Hwang, Thomas Schelly, Plaintiff: Guido Saveri, Saveri & Saveri, Inc., San Francisco, CA.
For Hwa Ja Chung, Issun K. Park,  [*12] Myung K. Park, Plaintiff: Hilary Kathleen Ratway, Hausfeld, LLP, 
Washington, DC; Michael Paul Lehmann, Hausfeld LLP, San Francisco, CA.
For Hee Ho Chung, Plaintiff: Hilary Kathleen Ratway, Hausfeld, LLP, Washington, DC; Michael Paul Lehmann, 
Hausfeld LLP, San Francisco, CA; Steven Noel Williams, Cotchett, Pitre & McCarthy, LLP, Burlingame, CA.
For James VanHorn, Ki-Yong Nam, Plaintiff: Steve W. Berman, PRO HAC VICE, Hagens Berman Sobol Shapiro 
LLP, Seattle, WA.
For Yoon S. Chang, Plaintiff: Bruce Lee Simon, Pearson, Simon, Warshaw & Penny, LLP, San Francisco, CA.
For Scott McLean, Plaintiff: Hilary Kathleen Ratway, Hausfeld, LLP, Washington, DC.
For Kirby K. Kim, Plaintiff: James Christopher Magid, LEAD ATTORNEY, Berman DeValerio, San Francisco, CA.
For Martin Kaufman, Plaintiff: Joseph Mario Patane, Law Office of Joseph M. Patane, San Francisco, CA; Lauren 
Clare Russell, Trump, Alioto, Trump & Prescott, LLP, San Francisco, CA.
For Kaz Fujita, Chaejean Ko, Plaintiff: Allan Steyer, Steyer Lowenthal Boodrookas Alvarez & Smith LLP, San 
Francisco, CA.
For R. Stan Morris, Plaintiff: Terry Gross, Gross & Belsky LLP, San Francisco, CA.
For Eunkyung Hwang, Plaintiff: Richard Alexander Saveri, Saveri  [*13] & Saveri, Inc., San Francisco, CA.
For Julie Yim, Plaintiff: Micha Star Liberty, Liberty Law Office, Oakland, CA.
For Jason Kim, Plaintiff: Lesley Ann Hale, LEAD ATTORNEY, Berman DeValerio, San Francisco, CA.
For Won B. Kang, Joong H. Kang, Christopher James Lee, Yang Hee Lee, Peter Kim, Plaintiff: Douglas A. Millen, 
Freed Kanner London & Millen LLC, Bannockburn, IL.
For Stuart Madnick, Plaintiff: Ann D. White, Ann D. White Law Offices, P.C., Jenkintown, PA; Daniel R. Karon, 
Goldman Scarlato & Karon, Cleveland, OH; James Christopher Magid, Joseph J. Tabacco, Jr., Berman DeValerio, 
San Francisco, CA; Robert Scott Palmer, Office of the Attorney General, Tallahassee, FL.
For United Airlines Inc., Defendant: Richard J. Favretto, LEAD ATTORNEY, Andrew Marc Kofsky, Andrew Abbott 
Nicely, John Roberti, Joseph Roberti, Mayer, Brown LLP, Washington, DC; Aengus Hartley Carr, Carroll, Burdick & 
McDonough LLP, San Francisco, CA; Edward D. Johnson, Jung-Ying Joann Liao, Mayer Brown LLP, Palo Alto, CA.
For UAL Corp., Defendant: Richard J. Favretto, LEAD ATTORNEY, Mayer, Brown, Rowe & Maw LLP, Washington, 
DC; Aengus Hartley Carr, Carroll, Burdick & McDonough LLP, San Francisco, CA; Andrew Abbott Nicely, 
 [*14] John Roberti, Mayer, Brown LLP, Washington, DC; Edward D. Johnson, Mayer Brown LLP, Palo Alto, CA.
For Virgin Atlantic Airways, Ltd., Defendant: Alan Turner, PRO HAC VICE, Charles E. Koob, Simpson Thacher & 
Bartlett LLP, New York, NY; Chris S. Coutroulis, Carlton Fields, Tampa, FL; Craig Crandall Reilly, Richards 
2011 U.S. Dist. LEXIS 148547, *11

 
McGettigan Reilly & West, Alexandria, VA; Harrison J. Frahn, IV, Simpson Thacher & Bartlett, Palo Alto, CA; Kevin 
Charles Cain, Peabody & Arnold LLP, Boston, MA; Leslie C. Boyd, Vairncross & Hempelmann, Seattle, WA.
For British Airways, PLC, Defendant: Daryl Andrew Libow, LEAD ATTORNEY, Sullivan & Cromwell LLP, 
Washington, DC; Brendan P. Cullen, Sullivan & Cromwell, Palo Alto, CA; Kevin Charles Cain, Peabody & Arnold 
LLP, Boston, MA; Mark Allan Salky, Greenberg Traurig, Miami, FL; Mark Steven Yacano, Wright Robinson 
Osthimer & Tatum, Richmond, VA; Steven Noel Williams, Cotchett Pitre & McCarthy LLP, Burlingame, CA.
For Air India, Ltd., Defendant: Kimberly Marie DeShano, LEAD ATTORNEY, Greenberg Traurig, LLP, Chicago, IL.
For Virgin Atlantic Airlines, Defendant: Chris S. Coutroulis, Carlton Fields, Tampa, FL.
For Korean Air Lines Co., Ltd., Defendant: Inna Zatulovsky, LEAD ATTORNEY,  [*15] Morgan, Lewis, San 
Francisco, CA.
For Junghee Kay, Interested Party: Lauren Clare Russell, Trump, Alioto, Trump & Prescott, LLP, San Francisco, 
CA.
For Carnival PLC, Claimant: Megan Dixon, LEAD ATTORNEY, William L. Monts, III, PRO HAC VICE, Hogan 
Lovells US LLP, San Francisco, CA.
For British Disabled Flying Association, Intervenor: Bryan Matthew Kreft, Steyer, Lowenthal, Boodrookas, Alvarez & 
Smith, San Francisco, CA."
364,Judges,"Judges: CHARLES R. BREYER, UNITED STATES DISTRICT JUDGE."
364,Opinion by,Opinion by: CHARLES R. BREYER
369,Counsel,"Counsel:  [**1] For ASSOCIATED WHOLESALE GROCERS, INC., FOUR B CORP., COSENTINO GROUP, INC., 
COSENTINO ENTERPRISES, INC., MID AM FOOD ENTERPRISES, INC., CNW FOODS, INC. (2:11-cv-03520), 
Plaintiffs: PATRICK J. STUEVE, RACHEL E. SCHWARTZ, LEAD ATTORNEYS, STUEVE SIEGEL HANSON LLP, 
KANSAS CITY, MO; THOMAS R. REHORN, III., LEAD ATTORNEY, TOMASIC & REHORN, KANSAS, KS.
For UNITED EGG PRODUCERS, UNITED EGG ASSOCIATION, UNITED STATES EGG MARKETERS, INC. 
(2:11-cv-03520), Defendants: JAN P. LEVINE, LEAD ATTORNEY, ROBIN P. SUMNER, PEPPER HAMILTON LLP, 
PHILADELPHIA, PA; JOSEPH M. REBEIN, LAURIE A. NOVION, LEAD ATTORNEYS, SHOOK HARDY & BACON, 
KANSAS CITY, MO.
For CAL-MAINE FOODS, INC., (2:11-cv-03520), Defendant: THOMAS A. ROTTINGHAUS, LEAD ATTORNEY, 
KANSAS, MO; TYLER W. HUDSON, LEAD ATTORNEY, WAGSTAFF & CARTMELL, LLP, KANSAS CITY, MO.
For DAYBREAK FOODS, INC., HILLANDALE FARMS EAST, INC., HILLANDALE FARMS OF PA., INC., 
HILLANDALE FARMS, INC., MIDWEST POULTRY SERVICES, L.P., NATIONAL FOOD CORPORATION, NUCAL 
FOODS, INC., OHIO FRESH EGGS, LLC, R.W. SAUDER INC. (2:11-cv-03520), Defendants: JOSEPH M. REBEIN, 
LAURIE A. NOVION, LEAD ATTORNEYS, SHOOK HARDY & BACON, KANSAS CITY, MO.
For MICHAEL FOODS, INC. (2:11-cv-03520),  [**2] Defendant: BRANDON J.B. BOULWARE, LEAD ATTORNEY, 
ROUSE HENDRICKS GERMAN MAY, KANSAS CITY, MO; DANIEL HODES, LEAD ATTORNEY, KANSAS CITY, 
MO.
For MISSOURI EGG COUNCIL, INC. (2:11-cv-03520), Defendant: JOHN C. NETTELS, JR., LEAD ATTORNEY, 
STINSON MORRISON HECKER LLP-, KANSAS CITY, MO; MARK D. HINDERKS, LEAD ATTORNEY, KANSAS 
CITY, MO.
For MOARK EGG CORPORATION, MOARK, LLC, NORCO RANCH, INC. (2:11-cv-03520), Defendants: DANIEL 
D. CRABTREE, LEAD ATTORNEY, STINSON MORRISON HECKER LLP-WALNUT, KANSAS CITY, MO.

 
For ROSE ACRE FARMS, INC. (2:11-cv-03520), Defendant: DANIEL F. CHURCH, LEAD ATTORNEY, MORRIS, 
WILLNAUER, KLOSTERMAN & CHURCH LLC-KC, KANSAS CITY, MO.
For SPARBOE FARMS, INC. (2:11-cv-03520), Defendant: ALAN H. MACLIN, LEAD ATTORNEY, TROY J. 
HUTCHINSON, LEAD ATTORNEY, PRO HAC VICE, BRIGGS AND MORGAN, P.A., MINNEAPOLIS, MN; LISA M. 
AGRIMONTI, LEAD ATTORNEY, BRIGGS & MORGAN. PA -MINNEAPOLIS, MINNEAPOLIS, MN.
For IN RE: PROCESSED EGG PRODUCTS ANTITRUST LITIGATION (2:08-md-02002), IN RE: IN RE: 
PROCESSED EGG PRODUCTS ANTITRUST LITIGATION.
For SANDRA A. JESKIE (2:08-md-02002), Special Master: SANDRA A. JESKIE, LEAD ATTORNEY, DUANE, 
MORRIS LLP, PHILADELPHIA, PA."
370,Judges,"Judges: GENE E.K. PRATTER, United States District  [**3] Judge."
370,Opinion by,Opinion by: GENE E.K. PRATTER
