頁碼,內容類型,內容
852,Counsel,"Counsel:  [*1] For Cellco Partnership, doing business as, Verizon Wireless, Plaintiff: Audrey M Pumariega, LEAD 
ATTORNEY, Ann M St Peter-Griffith, Marcos D Jimenez, Sandra J Millor, Scott B Cosgrove, Kasowitz Benson 
Torres & Friedman LLP - Miami, FL; Kiersten Ann Murphy, LEAD ATTORNEY, Lindsi Michelle Weber, Paul Kipp 
Charlton, Gallagher & Kennedy PA, Phoenix, AZ.
For Jason Hope, Defendant: Alison Erika Klingel, LEAD ATTORNEY, Squire Sanders (US) LLP - Phoenix, AZ, 
Phoenix, AZ; Donald A Wall, LEAD ATTORNEY, Squire Sanders & Dempsey LLP, Phoenix, AZ; Brian Andrew 
Cabianca, Squire Sanders & Dempsey (US) LLP - Phoenix, AZ; Dennis Ira Wilenchik, Wilenchik & Bartness PC, 
Phoenix, AZ; Joel Grant Woods, Grant Woods PC, Phoenix, AZ; Kathleen Erin Martoncik, Wilenchik & Bartness 
PC, Phoenix, AZ.
For Wayne P DeStefano, Christa Stephens, Quinn McCullough, Steve Uhrman, Defendants: Dennis Ira Wilenchik, 
Kathleen Erin Martoncik, Wilenchik & Bartness PC, Phoenix, AZ; Joel Grant Woods, Grant Woods PC, Phoenix, 
AZ.
For Cylon LLC, also known as, Jawa, New Economic Order LLC, Saguaro Media LLC, New EIN LLC, Ink Sign 
Holdings LLC, Yellow Ball Holdings LLC, Message Plan LLC, FYISMS.COM LLC, MYTXTSMS.COM LLC, Standard 
Plan  [*2] LLC, Standard Message LLC, SMS City LLC, Hot-Hot-News.Com LLC, City-O-Games.Com LLC, 
WorldTxts.Com LLC, TopicText.Com LLC, Text Charge LLC, All-Game-Cheats.Org LLC, News Alerts LLC, 
Defendants: Alison Erika Klingel, LEAD ATTORNEY, Squire Sanders (US) LLP - Phoenix, AZ, Phoenix, AZ; Donald 
A Wall, LEAD ATTORNEY, Squire Sanders & Dempsey LLP, Phoenix, AZ; Brian Andrew Cabianca, Squire 
Sanders & Dempsey (US) LLP - Phoenix, AZ; Dennis Ira Wilenchik, Wilenchik & Bartness PC, Phoenix, AZ; Joel 
Grant Woods, Grant Woods PC, Phoenix, AZ; Kathleen Erin Martoncik, Wilenchik & Bartness PC, Phoenix, AZ.
For Eye Level Holdings LLC, also known as, Jawa, Defendant: Donald A Wall, LEAD ATTORNEY, Squire Sanders 
& Dempsey LLP, Phoenix, AZ; Brian Andrew Cabianca, Squire Sanders & Dempsey (US) LLP - Phoenix, AZ; 
Dennis Ira Wilenchik, Wilenchik & Bartness PC, Phoenix, AZ; Joel Grant Woods, Grant Woods PC, Phoenix, AZ; 
Kathleen Erin Martoncik, Wilenchik & Bartness PC, Phoenix, AZ.

 
For Rick R Perry, Defendant: Dennis Ira Wilenchik, Wilenchik & Bartness PC, Phoenix, AZ.
For Cylon LLC, Text Charge LLC, Eye Level Holdings LLC, New Economic Order LLC, Saguaro Media LLC, New 
EIN LLC, Ink Sign Holdings LLC, Yellow  [*3] Ball Holdings LLC, Message Plan LLC, FYISMS.COM LLC, 
MYTXTSMS.COM LLC, Standard Plan LLC, Standard Message LLC, SMS City LLC, City-O-Games.Com LLC, Hot-
Hot-News.Com LLC, WorldTxts.Com LLC, TopicText.Com LLC, All-Game-Cheats.Org LLC, News Alerts LLC, 
Jason Hope, TopicText.Com LLC, Text Charge LLC, Quinn McCullough, Ink Sign Holdings LLC, Standard Plan 
LLC, FYISMS.COM LLC, WorldTxts.Com LLC, New Economic Order LLC, City-O-Games.Com LLC, Eye Level 
Holdings LLC, Standard Message LLC, MYTXTSMS.COM LLC, SMS City LLC, New EIN LLC, Counter Claimants: 
Alison Erika Klingel, LEAD ATTORNEY, Squire Sanders (US) LLP - Phoenix, AZ, Phoenix, AZ; Donald A Wall, 
LEAD ATTORNEY, Squire Sanders & Dempsey LLP, Phoenix, AZ; Brian Andrew Cabianca, Squire Sanders & 
Dempsey (US) LLP - Phoenix, AZ; Dennis Ira Wilenchik, Wilenchik & Bartness PC, Phoenix, AZ; Joel Grant Woods, 
Grant Woods PC, Phoenix, AZ; Kathleen Erin Martoncik, Wilenchik & Bartness PC, Phoenix, AZ.
For Cellco Partnership, doing business as, Verizon Wireless, Counter Defendant: Audrey M Pumariega, LEAD 
ATTORNEY, Kasowitz Benson Torres & Friedman LLP - Miami, FL; Kiersten Ann Murphy, LEAD ATTORNEY, 
Lindsi Michelle Weber, Paul Kipp Charlton, Gallagher  [*4] & Kennedy PA, Phoenix, AZ; Kiersten Ann Murphy, 
LEAD ATTORNEY, Gallagher & Kennedy PA, Phoenix, AZ; Ann M St Peter-Griffith, Marcos D Jimenez, Sandra J 
Millor, Scott B Cosgrove, Kasowitz Benson Torres & Friedman LLP, Miami, FL; Lindsi Michelle Weber , Gallagher & 
Kennedy PA, Phoenix, AZ.
For For Christa Stephens, Quinn McCullough, Wayne P DeStefano, Steve Uhrman, Wayne P DeStefano, Counter 
Claimants: Dennis Ira Wilenchik, Wilenchik & Bartness PC, Phoenix, AZ; Joel Grant Woods, Grant Woods PC, 
Phoenix, AZ; Kathleen Erin Martoncik, Wilenchik & Bartness PC, Phoenix, AZ.
For Cylon LLC, Message Plan LLC, News Alerts LLC, Saguaro Media LLC, Yellow Ball Holdings LLC, Hot-Hot-
News.Com LLC, All-Game-Cheats.Org LLC, Jason Hope, Counter Claimants: Alison Erika Klingel, LEAD 
ATTORNEY, Squire Sanders (US) LLP - Phoenix, AZ, Phoenix, AZ; Dennis Ira Wilenchik, Wilenchik & Bartness 
PC, Phoenix, AZ; Donald A Wall, LEAD ATTORNEY, Squire Sanders & Dempsey LLP, Phoenix, AZ.
For Christa Stephens, Steve Uhrman, Counter Claimant: Dennis Ira Wilenchik, Wilenchik & Bartness PC, Phoenix, 
AZ.
For Cellco Partnership, Counter Defendant: Audrey M Pumariega, LEAD ATTORNEY, Ann M St Peter-Griffith, 
Marcos D Jimenez,  [*5] Sandra J Millor, Scott B Cosgrove, Kasowitz Benson Torres & Friedman LLP - Miami, FL; 
Kiersten Ann Murphy, LEAD ATTORNEY, Lindsi Michelle Weber, Paul Kipp Charlton, Gallagher & Kennedy PA, 
Phoenix, AZ."
853,Judges,"Judges: David G. Campbell, United States District Judge."
853,Opinion by,Opinion by: David G. Campbell
871,Counsel,"Counsel:  [*1] For Arkansas Carpenters Health and Welfare Fund, Maria Locurto, Paper, Allied-Industrial, 
Chemical, and Energy Workers International Union, AFL-CIO, CLC, United Food & Commercial Workers and 
Participating Food Industry Employers Tri-State Health & Welfare Fund, Plaintiffs: Bernard Persky, LEAD 
ATTORNEY, Labaton Sucharow LLP, New York, NY; Joseph Lipofsky, Zwerling, Schachter & Zwerling, LLP, New 
York, NY.
For Dr. Sol Lubin, Plaintiff: Marc H. Edelson, LEAD ATTORNEY, Edelson & Associates, LLC, Doylestown, PA; 
Joseph Lipofsky, Zwerling, Schachter & Zwerling, LLP, New York, NY.
For Ann Stuart, Plaintiff: Marc H. Edelson, LEAD ATTORNEY, Edelson & Associates, LLC, Doylestown, PA; Peter 
L. Masnik, LEAD ATTORNEY, Kalikman & Masnik, Haddonfield, NJ; Joseph Lipofsky, Zwerling, Schachter & 
Zwerling, LLP, New York, NY.
For Louisiana Wholesale Drug Co., Inc., Plaintiff: Bruce E. Gerstein, LEAD ATTORNEY, Garwin, Gerstein & Fisher, 
LLP, New York, NY; John G. Odom, LEAD ATTORNEY, Odom & Des Roches, New Orleans, LA; Monica L. 
Rebuck, Hangley Aronchick Segal & Pudlin, Harrisburg, PA.
For Linda K. McIntyre, Plaintiff: Elwood S. Simon, LEAD ATTORNEY, Elwood S. Simon & Associates, P.C., 
Birminghan, MI; Joseph  [*2] Lipofsky, Zwerling, Schachter & Zwerling, LLP, New York, NY.
For One or more Plaintiff(s) in 01-cv-1112, Plaintiff: James P. Watts, LEAD ATTORNEY, Zimmerman Reed PLLC, 
Phoenix, AZ; Joseph Lipofsky, Zwerling, Schachter & Zwerling, LLP, New York, NY.
For One or more Plaintiff(s) in 01-cv-2093, Plaintiff: Frank Verderame, LEAD ATTORNEY, Plattner Verderame PC, 
Phoenix, Az; Joseph Lipofsky, Zwerling, Schachter & Zwerling, LLP, New York, NY.
2012 U.S. Dist. LEXIS 11600, *11600

 
For One or more Plaintiff(s) in 01-cv-1113, One or more Plaintiff(s) in 01-cv-1114, One or more Plaintiff(s) in 01-cv-
1121, One or more Plaintiff(s) in 00-cv-7648, One or more Plaintiff(s) in 01-cv-1122, One or more Plaintiff(s) in 01-
cv-2692, Plaintiffs: Joseph Lipofsky, Zwerling, Schachter & Zwerling, LLP, New York, NY.
For One or more Plaintiff(s) in 01-cv-1107, Plaintiff: Daniel C. Girard, LEAD ATTORNEY, PRO HAC VICE, Girard 
Gibbs LLP, San Francisco, Ca; Eric H. Gibbs, LEAD ATTORNEY, Girard & Green, San Francisco, Ca; Joseph 
Lipofsky, Zwerling, Schachter & Zwerling, LLP, New York, NY.
For One or more Plaintiff(s) in 01-cv-1158, Plaintiff: David Lee Fiol, LEAD ATTORNEY, Lieff Global, LLP, San 
Francisco, CA; Eric B. Fastiff, LEAD ATTORNEY, Lieff Cabraser  [*3] Heimann & Bernstein LLP, San Francisco, 
CA; Joseph R. Saveri, LEAD ATTORNEY, Lieff, Cabraser, Heimann & Bernstein, LLP, San Francisco, CA; Joseph 
Lipofsky, Zwerling, Schachter & Zwerling, LLP, New York, NY.
For One or more Plaintiff(s) in 01-cv-1115, Plaintiff: Andrew J. Ogilvie, Mark F. Anderson, LEAD ATTORNEYS, 
Kemnitzer Anderson Barron & Ogilvie, San Francisco, Ca; Jennifer S. Abrams, Joseph J. Tabacco, LEAD 
ATTORNEYS, Berman DeValerio Pease & Tabacco, San Francsico, Ca; Joseph Lipofsky, Zwerling, Schachter & 
Zwerling, LLP, New York, NY.
For One or more Plaintiff(s) in 01-cv-1108, Plaintiff: Guido Saveri, Richard Saveri, LEAD ATTORNEYS, Saveri & 
Saveri Inc., San Francisco, CA; Michael Hackard, LEAD ATTORNEY, Hackard, Holt & Heller, Gold River, CA; 
Joseph Lipofsky, Zwerling, Schachter & Zwerling, LLP, New York, NY.
For One or more Plaintiff(s) in 01-cv-1109, Plaintiff: Kenneth A. Wexler, LEAD ATTORNEY, The Wexler Firm, 
Chicago, IL; Marc H. Edelson, LEAD ATTORNEY, Edelson & Associates, LLC, Doylestown, PA; Samuel D. Heins, 
LEAD ATTORNEY, Heins Mills & Olson, P.L.C., Minneappolis, MN; Joseph Lipofsky, Zwerling, Schachter & 
Zwerling, LLP, New York, NY.
For One or more Plaintiff(s) in 01-cv-2691,  [*4] Plaintiff: Mario N. Alioto, LEAD ATTORNEY, Trump, Alioto, Trump 
& Prescott, LLP, San Francisco, CA; Joseph Lipofsky, Zwerling, Schachter & Zwerling, LLP, New York, NY.
For One or more Plaintiff(s) in 01-cv-1110, Plaintiff: Sharon T. Maier, LEAD ATTORNEY, Ross Dixon & Bell LLP, 
San Diego, Ca; Joseph Lipofsky, Zwerling, Schachter & Zwerling, LLP, New York, NY.
For One or more Plaintiff(s) in 01-cv-1116, Plaintiff: Jeffrey R. Krinsk, LEAD ATTORNEY, Finkelstein and Krinsk, 
San Diego, Ca; Joseph Lipofsky, Zwerling, Schachter & Zwerling, LLP, New York, NY.
For One or more Plaintiff(s) in 01-cv-2094, Plaintiff: Kevin I. Goldberg, LEAD ATTORNEY, Goldberg & Finnegan, 
Silver Spring, MD; Robert Keith Jenner, LEAD ATTORNEY, Greenberg & Bederman, Silver Spring, MD; Joseph 
Lipofsky, Zwerling, Schachter & Zwerling, LLP, New York, NY.
For One or more Plaintiff(s) in 01-cv-1117, One or more Plaintiff(s) in 01-cv-1118, Plaintiffs: Andrew Bennett Spark, 
LEAD ATTORNEY, Law Office of Andrew Bennett Spark, Esq., Sarasota, Fl; Ralph L. Friedland, LEAD 
ATTORNEY, LawServ, Chartered, Sarasota, FL; Joseph Lipofsky, Zwerling, Schachter & Zwerling, LLP, New York, 
NY.
For One or more Plaintiff(s) in 01-cv-1119, Plaintiff:  [*5] Kenneth J. Vianale, LEAD ATTORNEY, Vianale & Vianale 
LLP, Boca Raton, FL; Joseph Lipofsky, Zwerling, Schachter & Zwerling, LLP, New York, NY.
For One or more Plaintiff(s) in 01-cv-1120, Plaintiff: David A. Nester, LEAD ATTORNEY, Nester & Constance, 
Belleville, Il; Joseph P. Danis, LEAD ATTORNEY, Carey & Danis, St. Louis, Mo; Joseph R. Saveri, LEAD 
ATTORNEY, Lieff, Cabraser, Heimann & Bernstein, LLP, San Francisco, CA; Joseph Lipofsky, Zwerling, Schachter 
& Zwerling, LLP, New York, NY.
For One or more Plaintiff(s) in 01-cv-1520, Plaintiff: Daniel E. Gustafson, PRO HAC VICE, Karla Marie Gluek, 
Samuel D. Heins, LEAD ATTORNEYS, Heins Mills & Olson, P.L.C., Minneappolis, MN; Kenneth A. Wexler, LEAD 
ATTORNEY, The Wexler Firm, Chicago, IL; Marc H. Edelson, LEAD ATTORNEY, Edelson & Associates, LLC, 
Doylestown, PA; Joseph Lipofsky, Zwerling, Schachter & Zwerling, LLP, New York, NY.
For One or more Plaintiff(s) in 00-cv-7649, Plaintiff: Peter L. Masnik, LEAD ATTORNEY, Kalikman & Masnik, 
Haddonfield, NJ; Joseph Lipofsky, Zwerling, Schachter & Zwerling, LLP, New York, NY.
2012 U.S. Dist. LEXIS 11600, *2

 
For One or more Plaintiff(s) in 00-cv-7482, Plaintiff: Linda P. Nussbaum, LEAD ATTORNEY, Grant & Eisenhofer 
P.A., New York, NY;  [*6] Joseph Lipofsky, Zwerling, Schachter & Zwerling, LLP, New York, NY.
For One or more Plaintiff(s) in 00-cv-5246, Plaintiff: Dan Drachler, LEAD ATTORNEY, Seattle, WA; Joseph 
Lipofsky, Joseph S. Tusa, Robert S. Schachter, LEAD ATTORNEYS, Zwerling, Schachter & Zwerling, LLP, New 
York, NY.
For One or more Plaintiff(s) in 00-cv-6219, Plaintiff: Wallace A. Showman, LEAD ATTORNEY, Law Office of 
Wallace A. Showman, New York, NY; Joseph Lipofsky, Zwerling, Schachter & Zwerling, LLP, New York, NY.
For One or more Plaintiff(s) in 00-cv-4428, Plaintiff: Joseph Lipofsky, LEAD ATTORNEY, Zwerling, Schachter & 
Zwerling, LLP, New York, NY.
For One or more Plaintiff(s) in 00-cv-5033, Plaintiff: Joseph S. Tusa, LEAD ATTORNEY, Joseph Lipofsky, Zwerling, 
Schachter & Zwerling, LLP, New York, NY.
For One or more Plaintiff(s) in 00-cv-7650, Plaintiff: Bruce E. Gerstein, LEAD ATTORNEY, Garwin, Gerstein & 
Fisher, LLP, New York, NY; Joseph Lipofsky, Zwerling, Schachter & Zwerling, LLP, New York, NY.
For One or more Plaintiff(s) in 01-cv-644, Plaintiff: Richard B. Brualdi, LEAD ATTORNEY, The Brualdi Law Firm, 
New York, NY; Joseph Lipofsky, Zwerling, Schachter & Zwerling, LLP, New York, NY.
For One or more Plaintiff(s)  [*7] in 01-cv-648, Plaintiff: M. Christine Carty, LEAD ATTORNEY, Schnader Harrison 
Segal & Lewis LLP, New York, NY; Monica L. Rebuck, Steve D. Shadowen, LEAD ATTORNEYS, Hangley 
Aronchick Segal & Pudlin, Harrisburg, PA; Joseph Lipofsky, Zwerling, Schachter & Zwerling, LLP, New York, NY.
For One or more Plaintiff(s) in 01-cv-646, Plaintiff: Michael Straus, LEAD ATTORNEY, Straus & Boies, Birmingham, 
AL; Joseph Lipofsky, Zwerling, Schachter & Zwerling, LLP, New York, NY.
For One or more Plaintiff(s) in 01-cv-647, Plaintiff: Jules Brody, LEAD ATTORNEY, Stull, Stull & Brody, New York, 
NY; Joseph Lipofsky, Zwerling, Schachter & Zwerling, LLP, New York, NY.
For One or more Plaintiff(s) in 01-cv-1111, Plaintiff: B. J. Wade, LEAD ATTORNEY, Glassman Edwards Wade & 
Wyatt, P.C., Memphis, Tn; William M. Audet, LEAD ATTORNEY, Audet & Partners, LLP, San Francisco, CA; 
William H. Garvin, III, LEAD ATTORNEY, Law Offices of William H. Garvin III, P.A., Tallahassee, Fl; Joseph 
Lipofsky, Zwerling, Schachter & Zwerling, LLP, New York, NY.
For One or more Plaintiff(s) in 01-cv-3924, Plaintiff: John C. Cabaniss, LEAD ATTORNEY, Law Offices of John C. 
Cabaniss, Milwaukee, WI; Joseph P. Danis, LEAD ATTORNEY, Carey &  [*8] Danis, St. Louis, Mo; Joseph R. 
Saveri, LEAD ATTORNEY, Lieff, Cabraser, Heimann & Bernstein, LLP, San Francisco, CA; Peter B. Bensinger, Jr., 
LEAD ATTORNEY, Barlit Beck Herman Palenchar Scott, Chicago, IL; Joseph Lipofsky, Zwerling, Schachter & 
Zwerling, LLP, New York, NY.
For CVS Pharmacy, Inc., Rite Aid Corporation, Arthur's Drug Store, Inc., Indirect Purchasers Class, Plaintiffs: 
Monica L. Rebuck, Hangley Aronchick Segal & Pudlin, Harrisburg, PA.
One or more Plaintiff(s) in 00-cv-12450, Plaintiff, Pro se.
One or more Plaintiff(s) in 01-cv-3924, Plaintiff, Pro se.
For Bayer AG, Defendant: Phillip A. Proger, LEAD ATTORNEY, Jones Day Reavis & Pogue, Washington, DC; 
Kevin D McDonald, Jones Day, Washington, DC.
For Bayer Corp., Defendant: Fred H. Bartlit, Jr., LEAD ATTORNEY, Bartlit, Beck, Herman, Palenchar & Scott LLP, 
Chicago, IL; Michael J. Valaik, LEAD ATTORNEY, Bartlit Beck Herman Palenchar & Scott LLP, Chicago, IL; Phillip 
A. Proger, LEAD ATTORNEY, Jones Day Reavis & Pogue, Washington, DC; Kevin D McDonald, Jones Day, 
Washington, DC; Sean W. Gallagher, Barlit Beck Herman Palenchar & Scott LLP, Chicago, IL.
For Hoechst Marion Roussel, Inc., Defendant: David E. Everson, LEAD ATTORNEY,  [*9] Stinson, Mag & Fizzell, 
P.C., Kansas City, MO; Victoria Lee Smith, Stinson, Morrison, Hecker, LLP, Kansas City, MO.
2012 U.S. Dist. LEXIS 11600, *5

 
For The Rugby Group, Inc., doing business as, Rugby Laboratories, Inc., Defendant: David E. Everson, LEAD 
ATTORNEYLEAD ATTORNEY, Stinson, Mag & Fizzell, P.C., Kansas City, MO; Victoria Lee Smith, Stinson, 
Morrison, Hecker, LLP, Kansas City, MO.
For Watson Pharmaceuticals, Inc., Defendant: David E. Everson, LEAD ATTORNEYLEAD ATTORNEY, Stinson, 
Mag & Fizzell, P.C., Kansas City, MO.
For Barr Laboratories, Inc., Defendant: Joseph Serino, Jr., LEAD ATTORNEY, Kirkland & Ellis, New York, NY; 
Karen N. Walker, LEAD ATTORNEY, Kirkland & Ellis, Washington, DC; Edwin U, Kirkland & Ellis LLP, Washington, 
DC.
For One or more Defendant(s) in 01-cv-2093, Defendant: Jeffrey Hall, LEAD ATTORNEY, Bartlit Beck Herman 
Palenchar & Scott, Chicago, Il; Patrick Xavier Fowler, LEAD ATTORNEY, Snell & Wilmer LLP, Phoenix, Az.
For One or more Defendant(s) in 01-cv-1107, One or more Defendant(s) in 01-cv-2691, One or more Defendant(s) 
in 01-cv-1110, Defendants: Amy A. Stathos, LEAD ATTORNEY, Jones Day Reavis & Pogue, Los Angeles, Ca; 
Jeffrey A. LeVee, LEAD ATTORNEY, Jones Day Reavis & Pogue, Los Angeles,  [*10] CA.
For One or more Defendant(s) in 01-cv-1158, Defendant: Amy A. Stathos, LEAD ATTORNEY, Jones Day Reavis & 
Pogue, Los Angeles, Ca; Jeffrey A. LeVee, LEAD ATTORNEY, Jones Day Reavis & Pogue, Los Angeles, CA; 
Kevin D McDonald, LEAD ATTORNEY, Jones Day, Washington, DC; Phillip A. Proger, LEAD ATTORNEY, Jones 
Day Reavis & Pogue, Washington, DC; William V. O'Reilly, LEAD ATTORNEY, Jones, Day, Reavis, & Pogue, 
Washington, DC.
For One or more Defendant(s) in 01-cv-1115, Defendant: Amy A. Stathos, LEAD ATTORNEY, Jones Day Reavis & 
Pogue, Los Angeles, Ca; Jeffrey A. LeVee, LEAD ATTORNEY, Jones Day Reavis & Pogue, Los Angeles, CA; 
Phillip A. Proger, LEAD ATTORNEY, Jones Day Reavis & Pogue, Washington, DC; William V. O'Reilly, LEAD 
ATTORNEY, Jones, Day, Reavis, & Pogue, Washington, DC.
For One or more Defendant(s) in 01-cv-1108, Defendant: Jeffrey A. LeVee, LEAD ATTORNEY, Jones Day Reavis 
& Pogue, Los Angeles, CA.
For One or more Defendant(s) in 01-cv-1116, Defendant: Christopher J. Healey, LEAD ATTORNEY, Luce Forward 
Hamilton and Scripps, San Diego, Ca.
For One or more Defendant(s) in 01-cv-2094, Defendant: Karen N. Walker, LEAD ATTORNEY, Kirkland & Ellis, 
Washington, DC; Sarah Dryden Mackey, LEAD  [*11] ATTORNEY, Jones, Day, Reavis & Pogue, Washington, DC.
For One or more Defendant(s) in 01-cv-1117, Defendant: David E. Everson, LEAD ATTORNEY, Stinson, Mag & 
Fizzell, P.C., Kansas City, MO; Fred H. Bartlit, Jr., LEAD ATTORNEY, Bartlit, Beck, Herman, Palenchar & Scott 
LLP, Chicago, IL; John Kevin Carey, LEAD ATTORNEY, Carlton Fields, P.A., West Palm Beach, Fl; Jonathan L. 
Greenblatt, LEAD ATTORNEY, Shearman & Sterling, Washington, DC; Joseph Ianno, Jr., LEAD ATTORNEY, 
Carlton Fields, P.A., West Palm Beach, FL; Karen N. Walker, LEAD ATTORNEY, Kirkland & Ellis, Washington, DC; 
Phillip A. Proger, LEAD ATTORNEY, Jones Day Reavis & Pogue, Washington, DC.
For One or more Defendant(s) in 01-cv-1118, Defendant: Joseph Ianno, Jr., LEAD ATTORNEY, Carlton Fields, 
P.A., West Palm Beach, FL.
For One or more Defendant(s) in 01-cv-1119, Defendant: Fred H. Bartlit, Jr., LEAD ATTORNEY, Bartlit, Beck, 
Herman, Palenchar & Scott LLP, Chicago, IL; Joseph Ianno, Jr., LEAD ATTORNEY, Carlton Fields, P.A., West 
Palm Beach, FL; Karen N. Walker, LEAD ATTORNEY, Kirkland & Ellis, Washington, DC.
For One or more Defendant(s) in 01-cv-1120, Defendant: Heather S. Woodson, LEAD ATTORNEY, Stinson, Mag & 
Frizzell, P.C., Leawood,  [*12] Ks; Jonathan L. Greenblatt, LEAD ATTORNEY, Shearman & Sterling, Washington, 
DC; Kevin D McDonald, LEAD ATTORNEY, Jones Day, Washington, DC; Phillip A. Proger, LEAD ATTORNEY, 
Jones Day Reavis & Pogue, Washington, DC; Thomas D. Yannucci, LEAD ATTORNEY, PRO HAC VICE, Kirkland 
& Ellis, Washington, DC; William V. O'Reilly, LEAD ATTORNEY, Jones, Day, Reavis, & Pogue, Washington, DC.
For One or more Defendant(s) in 01-cv-1520, Defendant: Fred H. Bartlit, Jr., LEAD ATTORNEY, Bartlit, Beck, 
Herman, Palenchar & Scott LLP, Chicago, IL; Jonathan L. Greenblatt, LEAD ATTORNEY, Shearman & Sterling, 
2012 U.S. Dist. LEXIS 11600, *9

 
Washington, DC; Karen N. Walker, LEAD ATTORNEY, Kirkland & Ellis, Washington, DC; Mark Alan Jacobson, 
LEAD ATTORNEY, Lindquist & Vennum, Minneapolis, Mn; Phillip A. Proger, LEAD ATTORNEY, Jones Day Reavis 
& Pogue, Washington, DC.
For One or more Defendant(s) in 00-cv-7649, Defendant: Karen A. Confoy, LEAD ATTORNEY, Sterns & Weinroth, 
P.C., Trenton, NJ.
For One or more Defendant(s) in 00-cv-7650, Defendant: Fred H. Bartlit, Jr., LEAD ATTORNEY, Bartlit, Beck, 
Herman, Palenchar & Scott LLP, Chicago, IL; Kevin D McDonald, LEAD ATTORNEY, Jones Day, Washington, DC; 
Lawrence D. Rosenberg, LEAD ATTORNEY, Jones, Day,  [*13] Reavis & Pogue, New York, NY; Phillip A. Proger, 
LEAD ATTORNEY, Jones Day Reavis & Pogue, Washington, DC; William V. O'Reilly, LEAD ATTORNEY, Jones, 
Day, Reavis, & Pogue, Washington, DC.
For One or more Defendant(s) in 01-cv-644, Defendant: Barbra S. Levy, LEAD ATTORNEY, Jones Day reavis & 
Pogue, New York, NY; Fred H. Bartlit, Jr., LEAD ATTORNEY, Bartlit, Beck, Herman, Palenchar & Scott LLP, 
Chicago, IL; Jonathan L. Greenblatt, LEAD ATTORNEY, Shearman & Sterling, Washington, DC; Karen N. Walker, 
Thomas D. Yannucci, LEAD ATTORNEYS, Kirkland & Ellis, Washington, DC; Kevin D McDonald, LEAD 
ATTORNEY, Jones Day, Washington, DC; Phillip A. Proger, LEAD ATTORNEY, Jones Day Reavis & Pogue, 
Washington, DC; Thomas D. Yannucci, LEAD ATTORNEY, PRO HAC VICE, Kirkland & Ellis, Washington, DC; 
William V. O'Reilly, LEAD ATTORNEY, Jones, Day, Reavis, & Pogue, Washington, DC.
For One or more Defendant(s) in 01-cv-648, Defendant: Barbra S. Levy, LEAD ATTORNEY, Jones Day reavis & 
Pogue, New York, NY; David E. Everson, LEAD ATTORNEY, Stinson, Mag & Fizzell, P.C., Kansas City, MO; Fred 
H. Bartlit, Jr., LEAD ATTORNEY, Bartlit, Beck, Herman, Palenchar & Scott LLP, Chicago, IL; Jonathan L. 
Greenblatt, LEAD ATTORNEY,  [*14] Shearman & Sterling, Washington, DC; Thomas D. Yannucci, PRO HAC 
VICE, Karen N. Walker, LEAD ATTORNEYS, Kirkland & Ellis, Washington, DC; Kevin D McDonald, LEAD 
ATTORNEY, Jones Day, Washington, DC; Kimberly S. Penner, LEAD ATTORNEY, McCarter & English, LLP, New 
York, NY; Phillip A. Proger, LEAD ATTORNEY, Jones Day Reavis & Pogue, Washington, DC; William V. O'Reilly, 
LEAD ATTORNEY, Jones, Day, Reavis, & Pogue, Washington, DC.
For One or more Defendant(s) in 01-cv-647, Defendant: Barbra S. Levy, LEAD ATTORNEY, Jones Day reavis & 
Pogue, New York, NY; Miriam S. Higgins, LEAD ATTORNEY, HeartShare Human Services of New York, Brooklyn, 
NY.
For One or more Defendant(s) in 01-cv-1111, Defendant: Anna M. Grizzle, Dale R. Grimes, Robert E. Cooper, Jr., 
LEAD ATTORNEYS, Bass Berry & Sims, Nashville, Tn; David E. Everson, LEAD ATTORNEY, Stinson, Mag & 
Fizzell, P.C., Kansas City, MO; Fred H. Bartlit, Jr., LEAD ATTORNEY, Bartlit, Beck, Herman, Palenchar & Scott 
LLP, Chicago, IL; James D. Wilson, LEAD ATTORNEY, Harris Shelton Dunlap Cobb & Ryder, Memphis, Tn; 
Jonathan L. Greenblatt, LEAD ATTORNEY, Shearman & Sterling, Washington, DC."
877,Judges,"Judges: FREDERIC BLOCK, Senior United States District Judge."
877,Opinion by,Opinion by: FREDERIC BLOCK
880,Counsel,"Counsel: Kiesel Boucher Larson, William Larson; and Herbert L. Greenberg for Plaintiff and Appellant.
Manatt, Phelps & Phillips, Gregory N. Pimstone, Craig S. Bloomgarden, Joanna S. McCallum and Joanna Rosen 
for Defendant and Respondent."
880,Judges,"Judges: PERLUSS, P. J.; WOODS, J., JACKSON, J. concurred."
880,Opinion by,Opinion by: PERLUSS
895,Counsel,"Counsel:  [**1] For Plaintiff: Gordon L. Osaka, Kelly A. Fisher, GORDON L. OSAKA, ATTORNEY AT LAW, P.C., 
Portland, OR.
For Defendant: Bruce H. Schneider, STROOCK & STROOCK & LAVAN LLP, New York, NY; Philip S. Van Der 
Weele, K&L GATES LLP, Portland, OR."
895,Judges,"Judges: Michael H. Simon, United States District Judge."
895,Opinion by,Opinion by: Michael H. Simon
906,Counsel,"Counsel:  [**1] For Kirsten Schatz, Individually and on behalf of all others similarly situated, Patrick Witty, 
individually and on behalf of all others similarly situated, Plaintiffs: William Robert Weinstein, LEAD ATTORNEY, 
Law Offices of William R. Weisnstein, White Plains, NY; Kenneth Allan Levy, PRO HAC VICE, Kenneth A. Levy, 
Esq, Monroe, NY.
For Cellco Partnership, doing business as Verizon Wireless, Defendant: William Harlow Pratt, LEAD ATTORNEY, 
Kirkland and Ellis LLP, Palo Alto, CA; Joshua B. Simon, Mark Waldemar Rasmussen, Kirkland & Ellis LLP (NYC), 
New York, NY."
906,Judges,"Judges: Richard J. Holwell, United States District Judge."
906,Opinion by,Opinion by: Richard J. Holwell
927,Counsel,"Counsel: For Plaintiffs-Appellants: Gary B. Friedman, Friedman Law Group LLP (Tracey Kitzman, Aaron Patton, 
Warren Parrino, on the brief), New York, NY.
For Defendants-Appellees: Bruce H. Schneider, Stroock & Stroock & Lavan, LLP, New York, NY; Julia B. 
Strickland, Stephen J. Newman, Stroock & Stroock & Lavan LLP, Los Angeles, CA; Michael K. Kellogg, Derek T. 
Ho, Kellogg,  [**2] Huber, Hansen, Todd, Evans & Figel, PLLC, Washington, DC."
928,Judges,"Judges: POOLER and SACK, Circuit Judges.2"
928,Opinion by,Opinion by: POOLER
