頁碼,內容類型,內容
1043,Counsel,"Counsel:  [*1] Martin Quinn, Special Master, Pro se, JAMS, San Francisco, CA.
For Martin Quinn, Special Master: Martin Quinn, JAMS, San Francisco, CA.
Mr. Daniel Weinstein, Special Master, Pro se, JAMS, Inc., San Francisco, CA.
For Mr. Daniel Weinstein, Special Master: Martin Quinn, JAMS, San Francisco, CA.
For Giles Patricia, 07-3078, Plaintiff: Samuel W. Lanham, Jr., LEAD ATTORNEY, Lanham & Blackwell, Bangor, 
ME; Ian Otto, Straus & Boies LLP, Fairfax, VA.
For Gina Cerda, 07-1339, Linda Klare, 07-1339, Plaintiffs: Mario Nunzio Alioto, LEAD ATTORNEY, Trump Alioto 
Trump & Prescott LLP, San Francisco, CA.
For ATS Claim, LLC, 09-1115, Plaintiff: David Paul Germaine, LEAD ATTORNEY, Chicago, IL; Jason C. Murray, 
Crowell & Moring LLP, Los Angeles, CA.
For Direct Purchaser Plaintiffs, Plaintiff: Daniel L. Warshaw, LEAD ATTORNEY, Pearson, Simon, Warshaw & 
Penny LLP, Sherman Oaks, CA; Eric B. Fastiff, LEAD ATTORNEY, Andrew Scirica Kingsdale, Brendan Patrick 
Glackin, Lieff, Cabraser, Heimann & Bernstein, LLP, San Francisco, CA; Hilary Kathleen Ratway, LEAD 
ATTORNEY, Hausfeld, LLP, Washington, DC; Bruce Lee Simon, Pearson, Simon, Warshaw & Penny, LLP, San 
Francisco, CA; Richard Martin Heimann, Lieff Cabraser Heimann  [*2] & Bernstein, San Francisco, CA.
For Hewlett-Packard Company, Interested Party (5/19/09), 10-5577, Plaintiff: Beatrice B. Nguyen, Gregory D. Call, 
Esq., LEAD ATTORNEYS, Suzanne E. Rode, Crowell & Moring LLP, San Francisco, CA; Bryan Leach, Bartlit Beck 
Herman Palenchar & Scott LLP, Denver, CO; Fred H. Bartlit, Jr., Lester Houtz, Bartlit Beck Herman Palenchar & 
Scott, Denver, CO; Karma Micaela Giulianelli, PRO HAC VICE, Bartlit Beck Herman Palenchar & Scott, Denver, 
CO; Mark E Ferguson, Barlitt Beck Herman Palenchar & Scott, Chicago, Il; Mark S. Ouweleen, Attorney at Law, 
Bartlit Beck Herman Palenchar & Scott LLP, Chicago, IL.

 
For BellSouth Telecommunications, Inc., 09-4997, Pacific Bell Telephone Company 09-4997, Southwestern Bell 
Telephone Company, 09-4997, AT & T Corp., 09-4997, AT & T Datacomm, Inc., 09-4997, AT & T Mobility LLC, 09-
4997, AT & T Operations, Inc., 09-4997, AT & T Services, Inc., 09-4997, Plaintiffs: Christopher T. Leonardo, 
Kenneth L. Adams, R. Bruce Holcomb, Adams Holcomb LLP, Washington, DC; Jason C. Murray, Joshua Courtney 
Stokes, Crowell & Moring, Los Angeles, CA; Jeffrey H. Howard, PRO HAC VICE, Crowell & Moring LLP, 
Washington, DC; Jerome A. Murphy, Crowell &  [*3] Moring LLP, Liaison Counsel for Direct Aciton Plaintiffs, 
Washington, DC; Nathanial John Wood, Crowell & Moring LLP, San Francisco, CA; Joshua C. Stokes, Crowell & 
Moring LLP.
For Nokia Corporation, 09-5609, Nokia Inc., 09-5609, Plaintiffs: Brian Parker Miller, Donald MacKaye Houser, 
Edward Paul Bonapfel, Joann Elizabeth Johnston, Kacy Christine McCaffrey, Alston and Bird LLP, Atlanta, GA; 
Kevin Michael Pitre, Alston and Bird, Atlanta, GA; Lisa Kathleen Bojko, Alston & Bird, Atlanta, GA; Matthew Scott 
Orrell, Atlanta, GA; Matthew D. Richardson, Peter Konito, Alston Bird LLP, Atlanta, GA; Randall Lee Allen, Alston 
and Bird, Menlo Park, CA; Richard W. Stimson, Alston & Bird LLP, Dallas, TX; Valarie Cecile Williams, Donald 
MacKaye Houser, Alston & Bird LLP, Atlanta, GA.
For Motorola, Inc., 09-5840, Plaintiff: Jason C. Murray, Crowell & Moring LLP, Los Angeles, CA; Jeffrey H. Howard, 
PRO HAC VICE, Crowell & Moring LLP, Washington, DC; Jerome A. Murphy, Crowell & Moring LLP, Liaison 
Counsel for Direct Aciton Plaintiffs, Washington, DC; Joshua Courtney Stokes, Crowell & Moring, Los Angeles, CA; 
Nathanial John Wood, Crowell & Moring LLP, San Francisco, CA; R. Bruce Holcomb, Adams Holcomb LLP, 
 [*4] Washington, DC.
For Electrograph Systems, Inc., 10-117, Electrograph Technologies, Corp., 10-117, Plaintiffs: Jason C. Murray, 
Crowell & Moring LLP, Los Angeles, CA; Philip J Iovieno, Boies, Schiller & Flexner LLP, Albany, NY; William A. 
Isaacson, Boies Schiller & Flexner, Washington, DC.
For Dell Inc., 10-1064, Dell Products, L.P., 10-1064, Plaintiffs: Andrew Jacob Tuck, Debra Dawn Bernstein, 
Elizabeth Helmer Jordan, Matthew David Kent, Michael P. Kenny, Rodney J Ganske, Steven Daniel Hemminger, 
Alston and Bird LLP, Atlanta, GA; Douglas R. Young, Farella Braun & Martel LLP, San Francisco, CA; Melissa 
Mahurin Whitehead, Alston and Bird, Atlanta, GA.
For Indirect Purchaser Plaintiffs, Plaintiff: Joseph M. Alioto, Sr., LEAD ATTORNEY, Alioto Law Firm, San Francisco, 
CA; Daniel R. Shulman, Gray, Plant, Mooty, Mooty & Bennett, P.A., Minneapolis, MN; Derek G. Howard, Minami 
Tamaki LLP, San Francisco, CA; Jack Wing Lee, LEAD ATTORNEY, Minami Tamaki LLP, San Francisco, CA; 
John Dmitry Bogdanov, Cooper & Kirkham, P.C, San Francisco, CA; Robert William Finnerty, Girardi Keese, Los 
Angeles, CA; Steven J Foley, Hellmuth and Johnson PLLC, Edina, MN; Tracy R. Kirkham, Cooper & Kirkham, P.C., 
San Francisco,  [*5] CA; Gregory W. Landry, LaMarca & Landry, P.C.; Marvin A. Miller, Miller Law LLC.
For State of Oregon, 10-4346, ex rel. John Kroger, Attorney General, Plaintiff: Blake Lee Harrop, Office of the 
Attorney General, Antitrust Bureau, Chicago, IL; Brady R. Johnson, Attorney General of Washington, Seattle, WA; 
Michael E. Haglund, Michael K. Kelley, Michael G. Neff, Haglund Kelley Horngren Jones & Wilder, LLP, Portland, 
OR; Shay S. Scott, Haglund Kelley Horngren Jones & Wilder LLP, Portland, OR; Tim David Nord, Oregon 
Department of Justice, Financial Fraud/Consumer Protection, Salem, OR.
For Direct Purchaser Plaintiffs, Plaintiff: Joseph Richard Saveri, LEAD ATTORNEY, Lieff, Cabraser, Heiman & 
Bernstein, LLP, San Francisco, CA; Aaron M. Sheanin, Girard Gibbs LLP, San Francisco, CA; Andrew Scirica 
Kingsdale, Brendan Patrick Glackin, Lieff, Cabraser, Heimann & Bernstein, San Francisco, CA; Bruce Lee Simon, 
Pearson, Simon, Warshaw & Penny, LLP, San Francisco, CA; Eric B. Fastiff, Lieff, Cabraser, Heimann & Bernstein, 
LLP, Richard Martin Heimann, LEAD ATTORNEY, Lieff Cabraser Heimann & Bernstein, INTERIM LEAD 
COUNSEL, DIRECT PURCHASER CASES, San Francisco, CA. Thomas Kay Boardman, Pearson Simon, 
 [*6] Warshaw and Penny, LLP, San Francisco, CA.
For Tracfone Wireless, Inc., 10-3205, Plaintiff: David Bedford Esau, James Blaker Baldinger, Carlton Fields, P.A., 
West Palm Beach, FL; Robert L. Ciotti, Carlton Fields, Tampa, FL.
For State of Missouri, 10-3619, ex rel. Chris Koster, Attorney General, Plaintiff: Anne E. Schneider, Attorney 
General of Missouri; Liaison Counsel for the State Actions, LEAD ATTORNEY, Jefferson City, MO.
2012 U.S. Dist. LEXIS 21696, *2

 
For State of Arkansas, 10-3619, ex rel. Dustin, McDaniel, Attorney General, Plaintiff: David A. Curran, Assistant 
Attorney General, Little Rock, AR; Kevin Wells, Arkansas Attorney General's Office, Little Rock, AR.
For State of Michigan, 10-3619, ex rel. Michael A. Cox, Attorney General, Plaintiff: Mary Elizabeth Lippitt, Michigan 
Attorney General, Lansing, MI.
For State of Missouri, 10-3619, ex rel. Chris Koster, Attorney General, Plaintiff: Andrew McNally Hartnett, Office of 
the Missouri, Attorney General, Jefferson City, MO; Anne E. Schneider, Attorney General of Missouri, Consumer 
Protection, Jefferson City, MO.
For State of West Virginia, 10-3619, ex rel Darrell McGraw, Attorney General, Plaintiff: Douglas Lee Davis, Attorney 
General, Consumer Protection and Antitrust,  [*7] Charleston, WV; Jill L. Miles, Assistant Attorney General, 
Charleston, WV.
For State of Wisconsin, 10-3619, ex rel J.B. Van Hollen, Attorney General, Plaintiff: Gwendolyn J. Cooley, 
Wisconsin Attorney General, Madison, WI.
For State of Florida, Office of the Attorney General, Department of Legal Affairs, 10-3517, Plaintiff: Eli Friedman, 
Office of the Attorney General, State of Florida, Tallahassee, FL; Lizabeth Ann Leeds Brady, Nicholas J. 
Weilhammer, Robert Scott Palmer, Office of the Attorney General, Antitrust Division, The Capitol, PL-01, 
Tallahassee, FL.
For Best Buy Co., Inc., 10-4572, Best Buy Enterprise Services, Inc., 10-4572, Best Buy Purchasing LLC, 10-4572, 
Best Buy Stores, L.P., 10-4572, Magnolia Hi-Fi, Inc., 10-4572, Plaintiffs: David Martinez, LEAD ATTORNEY, 
Robins Kaplan Miller & Ciresi L.L.P., Los Angeles, CA; Matthew David Taggart, LEAD ATTORNEY, Attorney at 
Law, Robins Kaplan Miller and Ciresi LLP, Los Angeles, CA; Elliot S. Kaplan, Robins Kaplan Miller & Ciresi, 
Minneapolis, MN; K. Craig Wildfang, Attorney at Law, Minneapolis, MN; Laura Elizabeth Nelson, Robins Kaplan 
Miller and Ciresi, Minneapolis, MN; Lauren E. Wood, Robins Kaplan Miller & Ciresi L.L.P., Minneapolis,  [*8] MN; 
Roman M. Silberfeld, Robins Kaplan Miller & Ciresi L.L.P., Los Angeles, CA.
For Target Corp., 10-4945, Kmart Corp, 10-4945, Sears, Roebuck and Co., 10-4945, Good Guys, Inc., 10-4945, 
Newegg Inc., 10-4945, Plaintiffs: Christopher T. Leonardo, Adams Holcomb LLP, Washington, DC; Jason C. 
Murray, Crowell & Moring LLP, Los Angeles, CA; Jeffrey H. Howard, PRO HAC VICE, Crowell & Moring LLP, 
Washington, DC; Jerome A. Murphy, Crowell & Moring LLP, Liaison Counsel for Direct Aciton Plaintiffs, 
Washington, DC; Joshua Courtney Stokes, Crowell & Moring, Los Angeles, CA; Kenneth L. Adams, Adams 
Holcomb LLP, Washington, DC; Nathanial John Wood, Crowell & Moring LLP, San Francisco, CA; R. Bruce 
Holcomb, Adams Holcomb LLP, Washington, DC.
For Radioshack Corp., 10-4945, Plaintiff: Christopher T. Leonardo, Adams Holcomb LLP, Washington, DC; Jason 
C. Murray, Crowell & Moring LLP, Los Angeles, CA; Jeffrey H. Howard, PRO HAC VICE, Crowell & Moring LLP, 
Washington, DC; Jerome A. Murphy, Crowell & Moring LLP, Liaison Counsel for Direct Aciton Plaintiffs, 
Washington, DC; Joshua Courtney Stokes, Crowell & Moring, Los Angeles, CA; Kenneth L. Adams, Adams 
Holcomb LLP, Washington, DC; Nathanial John Wood, Crowell  [*9] & Moring LLP, San Francisco, CA; R. Bruce 
Holcomb, Adams Holcomb LLP, Washington, DC.
For Eastman Kodak Company, 10-5452, Plaintiff: Blaire Zina Russell, Nixon Peabody, SF, CA; John R. Foote, Karl 
David Belgum, Nixon Peabody LLP, San Francisco, CA.
For SB Liquidation Trust, 10-5458, Plaintiff: Allan Diamond, Jason Paul Fulton, Jim McCarthy, McCarthy D. James, 
Diamond McCarthy LLP, Dallas, TX; Erica W. Harris, Marc M. Seltzer, Ryan Christopher Kirkpatrick, Steven Gerald 
Sklaver, Susan Godfrey LLP, Houston, TX.
For Costco Wholesale Corp., 11-0058, Plaintiff: Cori G. Moore, David J. Burman, Noah G. Purcell, Troy Philip 
Sauro, Perkins Coil LLP, Seattle, WA; Euphemia Nikki Thomopulos, Perkins Coie, San Francisco, CA.
For Sony Computer Entertainment America, LLC, 10-5616, (10-5620 - voluntery dismissal), Sony Electronics, Inc., 
10-5616, (10-5620 - voluntary dismissal), Plaintiffs: David Mark Goldstein, Esq., Ross Christopher Paolino, Stephen 
V. Bomse, Orrick, Herrington & Sutcliffe LLP, San Francisco, CA; Richard James Mooney, Bryan Cave LLP, San 
2012 U.S. Dist. LEXIS 21696, *6

 
Francisco, CA; Robert L. Stolebarger, Holmes Roberts &  [*10] Owen LLP, San Francisco, CA; Shannon Christine 
Leong, Orrick Herrington and Sutcliffe, SF, CA.
For Alfred H. Siegel, 10-5625, as Trustee of the Circuit City Stores, Inc. Liquidating Trust, Plaintiff: David Humberto 
Orozco, Susman Godfrey LLP, Los Angeles, CA; H. Lee Godfrey, Johnny William Carter, Jonathan Jeffrey Ross, 
N/A, Kenneth S. Marks, Marc M. Seltzer, Susman Godfrey LLP, Houston, TX; Jordan Connors, Parker C. Folse, III, 
Rachel S. Black, Susman Godfrey LLP, Seattle, WA.
For State of New York, 11-0711, Plaintiff: Amy Elizabeth McFarlane, LEAD ATTORNEY, Geralyn Jeanette Trujillo, 
Jeremy R. Kasha, Richard L. Schwartz, New York State Office of the Attorney General, New York, NY.
For MetroPCS Wireless Inc., 11-0829, Plaintiff: Philip J Iovieno, LEAD ATTORNEY, Philip J. Iovieno, Boies, Schiller 
& Flexner LLP, Albany, NY; Anne M. Nardacci, Albany, NY; Lewis Titus LeClair, Mike McKool, Jr., Scott R Jacobs, 
McKool Smith, Dallas, TX; William A. Isaacson, Boies Schiller & Flexner, Washington, DC.
For Office Depot, Inc., 11-2225, Plaintiff: Stuart H. Singer, LEAD ATTORNEY, Stuart Harold Singer, Boies, Schiller 
& Flexner, LLP, Fort Lauderdale, FL; William A. Isaacson, Boies Schiller & Flexner,  [*11] Washington, DC.
For Jaco Electronics, Inc., 11-2495, Plaintiff: Jason C. Murray, Crowell & Moring LLP, Los Angeles, CA; Jeffrey H. 
Howard, PRO HAC VICE, Crowell & Moring LLP, Washington, DC; Jerome A. Murphy, Crowell & Moring LLP, 
Liaison Counsel for Direct Aciton Plaintiffs, Washington, DC; Joshua Courtney Stokes, Crowell & Moring, Los 
Angeles, CA; Nathanial John Wood, Crowell & Moring LLP, San Francisco, CA.
For T-Mobile USA Inc, 11-2591, Plaintiff: Brooke Ashley-May Taylor, Parker C Folse, III, Susman Godfrey L.L.P., 
Seattle, WA; Daniel B Rapport, Hallie B. Levin, PRO HAC VICE, Edward A. Friedman, Alexander David Levi, 
FRIEDMAN KAPLAN SEILER ADELMAN LLP, NEW YORK, NY; David H. Orozco, PRO HAC VICE, SUSMAN 
GODFREY (LA, CA), LOS ANGELES, CA.
For BestBuy.com, L.L.C., Plaintiff: David Martinez, LEAD ATTORNEY, Robins Kaplan Miller & Ciresi L.L.P., Los 
Angeles, CA; Laura Elizabeth Nelson, Robins Kaplan Miller and Ciresi, Minneapolis, MN.
For Benjamin Larry Luber, Class representative of the Missouri state, Plaintiff: Craig C. Corbitt, Francis Onofrei 
Scarpulla, Qianwei Fu, Zelle Hofmann Voelbel & Mason LLP, San Francisco, CA; Heather T Rankie, Zelle Hofmann 
et al, SF, CA; Joseph M. Alioto,  [*12] Sr., LEAD ATTORNEY, Alioto Law Firm, San Francisco, CA; Judith A. Zahid, 
Patrick Bradford Clayton, Zelle Hofmann Voelbel Mason & Gette, San Francisco, CA; Theresa Driscoll Moore, 
Alioto Law Firm, San Francisco, CA.
For Interbond Corporation of America, 11-3763, Plaintiff: Philip J Iovieno, LEAD ATTORNEY, Philip J. Iovieno, 
Boies, Schiller & Flexner LLP, Albany, NY; Stuart Harold Singer, Boies, Schiller & Flexner, LLP, Fort Lauderdale, 
FL; William A. Isaacson, Boies Schiller & Flexner, Washington, DC.
For Schultze Agency Services, LLC, (11-3856) on behalf of Tweeter OPCO, LLC and Tweeter Newco, LLC, Marta 
Cooperative of America, Inc., 11-4119, P.C. Richard & Son Long Island Corporation, 11-4119, ABC Appliance, Inc., 
11-4119, Plaintiffs: Anne M. Nardacci, Albany, NY; Christopher V. Fenlon, Albany, NY; Philip J. Iovieno, Boies, 
Schiller & Flexner LLP, Albany, NY; William A. Isaacson, Boies Schiller & Flexner, Washington, DC.
For Indirect Purchaser Plaintiffs, Plaintiff: Allan Steyer, Steyer Lowenthal Boodrookas Alvarez & Smith LLP, San 
Francisco, CA.
For Barry R. Himmelstein, Plaintiff: Barry R. Himmelstein, LEAD ATTORNEY, HIMMELSTEIN LAW NETWORK, 
Emeryville, CA.
For Tech Data Corporation,  [*13] 11-5765, Tech Data Product Management, Inc., 11-5765, The AASI Creditor 
Liquidating Trust, 11-5781 (by and through Kenneth A. Welt, Liquidating Trustee), Plaintiffs: Melissa Willett, William 
A. Issacson, Boies, Schiller & Flexner, Washington, DC; Mitchell E. Widom, Robert William Turken, Bilzin Sumberg 
Baena Price & Axelrod, LLP, Miami, FL; Scott N. Wagner, PRO HAC VICE, Bilzin Sumberg Baena Price & Axelrod, 
LLP, Miami, FL; Stuart Harold Singer, Boies, Schiller & Flexner, LLP, Fort Lauderdale, FL.
2012 U.S. Dist. LEXIS 21696, *9

 
For Compucom Systems Inc, 11-6241, Plaintiff: Christopher V. Fenlon, Philip J. Iovieno, Boies Schiller & Flexner 
LLP, Albany, NY; Lewis Titus LeClair, Mike McKool, Jr., Scott R Jacobs, McKool Smith, Dallas, TX; William A. 
Isaacson, Boies Schiller & Flexner, Washington, DC.
For Viewsonic Corporation, 12-0335, Plaintiff: Jason C. Murray, Crowell & Moring LLP, Los Angeles, CA; Jeffrey H. 
Howard, PRO HAC VICE, Crowell & Moring LLP, Washington, DC; Jerome A. Murphy, Crowell & Moring LLP, 
Liaison Counsel for Direct Aciton Plaintiffs, Washington, DC.
For LG Display Co., Ltd., (D, I, 09-1115) formerly known as LG Philips LCD Co., LTD, Defendant: Jerome Cary 
Roth, LEAD ATTORNEY, Kristin Linsley Myles,  [*14] Esq., Munger Tolles & Olson LLP, San Francisco, CA; Arman 
Oruc, Simpson Thacher and Bartlett LLP, Washington, DC; Brad D. Brian, Jonathan E. Altman, Jonathan Ellis 
Altman, Stuart Neil Senator, Truc Thanh Do, Munger Tolles & Olson LLP, Los Angeles, CA; Christopher Alan 
Nedeau, Nossaman LLP, San Francisco, CA; Hailyn Jennifer Chen, Attorney at Law, Los Angeles, CA; Holly A. 
House, Paul Hastings LLP, San Francisco, CA; Jane Jung Ah Lee, Jonathan Lin, Simpson Thacher and Bartlett 
LLP, Washington, DC; Jonathan Charles Sanders, Simpson Thacher Bartlett LLP, Palo Alto, CA; Kevin C. McCann, 
Paul Hastings Janofsky & Walker LLP, San Francisco, CA; Lee F Berger, Sean David Unger, Paul Hastings LLP, 
San Francisco, CA.
For Samsung Electronics Co. Ltd., (D, I, 09-1115), Defendant: Christopher Alan Nedeau, Nossaman LLP, San 
Francisco, CA; Daniel M Suleiman, Neil K. Roman, Robert D. Wick, Theodore Paul Metzler, Covington & Burling 
LLP, John Stewart Playforth, Derek Ludwin, Washington, DC; Elizabeth Catherine Arens, Covington and Burling, 
L.L.P. (DC), Washington, DC; Jeffrey Michael Davidson, Steven D Sassaman, Timothy C. Hester, Covington & 
Burling LLP, San Francisco, CA.
For Sharp Corporation, (D,  [*15] I, 09-1115), Sharp Electronics Corporation, (D, I, 09-1115), Defendants: Jacob R. 
Sorensen, LEAD ATTORNEY, Pillsbury Winthrop Shaw Pittman LLP, San Francisco, CA; Andrew Dale Lanphere, 
John M. Grenfell, Lindsay A. Lutz, Ryan Takemoto, Pillsbury Winthrop Shaw Pittman LLP, San Francisco, CA; 
Anne Benton Kaldor, Colin C. West, Erin Alysa Smart, Kristen A. Palumbo, Richard S. Taffet, Jon R. Roellke, 
Bingham McCutchen LLP, San Francisco, CA; Bruce H. Searby, Craig A Benson, Craig A. Benson, Joseph J 
Simons, Paul Weiss Rifkind Wharton & Garrison LLP, Washington, DC; Christopher Alan Nedeau, Nossaman LLP, 
San Francisco, CA; Joshua Courtney Stokes, Crowell & Moring, Los Angeles, CA; Kenneth A. Gallo, Clifford 
Chance US LLP, Washington, DC; Kenneth I. Schacter, Bingham McCutchen LLP, New York, NY.
For Toshiba Corporation, (D, I, 09-1115), Defendant: Christopher M. Curran, John H. Chung, Kristen Jentsch 
McAhren, LEAD ATTORNEYS, White & Case, Washington, DC; Christopher Alan Nedeau, Nossaman LLP, San 
Francisco, CA.
For Toshiba Matsushita Display Technology Co., Ltd., (D, I, 09-1115), Defendant: John H. Chung, LEAD 
ATTORNEY, White & Case LLP, New York, NY.
For Hitachi Ltd., (D, I, 09-1115), Defendant:  [*16] Christopher Alan Nedeau, Nossaman LLP, San Francisco, CA; 
Kent Michael Roger, Michelle Minju Kim-Szrom, John Clayton Everett, Jr., PRO HAC VICE, Morgan Lewis & 
Bockius LLP, San Francisco, CA; Kristie Anne Bluett, Morgan Lewis et al, SF, CA.
For Hitachi Displays, Ltd., Hitachi Electronic Devices (USA), Inc., (D, I, 09-1115), (D, I, 09-1115), Defendants: 
Christopher Alan Nedeau, Nossaman LLP, San Francisco, CA; Kent Michael Roger, Michelle Minju Kim-Szrom, 
John Clayton Everett, Jr., PRO HAC VICE, Morgan Lewis & Bockius LLP, San Francisco, CA.
For NEC Corporation, Defendant: Stephen Holbrook Sutro, Duane Morris LLP, San Francisco, CA.
For NEC LCD Technologies, Ltd., (D, I), Defendant: Stephen Holbrook Sutro, Duane Morris LLP, San Francisco, 
CA.
For NEC Electronics America, Inc., (D, I), Defendant: Stephen Holbrook Sutro, Duane Morris LLP, San Francisco, 
CA; Edward G. Biester, III, Duane Morris LLP, Philadelphia, PA.
For AU Optronics Corporation, (D, I, 09-1115), Defendant: Christopher Alan Nedeau, LEAD ATTORNEY, 
Nossaman LLP, San Francisco, CA; Allison Marie Dibley, Bryan B. Barnhart, Carl Lawrence Blumenstein, Esq., 
Patrick J. Richard, Nossaman LLP, San Francisco, CA; Jessica Rae Madrigal,  [*17] Kelly, Hockel & Klein P.C., 
2012 U.S. Dist. LEXIS 21696, *13

 
San Francisco, CA; Kirk Christopher Jenkins, Michael F. Healy, Esq., Sedwick Detert Moran & Arnold LLP, San 
Francisco, CA.
For AU Optronics Corporation America, (D, I, 09-1115), Defendant: John C. McGuire, LEAD ATTORNEY, 
Sedgwick, Detert, Moran & Arnold, Newark, NJ.
For Matthew Clark Lovell, LEAD ATTORNEY, Sedgwick LLP, San Francisco, CA; For Allison Marie Dibley, Bryan 
B. Barnhart, Carl Lawrence Blumenstein, Esq., Nossaman LLP, San Francisco, CA; Jason Haruo Wilson, Willenken 
Wilson Loh & Lieb LLP, Los Angeles, CA; Jessica Rae Madrigal, Kirk Christopher Jenkins, Michael F. Healy, Esq., 
Sedwick Detert Moran & Arnold LLP, San Francisco, CA; Patrick J. Richard, Nossaman LLP, San Francisc, CA.
For Chi Mei Optoelectronics USA, Inc., (D, I, 09-1115), Defendant: James Glenn Kreissman, LEAD ATTORNEY, 
Arka Dev Chatterjee, Jason Matthew Bussey, Simpson Thacher & Bartlett LLP, Palo Alto, CA; John Lyle Williams, 
Jr., LEAD ATTORNEY, San Jose, CA; Christopher Alan Nedeau, Nossaman LLP, San Francisco, CA; Harrison J. 
Frahn, IV, Simpson Thacher & Bartlett, Palo Alto, CA; Michael Jacob Ewart, Michael Ramsey Scott, HILLIS CLARK 
MARTIN PETERSON, SEATTLE, WA.
For Nexgen Mediatech  [*18] USA Inc, (D, 09-1115), Defendant: James Glenn Kreissman, LEAD ATTORNEY, 
Simpson Thacher & Bartlett LLP, Palo Alto, CA; John Lyle Williams, Jr., LEAD ATTORNEY, Manchester, Williams & 
Seibert, San Jose, CA; Arka Dev Chatterjee, Simpson Thacher & Bartlett LLP, Palo Alto, CA; Christopher Alan 
Nedeau, Nossaman LLP, San Francisco, CA; Harrison J. Frahn, IV, Jason Matthew Bussey, Simpson Thacher & 
Bartlett LLP, Palo Alto, CA; Michael Jacob Ewart, Michael Ramsey Scott, HILLIS CLARK MARTIN PETERSON, 
SEATTLE, WA.
For NEC Display Solutions of America, Inc., Defendant: Stephen Holbrook Sutro, Duane Morris LLP, San 
Francisco, CA; George Dominic Niespolo, Duane Morris LLP, San Francisco, CA.
For Samsung Electronics America, Inc., (D, I, 09-1115), Defendant: Christopher Alan Nedeau, Nossaman LLP, San 
Francisco, CA; Daniel M Suleiman, Derek Ludwin, Elizabeth Catherine Arens, John Stewart Playforth, Neil K. 
Roman, Robert D. Wick, Covington and Burling, L.L.P. (DC), Washington, DC; Jeffrey Michael Davidson, Steven D 
Sassaman, Covington and Burling, San Francisco, CA; Timothy C. Hester, Covington & Burling, San Francisco, CA; 
Theodore Paul Metzler, Covington and Burling LLP, Washington, DC.
For Chi Mei  [*19] Optoelectronics Corporation, (D, I, 09-1115), Defendant: James Glenn Kreissman, LEAD 
ATTORNEY, Simpson Thacher & Bartlett LLP, Palo Alto, CA; John Lyle Williams, Jr., LEAD ATTORNEY, 
Manchester, Williams & Seibert, San Jose, CA; Arka Dev Chatterjee, Simpson Thacher Bartlett LLP, Palo Alto, CA; 
Christopher Alan Nedeau, Nossaman LLP, San Francisco, CA; Harrison J. Frahn, IV, Simpson Thacher & Bartlett, 
Palo Alto, CA; Jason Matthew Bussey, Simpson Thacher and Barlett LLP, Palo Alto, CA; Melissa Margaret Derr, 
Simpson Thacher and Bartlett LLP, Palo Alto, CA; Michael Jacob Ewart, Michael Ramsey Scott, HILLIS CLARK 
MARTIN PETERSON, SEATTLE, WA.
For IPS Alpha Technology, LTD., (D), dismissed from IP amended complaint on 2/21/08, Defendant: Kent Michael 
Roger, Morgan Lewis & Bockius LLP, San Francisco, CA.
For Epson Electronics America, Inc., (D), Dismissed as a indirect purchaser defendant on 4/1/08, Defendant: 
Christopher Alan Nedeau, Nossaman LLP, San Francisco, CA; Derek Francis Foran, Stephen P. Freccero, 
Morrison & Foerster LLP, San Francisco, CA; Kimberly Linnell Taylor, Carr, McClellan, Ingersoll, Thompson & Horn, 
Burlingame, CA; Melvin R. Goldman, Morrison & Foerster, San Francisco,  [*20] CA; Sean David Unger, Paul, 
Hastings, Janofsky & Walker LLP, San Francisco, CA; Stephen E. Taylor, Taylor & Company Law Offices, LLP, 
San Francisco, CA; David Lawrence Meyer, Morrison & Foerster, Washington, DC.
For Nexgen Mediatech, Inc. (""Nexgen""), (D, 09-1115), Defendant: James Glenn Kreissman, LEAD ATTORNEY, 
Simpson Thacher & Bartlett LLP, Palo Alto, CA; John Lyle Williams, Jr., LEAD ATTORNEY, Manchester, Williams & 
Seibert, San Jose, CA; Arka Dev Chatterjee, Simpson Thacher Bartlett LLP, Palo Alto, CA; Christopher Alan 
Nedeau, Nossaman LLP, San Francisco, CA; Harrison J. Frahn, IV, Simpson Thacher & Bartlett, Palo Alto, CA; 
Jason Matthew Bussey, Simpson Thacher and Barlett LLP, Palo Alto, CA; Melissa Margaret Derr, Simpson Thacher 
and Bartlett LLP, Palo Alto, CA; Michael Jacob Ewart, Michael Ramsey Scott, HILLIS CLARK MARTIN 
PETERSON, SEATTLE, WA.
2012 U.S. Dist. LEXIS 21696, *17

 
For Tatung Company of America, Inc. (""Tatung America""), (09-1115) (dismissed on 7/21/11 by Direct Purchaser 
Plaintiff Class), Defendant: Joel Steven Sanders, LEAD ATTORNEY, Gibson, Dunn & Crutcher LLP, San 
Francisco, CA; Christopher Alan Nedeau, Nossaman LLP, San Francisco, CA; Joel Calcar Willard, Gibson, Dunn 
Crutcher LLP, San Francisco,  [*21] CA; Rachel S. Brass, Gibson Dunn & Crutcher LLP, San Francisco, CA; 
William S Farmer, Collette Erickson Farmer & O'Neill LLP, San Francisco, CA; Austin Van Schwing, Gibson, Dunn 
& Crutcher LLP, San Francisco, CA.
For Toshiba America Electronics Components, Inc., (D, I, 09-1115), Toshiba America Information Systems, Inc., (D, 
I, 09-1115), Toshiba Mobile Display Co., Ltd., Defendants: Christopher M. Curran, LEAD ATTORNEY, White & 
Case, Washington, DC; John H. Chung, LEAD ATTORNEY, White & Case LLP, New York, NY; Kristen Jentsch 
McAhren, LEAD ATTORNEY, White and Case LLP, Washington, DC; Christopher Alan Nedeau, Nossaman LLP, 
San Francisco, CA.
For LG Display America, Inc., (D, I, 09-1115), formerly known as LG Philips LCD America, Inc, Defendant: Jerome 
Cary Roth, LEAD ATTORNEY, Kristin Linsley Myles, Esq., Munger Tolles & Olson LLP, San Francisco, CA; Arman 
Oruc, Jane Jung Ah Lee, Jonathan Lin, Simpson Thacher and Bartlett LLP, Washington, DC; Brad D. Brian, 
Jonathan E. Altman, Munger Tolles & Olson LLP, Los Angeles, CA; Christopher Alan Nedeau, Nossaman LLP, San 
Francisco, CA; Hailyn Jennifer Chen, Attorney at Law, Los Angeles, CA; Holly A. House, Lee F Berger, Paul 
Hastings LLP, San  [*22] Francisco, CA; Jonathan Ellis Altman, Munger Tolles and Olson, Los Angeles, CA; 
Jonathan Charles Sanders, Simpson Thacher Bartlett LLP, Palo Alto, CA; Katerina S Colitti, PRO HAC VICE, 
Cleary Gottlieb Steen & Hamilton LLP, Washington, DC; Kevin C. McCann, Paul Hastings Janofsky & Walker LLP, 
San Francisco, CA; Sean David Unger, Paul, Hastings, LLP, San Francisco, CA; Stuart Neil Senator, Munger Tolles 
& Olson, Los Angeles, CA; Truc Thanh Do, Munger Tolles Olson LLP, Los Angeles, CA.
For Toshiba Mobile Display Technology Co., Ltd., 09-4997, Defendant: Christopher Alan Nedeau, Nossaman LLP, 
San Francisco, CA.
For Mitsui & Co. (Taiwan), Limited, (D), Defendant: Erin Murdock-Park, Cleveland, Oh; Lisa Cox Ghannoum, Baker 
Hostetler, Cleveland, OH; Michael Edward Mumford, Ernest E. Vargo, Jr., Baker Hostetler LLP, Cleveland, OH; 
Paul P Eyre, Baker Hostetler LLP, New York, NY; Peter Wethrell James, Baker Hostetler, Los Angeles, CA; Tracy 
Lynn Cole, Baker & Hostetler LLP, New York, NY.
For Sanyo Consumer Electronics Co., Ltd., (D), Defendant: Allison Ann Davis, LEAD ATTORNEY, Sam N. Dawood, 
Sanjay Mohan Nangia, Davis Wright Tremaine LLP, San Francisco, CA; Christopher Alan Nedeau, Nossaman LLP, 
 [*23] San Francisco, CA; Nick Steven Verwolf, Davis Wright Tremaine LLP, Bellevue, WA.
For Samsung SDI America, Inc., Defendant: Eric Scott O'Connor, Sheppard Mullin LLP, New York, NY; Michael W. 
Scarborough, Sheppard Mullin Richter & Hampton LLP, San Francisco, CA; Tyler Mark Cunningham, Sheppard 
Mullin Richter & Hampton, San Francisco, CA.
For Samsung SDI Co., Ltd., Defendant: Christopher Alan Nedeau, Nossaman LLP, San Francisco, CA; Eric Scott 
O'Connor, Sheppard Mullin LLP, New York, NY; Michael W. Scarborough, Sheppard Mullin Richter & Hampton 
LLP, San Francisco, CA; Tyler Mark Cunningham, Sheppard Mullin Richter & Hampton, San Francisco, CA.
For Chimei Innolux Corp., Defendant: James Glenn Kreissman, LEAD ATTORNEY, Simpson Thacher & Bartlett 
LLP, Palo Alto, CA; Arka Dev Chatterjee, Simpson Thacher Bartlett LLP, Palo Alto, CA; Christopher Alan Nedeau, 
Nossaman LLP, San Francisco, CA; Harrison J. Frahn, IV, Simpson Thacher & Bartlett, Palo Alto, CA; Jason 
Matthew Bussey, Simpson Thacher and Barlett LLP, Palo Alto, CA; Michael Jacob Ewart, Michael Ramsey Scott, 
HILLIS CLARK MARTIN PETERSON, SEATTLE, WA; Michael Ramsey Scott, HILLIS CLARK MARTIN 
PETERSON, SEATTLE, WA.
For Philips Electronics  [*24] North America Corporation, Koninklijke Philips Electronics N.V., (11-2495), 
Defendants: Brendan P. Cullen, Sullivan & Cromwell, Palo Alto, CA; Matthew S. Fitzwater, Sullivan & Cromwell 
LLP, New York, NY.
For Tatung Company, Defendant: William S Farmer, Collette Erickson Farmer & O'Neill LLP, San Francisco, CA; 
Joel Steven Sanders, LEAD ATTORNEY, Gibson, Dunn & Crutcher LLP, San Francisco, CA; Christopher Alan 
2012 U.S. Dist. LEXIS 21696, *20

 
Nedeau, Nossaman LLP, San Francisco, CA; William S Farmer, Collette Erickson Farmer & O'Neill LLP, San 
Francisco, CA.
For Chi Mei Optoelectronics Japan Co Ltd, Defendant: Christopher Alan Nedeau, Nossaman LLP, San Francisco, 
CA; Melissa Margaret Derr, Simpson Thacher and Bartlett LLP, Palo Alto, CA.
For Renesas Electronics America, (11-2495), NEC Corporation of America, Defendants: Stephen Holbrook Sutro, 
Duane Morris LLP, San Francisco, CA.
For Mitsui & Co. (U.S.A.), Inc., Defendant: Erin Murdock-Park, Paul P Eyre, Cleveland, OH; Ernest E. Vargo, Jr., 
Michael Edward Mumford, Baker Hostetler LLP, Cleveland, OH; Tracy Lynn Cole, Baker & Hostetler LLP, New 
York, NY.
For Apple Inc., Interested Party: Caroline Nason Mitchell, Robert Allan Mittelstaedt, LEAD ATTORNEYS, Jones 
Day, San Francisco,  [*25] CA.
Douglas C. Giordan, Interested Party, Pro se, Port Washington, NY.
For State of California, Amicus: Adam Miller, LEAD ATTORNEY, CA Dept of Justice, San Francisco, CA; Emilio 
Eugene Varanini, IV, State Attorney General's Office, San Francisco, CA.
For State of South Carolina, Amicus: Susan Foxworth Campbell, McGowan Hood and Felder, Columbia, SC.
For United States Antitrust Division, Department of Justice, Intervenor: Peter K. Huston, LEAD ATTORNEYS, 
Department of Justice, Antitrust Division, San Francisco, CA; Alexandra Jill Shepard, Micah Lanielle Wyatt, U.S. 
Department of Justice, Antitrust Division, San Francisco, CA; David J. Ward, U.S. Department of Justice, Antritrust 
Division, San Francisco Field Office, San Francisco, CA; E. Kate Patchen, U.S. Department of Justice, San 
Francisco, CA; Heather S. Tewksbury, United States Department of Justice, Antitrust Division, San Francisco, CA; 
Michael L. Scott, Antitrust Division, San Francisco, CA.
For State of Illinois, Intervenor: Blake Lee Harrop, LEAD ATTORNEY, Office of the Attorney General, Antitrust 
Bureau, Chicago, IL; Brady R. Johnson, Attorney General of Washington, Seattle, WA; Chadwick Oliver Brooker, 
Office of the Illinois  [*26] Attorney General, Chicago, IL; Michael E. Haglund, Haglund Kelley Horngren Jones & 
Wilder, LLP, Portland, OR; Michael K. Kelley, Haglund Kelley Horngren Jones & Wilde LLP, Portland, OR.
For State of Washington, 10-5711 (plaintiff), Intervenor: Brady R. Johnson, LEAD ATTORNEY, Attorney General of 
Washington, Seattle, WA; Blake Lee Harrop, Office of the Attorney General, Antitrust Bureau, Chicago, IL; 
Jonathan A Mark, Attorney General of Washington, Seattle, WA; Michael E. Haglund, Haglund Kelley Horngren 
Jones & Wilder, LLP, Portland, OR; Michael K. Kelley, Haglund Kelley Horngren Jones & Wilde LLP, Portland, OR; 
Tina E. Kondo, Senior Assistant Attorney General, Seattle, WA.
For NEC LCD Technologies, Ltd., Intervenor: Stephen Holbrook Sutro, Duane Morris LLP, San Francisco, CA.
For Samsung SDI America, Inc., Samsung SDI Co., Ltd., Intervenors: Michael W. Scarborough, Sheppard Mullin 
Richter & Hampton LLP, San Francisco, CA; Tyler Mark Cunningham, Sheppard Mullin Richter & Hampton, San 
Francisco, CA.
For Philips Electronics North America Corp., Intervenor: Brendan P. Cullen, Sullivan & Cromwell, Palo Alto, CA.
For Sanyo Consumer Electronics Co., Ltd., Intervenor: Allison Ann Davis, Davis  [*27] Wright Tremaine LLP, San 
Francisco, CA."
