頁碼,內容類型,內容
21,Counsel,"Counsel:  [*1] Attorneys for Plaintiffs: Not Present.
Attorneys for Defendants: Not Present."
21,Judges,Judges: James V. Selna.
21,Opinion by,Opinion by: James V. Selna
35,Counsel,"Counsel:  [*1] Judge Read Ambler, Special Master, Pro se, San Jose, CA.
For Michael Malone, individually and on behalf of all others similarly situated, Plaintiff: Michael Andrew McShane, 
LEAD ATTORNEY, Aaron H. Darsky, Audet & Partners, LLP, SAN FRANCISCO, CA; Beverly Tse, Christopher S. 
Studebaker, Daniel Hume, David E. Kovel, Kenneth G. Walsh , Kirby McInerney, LLP, New York, NY; Christine 
Pedigo Bartholomew, Rosemary M. Rivas, Finkelstein Thompson LLP, San Francisco, CA; Elaine T. Byszewski, 
Hagens Berman Sobol Shaprio LLP, Los Angeles, CA; George W. Sampson, Steve W. Berman, PRO HAC VICE, 
Hagens Berman Sobol Shapiro LLP, Seattle, WA; I. Stephen Rabin, Rabin & Peckel LLP, New York, NY; Jeff D 
Friedman, Shana E. Scarlett, Hagens Berman Sobol Shapiro LLP, Berkeley, CA; Jeffrey Squire, Bragar Wexler & 
Eagel, P.C., New York, NY; Joseph P. Garland, Klein & Solomon LLP, New York, NY; Joseph V. McBride, Rabin 
and Peckel, New York, NY; Karina Kosharskyy , PRO HAC VICE, New York, NY.
For Ann Farmer, Todd Van Pelt, Plaintiffs: Beverly Tse, Christopher S. Studebaker, Kenneth G. Walsh , Kirby 
McInerney, LLP, New York, NY; Elaine T. Byszewski, Hagens Berman Sobol Shaprio LLP, Los Angeles, CA; 
George W. Sampson,  [*2] Steve W. Berman, PRO HAC VICE, Hagens Berman Sobol Shapiro LLP, Seattle, WA; 
Jeff D Friedman, Shana E. Scarlett, Hagens Berman Sobol Shapiro LLP, Berkeley, CA; Karina Kosharskyy , PRO 
HAC VICE, New York, NY.
For James Donohue, Plaintiff: Aaron H. Darsky, Audet & Partners, LLP, SAN FRANCISCO, CA; Jeff D Friedman, 
Hagens Berman Sobol Shapiro LLP, Berkeley, CA.
For Jeffrey Enebely, Plaintiff: Christopher S. Studebaker, Kirby McInerney, LLP, New York, NY; Karina Kosharskyy 
, PRO HAC VICE, New York, NY; Kenneth G. Walsh , Kirby McInerney LLP, New York, NY; Reginald Von Terrell, 
The Terrell Law Group, Oakland, CA.

 
For eBay, Inc., Defendant: Julie Dawn Wood, LEAD ATTORNEY, O'Melveny & Myers, San Francisco, CA; Thomas 
Patrick Brown, LEAD ATTORNEY, Brynly R. Llyr, Dixie Lee Noonan, Katherine Robison, Michael Frederick Tubach, 
Randall W. Edwards, O'Melveny & Myers LLP, San Francisco, CA.
For AOL, LLC, Attorneys for Interested Party AOL, LLC, McGuireWoods LLP, Los Angeles, CA, Interested Party: 
Susan L. Germaise, McGuireWoods LLP, Los Angeles, CA.
For Visa Inc., Non-Party Visa Inc., Holme Roberts & Owen LLp, San Francisco, CA, Miscellaneous: Robert L. 
Stolebarger, LEAD ATTORNEY, Holmes Roberts & Owen  [*3] LLP, San Francisco, CA."
36,Judges,"Judges: JEREMY FOGEL, United States District Judge."
36,Opinion by,Opinion by: JEREMY FOGEL
49,Counsel,"Counsel:  [*1] For Precision CPAP, Inc., Med-Ex, Phase III Vans, Inc., doing business as East Medical Equipment 
and Supply, Medical Place, Inc., Plaintiffs: Brian Michael Clark, LEAD ATTORNEY, Wiggins Childs Quinn & 
Pantanzis, PC, Birmingham, AL; Dwayne Lamar Brown, LEAD ATTORNEY, Law Office of Dwayne L Brown PC, 
Montgomery, AL.
For Jackson Hospital, Defendant: Dennis Ray Bailey, LEAD ATTORNEY, Rushton Stakely Johnston & Garrett PC, 
Montgomery, AL; James Eugene Williams, LEAD ATTORNEY, Melton Espy & Williams, PC, Montgomery, AL.
For Med-South, Inc., Defendant: Dennis Ray Bailey, LEAD ATTORNEY, Rushton Stakely Johnston & Garrett PC, 
Montgomery, AL; James Eugene Williams, LEAD ATTORNEY, Melton Espy & Williams, PC, Montgomery, AL; 
Robert Brett Adair, Carlson & Adair, LLC, Birmingham, AL.
For JMS Health Services, LLC, doing business as Jackson Med-South Home Health, LLC, Defendant: Dennis Ray 
Bailey, LEAD ATTORNEY, Rushton Stakely Johnston & Garrett PC, Montgomery, AL; James Eugene Williams, 
LEAD ATTORNEY, Melton Espy & Williams, PC, Montgomery, AL; Robert Brett Adair, LEAD ATTORNEY, Carlson 
& Adair, LLC, Birmingham, AL.
For Baptist Health, Inc., Defendant: Dennis Ray Bailey, LEAD ATTORNEY, Rushton Stakely  [*2] Johnston & 
Garrett PC, Montgomery, AL; Glenn B. Rose, J. David Mcdowell, LEAD ATTORNEYS, Harwell Howard Hyne 
Gabbert & Manner, P.C., Nashville, TN; James Eugene Williams, LEAD ATTORNEY, Melton Espy & Williams, PC, 
Montgomery, AL.
For American Home Patient, Inc., Baptist Ventures-American Home Patient, Defendants: Dennis Ray Bailey, LEAD 
ATTORNEY, Rushton Stakely Johnston & Garrett PC, Montgomery, AL; , Glenn B. Rose, J. David McdowellLEAD 
ATTORNEYS, Harwell Howard Hyne Gabbert & Manner, P.C., Nashville, TN; James Eugene Williams, Melton Espy 
& Williams, PC, Montgomery, AL.
For Lincare Inc., Defendant: Gregory Scotch Ritchey, LEAD ATTORNEY, Ritchey, Simpson & Glick, PLLC, 
Birmingham, AL; Richard Stephen Walker, LEAD ATTORNEY, Ritchey & Simpson, PLLC, Birmingham, AL."
49,Judges,"Judges: Myron H. Thompson, UNITED STATES DISTRICT JUDGE."
49,Opinion by,Opinion by: Myron H. Thompson
63,Counsel,"Counsel:  [*1] For Masimo Corporation, Plaintiff: Jack B. Blumenfeld, LEAD ATTORNEY, Jeremy Alexander Tigan, 
Julia Heaney, Morris, Nichols, Arsht & Tunnell, Wilmington, DE; Deborah Croyle, Douglas G. Muehlhauser, Irfan A. 
Lateef, Jon Gurka, Joseph S. Cianfrani, Joseph R. Re, M. Lawrence Popofsky, Michelle E. Armond, Perry D. 
Oldham, Robert A. Rosenfeld, Scott A. Westrich, PRO HAC VICE.
For Philips Electronics North America Corporation, Defendant: Richard L. Horwitz, LEAD ATTORNEY, David Ellis 
Moore, Doungamon Fon Muttamara-Walker, Potter Anderson & Corroon, LLP, Wilmington, DE; Brian Rosenthal, 
Clayton Scott Hataway, Russell B. Hill, PRO HAC VICE.
For Philips Medizin Systeme Boblingen Gmbh, Defendant, Counter Claimant: Richard L. Horwitz, LEAD 
ATTORNEY, David Ellis Moore, Doungamon Fon Muttamara-Walker, Potter Anderson & Corroon, LLP, Wilmington, 
DE.
For Philips Electronics North America Corporation, Counter Claimant, Counter Defendant: Richard L. Horwitz, 
LEAD ATTORNEY, David Ellis Moore, Doungamon Fon Muttamara-Walker, Potter Anderson & Corroon, LLP, 
Wilmington, DE; Brian Rosenthal.
For Masimo Corporation, Counter Defendant, Counter Claimant: Jack B. Blumenfeld, LEAD ATTORNEY, Julia 
Heaney, Morris,  [*2] Nichols, Arsht & Tunnell, Wilmington, DE; Irfan A. Lateef; Jon Gurka, Joseph S. Cianfrani, 
Joseph R. Re, PRO HAC VICE."
63,Judges,"Judges: Mary Pat Thynge, UNITED STATES MAGISTRATE JUDGE.
2010 U.S. Dist. LEXIS 23057, *23057"
63,Opinion by,Opinion by: Mary Pat Thynge
70,Counsel,"Counsel:  [*1] For Midwest Agency Services, Inc., Plaintiff: Matthew D. Hemmer, Scott Rowland Thomas, LEAD 
ATTORNEYS, Hemmer, Pangburn, DeFrank PLLC, Fort Mitchell, KY.
For Premier Dealer Services, Inc., Intervenor Plaintiff: Scott Rowland Thomas, LEAD ATTORNEY, Matthew D. 
Hemmer, Hemmer, Pangburn, DeFrank PLLC, Fort Mitchell, KY.
For JP Morgan Chase Bank, N.A., Chase Auto Finance Corp., Chase Insurance Agency, Inc., Defendants: Matthew 
C. Blickensderfer, LEAD ATTORNEY, PRO HAC VICE, Frost Brown Todd LLC - Cincinnati, Cincinnati, OH; Sheryl 
G. Snyder, LEAD ATTORNEY, Frost Brown Todd LLC - Louisville, Louisville, KY."
70,Judges,"Judges: Danny C. Reeves, United States District Judge."
70,Opinion by,Opinion by: Danny C. Reeves
83,Counsel,"Counsel:  [*1] For DICAR, INC., ROBUD, Plaintiffs: JOHN G. GILFILLAN, III, LEAD ATTORNEY, CARELLA, 
BYRNE, BAIN, GILFILLAN, CECCHI, STEWART & OLSTEIN, PC, ROSELAND, NJ; STEPHEN R. BUCKINGHAM, 
LEAD ATTORNEY, DAVID L. HARRIS, LOWENSTEIN SANDLER, PC, ROSELAND, NJ.
For STAFFORD CORRUGATED PRODUCTS, INC., Defendant: ANTHONY R. MAUTONE, JR., LEAD 
ATTORNEY, MAUTONE & HORAN, WEST ORANGE, NJ.
For STAFFORD CORRUGATED PRODUCTS, INC., Counter Claimant: ANTHONY R. MAUTONE, JR., LEAD 
ATTORNEY, MAUTONE & HORAN, WEST ORANGE, NJ.
2010 U.S. Dist. LEXIS 23667, *23667

 
For DICAR, INC., Counter Defendant: MICHAEL J. HAHN, LEAD ATTORNEY, DAVID L. HARRIS, STEPHEN R. 
BUCKINGHAM, LEAD ATTORNEY, LOWENSTEIN SANDLER, PC, ROSELAND, NJ.
For ROBUD, Counter Defendant: STEPHEN R. BUCKINGHAM, LEAD ATTORNEY, DAVID L. HARRIS, 
LOWENSTEIN SANDLER, PC, ROSELAND, NJ.
For DICAR, INC., ROBUD, Counter Defendants: JOHN G. GILFILLAN, III, LEAD ATTORNEY, CARELLA, BYRNE, 
BAIN, GILFILLAN, CECCHI, STEWART & OLSTEIN, PC, ROSELAND, NJ; STEPHEN R. BUCKINGHAM, LEAD 
ATTORNEY, DAVID L. HARRIS, LOWENSTEIN SANDLER, PC, ROSELAND, NJ."
83,Judges,"Judges: Hon. Dennis M. Cavanaugh, United States District Judge."
83,Opinion by,Opinion by: Dennis M. Cavanaugh
97,Counsel,"Counsel:  [**1] For Plaintiff: Gary B. Friedman, Tracey Kitzman, FRIEDMAN LAW GROUP LLP; Richard Rouco, 
Sara C. Hacker, Joe R. Whatley, WHATLEY DRAKE & KALLAS, LLC.

 
For Defendant: Gordon Schnell, David A. Scupp, CONSTANTINE CANNON LLP."
97,Judges,"Judges: Lewis A. Kaplan, United States District Judge."
97,Opinion by,Opinion by: Lewis A. Kaplan
103,Counsel,"Counsel: For KOREA KUMHO PETROCHEMICAL CO., LTD., Plaintiff - Appellant: William H. Forman, Esquire, 
Attorney, Robert G. Badal, Esquire, Attorney, Bethany Marvin Stevens, Attorney, Wilmer Cutler Pickering Hale & 
Dorr LLP, Los Angeles, CA.
For FLEXSYS AMERICA LP, FLEXSYS N.V., Defendants - Appellees: D. Jarrett Arp, Esquire, Adam Joseph 
DiVincenzo, GIBSON DUNN & CRUTCHER, LLP, Washington, DC; Andrew Edelstein, Daniel Glen Swanson, 
Attorney, GIBSON DUNN & CRUTCHER, LLP, Los Angeles, CA; Ann Stewart Robinson, Counsel, Office of the 
Chief Counsel for Employment, United States Senate, Washington, DC."
103,Judges,"Judges: Before: HALL, THOMPSON and McKEOWN, Circuit Judges."
105,Judges,"Judges:  [*1] WILLIAM H. FOLLETT, J."
105,Opinion by,Opinion by: WILLIAM H. FOLLETT
110,Counsel,"Counsel: For PLUSH LOUNGE LAS VEGAS LLC, Plaintiff - Appellant: John C. Kirkland, Esquire, Luce Forward 
Hamilton & Scripps, LLP, Los Angeles, CA; Steven S. Fleischman, Esquire, Attorney, ROBIE & MATTHAI, APC, 
Los Angeles, CA.
For HOTSPUR RESORTS NEVADA INC., Defendant - Appellee: Andrew Stuart Pauly, GREENWALD PAULY 
FOSTER & MILLER, Santa Monica, CA."
110,Judges,"Judges: Before: GOULD, IKUTA and N.R. SMITH, Circuit Judges."
111,Counsel,"Counsel:  [*1] For Westfield Insurance Company, Plaintiff: Mark R Smith, LEAD ATTORNEY, Smith Fisher Maas & 
Howard PC, Indianapolis, IN.
For Gil Behling & Son Inc, Larry Behling, Defendants: Stephen M Maish, LEAD ATTORNEY, Maish and Mysliwy, 
Hammond, IN."
112,Judges,"Judges: THERESA L. SPRINGMANN, UNITED STATES DISTRICT JUDGE."
112,Opinion by,Opinion by: THERESA L. SPRINGMANN
130,Counsel,"Counsel:  [**1] For Tyr Sport Inc, a California corporation, Plaintiff: Christopher W Arledge, LEAD ATTORNEY, 
One LLP, Costa Mesa, CA; Jennifer Sun, Lawrence J Hilton, William E Halle, LEAD ATTORNEYS, O'Neil LLP, 
Irvine, CA.
For Warnaco Swimwear Inc, a Delaware corporation, doing business as Speedo USA, Defendant: Stuart M Richter, 
Zia F Modabber, LEAD ATTORNEYS, Gregory S Korman, Katten Muchin Rosenman, Los Angeles, CA.
For United States Swimming Inc, an Ohio corporation, Mark Schubert, an individual, Defendants: Adam Paul 
Brezine, Jonathan G Fetterly, LEAD ATTORNEYS, Holme Roberts & Owen LLP, Los Angeles, CA; Jennifer Bielak, 
Richard R Young, LEAD ATTORNEYS, PRO HAC VICE, Colorado Springs, CO.
For Erik Vendt, an individual, Defendant: Richard J Foster, LEAD ATTORNEY, Law Office of Richard J Foster, Seal 
Beach, CA."
130,Judges,"Judges: JAMES V. SELNA, UNITED STATES DISTRICT JUDGE."
130,Opinion by,Opinion by: JAMES V. SELNA
145,Counsel,"Counsel:  [*1] For Manuel Flores, Alejandro Sicajau, Plaintiffs: Adam Lee Pedersen, Adam Wang, Law Office of 
Adam Wang, San Jose, CA.
For EI Maintenance Company, also known as E.I.M Demolition, Ken Irwin, Defendants: James Louis Kohl, LEAD 
ATTORNEY, Law Offices of James Louis Kohl, Walnut Creek, CA."
146,Judges,"Judges: CLAUDIA WILKEN, United States District Judge."
146,Opinion by,Opinion by: CLAUDIA WILKEN
151,Counsel,"Counsel:  [*1] For Gregory Grant, MD, Benjamin Fann, MD, David Hayes, MD, Plaintiffs: C. William Hinnant , Jr., 
LEAD ATTORNEY, PRO HAC VICE, Medicolegal Consultants, LLC, Anderson, SC; Joel B. Stevenson, LEAD 
ATTORNEY, Swain, Stevenson & Moore, Asheville, NC.
For Fletcher Hospital, Incorporated, Defendant: Jacqueline D. Grant, LEAD ATTORNEY, Roberts & Stevens, P.A., 
Asheville, NC; James Larry Jones , W. Davis Frye , LEAD ATTORNEYS, PRO HAC VICE, Baker Donelson 
Bearman Caldwell & Berkowitz, Jackson, MS.
For Park Ridge Medical Associates, Defendant: Jacqueline D. Grant, LEAD ATTORNEY, Roberts & Stevens, P.A., 
Asheville, NC."
151,Judges,"Judges: Martin Reidinger, United States District Judge."
151,Opinion by,Opinion by: Martin Reidinger
157,Counsel,"Counsel:  [*1] For WILLIAM SHIPP, STACY SHIPP, INDIVIDUALLY, PROFESSIONALLY, AND AS EXCLUSIVE 
RESIDUAL CO-OWNERS OF ALL RIGHTS PREVIOUSLY HELD BY THE 560 COATES STREET PARTNERSHIP 
BETWEEN WILLIAM SHIPP AND JASON FYK, Plaintiffs: NORMAN SHAPERO, LEAD ATTORNEY, WEST 
CHESTER, PA.
For DONNA DONAHER, INDIVIDUALLY, PROFESSIONALLY, AND AS A REPRESENTATIVE MEMBER OF 
CLASS A, TUCKER ARENSBERG, PC, Defendants: WILLIAM F. MCDEVITT, CHRISTIE PABARUE 
MORTENSEN $ YOUNG, PHILADELPHIA, PA.
For JOHN ROACH, INDIVIDUALLY, PROFESSIONALLY, AND AS A REPRESENTATIVE MEMBER OF CLASS B, 
PNC BANK, NATIONAL ASSOCIATION, Defendants: DANIEL B. HUYETT, LEAD ATTORNEY, STEVENS & LEE, 
READING, PA.
JASON FYK, AS AGENT FOR PNC BANK, NATIONAL ASSOCIATION AND THE PNC/TA CLAN, Defendant, Pro 
se, COCHRANVILLE, PA.
FOR YOUR KIDS, INC., Defendant, Pro se, COCHRANVILLE, PA."
158,Judges,"Judges: Louis H. Pollak, United States District Judge."
158,Opinion by,Opinion by: Louis H. Pollak
176,Counsel,"Counsel:  [**1] For Kroger Co, Plaintiff: Wilbert Benjamin Markovits, LEAD ATTORNEY, Waite, Schneider, Bayless 
& Chesley, Cincinnati, OH; William Henry Blessing, LEAD ATTORNEY, Cincinnati, OH; Gregory Alan Harrison, 
Dinsmore & Shohl -1, Cincinnati, OH; Jean M Geoppinger, Waite Schneider Bayless & Chesley Co LPA, Cincinnati, 
OH; Richard Alan Arnold, Scott E Perwin, Kenny Nachwalter, P.A., Miami, FL.
For Sanofi-Aventis, Defendant: Joseph P Thomas, LEAD ATTORNEY, Ulmer & Berne - 1, Cincinnati, OH; Richard 
J. Stark, LEAD ATTORNEY, Cravath, Swaine & Moore LLP, New York City, NY; Alan R Dial, Kevin R Sullivan, 
Peter M Todaro, King & Spalding LLP, Washington, DC; David Greenwald, Evan R. Chesler, Cravath, Swaine & 
Moore LLP, New York, NY; Jeffrey Francis Peck, Ulmer & Berne LLP - 1, Cincinnati, OH.
For Bristol-Myers Squibb Co, Defendant: Gregory Alan Harrison, LEAD ATTORNEY, Dinsmore & Shohl -1, 
Cincinnati, OH; Richard J. Stark, LEAD ATTORNEY, Cravath, Swaine & Moore LLP, New York City, NY; Alan R 
Dial, Kevin R Sullivan, Peter M Todaro, King & Spalding LLP, Washington, DC; David Greenwald, Evan R. Chesler, 
Cravath, Swaine & Moore LLP, New York, NY.
For Apotex Corporation, Defendant: Robert Alan Klingler, LEAD  [**2] ATTORNEY, Cincinnati, OH; Gregory Alan 
Harrison, Dinsmore & Shohl -1, Cincinnati, OH; Howard Langer, PRO HAC VICE, Langer & Grogan, P.C., 
Philadelphia, PA; John James Grogan, Langer & Grogan, P.C., Philadelphia, PA; Kathleen Mary Brinkman, 
Cincinnati, OH; Robert S Silver, Caesar, Rivise, Bernstein, Cohen & Pokotilow, Ltd., Philadelphia, PA.
For Sanofi-Synthelabo, Inc., Sanofi-Aventis U.S. L.L.C., Bristol-Myers Squibb Sanofi Pharmaceuticals Holding 
Partnership, Defendants: Joseph P Thomas, LEAD ATTORNEY, Ulmer & Berne - 1, Cincinnati, OH; Gregory Alan 
Harrison, Dinsmore & Shohl -1, Cincinnati, OH; Jeffrey Francis Peck, Ulmer & Berne LLP - 1, Cincinnati, OH."
177,Judges,"Judges: Michael H. Watson, UNITED STATES DISTRICT JUDGE."
177,Opinion by,Opinion by: Michael H. Watson
