頁碼,內容類型,內容
348,Counsel,"Counsel: For CHRISTOPHER WINN, on behalf of himself and all others similarly situated, WILLIAM CUMMINGS, 
on behalf of himself and all others similarly situated, CHRISTOPHER VILLEMARETTE, on behalf of himself and all 
others similarly situated, NATALIE CUMMINGS, on behalf of himself and all others similarly situated, Plaintiff - 
Appellants: Loren Kieve, Kieve Law Offices, San Francisco, CA; Louis Fox Burke, New York, NY; William Smythe 
Shepherd, Jr., Shepherd, Smith & Edwards, L. L. P., Houston, TX; Arun S. Subramanian, Susman Godfrey, L.L.P., 
New York, NY.
For ALAMO TITLE INSURANCE COMPANY, FIDELITY NATIONAL TITLE INSURANCE CO, CHICAGO TITLE 
INSURANCE CO., TICOR TITLE INSURANCE CO, FIDELITY NATIONAL FINANCE, INC., LAWYERS TITLE 
INSURANCE CORPORATION, Defendant - Appellees: Barry R. Ostrager, Kevin J. Arquit, Patrick Timothy Shilling, 
Simpson, Thacher & Bartlett, L.L.P., New York, NY; Chris A. Blackerby, Germer, Gertz, Beaman & Brown, L.L.P., 
Austin, TX; Lawrence Louis Germer, Charles W. Goehringer, Jr., Germer Gertz, L.L.P., Beaumont, TX.

 
For FIRST AMERICAN TITLE INSURANCE COMPANY OF NEW YORK,  [**2] UNITED GENERAL TITLE 
INSURANCE CO, FIRST AMERICAN CORP, Defendant - Appellees: George Allan Van Fleet, Greenberg Traurig, 
L.P., Houston, TX; James Ian Serota, Greenberg Traurig, L.L.P., New York, NY.
For COMMONWEALTH LAND TITLE INSURANCE CO, Defendant - Appellee: Barry R. Ostrager, Kevin J. Arquit, 
Patrick Timothy Shilling, Simpson, Thacher & Bartlett, L.L.P., New York, NY; Chris A. Blackerby, Germer, Gertz, 
Beaman & Brown, L.L.P., Austin, TX; Charles W. Goehringer, Jr., Germer Gertz, L.L.P., Beaumont, TX.
For LANDAMERICA FINANCIAL GROUP, INC., Defendant - Appellee: Barry R. Ostrager, Simpson, Thacher & 
Bartlett, L.L.P., New York, NY; Lawrence Louis Germer, Charles W. Goehringer, Jr., Germer Gertz, L.L.P., 
Beaumont, TX.
For STEWART TITLE INSURANCE COMPANY, STEWART INFORMATION SERVICES CORP., Defendant - 
Appellees: Layne E. Kruse, Fulbright & Jaworski, L.L.P., Houston, TX; David Marion Foster, Fulbright & Jaworski, 
L.L.P., Washington, DC; Mark Allen Robertson, Fulbright & Jaworski, L.L.P., New York, NY."
349,Judges,"Judges: Before DAVIS, WIENER, and SOUTHWICK, Circuit Judges."
351,Counsel,"Counsel:  [*1] For Active Disposal Inc., Plaintiff: David A. Novoselsky, LEAD ATTORNEY, David A. Novoselsky & 
Associates, Chicago, Il; Brian Albert Schroeder, James J Ayres, Sr., Julie E Fox, Novoselsky Law Offices, Chicago, 
IL.
For All Waste Disposal, Waste One, LLC, Wastebox, Inc., Trash Can Recycling, LLC, Roll-On Roll-Off Inc., 
Recycling Systems, Inc., Premium Disposal, Inc., Prairieland Disposal, Inc., Molenhouse Enterprises, Inc., MBL 
Recycling, Inc., Liberty Waste & Recycling Service, Inc., K. Hoving Recycling & Disposal, Inc., J. L. Roll-Off 
Service, Inc., Economy Disposal Services, Inc., Disposal Management Systems, Inc., Circle M Dumpster Service, 
inc., Boxco, Inc., Bosman Disposal, Plaintiffs: David A. Novoselsky, LEAD ATTORNEY, David A. Novoselsky & 
Associates, Chicago, Il; Brian Albert Schroeder, Julie E Fox, Novoselsky Law Offices, Chicago, IL.
For Apex Enteriors Inc, Showalter Roofing, Inc., Ostrander Construction, Inc., Omni Commercial Group Inc, 
Nicholas & Associates, Inc., Murphy Roofing, Inc., Lawrence E. Gustafson Roofing, Inc., Feze Roofing, Inc., CFS 
Enterprises, Inc., C.M. Roof Systems Inc, Plaintiffs: Brian Albert Schroeder, Julie E Fox, Novoselsky Law Offices, 
Chicago, IL.
For  [*2] Fred J. Smith Roofing, Plaintiff: Julie E Fox, Novoselsky Law Offices, Chicago, IL.

 
For City of Darien, The, an Illinois Municipal Corporation, Defendant: John B. Murphey, LEAD ATTORNEY, 
Rosenthal, Murphey, Coblentz & Donahue, Chicago, IL.
For City of Evanston, The, an Illinois Municipal Corporation, Defendant: Charles E. Harper, Jr., LEAD ATTORNEY, 
Jacquelyn T. Pinnell, Quarles & Brady LLP, Chicago, IL; Jack M. Siegel, LEAD ATTORNEY, Holland & Knight LLP, 
Chicago, IL.
For City of Oak Brook Terrace, The, an Illinois Municipal Corporation, Defendant: William W. Kurnik, LEAD 
ATTORNEY, Kristen Diane Alkire, Knight, Hoppe, Kurnik & Knight LLC, Rosemont, IL.
For City of Prospect Heights, The, an Illinois Municipal Corporation, Defendant: Paul Alan Rettberg, LEAD 
ATTORNEY, Brandon K Lemley, Christopher Paul Keleher, Querrey & Harrow, Ltd., Chicago, IL; Robert S. 
OMeara, LEAD ATTORNEY, Casey L Westover, Reed Smith LLP, Chicago, IL.
For Village of Addison, The, an Illinois Municipal Corporation, Village of Wilmette, The, an Illinois Municipal 
Corporation, Defendants: Paul Alan Rettberg, LEAD ATTORNEY, Brandon K Lemley, Christopher Paul Keleher, 
Querrey & Harrow, Ltd., Chicago, IL.
For Village of  [*3] Hoffman Estates, The, an Illinois Municipal Corporation, Defendant: Arthur L. Janura, Jr., LEAD 
ATTORNEY, Arnstein & Lehr LLP, Hoffman Estates, IL; Charles E. Harper, Jr., LEAD ATTORNEY, Jacquelyn T. 
Pinnell, Quarles & Brady LLP, Chicago, IL; Hal R. Morris, LEAD ATTORNEY, Jenifer Hitt Caracciolo, Arnstein & 
Lehr, LLP, Chicago, IL.
For Village of Mt. Prospect, The, an Illinois Corporation, Defendant: Gregory T. Smith, Klein Thorpe and Jenkins 
Ltd., Chicago, IL.
For Village of Northfield, The, an Illinois Municipal Corporation, Village of Wheeling, The, an Illinois Municipal 
Corporation, Defendants: John H. Anderson, LEAD ATTORNEY, Seyfarth Shaw LLP, Chicago, IL."
353,Judges,"Judges: MATTHEW F. KENNELLY, United States District Judge."
353,Opinion by,Opinion by: MATTHEW F. KENNELLY
358,Counsel,"Counsel:  [*1] For Bayer Healthcare Pharmaceuticals Inc., Plaintiff: Jonathan W Fountain, LEAD ATTORNEY, 
Howard & Howard Attorneys PLLC, Las Vegas, NV USA; Matthew R. Ford, LEAD ATTORNEY, PRO HAC VICE, 
Bartlit Beck Herman Palenchar & Scott, Chicago, IL USA; Lewis Roca Rothgerber Christie LLP, Las Vegas, NV 
USA, Las Vegas, NV, USA; Peter B. Bensinger, Jr., LEAD ATTORNEY, PRO HAC VICE, Bartlit Beck Herman 
Palenchar & Scott LLP, Chicago, IL USA; Sundeep K. Addy, LEAD ATTORNEY, PRO HAC VICE, Bartlit Beck 
Herman Palenchar & Scott LLP, Denver, CO USA; Adam K Mortara, PRO HAC VICE, Bartlit Beck Herman 
Palenchar & Scott LLP, Chicago, IL USA; Clark T. Thiel, Pillsbury Winthrop Shaw Pittman LLP, Four Embarcadero 
Center, 22nd Floor, San Francisco, CA USA; Jeffrey A Mandell, Bartlit Beck Herman Palenchar & Scott LLP, 
Chicago, IL USA; Nikkya G. Williams, Lewis and Roca LLP, Las Vegas, NV USA; Paul J Skiermont, PRO HAC 
VICE, Skiermont Puckett LLP, Dallas, TX USA.
For Bayer Schering Pharma AG, Plaintiff: Adam K Mortara, LEAD ATTORNEY, PRO HAC VICE, Bartlit Beck 
Herman Palenchar & Scott LLP, Chicago, IL USA; Jeffrey A Mandell, LEAD ATTORNEY, Bartlit Beck Herman 
Palenchar & Scott LLP, Chicago, IL USA; Jonathan W Fountain, [*2]  LEAD ATTORNEY, Howard & Howard 
Attorneys PLLC, Las Vegas, NV USA; Matthew R. Ford, LEAD ATTORNEY, PRO HAC VICE, Bartlit Beck Herman 
Palenchar & Scott, Chicago, IL USA; Lewis Roca Rothgerber Christie LLP, Las Vegas, NV USA, Las Vegas, NV 
USA; Paul J Skiermont, LEAD ATTORNEY, PRO HAC VICE, Skiermont Puckett LLP, Dallas, TX USA; Peter B. 
Bensinger, Jr., LEAD ATTORNEY, PRO HAC VICE, Bartlit Beck Herman Palenchar & Scott LLP, Chicago, IL USA; 
Sundeep K. Addy, LEAD ATTORNEY, PRO HAC VICE, Bartlit Beck Herman Palenchar & Scott LLP, Denver, CO 
USA; Clark T. Thiel, Pillsbury Winthrop Shaw Pittman LLP, Four Embarcadero Center, 22nd Floor, San Francisco, 
CA USA; Nikkya G. Williams, Lewis and Roca LLP, Las Vegas, NV USA.
For Watson Pharmaceuticals, Inc., Watson Laboratories, Inc., Defendants: Cedric C.Y. Tan, LEAD ATTORNEY, 
PRO HAC VICE, Crowell & Moring LLP, Washington, DC USA; Kristin M Cooklin, LEAD ATTORNEY, Crowell & 
Moring, Washington, DC USA; Neil M McCarthy, LEAD ATTORNEY, PRO HAC VICE, Neil McCarthy, Esq., PC, 
Silver Spring, MD USA; Ryan E. Johnson, LEAD ATTORNEY, Watson Rounds, Las Vegas, NV USA; Byron R Chin, 
PRO HAC VICE, Townsend and Townsend and Crew LLP, Palo Alto, CA USA; Dan C. [*3]  Bowen, Bowen Hall, 
Reno, NV USA; David J. Tsai, Pillsbury Winthrop Shaw Pittman LLP, San Francisco, CA USA; Kenneth E. Jenkins, 
Townsend and Townsend and Crew LLP, San Diego, CA USA; Mark T. Jansen, PRO HAC VICE, Crowell & Moring 
LLP, San Francisco, CA USA; Michael D Rounds, Brownstein Hyatt Farber Schreck, LLC, Reno, NV USA.

 
For Sandoz, Inc., Defendant: Dan C. Bowen, LEAD ATTORNEY, Bowen Hall, Reno, NV USA; Delphine W. Knight 
Brown, LEAD ATTORNEY, Kelley Drye & Warren LLP, Stamford, CT USA; Joseph A Boyle, LEAD ATTORNEY, 
PRO HAC VICE, Kelley Drye & Warren LLP, Parsippany, NJ USA; Joseph Hynds, LEAD ATTORNEY, Rothwell 
Figg Ernst & Manbeck, Washington, DC USA; Lisa Phillips, LEAD ATTORNEY, PRO HAC VICE, Rotwell Figg Ernst 
& Manbeck, Washington, DC USA; Paul W. Garrity, LEAD ATTORNEY, August T Horvath, Kelley Drye & Warren 
LLP, New York, NY USA; Steve Lieberman, LEAD ATTORNEY, PRO HAC VICE, Rothwell, Figg, Ernst & Manbech, 
Washington, DC USA; Steven J Moore, LEAD ATTORNEY, Kelley, Drye & Warren, Stamford, CT USA; Vincent P 
Rao, II, LEAD ATTORNEY., Parsippany, NJ USA; Kristin M Cooklin, Crowell & Moring, Washington, DC USA; Mark 
T. Jansen, PRO HAC VICE, Crowell & Moring LLP, San Francisco, [*4]  CA USA.
For Watson Pharmaceuticals, Inc., Watson Laboratories, Inc., Counter Claimants: Cedric C.Y. Tan, LEAD 
ATTORNEY, PRO HAC VICE, Crowell & Moring LLP, Washington, DC USA; Kristin M Cooklin, LEAD ATTORNEY, 
Crowell & Moring, Washington, DC USA; Neil M McCarthy, LEAD ATTORNEY, PRO HAC VICE, Neil McCarthy, 
Esq., PC, Silver Spring, MD USA; Ryan E. Johnson, LEAD ATTORNEY, Watson Rounds, Las Vegas, NV USA; 
Byron R Chin, PRO HAC VICE, Townsend and Townsend and Crew LLP, Palo Alto, CA USA; David J. Tsai, 
Pillsbury Winthrop Shaw Pittman LLP, San Francisco, CA USA; Mark T. Jansen, PRO HAC VICE, Crowell & Moring 
LLP, San Francisco, CA USA; Michael D Rounds, Brownstein Hyatt Farber Schreck, LLC, Reno, NV USA.
For Bayer Schering Pharma AG, Bayer Schering Pharma AG, Bayer Schering Pharma AG, Counter Defendants: 
Adam K Mortara, LEAD ATTORNEY, PRO HAC VICE, Bartlit Beck Herman Palenchar & Scott LLP, Chicago, IL 
USA; Jeffrey A Mandell, LEAD ATTORNEY, Bartlit Beck Herman Palenchar & Scott LLP, Chicago, IL USA; 
Jonathan W Fountain, LEAD ATTORNEY, Howard & Howard Attorneys PLLC, Las Vegas, NV USA; Matthew R. 
Ford, LEAD ATTORNEY, PRO HAC VICE, Bartlit Beck Herman Palenchar & Scott, Chicago, IL USA; Lewis [*5]  
Roca Rothgerber Christie LLP, Las Vegas, NV USA, Las Vegas, NV USA; Paul J Skiermont, LEAD ATTORNEY, 
PRO HAC VICE, Skiermont Puckett LLP, Dallas, TX USA; Peter B. Bensinger, Jr., LEAD ATTORNEY, PRO HAC 
VICE, Bartlit Beck Herman Palenchar & Scott LLP, Chicago, IL USA; Sundeep K. Addy, LEAD ATTORNEY, PRO 
HAC VICE, Bartlit Beck Herman Palenchar & Scott LLP, Denver, CO USA; Clark T. Thiel, Pillsbury Winthrop Shaw 
Pittman LLP, Four Embarcadero Center, 22nd Floor, San Francisco, CA USA.
For Bayer Healthcare Pharmaceuticals Inc., Bayer Healthcare Pharmaceuticals Inc., Bayer Healthcare 
Pharmaceuticals Inc., Counter Defendants: Jonathan W Fountain, LEAD ATTORNEY, Howard & Howard Attorneys 
PLLC, Las Vegas, NV USA; Matthew R. Ford, LEAD ATTORNEY, PRO HAC VICE, Bartlit Beck Herman Palenchar 
& Scott, Chicago, IL USA; Lewis Roca Rothgerber Christie LLP, Las Vegas, NV USA, Las Vegas, NV 89102-, USA; 
Peter B. Bensinger, Jr., LEAD ATTORNEY, PRO HAC VICE, Bartlit Beck Herman Palenchar & Scott LLP, Chicago, 
IL USA; Sundeep K. Addy, LEAD ATTORNEY, PRO HAC VICE, Bartlit Beck Herman Palenchar & Scott LLP, 
Denver, CO USA; Adam K Mortara, PRO HAC VICE, Bartlit Beck Herman Palenchar & Scott LLP, Chicago, IL [*6]  
USA; Clark T. Thiel, Pillsbury Winthrop Shaw Pittman LLP, Four Embarcadero Center, 22nd Floor, San Francisco, 
CA USA; Jeffrey A Mandell, Bartlit Beck Herman Palenchar & Scott LLP, Chicago, IL USA; Paul J Skiermont, PRO 
HAC VICE, Skiermont Puckett LLP, Dallas, TX USA.
For Watson Pharmaceuticals, Inc., Watson Laboratories, Inc., Counter Claimants: Cedric C.Y. Tan, LEAD 
ATTORNEY, PRO HAC VICE, Crowell & Moring LLP, Washington, DC USA; David J. Tsai, LEAD ATTORNEY, 
David J. Tsai, Pillsbury Winthrop Shaw Pittman LLP, San Francisco, CA USA; Kristin M Cooklin, LEAD 
ATTORNEY, Crowell & Moring, Washington, DC USA; Neil M McCarthy, LEAD ATTORNEY, PRO HAC VICE, Neil 
McCarthy, Esq., PC, Silver Spring, MD USA; Ryan E. Johnson, LEAD ATTORNEY, Watson Rounds, Las Vegas, 
NV USA; Byron R Chin, PRO HAC VICE, Townsend and Townsend and Crew LLP, Palo Alto, CA USA; Kenneth E. 
Jenkins, Townsend and Townsend and Crew LLP, San Diego, CA USA; Mark T. Jansen, PRO HAC VICE, Crowell 
& Moring LLP, San Francisco, CA USA; Michael D Rounds, Brownstein Hyatt Farber Schreck, LLC, Reno, NV USA.
For Sandoz, Inc., Counter Claimant: Dan C. Bowen, LEAD ATTORNEY, Bowen Hall, Reno, NV USA; Delphine W. 
Knight Brown, LEAD ATTORNEY, [*7]  Kelley Drye & Warren LLP, Stamford, CT USA; Joseph A Boyle, LEAD 
ATTORNEY, Kelley Drye & Warren LLP, Parsippany, NJ USA; Joseph Hynds, LEAD ATTORNEY, Rothwell Figg 
Ernst & Manbeck, Washington, DC USA; Lisa Phillips, LEAD ATTORNEY, PRO HAC VICE, Rotwell Figg Ernst & 
Manbeck, Washington, DC USA; Paul W. Garrity, LEAD ATTORNEY, August T Horvath, Kelley Drye & Warren 
LLP, New York, NY USA; Steve Lieberman, LEAD ATTORNEY, PRO HAC VICE, Rothwell, Figg, Ernst & Manbech, 
2010 U.S. Dist. LEXIS 161986, *3

 
Washington, DC USA; Steven J Moore, LEAD ATTORNEY, Kelley, Drye & Warren, Stamford, CT USA; Vincent P 
Rao, II, LEAD ATTORNEY., Parsippany, NJ USA; Kristin M Cooklin, Crowell & Moring, Washington, DC USA; Mark 
T. Jansen, PRO HAC VICE, Crowell & Moring LLP, San Francisco, CA USA."
361,Judges,"Judges: Kent J. Dawson, United States District Judge."
361,Opinion by,Opinion by: Kent J. Dawson
372,Counsel,"Counsel:  [*1] For Thomas Boyd, Randa Jones, Plaintiffs: Mark Samuel Kaufman, LEAD ATTORNEY, Kaufman & 
Kahn, LLP, New York, NY; Curtis V. Trinko, Law Offices of Curtis V. Trinko, New York, NY; Paul Grobman, Paul 
Grobman, New York, NY.
For Joan Grant Boyd, Humberto Meneses, Sybil Taylor, Tonya Warters, on behalf of themselves and all others 
similarly situated, Plaintiffs: Curtis V. Trinko, Law Offices of Curtis V. Trinko, New York, NY; Mark Samuel Kaufman, 
Kaufman & Kahn, LLP, New York, NY; Paul Grobman, Paul Grobman, New York, NY.
For J.E. Robert Co., Inc., JER Revenue Services, LLC, Defendants: Jonathan David Elliot, LEAD ATTORNEY, 
Zeldes, Needle & Cooper, Bridgeport, CT.
For NYCTL 1996-1 Trust, NYCTL 1997-1 Trust, NYCTL 1998-1 Trust, NYCTL 1999-1 Trust, Defendants: Stephen 
Edward Kitzinger, LEAD ATTORNEY, New York Law Department, New York, NY."
372,Judges,"Judges: Ramon E. Reyes, Jr., United States Magistrate Judge."
372,Opinion by,"Opinion by: Ramon E. Reyes, Jr."
396,Counsel,"Counsel:  [**1] For Jordan Katz, on behalf of himself and all others similarly situated, Plaintiff: Bruce K. Cohen, 
Daniel B. Allanoff, LEAD ATTORNEYS, PRO HAC VICE, Meredith Cohen Greenfogel & Skirnick, Philadelphia, PA; 
Christopher L. Lebsock, Michael P. Lehmann, LEAD ATTORNEYS, Hausfeld, San Francisco, CA; Barbara J. Felt, 
Vincent J. Esades, Heins, Mills & Olson, Minneapolis, MN; Daniel R. Karon, Goldman, Scarlato & Karon - 
Cleveland, Cleveland, OH; Jennifer Sarnelli, Joseph J. DePalma, Lite DePalma Greenberg & Rivas, Newark, NJ; 
Todd B. Naylor, Murdock, Goldenberg, Schneider & Groh, Cincinnati, OH.
For Gaby Hasrouni, Plaintiff in Member Case 5:08cv1289, Plaintiff: Aaron M. McParlan, James S. Reece, Michael 
E. Jacobs, Richard M. Hagstrom, LEAD ATTORNEYS, PRO HAC VICE, Zelle, Hofmann, Voelbel, Mason & Gette, 
Minneapolis, MN; Chris T. Nolan, LEAD ATTORNEY, Perantinides & Nolan, Akron, OH; Daniel B. Allanoff , 
Meredith Cohen Greenfogel & Skirnick, Philadelphia, PA; Todd B. Naylor, Murdock, Goldenberg, Schneider & Groh, 
Cincinnati, OH.
For Gina Hasrouni, Plaintiff in Member Case 5:08cv1289, Plaintiff: Chris T. Nolan, LEAD ATTORNEY, Perantinides 
& Nolan, Akron, OH; James S. Reece, Michael E. Jacobs, Richard  [**2] M. Hagstrom, LEAD ATTORNEYS, PRO 
HAC VICE, Zelle, Hofmann, Voelbel, Mason & Gette, Minneapolis, MN; Daniel B. Allanoff, PRO HAC VICE, 
Meredith Cohen Greenfogel & Skirnick, Philadelphia, PA; Todd B. Naylor, Murdock, Goldenberg, Schneider & Groh, 
Cincinnati, OH.
For Craig Mintz, Plaintiff in Member Case 1:08cv678, Plaintiff: Anthony D. Shapiro, Steve W. Berman, LEAD 
ATTORNEYS, Hagens, Berman Sobol, Shapiro, Seattle, WA; Bruce K. Cohen, Daniel B. Allanoff, LEAD 
ATTORNEYS, PRO HAC VICE, Steven J. Greenfogel, LEAD ATTORNEY, Meredith Cohen Greenfogel & Skirnick, 
Philadelphia, PA; Daniel R. Karon, LEAD ATTORNEY, Goldman, Scarlato & Karon - Cleveland, Cleveland, OH; 
Todd B. Naylor, Murdock, Goldenberg, Schneider & Groh, Cincinnati, OH.
For Sean Nightingale, Plaintiff in Member Case 1:08cv741, Plaintiff: Eugene A. Spector, Jonathan M. Jagher, 
William G. Caldes, LEAD ATTORNEYS, PRO HAC VICE, Jay S. Cohen, PRO HAC VICE, Spector, Roseman, 
Kodroff & Willis, Philadelphia, PA; Jeffrey S. Goldenberg, John C. Murdock, LEAD ATTORNEYS, Todd B. Naylor, 
Murdock, Goldenberg, Schneider & Groh, Cincinnati, OH; Daniel B. Allanoff, PRO HAC VICE, Meredith Cohen 
Greenfogel & Skirnick, Philadelphia, PA.
For Micah  [**3] Watts, Plaintiff in Member Case 1:08cv803, Plaintiff: Andrew L. Mackerer, LEAD ATTORNEY, 
Mager & Goldstein, Philadelphia, PA; Daniel R. Karon, LEAD ATTORNEY, Goldman, Scarlato & Karon - Cleveland, 
Cleveland, OH; Jayne A. Goldstein, LEAD ATTORNEY, Shepherd Finkelman Miller & Shah - Weston, Weston, FL; 
Lee Albert, LEAD ATTORNEY, Murray, Frank & Sailer, New York, NY; Natalie Finkelman Bennett, LEAD 
ATTORNEY, Shepherd Finkelman Miller & Shah - Media, Media, PA; Roger J. Bernstein, LEAD ATTORNEY, 
702 F. Supp. 2d 840, *840; 2010 U.S. Dist. LEXIS 30913, **30913

 
Bernstein Nackman & Feinberg, New York, NY; Daniel B. Allanoff, PRO HAC VICE, Meredith Cohen Greenfogel & 
Skirnick, Philadelphia, PA; Todd B. Naylor, Murdock, Goldenberg, Schneider & Groh, Cincinnati, OH.
For Carol A. Rhamy, Plaintiff in Member Case 1:08cv750, Plaintiff: Brian P. Kopp, LEAD ATTORNEY, Betras, 
Maruca, Kopp & Harshman - Canfield, Canfield, OH; Chad A. Carder, Gerald J. Rodos, Jeffrey B. Gittleman, LEAD 
ATTORNEYS, Barrack, Rodos & Bacine, Philadelphia, PA; Daniel B. Allanoff, PRO HAC VICE, Meredith Cohen 
Greenfogel & Skirnick, Philadelphia, PA; Todd B. Naylor, Murdock, Goldenberg, Schneider & Groh, Cincinnati, OH.
For Katherine A. Wirkus, Plaintiff in Member Case 1:08cv1021, Plaintiff:  [**4] David R. Scott, LEAD ATTORNEY, 
Scott & Scott - Colchester, Colchester, CT; Walter W. Noss, LEAD ATTORNEY, Scott & Scott - Chagrin Falls, 
Cleveland Heights, OH; Daniel B. Allanoff, PRO HAC VICE, Meredith Cohen Greenfogel & Skirnick, Philadelphia, 
PA; Todd B. Naylor, Murdock, Goldenberg, Schneider & Groh, Cincinnati, OH.
For Adam C Falkner, Plaintiff in Member Case 1:08cv1836, Plaintiff: Krishna B. Narine, LEAD ATTORNEY, 
Huntingdon Valley, PA; Christopher J. Gray, New York, NY; Daniel B. Allanoff, PRO HAC VICE, Meredith Cohen 
Greenfogel & Skirnick, Philadelphia, PA; Kirk G. Smith, Samuel D. Edwards, Shepherd Smith Edwards & Kantas, 
Houston, TX; Leslie Wybiral, Louis F. Burke, Law Office of Louis F. Burke, New York, NY; Roger W. Van Deusen, 
Van Deusen & Wagner, Cleveland, OH; Todd B. Naylor, Murdock, Goldenberg, Schneider & Groh, Cincinnati, OH.
For Fidelity National Title Insurance Company, Chicago Title Insurance Company, Ticor Title Insurance Company, 
Security Union Title Insurance Company, Ticor Title Insurance Company of Florida, Fidelity National Financial, Inc., 
Commonwealth Land Title Insurance Company, Lawyers Title Insurance Corporation, Defendants: Arthur M. 
Kaufman, Deborah  [**5] A. Coleman, Robert J. Fogarty, Steven A. Goldfarb, Hahn, Loeser & Parks - Cleveland, 
Cleveland, OH; Patricia A. Screen, Brouse McDowell - Cleveland, Cleveland, OH.
For First American Title Insurance Company, United General Title Insurance Company, Ohio Bar Title Insurance 
Company, Port Lawrence Title and Trust Company, T.A. Title Insurance Company, Censtar Title Insurance 
Company, First American Corporation, Defendants: James I. Serota, Kenneth A. Lapatine, Stephen L. Saxl, LEAD 
ATTORNEYS, PRO HAC VICE, Greenberg Traurig - New York, New York, NY; Patricia A. Screen, Brouse 
McDowell - Cleveland, Cleveland, OH.
For Transnation Title Insurance Company, Defendant: Phillip E. Stano, LEAD ATTORNEY, PRO HAC VICE, 
Sutherland, Asbill & Brennan - Washington, Washington, DC; Tim L. Collins, LEAD ATTORNEY, Brendan R. Doyle, 
Thomas J. Scanlon, Collins & Scanlon, Cleveland, OH; Arthur M. Kaufman, Deborah A. Coleman, Robert J. 
Fogarty, Steven A. Goldfarb, Hahn, Loeser & Parks - Cleveland, Cleveland, OH; Patricia A. Screen, Brouse 
McDowell - Cleveland, Cleveland, OH; Scott Wilson, Collins and Scanlon, Cleveland, OH.
For LandAmerica Financial Group, Inc., Defendant: Phillip E. Stano, LEAD ATTORNEY, PRO  [**6] HAC VICE, 
Sutherland, Asbill & Brennan - Washington, Washington, DC; Tim L. Collins, LEAD ATTORNEY, Brendan R. Doyle, 
Thomas J. Scanlon, Collins & Scanlon, Cleveland, OH; Deborah A. Coleman, Hahn, Loeser & Parks - Cleveland, 
Cleveland, OH; Patricia A. Screen, Brouse McDowell - Cleveland, Cleveland, OH; Scott Wilson, Collins and 
Scanlon, Cleveland, OH.
For Stewart Title Guaranty Company, National Land Title Insurance Company, Stewart Information Services 
Corporation, Defendants: David M Foster, LEAD ATTORNEY, PRO HAC VICE, Fulbright & Jaworski - Washington, 
Washington, DC; Gerard D. Kelly, LEAD ATTORNEY, PRO HAC VICE, Kevin M. Fee, LEAD ATTORNEY, Sidley 
Austin - Chicago, Chicago, IL; Kerin L. Kaminski, Giffen & Kaminski, Cleveland, OH; Mark A. Robertson, Fulbright & 
Jaworski - New York, New York, NY; Patricia A. Screen, Brouse McDowell - Cleveland, Cleveland, OH.
For Old Republic National Title Insurance Company, Old Republic International Corporation, Defendants: David G. 
Greene, Kevin J. Walsh, LEAD ATTORNEYS, PRO HAC VICE, Locke Lord Bissell & Liddell - New York, New York, 
NY; Patricia A. Screen, Brouse McDowell - Cleveland, Cleveland, OH; Russell J. Kutell, Frost Brown Todd - 
Columbus,  [**7] Columbus, OH."
399,Judges,"Judges: HONORABLE SARA LIOI, UNITED STATES DISTRICT JUDGE."
399,Opinion by,"Opinion by: SARA LIOI
702 F. Supp. 2d 840, *840; 2010 U.S. Dist. LEXIS 30913, **3"
433,Counsel,"Counsel:  [**1] For Municipal Revenue Services, Inc., Plaintiff: John G. Dean, LEAD ATTORNEY, Elliott Greenleaf 
& Siedzikowski, P.C., Scranton, PA; John M. Elliott, LEAD ATTORNEY, Elliott, Greenleaf & Siedzikowski PC, Blue 
Bell, PA; John P. Elliott, LEAD ATTORNEY, Elliott Greenleaf & Siedzikowski, P.C., Blue Bell, PA; Mark J. 
Schwemler, LEAD ATTORNEY, Elliott, Greenleaf & Siedzikowski, PC, Blue Bell, PA; Bruce W. Kauffman, Elliott 
Greenleaf, Philadelphia, PA.
For Thomas J. Ellis, James R. Matthews, Montgomery County Commissioners, Movants: John P. Gonzales, LEAD 
ATTORNEY, Marshall, Dennehey, Warner, Coleman & Goggin, King of Prussia, PA; Philip W. Newcomer, LEAD 
ATTORNEY, Office of the Montgomery County Solicitor's Office, Norristown, PA.
For XSPAND, Inc., Defendant: C. Grainger Bowman, LEAD ATTORNEY, Kirkpatrick & Lockhart Preston Gates Ellis 
LLP, Harrisburg, PA; David R. Fine, LEAD ATTORNEY, K&L Gates LLP, Harrisburg, PA.
For Bear, Stearns & Co, Inc., Defendant: Craig E. Ziegler, Montgomery, McCracken, Walker & Rhoads, 
Philadelphia, PA.
For Steven W. Cappelli, Miscellaneous Party: James G. Mann, Rodney A. Corey, LEAD ATTORNEYS, Harrisburg, 
PA.
For Dominic Pileggi, Senate of the Commonwealth of Pennsylvania,  [**2] Unknown Party Types: Thomas W. 
Dymek, LEAD ATTORNEY, Stradley Ronon Stevens & Young, LLP, Philadelphia, PA.
For James R. Matthews, Amicus: Philip W. Newcomer, LEAD ATTORNEY, Office of the Montgomery County 
Solicitor's Office, Norristown, PA.
For Montgomery County Commissioners, Amicus: Philip W. Newcomer, LEAD ATTORNEY, Office of the 
Montgomery County Solicitor's Office, Norristown, PA; Robert L. Knupp, Knupp, Kodak & Imblum, P.C., Harrisburg, 
PA.
For Gregg Melinson, Intervenor: Patrick J. Stapleton, LEAD ATTORNEY, Weber Gallagher Simpson Stapleton 
Fires & Newby LLP, Philadelphia, PA; Andrew K. Worek, Weber Gallagher Siimpson Stapleton Fires & Newby, LLP, 
Philadelphia, PA.
For XSPAND, Inc., Counterclaim Plaintiff: David R. Fine, LEAD ATTORNEY, K&L Gates LLP, Harrisburg, PA; C. 
Grainger Bowman, Kirkpatrick & Lockhart Preston Gates Ellis LLP, Harrisburg, PA.
700 F. Supp. 2d 692, *692; 2010 U.S. Dist. LEXIS 31290, **31290

 
For Municipal Revenue Services, Inc., Counterclaim Defendant: John P. Elliott, Elliott Greenleaf & Siedzikowski, 
P.C., Blue Bell, PA."
434,Judges,"Judges: Hon. John E. Jones III, United States District Judge."
434,Opinion by,Opinion by: John E. Jones III
