頁碼,內容類型,內容
323,Counsel,"Counsel:  [**1] For Blaine Cox, on behalf of himself and other consumers similarly situated (JFM-00-1242), Debra 
Cunningham, (JFM-00-1242), Elizabeth Strickland, (JFM-00-1242), Rene Gonzalez, (JFM-00-1242), Eric Ferrell, on 
behalf of themselves and others similarly sitiuated (JFM-00-1242), Plaintiffs: David D Shelby, Robert B Roden, 
Shelby and Cartee LLC, Birmingham, AL; M Shane Luckado, Law Office, Birmingham, AL.
699 F. Supp. 2d 730, *730; 2010 U.S. Dist. LEXIS 30756, **30756

 
For Wayne Mims, Individually and on behalf of all others similarly situated (JFM-00-1243), Plaintiff: Alan M 
Mansfield, PRO HAC VICE, Dennis Stewart, Milberg Weiss Bershad Hynes and Lerach, San Diego, CA; Andrew 
Steven Friedman, Bonnett Fairbourn Friedman and Balint PC, Phoenix, AZ; David J Bershad, Robert A Wallner, 
Milberg Weiss Bershad and Schulman LLP, New York, NY; David Daniel Weinzweig, Bonnett Fairbourn Friedman 
and Balint PC, Phoenix, AZ; Kenneth J Vianale, Milberg Weiss Bershad Hynes and Lerach, Boca Raton, FL; 
Leonard B Simon, Lerach Coughlin Stoia Geller Rudman and Robbins LLP, San Diego, CA; Mark D Bogen, PRO 
HAC VICE, Law Office of Mark D Bogen, Deerfield, FL; Michael James Flannery, Carey and Danis LLC, St Louis, 
MO.
For Clay Tyler, (JFM-00-1244), Peter Haklar, on behalf of  [**2] themselves and all others similarly situated (JFM-
00-1244), Plaintiffs: Donald F Hildre, Dougherty Hildre Dudek and Haklar, San Diego, CA; Stanley M Chesley, 
Waite Schneider Bayless and ChesleyCo LPA, Cincinnati, OH.
For Gravity Inc, as class representatives and individually (JFM-00-1247), Plaintiff: Gregory Baruch, J Daniel 
Leftwich, Michael J Quinn, R Stephen Berry, Berry and Leftwich, Washington, DC; Mark C Hansen, Kellogg Huber 
HansenTodd Evans and Figel PLLC, Washington, DC; Michael K Kellogg, Steven F Benz, Kellogg Huber Hansen 
Todd Evans and Figel PLLC, Washington, DC; Nelson Roach, Nix Patterson and Roach, Daingerfield, TX; Scott K 
Attaway, Kellogg Huber Hansen Todd and Evans PLLC, Washington, DC.
For 403 West Loop 820 N, (JFM-00-1247), Plaintiff: Gregory Baruch, J Daniel Leftwich, Michael J Quinn, R Stephen 
Berry, Berry and Leftwich, Washington, DC; Mark C Hansen, Kellogg Huber HansenTodd Evans and Figel PLLC, 
Washington, DC; Michael K Kellogg, Steven F Benz, Kellogg Huber Hansen Todd Evans and Figel PLLC, 
Washington, DC.
For Eleaders Inc, a corporation (JFM-00-1248), Plaintiff: Thomas Graham Thompson, Jr, Finkelstein Thompson 
Loughran, Washington, DC; Tracy Diana Rezvani, Finkelstein  [**3] Thompson and Loughran, Washington, DC.
For Franklin L DeJulius, individually and on behalf of all those similarly situated (JFM-00-1249), Plaintiff: David J 
Frantz, Conlon Frantz Phelan and Varma, Washington, DC.
For Paul A Deiter, on behalf of himself and all others similarly situated (JFM-00-1250), Plaintiff: Justin Witkin, 
Aylstock Witkin Sasser PLC, Gulf Breeze, FL; Paul T Gallagher, Law Office, Washington, DC; Robert J Wozniak, Jr, 
Freed Kanner London & Millen, LLC, Bannockburn, IL.
For Eric S Lazarus, individually and on behalf of all those similarly situated (JFM-00-1251), Plaintiff: Alan Michael 
Grunspan, Kaufman Miller Dickstein and Grunspan, Miami, FL; Alice McInerney, Kirby McInerney and Squire, New 
York, NY; Daniel Hume, Kirby McInerney and Squire LLP, New York, NY.
For To The Rescue Comprehensive Computer Services, on behalf of itself and all others similarly situated (JFM-00-
1252), Plaintiff: D Michael Campbell, Campbell and Associates, Miami, FL.
For Precision Billing Services Inc, (JFM-00-1256), MSC Systems Inc, on behalf of themselves and all others 
similarly situated (JFM-00-1256), Plaintiffs: William F Sasser, Carey and Danis, St Louis, MO.
For Gary Leach, on behalf of  [**4] themselves and all others similarly situated (JFM-00-1256), Plaintiff: Douglas R 
Sprong, Carr Korein Tillery Kunin Montroy Cates, Belleville, IL.
For Elizabeth A Wilson, individually and on behalf of all those similarly situated (JFM-00-1257), Plaintiff: Daniel 
Hume, LEAD ATTORNEY, Kirby McInerney and Squire LLP, New York, NY; Alice McInerney, Kirby McInerney and 
Squire, New York, NY; Robert W Coykendall, Morris Laing Evans Brock and Kennedy Chtd, Topeka, KS.
For Jay S Quigley, individually and on behalf of all persons similarly situated in the USA (JFM-00-1258), Plaintiff: 
Frank C Dudenhefer, Jr, John J Cummings, III, Cummings Cummings and Dudenhefer, New Orleans, LA; 
Gladstone N Jones, III, Randall A Smith, Sarah R Ranier, Smith Jones and Fawer, New Orleans, LA; Spiro J 
Verras, Jones Verras and Freiberg LLC, New Orleans, LA.
For John W Redmann, individually and on behalf of all persons similarly situated in the USA (JFM-00-1258), 
Plaintiff: Gladstone N Jones, III, Randall A Smith, Sarah R Ranier, Smith Jones and Fawer, New Orleans, LA; Spiro 
J Verras, Jones Verras and Freiberg LLC, New Orleans, LA.
699 F. Supp. 2d 730, *730; 2010 U.S. Dist. LEXIS 30756, **1

 
For D's Pet Supplies Inc, individually and on behalf of all those similarly situated (JFM-00-1259),  [**5] Plaintiff: 
Andrew J Morganti, Miller Faucher and Cafferty LLP, Ann Arbor, MI; Christopher Lovell, Lovell and Stewart LLP, 
New York, NY; Patrick E Cafferty, Miller Faucher and Cafferty LLP, Ste 885, Ann Arbor, MI.
For David Bach, individually and on behalf of all those similarly situated (JFM-00-1260), Plaintiff: Alice McInerney, 
Kirby McInerney and Squire, New York, NY; Daniel Hume, Kirby McInerney and Squire LLP, New York, NY; Elwood 
S Simon, Brimingham, MI; John P Zuccarini, Elwood S Simon and Associates PC, Brimingham, MI; Lance C 
Young, PRO HAC VICE, Birmingham, MI.
For The Rubbright Group, individually and on behalf of those similarly situated (JFM-00-1261), James M Burt, 
(JFM-00-1261), Reclaim Center Inc, individually and on behalf of those similarly situated (JFM-00-1261), Plaintiffs: 
Michelle K Enright, Law Office, Minneapolis, MN; Richard M Hagstrom, Law Office, Minneapolis, MN.
For Steven Nielsen, individually and as representative of all persons similarly situated (JFM-00-1262), Plaintiff: Ben 
Barnow, Barnow and Goldberg, Chicago, IL; Daniel J Petroski, Jr, Vahldiek Cano Grayson Hovenkamp Petroski, 
Houston, TX; David H Weinstein, PRO HAC VICE, Weinstein Kirchenoff Scarlato  [**6] and Goldman, Philadelphia, 
PA; George R Serdar, Madhulika Jain, Messerli and Kramer, Minneapolis, MN; James M Ziegler, Kenneth B 
McClain, Ralph K Phalen, Humphrey Farrington and McClain PC, Independence, MO; William R Steinmetz, Norris 
and Rieselbach, Milwaukee, WI.
For Raymond Pryor, individually and on behalf of all those similarly situated (JFM-00-1263), Plaintiff: Christopher 
Lovell, Lovell and Stewart LLP, New York, NY; Jonathan Kord Lagemann, Law Office, New York, NY.
For Seastrom Associates LTD, individually and on behalf of all those similarly situated (JFM-00-1264), Plaintiff: 
Christopher Lovell, Gary S Jacobson, Lovell and Stewart LLP, New York, NY.
For Chris Campbell, on his own behalf and through whom a class of persons similarly situated may also each 
appear despite their great numbers (JFM-00-1267), Plaintiff: Gregg Meyers, Gregg Meyers Attorney at Law, 
Charleston, SC; J David Flowers, Law Office, Greenville, SC; Michael S Seekings, Charleston, SC.
For Denise Davenport, individually and (JFM-00-1268), doing business as, D&D Staffing, Plaintiff: Robert L Lieff, 
Lieff Cabraser Heimann and Bernstein LLP, San Francisco, CA; Thomas Matthew Sobol, Hagens Berman LLP, 
Boston, MA;  [**7] William Gordon Ball, Ball and Scott, Knoxville, TN.
For Sara Cheeseman, on behalf of herself and all others similarly situated (JFM-00-1269), Plaintiff: Jacob B 
Perkinson, LEAD ATTORNEY, Dennis J Johnson, Johnson and Perkinson, South Burlington, VT.
For Ronald Rodjenski, on behalf of himself and all others similarly situated (JFM-00-1269), Plaintiff: Dennis J 
Johnson, Johnson and Perkinson, South Burlington, VT.
For Harold A Phillips, (JFM-00-1271), Plaintiff: Alice McInerney, Kirby McInerney and Squire, New York, NY; Daniel 
Hume, Kirby McInerney and Squire LLP, New York, NY; Joshua I Barrett, Rudolph L DiTrapano, Sean P McGinley, 
Ditrapano Barrett and Dipiero, Charleston, WV.
For Matthew W O'Neill, individually and as representative of all similarly situated individuals (JFM-00-1272), 
Plaintiff: Ben Barnow, Barnow and Goldberg, Chicago, IL; Daniel J Petroski, Jr, Vahldiek Cano Grayson 
Hovenkamp Petroski, Houston, TX; William R Steinmetz, Norris and Rieselbach, Milwaukee, WI.
For Robert Weinke, individually and on behalf of all others similarly situated (JFM-00-1273), David Jaffee, 
individually and on behalf of all others similarly situated (JFM-00-1603), Plaintiffs: Alan M Mansfield, PRO 
 [**8] HAC VICE, Dennis Stewart, Milberg Weiss Bershad Hynes and Lerach, San Diego, CA; David J Bershad, 
Robert A Wallner, Milberg Weiss Bershad and Schulman LLP, New York, NY; Kenneth J Vianale, Milberg Weiss 
Bershad Hynes and Lerach, Boca Raton, FL; Leonard B Simon, Lerach Coughlin Stoia Geller Rudman and Robbins 
LLP, San Diego, CA.
For Idy Klein, individually and on behalf of all of those similarly situated (JFM-00-1602), Dawn Brandt, individually 
and on behalf of all others similarly situated (JFM-00-2146), Plaintiffs: Charles Selcer Zimmerman, Zimmerman 
Reed, Minneapolis, MN; Stanley M Chesley, Waite Schneider Bayless and ChesleyCo LPA, Cincinnati, OH.
699 F. Supp. 2d 730, *730; 2010 U.S. Dist. LEXIS 30756, **4

 
For Avi Mandel, individually and on behalf of all those similarly situated (JFM-00-1604), Plaintiff: Joseph M Weiss, 
Law Office, New York, NY; Jules Brody, Stull Stull and Brody, New York, NY; Lynn Lincoln Sarko, PRO HAC VICE, 
Keller Rohrback LLP, Seattle, WA.
For John Glase, individually and on behalf of all those similarly situated (JFM-00-1605), Bruce Wright, individually 
and on behalf of all those similarly situated (JFM-00-1605), Plaintiffs: Edward W Cochran, Cochran and Cochran, 
Shaker Heights, OH.
For Johanna M McWhinney, individually  [**9] and on behalf of all others similarly situated (JFM-00-1606), Plaintiff: 
Kenneth P McKay, Law Office, Pittsburgh, PA.
For South Dakota Association of Plumbing Heating and Cooling Contractors, a non-profit corporation (JFM-00-
1607), Plaintiff: James C Robbennolt, Olinger Lovald Robbennolt McCahren, Pierre, SD.
For Johnnie Moon, (JFM-00-1608), Plaintiff: Christopher Lovell, Lovell and Stewart LLP, New York, NY; F Thomas 
Olson, Hall Charne Burce and Olson, Milwaukee, WI.
For Robert Lee Colebank, individually and as representative of all persons similarly situated (JFM-00-1610), 
Plaintiff: Ben Barnow, Barnow and Goldberg, Chicago, IL; Daniel J Petroski, Jr, Vahldiek Cano Grayson 
Hovenkamp Petroski, Houston, TX; David H Weinstein, PRO HAC VICE, Weinstein Kirchenoff Scarlato and 
Goldman, Philadelphia, PA; James F Humphreys, James Humphreys and Associates LC, Charleston, WV.
For Bryan K Manson, (JFM-00-2302), Plaintiff: David W Dogan, III, Dogan and Wilkinson, Jackson, MS.
For Silverware Ltd, an English Corp. (JFM-00-1682), Datacrown LTD, an English Corp. on behalf of themselves and 
all others similarly situated (JFM-00-1682), Plaintiffs: James P Ulwick, Kramon and Graham PA, Baltimore, MD; 
Melissa  [**10] H Maxman, Baker and Hostetler, Washington, DC; Michael M Baylson, Duane Morris and Hecksher, 
Philadelphia, PA.
For Data Unit AG, a Swiss Corp. (JFM-00-1682), Plaintiff: Melissa H Maxman, Baker and Hostetler, Washington, 
DC.
For Fred Luce, (JFM-00-1740), Plaintiff: Mario N Alioto, Trump Alioto Trump and Prescott LLP, San Francisco, CA.
Edward Michael O'Brien, (JFM-00-1817)(JFM-02-3832), Plaintiff, Pro se, Santa Barbara, CA.
For Cynthia M Aikens, (JFM-00-2132), Plaintiff: Ben Barnow, Barnow and Goldberg, Chicago, IL; Daniel J Petroski, 
Jr, Vahldiek Cano Grayson Hovenkamp Petroski, Houston, TX; David H Weinstein, PRO HAC VICE, Weinstein 
Kirchenoff Scarlato and Goldman, Philadelphia, PA; Kenneth B McClain, Humphrey Farrington and McClain PC, 
Independence, MO; Michael G Stag, Sacks and Smith LLC, New Orleans, LA.
For Clair Falgoust, (JFM-00-2133), Carlton Falgoust, on behalf of themselves and all other persons similarly 
situated (JFM-00-2133), Plaintiffs: Daniel E Becnel, Law Offices of Daniel E Becnel, Reserve, LA; Dianne M Nast, 
Roda and Nast PC, Lancaster, PA; Richard Joseph Arsenault, PRO HAC VICE, Alexandria, LA; Thomas J Kliebert, 
Jr., Kliebert and Heltz, Gramercy, LA.
For Manual Knight,  [**11] (JFM-00-2134), Plaintiff: Thomas Coffin Willcox, Law Office of Thomas Willcox, 
Washington, DC; William Charles Claiborne, III, Law Offices of William Claiborne, Washington, DC.
For Webster T Knight, (JFM-00-2134), James Rudasil, on behalf of themselves and all others similarly situated 
(JFM-00-2134), Plaintiffs: Thomas Coffin Willcox, Law Office of Thomas Willcox, Washington, DC.
For Aubrey Bernard, individually and on behalf of all others similarly situated (JFM-00-2135), Plaintiff: Richard D 
Heideman, Heideman Nudelman and Kalik PC, Washington, DC.
For O'Sullivan Hicks and Patton LLP, on behalf of itself and all others similarly situated (JFM-00-2137), Plaintiff: 
Justin Witkin, Aylstock Witkin Sasser PLC, Gulf Breeze, FL; Raymond Lawler, Law Office, Town and Country 
Professional Offices, Marion, IL.
For Carl C Conrad, on behalf of himself and all others similarly situated (JFM-00-2138), Plaintiff: T Evan Schaeffer, 
Carey and Danis, St. Louis, MO.
699 F. Supp. 2d 730, *730; 2010 U.S. Dist. LEXIS 30756, **8

 
For Geraldine Guice, (JFM-00-2140), Plaintiff: Charles E Griffin, Griffin and Associates, Jackson, MS.
For William Brand Pryor, on behalf of himself and all others similarly situated (JFM-00-2141), Plaintiff: Christopher 
Lovell, Lovell and Stewart  [**12] LLP, New York, NY; Morgan W Bentley, Law Office, Newark, NJ.
For Pacific Coast Systems, (JFM-00-2142), Teri Gordon, on behalf of themselves and all others similarly situated 
(JFM-00-2142), Elham Shirzai, on behalf of herself and all others similarly situated (JFM-00-2142 & 00-2145), 
Plaintiffs: Bennet McConaughy, Sandler Ahern and McConaughy, Seattle, WA; William M Audet, The Alexander 
Law Firm, San Jose, CA.
For Michael Shevekov, on behalf of himself and all others similarly situated (JFM-00-2142 & 00-2144), Plaintiff: 
Bennet McConaughy, Sandler Ahern and McConaughy, Seattle, WA.
For Donald J Gianni, Jr, (JFM-00-2147), Rinaldo Veltri, (JFM-00-2147), Mario Traffichini, on behalf of themselves 
and all others similarly situated (JFM-00-2147), Plaintiffs: M Eric Frankovitch, Frankovitch Anetakis Colantonio and 
Simon, Weirton, WV.
For John F Siegenthaler, on behalf of themselves and all others similarly situated (JFM-99-3897), Caren M McCall, 
(JFM-99-3897), Plaintiffs: Ronald B Rubin, Circuit Court for Montgomery County, Rockville, MD.
For Larry A Penix, individually and on behalf of all those similarly situated (JFM-00-2148), Turner Corporation, 
(JFM-00-2139), Plaintiffs: Christopher Lovell,  [**13] Lovell and Stewart LLP, New York, NY.
For Pryce M Haynes, II, (JFM-00-2149), Plaintiff: Alan M Mansfield, PRO HAC VICE, Dennis Stewart, Milberg 
Weiss Bershad Hynes and Lerach, San Diego, CA; Leonard B Simon, Lerach Coughlin Stoia Geller Rudman and 
Robbins LLP, San Diego, CA; Michael James Flannery, Carey and Danis LLC, St Louis, MO.
For John K Heidlage, (JFM-00-1265), Ryan D Reynolds, on behalf of themselves and all others similarly situated 
(JFM-00-1265), Thomas McCaleb, (JFM-00-1265, 00-1266 & 00-2117), Vicki McCaleb, (JFM-00-1265 & 00-2117), 
Gale Ruffin, (JFM-00-1265, 00-1266 & 00-2117), Steven Master, (JFM-00-1266), Thomas Infante, (JFM-00-1266), 
James Woods, (JFM-00-1266), Leyton T Brown, (JFM-00-1266), Plaintiffs: Robert Heuck, II, Waite Schneider 
Bayless and Chesley Co LPA, Cincinnati, OH; Stanley M Chesley, Waite Schneider Bayless and ChesleyCo LPA, 
Cincinnati, OH; Wilbert B Markovits, Waite Schneider Bayless and Chesley Co LPA, Cincinnati, OH.
For Linda Dameron Kloth, (JFM-00-1265, 00-1266 & 00-2117, Plaintiff: Christopher Lovell, Lovell and Stewart LLP, 
New York, NY; Mary N Strimel, United States Department of Justice, Antitrust Division Networks and Technology 
Section, Washington,  [**14] DC; Michael D Hausfeld, Cohen Milstein Hausfeld and Toll PLLC, Washington, DC; 
Robert Heuck, II, Waite Schneider Bayless and Chesley Co LPA, Cincinnati, OH; Robert J Wozniak, Jr, Freed 
Kanner London & Millen, LLC, Bannockburn, IL; Stanley M Chesley, Waite Schneider Bayless and ChesleyCo LPA, 
Cincinnati, OH; Wilbert B Markovits, Waite Schneider Bayless and Chesley Co LPA, Cincinnati, OH.
For Daniel C Ray, individually and on behalf of all others similarly situated (JFM-00-2441), Julie Tinkham, on behalf 
of herself and all others similarly situated (JFM-00-2450), Plaintiffs: Charles Selcer Zimmerman, Zimmerman Reed, 
Minneapolis, MN; Robert Heuck, II, Waite Schneider Bayless and Chesley Co LPA, Cincinnati, OH; Stanley M 
Chesley, Waite Schneider Bayless and ChesleyCo LPA, Cincinnati, OH; Wilbert B Markovits, Waite Schneider 
Bayless and Chesley Co LPA, Cincinnati, OH.
For GTI System Integrators, on behalf of itself and all others similarly situated (JFM-00-2443), Plaintiff: Daniel C 
Girard, Girard Gibbs LLP, San Francisco, CA, PRO HAC VICE; William A Kershaw, PRO HAC VICE, Kronick 
Moskovitz Tiedemann and Girard, Sacramento, CA.
For Tzirl Fine, on behalf of herself and others similarly situated  [**15] (JFM-00-2449), Plaintiff: Norman L Lippitt, 
Jyman and Lippitt, Birmingham, MI.
For Derek M Prentice, on behalf of himself and all other Oklahoma citizens similarly situated (JFM-00-2451), Kurt C 
Carter, on behalf of themselves and all other Oklahoma citizens similarly situated (JFM-00-2451), Plaintiffs: Larry 
Derryberry, Derryberry Quigley Solomon and Neifeh, Oklahoma City, OK.
For James T Brems, (JFM-00-2445), Plaintiff: Christopher Lovell, Lovell and Stewart LLP, New York, NY; Patrick M 
Roby, Elderkin Law Firm, Cedar Rapids, IA.
699 F. Supp. 2d 730, *730; 2010 U.S. Dist. LEXIS 30756, **11

 
For Tim Applegate, individually and on behalf of all others similarly situated (JFM-00-2448), Plaintiff: Alan M 
Mansfield, PRO HAC VICE, Dennis Stewart, Milberg Weiss Bershad Hynes and Lerach, San Diego, CA; David J 
Bershad, Robert A Wallner, Milberg Weiss Bershad and Schulman LLP, New York, NY; Kenneth J Vianale, Milberg 
Weiss Bershad Hynes and Lerach, Boca Raton, FL; Leonard B Simon, Lerach Coughlin Stoia Geller Rudman and 
Robbins LLP, San Diego, CA; Mark D Bogen, PRO HAC VICE, Law Office of Mark D Bogen, Deerfield, FL; Michael 
James Flannery, Carey and Danis LLC, St Louis, MO.
For Paul L Howard, on behalf of himself and all others similarly situated (JFM-00-2446),  [**16] Plaintiff: James 
Fletcher Keller, Waite Schneider Bayless and Chesley Co, Cincinnati, OH; Robert Heuck, II, Waite Schneider 
Bayless and Chesley Co LPA, Cincinnati, OH; Stanley M Chesley, Waite Schneider Bayless and ChesleyCo LPA, 
Cincinnati, OH; Wilbert B Markovits, Waite Schneider Bayless and Chesley Co LPA, Cincinnati, OH.
For John A Supernovich, (JFM-00-3471), Marlene K Supernovich, individually and on behalf of all others similarly 
situated (JFM-00-3471), Plaintiffs: Alfred G Yates, Jr, Law Offices of Alfred G Yates Jr, Pittsburgh, PA; Paul M 
Goltz, Law Office, Pittsburgh, PA.
For Sherwood, Plaintiff: Edmund L Carey, Jr, Barrett Johnston and Parsley, Nashville, TN.
For Automatik Design Inc, individually and on behalf of all persons similarly situated in the State of Louisiana(JFM-
02-153), Plaintiff: Frank C Dudenhefer, Jr, Cummings Cummings and Dudenhefer, New Orleans, LA; Gladstone N 
Jones, III, Smith Jones and Fawer, New Orleans, LA; Spiro J Verras, Jones Verras and Freiberg LLC, New 
Orleans, LA.
For State of West Virginia, ex rel Darrell V McGraw Jr Attorney General (JFM-02-2091), Plaintiff: Benjamin L Bailey, 
Bailey and Glasser LLP, Charleston, WV; Douglas L Davis, West Virginia  [**17] Attorney Generals Office, 
Charleston, WV; John W Barrett, Barrett Law Firm PLLC, Charleston, WV.
For Netscape Communications Corp, Case transferred to MDL from D., D.C., C.A. No. 1:02-97, Plaintiff: James P 
Ulwick, Kramon and Graham PA, Baltimore, MD.
For Sun Microsystem, Plaintiff: John Bucher Isbister, William Stuart Heyman, Tydings and Rosenberg LLP, 
Baltimore, MD; Kirk Robert Ruthenberg, Michael Asher Schlanger, Sonnenschein Nath and Rosenthal LLP, 
Washington, DC; Robert M Galvin, Day Casebeer Madrid and Batchelder LLP, Cupertino, CA.
For Be Incorporated, Plaintiff: James T Southwick, Susman Godfrey LLP, Houston, TX; Parker C Folse, III, Susman 
Godfrey LLP, Seattle, WA.
For Burst.com Inc, Plaintiff: Bruce Joshua Wecker, Spencer Hosie, Hosie Frost Large and McArthur, San Francisco, 
CA; Robert J Yorio, Carr and Ferrell LLP, Palo Alto, CA.
For Keith F Cooper, as responsible person and liquidating trustee for CHS Electronics, Inc., on behalf of itself and 
all others similarly situated (JFM-02-3332), Plaintiff: Robert J Wozniak, Jr, Freed Kanner London & Millen, LLC, 
Bannockburn, IL.
For Conway, Mackenzie & Dunleavy, P.C., as Trustee of INCA Computer Company, u/a/d 12/10/98, on behalf of 
 [**18] itself and all others similarly situated (JFM-02-3331), Plaintiff: Christopher James Cormier, Cohen Milstein 
Hausfeld and Toll PLLC, Washington, DC; Robert J Wozniak, Jr, Freed Kanner London & Millen, LLC, 
Bannockburn, IL.
For Rhoda Henning, (JFM-02-3920), Plaintiff: Elwood S Simon, LEAD ATTORNEY, Brimingham, MI; Robert J 
Wozniak, Jr, Freed Kanner London & Millen, LLC, Bannockburn, IL.
For John Roby, (JFM-03-741), Henry Mascagni, (JFM-03-743), Hayley J. Gardner, (JFM-03-744), Steve Grubb, 
(JFM-03-745), Linda Stewart, (JFM-03-746), Murline Addington, (JFM-03-747), Travis D. McHann, Jr., (JFM-03-
748), Billy Lewis, (JFM-03-749), Booker T. Bailey, Jr., (JFM-03-750), James Pigg, (JFM-03-751), Angela Brinkley, 
(JFM-03-752), Delanious Harried, (JFM-03-753), Gertrude Green, (JFM-03-754), Camelia Calvert, (JFM-03-755), 
Mary Wyatt, (JFM-03-756), Emma Walton, (JFM-03-757), Iletha Green, (JFM-03-758), Plaintiffs: Brent Hardy 
Hazzard, LEAD ATTORNEY, Hazzard Law LLC, Jackson, MS; Christopher W Cofer, Cofer and Associates PA, 
Jackson, MS.
699 F. Supp. 2d 730, *730; 2010 U.S. Dist. LEXIS 30756, **15

 
For Michael NMI Lewis, (JFM-03-742), Plaintiff: Brent Hardy Hazzard, LEAD ATTORNEY, Hazzard Law LLC, 
Jackson, MS.
For Realnetworks, Inc., JFM-04-968, Plaintiff: G Stewart  [**19] Webb, Jr, LEAD ATTORNEY, Venable LLP, 
Baltimore, MD; John David Byars, Reeghan W Raffals, Bartlit Beck Herman Palenchar and Scott LLP, Chicago, IL; 
Eric R Olson, Bartlit Beck Herman Palenchar and Scott LLP, Denver, CO; James P Ulwick, Kramon and Graham 
PA, Baltimore, MD; Lynn Marie Engel, The Summit Law Group, Seattle, WA; Sean William Gallagher, Bartlit Beck 
Herman Palenchar and Scott LLP, Courthouse Pl, Chicago, IL.
For Birdsong Tractor and Supply, Inc., Plaintiff: Richard Lee Quintus, Roberts Law Firm PA, Little Rock, AR.
For City and County of San Francisco, County of Santa Clara, County of Los Angeles, City of Los Angeles, County 
of San Mateo, County of Contra Costa, Plaintiffs: Mark T Jansen, LEAD ATTORNEY, Townsend and Towsend and 
Crew LLP, San Francisco, CA; Craig C Corbitt, Zelle Hofmann Voelbel Mason and Gette LLP, San Francisco, CA; 
Daniel J Furniss, Townsend and Townsend and Crew LLP, Palo Alto, CA; Eugene Chatham Crew, Louise E Ma, 
Townsend and Townsend and Crew LLP, San Francisco, CA; Steven F Benz, Kellogg Huber Hansen Todd Evans 
and Figel PLLC, Washington, DC.
For Novell, Inc., Plaintiff: Jeffrey M Johnson, LEAD ATTORNEY, Milton A Marquis, R Bruce Holcomb, Dickstein 
Shapiro  [**20] LLP, Washington, DC.
For Michael I Mark, Plaintiff: Ben Barnow, LEAD ATTORNEY, Barnow and Goldberg, Chicago, IL.
For Go Computer, Inc., JFM-05-2413, S. Jerrold Kaplan, JFM-05-2413, Plaintiffs: Steven F Benz, LEAD 
ATTORNEY, Michael K Kellogg, Kellogg Huber Hansen Todd Evans and Figel PLLC, Washington, DC; Eugene 
Chatham Crew, Townsend and Townsend and Crew LLP, San Francisco, CA.
For Daisy Mountain Fire District, Plaintiff: Mark D Samson, Keller Rohrback PLC, Phoenix, AZ.
For Pradeep Sujan, Individually and on behalf of all others similarly situated (JFM-02-3397), Consol Plaintiff:
For Microsoft Corporation, Defendant: Matthew L Larrabee, LEAD ATTORNEY, Heller Ehrman White and 
McAuliffe, San Francisco, CA; Bradley S Phillips, Munger Tolles and Olson LLP, Los Angeles, CA; G Stewart 
Webb, Jr, Randolph Stuart Sergent, Venable LLP, Baltimore, MD; John A Jurata, Jr, PRO HAC VICE, Orrick, 
Herrington & Sutcliffe LLP, Washington, DC; Jonathan H Blavin, Rohit K Singla, Samuel N Weinstein, Ted Dane, 
Munger Tolles and Olson LLP, San Francisco, CA; Michael James DeVinne, Venable LLP, Baltimore, MD; Charles 
B Casper, Montgomery McCracken Walker and Rhoads, Philadelphia, PA; Daryl A Libow, David B Tulchin, 
 [**21] Joseph E Neuhaus, Justin J Daniels, Richard C Pepperman, II, Sullivan and Cromwell, New York, NY; 
Maureen P Sheehan, New York, NY; Richard Wallis, Steven J Aeschbacher, Thomas W Burt, Microsoft 
Corporation, One Microsoft Way, Redmond, WA; Steve William Berman, Hagens Berman LLP, Seattle, WA.
For Compaq Computer Corporation, (JFM-00-1247 Gravity), Defendant: Gaynelle Jones, Compaq Computer 
Corporation, Houston, TX; John F. Cooney, Venable Baetjer Howard and Civiletti, Washington, DC; Martin L Saad, 
Venable LLP, Baltimore, MD.
For Dell Computer, (JFM-00-1247 Gravity), Defendant: Heather K Gerken, Jenner and Block, Washington, DC; 
Jerold S Solovy, Jenner and Block, Chicago, IL; Paul March Smith, Jenner and Block LLC, Washington, DC; 
Samuel R Miller, Folger Levin and Kahn LLP, San Francisco, CA.
For Packard Bell Nec Inc, (JFM-00-1247 Gravity), Defendant: George Brian Busey, Morrison and Foerster LLP, 
Washington, DC; Penelope A Preovolos, Morrison and Foerster, San Francisco, CA; W Stephen Smith, Morrison 
and Foerster, Washington, DC.
For International Business Machines Corporation, International Business Machines Corporation, The Walt Disney 
Company, The Walt Disney Company, AOL Time Warner,  [**22] Inc., The Walt Disney Company, Defendants: 
Patrick M Shields, Quinn Emanuel Urguhart Oliver And Hedges, Los Angeles, CA.
For Radio Shack Corporation, Defendant: Martin L Saad, Venable LLP, Baltimore, MD.
For National Plaintiffs' Counsel, Movant: Brent W Landau, Christopher James Cormier, Cohen Milstein Hausfeld 
and Toll PLLC, Washington, DC.
699 F. Supp. 2d 730, *730; 2010 U.S. Dist. LEXIS 30756, **18

 
Kevin Mitnick, Movant, Pro se.
Jonathan Lee Riches, Movant, Pro se.
Barry Worthington Keenan, Movant, Pro se.
Jonathan Lee Riches, Movant, Pro se, Lexington, KY.
For WildTangent Inc., (JFM-02-2739), Interested Party: Edward J Kessler, LEAD ATTORNEY, Sterne Kessler 
Goldstein and Fox PLLC, Washington, DC.
For Eastman Kodak Company, Interested Party: Charles S Fax, Rifkin Livingston Levitan and Silver, Greenbelt, 
MD.
For Gateway, Inc., Interested Party: John G Froemming, LEAD ATTORNEY, Howrey LLP, Washington, DC.
For Kirby, McInerney & Squire, LLP, Lerach Coughlin Stoia Geller Rudman & Robbins LLP, Lieff Cabraser, Heiman 
& Bernstein, LLP, Interested Partys: Andrew Marc Dansicker, Law Office of Andrew M. Dansicker, LLC, Hunt 
Valley, MD.
For Zelle, Hofmann, Voebel, Mason & Gette LLP, Interested Party: William P McGrath, Jr, Porter Wright Morris and 
Arthur LLP,  [**23] Washington, DC.
For Nortel Networks, Amicus:
For Software and Information Industry Association, Intervenor: Stephanie Ann Joyce, Kelley Drye and Warren LLP, 
Washington, DC.
For Clifford Kupperberg, Special Appearance of Previously Certified Classes of California Plaintiffs, Intervenor: 
Eugene Chatham Crew, Townsend and Townsend and Crew LLP, San Francisco, CA.
For Gregg Lachterman, Intervenor: Robert J Wozniak, Jr, Freed Kanner London & Millen, LLC, Bannockburn, IL.
For Microsoft Corporation, Counter Claimant: G Stewart Webb, Jr, Venable LLP, Baltimore, MD.
For Sun Microsystem, Counter Defendant: Michael Asher Schlanger, Sonnenschein Nath and Rosenthal LLP, 
Washington, DC; Robert M Galvin, Day Casebeer Madrid and Batchelder LLP, Cupertino, CA."
