頁碼,內容類型,內容
1207,Counsel,"Counsel:  [*1] For Michelle Downs, Laurie Jarrett, Plaintiffs: Adrienne W. Kim, Doris A. Kim, Mark K. Gray, 
Matthew L. White, Franklin Gray & White, Louisville, KY; Joe R. Whatley, Jr., Whatley Drake & Kallas, LLC, 
Birmingham, AL; Max R. Schwartz, Whatley Drake & Kallas, LLC, New York, NY.
For Insight Communications Company, L.P., doing business as Insight, Defendant: Laurence John Zielke, LEAD 
ATTORNEY, Janice M. Theriot, The Zielke Law Firm, Louisville, KY; Bruce D. Sokler, Robert G. Kidwell, Mintz, 
Levin, Cohn, Ferris, Glovsky & Popeo, Washington, DC."
1207,Judges,"Judges: Charles R. Simpson, III, United States District Judge."
1207,Opinion by,"Opinion by: Charles R. Simpson, III"
1213,Counsel,"Counsel:  [*1] Attorneys for Plaintiffs: Not Present.
Attorneys for Defendants: Not Present."
1213,Judges,Judges: James V. Selna.
1213,Opinion by,Opinion by: James V. Selna
1225,Counsel,"Counsel:  [*1] For WARREN GENERAL HOSPITAL, on behalf of itself and all others similarly situated, Plaintiff: 
JEFFREY J. CORRIGAN, LEAD ATTORNEY, SPECTOR, ROSEMAN & KODROFF, ESQS., PHILADELPHIA, PA; 
MARC H. EDELSON, COUNSEL NOT ADMITTED TO USDC-NJ BAR, DOYLESTOWN, PA.
For AMGEN, INC., Defendant: MICHAEL R. GRIFFINGER, LEAD ATTORNEY, CHRISTOPHER T. WALSH, 
MICHAEL F. QUINN, GIBBONS, PC, NEWARK, NJ."
1226,Judges,"Judges: STANLEY R. CHESLER, United States District Judge."
1226,Opinion by,Opinion by: STANLEY R. CHESLER
1235,Counsel,"Counsel: For Hillsborough County Florida, Appellant: Stephen Mark Todd, Hillsborough County Attorney's Office, 
TAMPA, FL.
For Republic Services of Florida, Appellant: Limited Partnership, Marie Tomassi, Trenam, Kemker, Scharf, Barkin, 
Frye, O'Neill & Mullis P.A., Saint Petersburg, FL.
For Waste Management Inc. of Florida, Appellant: David Clark Borucke, Holland & Knight, LLP, TAMPA, FL.
For Danner Construction Co., Inc., Appellee: Andrew Kenyon MacFarlane, Macfarlane Ferguson & McMullen, 
TAMPA, FL.
For Gateway Roll-Off Services, LP, Appellee: William B. Taylor, IV, MacFarlane, Ferguson & McMullen, Tampa, FL."
1235,Judges,"Judges: Before DUBINA, Chief Judge, MARTIN and COX, Circuit Judges. MARTIN, concurring."
1235,Opinion by,Opinion by: DUBINA
1245,Counsel,"Counsel: For UNITED STATES OF AMERICA, Plaintiff - Appellee: Josette Louise Cassiere, Assistant U.S. 
Attorney, Carol Mignonne Griffing, Assistant U.S. Attorney, U.S. Attorney's Office, Western District of Louisiana, 
Shreveport, LA.
For JAMES RAY COLEMAN, Defendant - Appellant: Billy James Guin, Jr., Rountree & Guin, Shreveport, LA."
1245,Judges,"Judges: Before GARWOOD, STEWART, and CLEMENT, Circuit Judges."
1245,Opinion by,Opinion by: CARL E. STEWART
1254,Counsel,"Counsel:  [*1] For Pamela Brennan, Plaintiff: Daniel O. Myers, LEAD ATTORNEY, Richardson, Patrick, Westbrook 
and Brickman, LLC, Mt. Pleasant, SC; Joseph Richard Saveri, LEAD ATTORNEY, Brendan Patrick Glackin, Hector 
Daniel Geribon, Jahan C. Sagafi, Lieff, Cabraser, Heiman & Bernstein, LLP, San Francisco, CA; Andrew W. Hutton, 
Deborah Brown McIlhenny, Hutton & Hutton, LLC, Wichita, KS; Anthony J. Bolognese, Bolognese & Associates 
LLC, Philadelphia, PA; Bart D. Cohen, Merrill G. Davidoff, Michael J. Kane, Berger & Montague, P.C., Philadelphia, 
PA; Daniel Bruce Allanoff, Joel Cary Meredith, Meredith Cohen Greenfogel & Skirnick PC, Philadelphia, PA; Daniel 
E. Gustafson, Karla M. Gluek, Gustafson Gluek PLLC, Minneapolis, MN; David Felderman, Eugene A. Spector, 
Jeffrey J. Corrigan, William G. Caldes, Spector, Roseman & Kodroff & Willis, P.C., Philadelphia, PA; George A. 
Shohet, Attorney at Law, Venice, CA; Gretchen M. Nelson, Kreindler & Kreindler LLP, Los Angeles, CA; Joseph C. 
Kohn, William E. Hoese, Kohn Swift & Graf P.C., Philadelphia, PA; Joshua P. Davis, University of San Francisco 
School of Law, San Francisco, CA; Kim Keevers, Richardson Patrick Westbrook & Brickman, Charleston, SC; Marc 
Howard  [*2] Edelson, Edelson & Associates, LLC, Doylestown, PA; Marc S. Moller, Kreindler & Kreindler LLP, New 
York, NY; Mark G. Ayesh, Ayesh Law Offices, Wichita, KS; Michael Joseph Brickman, Richardson, Patrick, 
Westbrook & Brickman, LLC, Charleston, SC.
For Terry Crayton, Darla Martinez, on behalf of themselves & all others similarly situated, Plaintiffs: Daniel O. 
Myers, LEAD ATTORNEY, Richardson, Patrick, Westbrook and Brickman, LLC, Mt. Pleasant, SC; Joseph Richard 
Saveri, LEAD ATTORNEY, Brendan Patrick Glackin, Hector Daniel Geribon, Jahan C. Sagafi, Lieff, Cabraser, 
Heiman & Bernstein, LLP, San Francisco, CA; Andrew W. Hutton, Deborah Brown McIlhenny, Hutton & Hutton, 
LLC, Wichita, KS; Anthony J. Bolognese, Bolognese & Associates LLC, Philadelphia, PA; Bart D. Cohen, Merrill G. 
Davidoff, Michael J. Kane, Berger & Montague, P.C., Philadelphia, PA; Daniel Bruce Allanoff, Joel Cary Meredith, 
Meredith Cohen Greenfogel & Skirnick PC, Philadelphia, PA; Daniel E. Gustafson, Karla M. Gluek, Gustafson 
Gluek PLLC, Minneapolis, MN; David Felderman, Eugene A. Spector, Jeffrey J. Corrigan, William G. Caldes, 
Spector, Roseman & Kodroff & Willis, P.C., Philadelphia, PA; George A. Shohet, Attorney at Law,  [*3] Venice, CA; 
Gretchen M. Nelson, Kreindler & Kreindler LLP, Los Angeles, CA; Joseph C. Kohn, William E. Hoese, Kohn Swift & 
Graf P.C., Philadelphia, PA; Joshua P. Davis, University of San Francisco School of Law, San Francisco, CA; Kim 

 
Keevers, Richardson Patrick Westbrook & Brickman, Charleston, SC; Marc Howard Edelson, Edelson & 
Associates, LLC, Doylestown, PA; Marc S. Moller, Kreindler & Kreindler LLP, New York, NY; Mark G. Ayesh, Ayesh 
Law Offices, Wichita, KS; Michael Joseph Brickman, Richardson, Patrick, Westbrook & Brickman, LLC, Charleston, 
SC; W. Joseph Bruckner, Lockridge Grindal Nauen P.L.L.P, Minneapolis, MN.
For Cecilia Salvador, Plaintiff: Bart D. Cohen, Merrill G. Davidoff, Michael J. Kane, Berger & Montague, P.C., 
Philadelphia, PA; Brendan Patrick Glackin, Hector Daniel Geribon, Lieff Cabraser Heimann & Bernstein, LLP, San 
Francisco, CA; David Felderman, Spector, Roseman & Kodroff & Willis, P.C., Philadelphia, PA; Eugene A. Spector, 
Jeffrey J. Corrigan, William G. Caldes, Spector, Roseman, Kodroff & Willis, P.C., Philadelphia, PA; Jayne Arnold 
Goldstein, Shepherd, Finkelman, Miller & Shah, LLP, Weston, FL; Joseph Richard Saveri, Lieff, Cabraser, Heiman 
& Bernstein, LLP,  [*4] San Francisco, CA.
For Peter Sanchez, Plaintiff: David B. Krauss, LEAD ATTORNEY, Law Office of David B. Krauss, New York, NY; 
Bart D. Cohen, Merrill G. Davidoff, Berger & Montague, P.C., Philadelphia, PA; Brendan Patrick Glackin, Hector 
Daniel Geribon, Lieff Cabraser Heimann & Bernstein, LLP, San Francisco, CA; Eugene A. Spector, Spector 
Roseman Kodroff & Willis, PC, Philadelphia, PA; Joseph Richard Saveri, Lieff, Cabraser, Heiman & Bernstein, LLP, 
San Francisco, CA.
For Deborah Fennern, Plaintiff: David B. Krauss, LEAD ATTORNEY, Law Office of David B. Krauss, New York, NY; 
Bart D. Cohen, Merrill G. Davidoff, Berger & Montague, P.C., Philadelphia, PA; Brendan Patrick Glackin, Hector 
Daniel Geribon, Lieff Cabraser Heimann & Bernstein, LLP, San Francisco, CA; Garrett D. Blanchfield, Jr., Reinhardt 
Wendorf & Blanchfield, St. Paul, MN; Joseph Richard Saveri, Lieff, Cabraser, Heiman & Bernstein, LLP, San 
Francisco, CA.
For Darecia Miller, Lynette Williams, Plaintiffs: Reginald Von Terrell, LEAD ATTORNEY, The Terrell Law Group, 
Oakland, CA; Bart D. Cohen, Merrill G. Davidoff, Berger & Montague, P.C., Philadelphia, PA; Brendan Patrick 
Glackin, Hector Daniel Geribon, Lieff Cabraser Heimann &  [*5] Bernstein, LLP, San Francisco, CA; Donald Chidi 
Amamgbo, Esq., Amamgbo & Associates, Oakland, CA; Joseph Richard Saveri, Lieff, Cabraser, Heiman & 
Bernstein, LLP, San Francisco, CA.
For Melissa Griffin, Dorothy Stam, Plaintiffs: Laurence D. King, LEAD ATTORNEY, Linda M. Fong, Kaplan Fox & 
Kilsheimer LLP, San Francisco, CA; Bart D. Cohen, Merrill G. Davidoff, Berger & Montague, P.C., Philadelphia, PA; 
Brendan Patrick Glackin, Hector Daniel Geribon, Lieff Cabraser Heimann & Bernstein, LLP, San Francisco, CA; 
Joseph Richard Saveri, Lieff, Cabraser, Heiman & Bernstein, LLP, San Francisco, CA; Linda Phyllis Nussbaum, 
Nussbaum LLP, Scarsdale, NY; Lori Sambol Brody, Kaplan Fox & Kilsheimer LLP, Los Angeles, CA.
For Steve Murray, Plaintiff: Beth E. Terrell, LEAD ATTORNEY, Terrell Marshall & Daudt PLLC, Seattle, WA; Bart D. 
Cohen, Merrill G. Davidoff, Berger & Montague, P.C., Philadelphia, PA; Brendan Patrick Glackin, Hector Daniel 
Geribon, Lieff Cabraser Heimann & Bernstein, LLP, San Francisco, CA; Joseph Richard Saveri, Lieff, Cabraser, 
Heiman & Bernstein, LLP, San Francisco, CA.
For Grace P. Spohnholz, Plaintiff: George T. Freeman, LEAD ATTORNEY, Anchorage, AK; Bart D. Cohen, Merrill 
G. Davidoff,  [*6] Berger & Montague, P.C., Philadelphia, PA; Brendan Patrick Glackin, Hector Daniel Geribon, Lieff 
Cabraser Heimann & Bernstein, LLP, San Francisco, CA; Joseph Richard Saveri, Lieff, Cabraser, Heiman & 
Bernstein, LLP, San Francisco, CA.
For Concord EFS, Inc., First Data Corp., Defendants: Benjamin Kneeland Riley, Howrey LLP, San Francisco, CA; 
Brian Douglas Wallach, Peter Edward Moll, Esq., Howrey Simon Arnold & White, LLP, Washington, DC; Stephen R. 
Cook, Howrey LLP, Irvine, CA; Buckmaster DeWolf, Howrey Simon Arnold & White, LLP, Menlo Park, CA.
For Bank of America Corporation, Defendant: Anita Fern Stork, Esq., LEAD ATTORNEY, Kelly Patrice Finley, 
Sonya Diane Winner, Covington & Burling LLP, San Francisco, CA; Erin C Smith, Tara M. Steeley, Covington & 
Burling, San Francisco, CA.
For Bank One, N.A., Defendant: Benjamin Jonathan Fox, Sylvia Rivera, Morrison & Foerster LLP, Los Angeles, CA; 
Robert Steven Stern, Morrison & Foerster, Los Angeles, CA.
2010 U.S. Dist. LEXIS 61160, *3

 
For J.P. Morgan Chase & Co., Defendant: Sylvia Rivera, Morrison & Foerster LLP, Los Angeles, CA; W. Stephen 
Smith, Morrison & Foerster LLP, Washington, DC.
For Citibank (West), F.S.B., CitiGroup, Inc., Citibank, N.A., Defendants: David F. Graham,  [*7] Eric Henry Grush, 
PRO HAC VICE, Sidley Austin LLP, Chicago, IL; Menesh S. Patel, Sidley Austin LLP, San Francisco, CA.
For Suntrust Banks, Inc., Defendant: Deborah Kay Croyle, Orrick Herrington & Sutcliffe, San Francisco, CA; M. 
Laurence Popofsky, Orrick, Herrington & Sutcliffe LLP, San Francisco, CA.
For Wachovia Corporation, Defendant: Jack R. Nelson, LEAD ATTORNEY, Kirsten Joy Daru, Michele D. Floyd, 
Reed Smith LLP, San Francisco, CA.
For Wachovia Bank NA, Defendant: Kirsten Joy Daru, Michele D. Floyd, Reed Smith LLP, San Francisco, CA.
For Wells Fargo & Co., Wells Fargo Bank, N.A., Defendants: Brett Davis Collins, Daniel Murray Wall, Erica T. 
Grossman, Latham & Watkins LLP, San Francisco, CA; Donald I Baker, Baker & Miller PLLC, Washington, DC; 
Katie Ya-yee Chang, Joshua N. Holian, Latham & Watkins, San Francisco, CA.
For Servus Financial Corp., Defendant: Brett Davis Collins, Daniel Murray Wall, Erica T. Grossman, Latham & 
Watkins LLP, San Francisco, CA; Katie Ya-yee Chang, Joshua N. Holian, Latham & Watkins, San Francisco, CA.
For Bank of America, N.A., Defendant: Anita Fern Stork, Esq., Kelly Patrice Finley, Sonya Diane Winner, Covington 
& Burling LLP, San Francisco, CA; Erin C Smith,  [*8] Covington & Burling, San Francisco, CA.
For JP Morgan Chase Bank, N.A., Defendant: Robert Steven Stern, Morrison & Foerster, Los Angeles, CA; Sylvia 
Rivera, Morrison & Foerster LLP, Los Angeles, CA.
Gilberto Felix, Movant, Pro se, Salters, SC.
Gino Romano, Movant, Pro se, Endicott, NY."
1256,Judges,"Judges: CHARLES R. BREYER, UNITED STATES DISTRICT JUDGE."
1256,Opinion by,Opinion by: CHARLES R. BREYER
1265,Counsel,"Counsel: Marc E. Kasowitz with whom Kasowitz, Benson, Torres & Friedman LLP was on brief for appellant.
Scott P. Lewis with whom Kevin D. Batt, Melissa C. Allison and Anderson & Kreiger LLP were on brief for 
appellees."
1265,Judges,"Judges: Before Lynch, Chief Judge, Boudin and Lipez, Circuit Judges."
1265,Opinion by,Opinion by: BOUDIN
1273,Counsel,"Counsel:  [**1] For Sterling Merchandising, Inc., Plaintiff: David C. Indiano-Vicic, Jeffrey M. Williams-English, LEAD 
ATTORNEYS, Seth Erbe, Indiano & Williams, PSC, San Juan, PR; PHV Adam C. Briggs, LEAD ATTORNEY, PRO 
HAC VICE, PHV David J. Gilles, PHV Josh Johanningmeier, PRO HAC VICE, Godfrey & Kahn, S.C., Madison, WI; 
Javier A. Morales-Ramos, Javier A. Morales Ramos Law Office, San Juan, PR; PHV Jennifer Cotner, PHV Kevin J. 
O'Connor, PRO HAC VICE, LaFollete Godfrey & Kahn, Madison, WI.
For Nestle, S.A., Nestle Puerto Rico, Inc., Payco Foods Corporation, Defendants: Luis A. Oliver-Fraticelli, LEAD 
ATTORNEY, Roberto A. Camara-Fuertes, Fiddler, Gonzalez & Rodriguez, San Juan, PR; PHV Erik T. Koons, PHV, 
Carmine R. Zarlenga, LEAD ATTORNEYS, PRO HAC VICE, Howrey LLP, Washington, DC.
For Nestle Holdings, Inc., Defendant: Luis A. Oliver-Fraticelli, LEAD ATTORNEY, Roberto A. Camara-Fuertes, 
Fiddler, Gonzalez & Rodriguez, San Juan, PR; PHV Erik T. Koons, PHV, Carmine R. Zarlenga, LEAD 
ATTORNEYS, PRO HAC VICE, Howrey LLP, Washington, DC.
For Department of Justice, Amicus: Lavinia Aparicio-Lopez, Commonwealth Department of Justice, San Juan, 
 [**2] PR.
For PMC Marketing Corp., Interested Party: Javier I. Arbona, LEAD ATTORNEY, Quinones, Sanchez & Guzman, 
PSC, San Juan, PR.
For Sterling Merchandising, Inc., Counter Defendant: Seth Erbe, LEAD ATTORNEY, Indiano & Williams, PSC, San 
Juan, PR."
1274,Judges,"Judges: SALVADOR E. CASELLAS, U.S. Senior District Judge."
1274,Opinion by,Opinion by: SALVADOR E. CASELLAS
1293,Counsel,"Counsel:  [*1] For Edith Manabat, Plaintiff: Peter Jason Cabbiness, LEAD ATTORNEY, Law Office Of Peter J. 
Cabbiness, Clovis, CA."
1293,Judges,"Judges: Lawrence J. O'Neill, UNITED STATES DISTRICT JUDGE."
1293,Opinion by,Opinion by: Lawrence J. O'Neill
1312,Counsel,"Counsel: ROBERT D. MacGILL, ESQUIRE (ARGUED), PETER J. RUSTHOVEN, ESQUIRE, STANLEY C. 
FICKLE, ESQUIRE, HAMISH S. COHEN, ESQUIRE, MATTHEW B. BARR, ESQUIRE, Barnes and Thornburg, 
Indianapolis, Indiana; C. BARR FLINN, ESQUIRE, KAREN E. KELLER, ESQUIRE, Young Conaway Stargatt & 
Taylor, Wilmington, Delaware, Attorneys for Appellants.
BRADLEY I. RUSKIN, ESQUIRE (ARGUED), JENNIFER R. SCULLION, ESQUIRE, COLIN A. UNDERWOOD, 
ESQUIRE, ROBERT D. FORBES, ESQUIRE, Proskauer Rose, New York, New York; LAWRENCE C. ASHBY, 
ESQUIRE, CAROLYN S. HAKE, ESQUIRE, TONI-ANN PLATIA, ESQUIRE, PHILIP TRAINER, JR., ESQUIRE, 
Ashby & Geddes, Wilmington, Delaware, Attorneys for Appellees."
1312,Judges,"Judges: Before: SCIRICA, JORDAN and GREENBERG, Circuit Judges."
1312,Opinion by,Opinion by: SCIRICA
1333,Counsel,"Counsel: Montgomery & Andrews, P.A., Sarah M. Singleton, Walter J. Melendres, Victor R. Ortega, Santa Fe, NM; 
Arnold & Porter, L.L.P., Kenneth L. Chernof, Washington, DC; Boies, Schiller & Flexner, L.L.P., David Boies, 
Armonk, NY; Jack G. Stern, New York, NY; Amy J. Mauser, Washington, DC for Petitioner Philip Morris 
Incorporated.
Rodey, Dickason, Sloan, Akin & Robb, P.A., Andrew G. Schultz, Albuquerque, NM; Jones Day, Edwin L. Fountain, 
Washington, DC; Thomas Demitrack, Cleveland, OH, for Petitioners R.J. Reynolds Tobacco Company and Brown & 
Williamson Tobacco Corporation.
Youtz & Valdez, P.C., Shane C. Youtz, Albuquerque, NM; Ball & Scott Law Offices, Gordon Ball, Knoxville, TN; 
Cuneo Gilbert & Laduca, L.L.P., Jonathan W. Cuneo, Daniel Cohen, Washington, DC; Hausfeld, L.L.P., Michael D. 
Hausfeld, Megan E. Jones, Washington, DC, for Respondents."
1333,Judges,"Judges: EDWARD L. CHAVEZ, Justice. WE CONCUR: CHARLES W. DANIELS, Chief Justice, PATRICIO M. 
SERNA, Justice, PETRA JIMENEZ MAES, Justice, RICHARD C. BOSSON, Justice."
1333,Opinion by,Opinion by: EDWARD L. CHAVEZ
1348,Counsel,"Counsel:  [*1] For Fern M Smith, Special Master: Fern M. Smith, JAMS, San Francisco, CA.
For LG Display Co., Ltd., (D, I), formerly known as LG Philips LCD Co., LTD., LG Display America, Inc., (D, I), 
formerly known as LG Philips LCD America, Inc., Defendants: Jerome Cary Roth, LEAD ATTORNEY, Munger 
Tolles & Olson LLP, San Francisco, CA; Michael Robert Lazerwitz, LEAD ATTORNEY, Cleary Gottlieb Steen & 
Hamilton, Washington, DC.
For Samsung Electronics Co. Ltd., (D, I), Samsung Electronics America, Inc., (D, I), Defendants: Michael W. 
Scarborough, Sheppard Mullin Richter & Hampton LLP, San Francisco, CA.
For Sharp Corporation, LEAD ATTORNEY (D, I), Defendant: Jacob R. Sorensen, LEAD ATTORNEY, Pillsbury 
Winthrop Shaw Pittman LLP, San Francisco, CA.
For Sharp Electronics Corporation, LEAD ATTORNEY (D, I), Defendant: Jacob R. Sorensen, LEAD ATTORNEY, 
Pillsbury Winthrop Shaw Pittman LLP, San Francisco, CA; August Orval Stofferahn, Ryan Takemoto, Susan 
Greenberg, Tara Michele Desautels, Pillsbury Winthrop Shaw Pittman LLP, San Francisco, CA; Fusae Nara, 
Pillsbury Winthrop LLP, San Francisco, CA.
For Toshiba Corporation, (D, I), Toshiba Matsushita Display Technology Co., Ltd., (D, I), Toshiba America 
Information  [*2] Systems, Inc., (D, I), Defendants: John H. Chung, LEAD ATTORNEY, Wayne A. Cross, White & 
Case LLP, New York, NY.
For Hitachi Ltd., (D, I), Hitachi Displays, Ltd., (D, I), IPS Alpha Technology, LTD., (D), dismissed from IP amended 
complaint on 2/21/08, Defendants: Michael W. Scarborough, Morgan Lewis & Bockius LLP, San Francisco, CA.
For Hitachi Electronic Devices (USA), Inc., (D, I), Defendant: Candice Simone Petty, LEAD ATTORNEY,; Kent 
Michael Roger, LEAD ATTORNEY, Morgan Lewis & Bockius LLP, San Francisco, CA; William James Taylor, LEAD 
ATTORNEY.

 
For AU Optronics Corporation, (D, I), Defendant: Carl Lawrence Blumenstein, Nossaman Guthner Knox & Elliott 
LLP, San Francisco, CA.
For AU Optronics Corporation America, (D, I), Defendant: John C. McGuire, LEAD ATTORNEY, Sedgwick, Detert, 
Moran & Arnold, Newark, NJ; Matthew Clark Lovell, LEAD ATTORNEY, Sedgwick Detert Moran & Arnold, LLP, San 
Francisco, CA; Carl Lawrence Blumenstein, Nossaman Guthner Knox & Elliott LLP, San Francisco, CA; Christopher 
Alan Nedeau, Sedgwick Detert Moran & Arnold LLP, San Francisco, CA; Jason Haruo Wilson, Willenken Wilson 
Loh & Lieb LLP, Los Angeles, CA; Michael F. Healy, Esq., Sedwick, Detert, Moran & Arnold, San  [*3] Francisco, 
CA.
For Chi Mei Optoelectronics USA, Inc., (D, I), Defendant: Nathan Loy Walker, LEAD ATTORNEY, WilmerHale, Palo 
Alto, CA; Gordon Pearson, Wilmer Cutler Pickering Hale and Dorr LLP, Washington, DC; Steven F. Cherry, Wilmer 
Cutler Pickering Hale & Dorr LLP, Washington, DC, DC; Therese Lee, Wilmer Cutler Pickering Hale & Dorr LLP, 
Washington, DC; Wilmer Cutler, Hale and Dorr LLP, Washington, DC.
For Chunghwa Picture Tubes Ltd., (D, I), Defendant: Joshua David Hess, Gibson Dunn & Crutcher LLP, San 
Francisco, CA.
For Hannstar Display Corporation, (D, I), Defendant: Hugh F. Bangasser, K&L Gates LLP, Seattle, WA; Hugh 
Frederick Bangasser, Julie Anne Halter, K&L Gates, Seattle, WA; Jeffrey L. Bornstein, K&L Gates LLP, San 
Francisco, CA; Ramona M. Emerson, K&L GATES, Seattle, WA.
For Samsung Semiconductor, Inc., (D, I), Defendant: Gary L. Halling, LEAD ATTORNEY, Michael W. Scarborough, 
Sheppard Mullin Richter & Hampton LLP, San Francisco, CA; Tyler Mark Cunningham, Sheppard Mullin Richter & 
Hampton, San Francisco, CA.
For CMO Japan Co., Ltd., (D, I), Chi Mei Corporation, (D, I), Chi Mei Optoelectronics Corporation, (D, I), Nexgen 
Mediatech, Inc. (""Nexgen""), (D), Defendants: Gordon Pearson,  [*4] Wilmer Cutler Pickering Hale and Dorr LLP, 
Washington, DC.
For Nexgen Mediatech USA Inc, (D), Defendant: Caren K. Khoo, LEAD ATTORNEY, Wilmer Cutler Pickering Hale 
& Dorr, New York, NY; Gordon Pearson, Wilmer Cutler Pickering Hale and Dorr LLP, Washington, DC; Steven F. 
Cherry, Wilmer Cutler Pickering Hale & Dorr LLP, Washington, DC, DC; Therese Lee, Wilmer Cutler Pickering Hale 
& Dorr LLP, Washington, DC; Wilmer Cutler, Hale and Dorr LLP, Washington, DC.
For Epson Electronics America, Inc., (D), Dismissed as a indirect purchaser defendant on 4/1/08, Defendant: Kevin 
C. McCann, LEAD ATTORNEY, Paul Hastings Janofsky & Walker LLP, San Francisco, CA; Chad A. Westfall, Sean 
David Unger, Paul, Hastings, Janofsky & Walker LLP, San Francisco, CA.
For Tatung Company of America, Inc. (""Tatung America""), (D), Defendant: Bruce H. Jackson, LEAD ATTORNEY, 
Baker & McKenzie, San Francisco, CA; Karen Sewell, PRO HAC VICE, Baker & McKenzie LLP, Chicago, Il; Nancy 
Chung Allred, Baker & McKenzie LLP, San Francisco, CA; Patrick J. Ahern, PRO HAC VICE, Baker & McKenzie, 
Chicago, IL; Robert Walter Tarun, Baker & McKenzie LLP, San Francisco, CA; Roxane C. Busey, PRO HAC VICE, 
BAker & McKenzie LLP, Chicago,  [*5] IL.
For Toshiba America Electronics Components, Inc., (D, I), Defendant: John H. Chung, Wayne A. Cross, LEAD 
ATTORNEYS, White & Case LLP, New York, NY; Kristen J. McAhren, LEAD ATTORNEY, White & Case LLP, 
Washington, DC.
For State of California, Amicus: Emilio Eugene Varanini, IV, State Attorney General's Office, San Francisco, CA.
For United States Antitrust Division, Department of Justice, Intervenor: Alexandra Jill Shepard, U.S. Department of 
Justice, Antitrust Division, San Francisco, CA; David J. Ward, U.S. Department of Justice, Antritrust Divsion, San 
Francisco Field Office, San Francisco, CA; Heather S. Tewksbury, United States Department of Justice, Antitrust 
Division, San Francisco, CA; Michael L. Scott, Antitrust Division, San Francisco, CA; Niall Edmund Lynch, U.S. 
Department of Justice, Antitrust Division, San Francisco, CA."
1349,Judges,"Judges: SUSAN ILLSTON, United States District Judge.
2010 U.S. Dist. LEXIS 65023, *2"
1349,Opinion by,Opinion by: SUSAN ILLSTON
