頁碼,內容類型,內容
12,Counsel,"Counsel: Theodore B. Olson argued the cause for 
petitioner.
Thomas G. Hungar argued the cause for the United 
States, as amicus curiae, by special leave of court.
551 U.S. 877, *877; 127 S. Ct. 2705, **2705; 168 L. Ed. 2d 623, ***629; 2007 U.S. LEXIS 8668, ****5

 
Robert W. Coykendall argued the cause for 
respondent.
Barbara D. Underwood argued the cause for New 
York, et al., as amici curiae, by special leave of court."
13,Judges,"Judges: Kennedy, J., delivered the opinion of the Court, 
in which Roberts, C. J., and Scalia, Thomas, and Alito, 
JJ., joined. Breyer, J., filed a dissenting opinion, in 
which Stevens, Souter, and Ginsburg, JJ., joined, post, 
p. 908."
13,Opinion by,Opinion by: KENNEDY
