Case Index,Core Terms
Case 90,"carriers, Interstate, motor carrier, transportation, associations, combinations, anti trust law, regulation, antitrust, 
purposes, tariffs, public interest, instant matter, consolidation, commodities, effectuate, membership, evidences, 
annulled, effects, exempt"
Case 91,"trade secret, covenant, patent, chemicals, competitor, compete, district court, secret, confidential information, 
automated, hired, duplicate, suppliers, barbecue, cases, competitive advantage, former employer, composition, 
contracts, customers, Bearings, restrictive covenant, indirectly, novelty, parties, courts, meats, sales"
Case 92,"bid, depository, withdraw, plumbing, subcontractor, arbitration award, general contractor, Contractors, user, 
awarding authority, closing time, construction project, mechanical work, sheet metal, Cartwright Act, confirmation, 
withdrawn"
Case 93,"trial court, cases, new rule, consignment, retrospective, station, new trial, prospective application, announced, 
lease, renew, damages, anti trust law, favoring, motion for a new trial, gasoline, market value, Sherman Act, weight 
of the evidence, factors"
Case 94,"defendants', allegations, anti trust law, counterclaim, violations, trade secret, disclosure, sustaining, wrongdoing, 
practices, closed circuit television, general allegation, cause of action, subject matter, unrelated, modified, network, 
screen, alleged wrongful conduct, unfair competition act, business practice, direct relation, no purpose, plaintiff-
appellant, disbursements, appropriated, monopolistic, transactions, multi-media, proceedings"
Case 95,"retailers, practices, salesmen, prices, sales manager, Sherman Act, violations, injunctive relief, manufacturer, 
resale price, discount, suggested retail price, retail price, episodes, footwear, discontinuance, advertising, 
conspiracy, selling, personnel, cases, abandoned, canvas, proven, sales, price-cutting, price-fixing, merchandise, 
injunction, resumption"
Case 96,"patent, pool, license, royalty, licensee, patentee, Radio, district court, injunction, products, manufacture, Automatic, 
patent misuse, monopoly, infringement, merchandise, parties, damages, anti trust law, injunctive relief, trial court, 
conditioning, invention, percentage-of-sales, distributors, conspiracy, royalty payment, importation, provisions, 
insisted"
Case 97,"Interrogatory, patent, defendants', antitrust, discovery, objected, counterclaim, parties, severance, first trial, 
confidential, disclosure, infringement"
Case 98,"patent, salts, cyanate, aeration, bath, nitriding, trademark, infringement, metal, shops, air, anti-trust, prior art, 
cyanide, patent-in-suit, processes, captive, heat, customers, misuse, soft, file wrapper, non-aerated, franchise, 
chemical, Steel, heat-treater, franchisees, words, process-in-suit"
Case 99,"taxpayer, stockholder, damages, plant, municipality"
Case 100,"Clayton Act, acquisition, stock, automotive, damages, fabrics, finishes, percent, district court, anti trust law, 
antitrust, decree, violation of section, cause of action, Sherman Act, supplier, cases, prima facie evidence, private 
action, evidentiary, pre-trial, monopoly, government's case, stock interest, treble damages, money damages, 
ultimate fact, treble-damage, plaintiffs', ownership"
