Case Index,Core Terms
Case 79,"dental, trademark, dentist, goodwill, sales, products, distributed, importation, impression, customers, instructions, 
preliminary injunction, distributorship, registration, distributor, volume, irreparable harm, public interest, conventions, 
packaging, dealers, rights, sells"
Case 80,"sham exception, misrepresentation, allegations, defendants', antitrust, motion to dismiss, immunity, cardiac, sham, 
New Rule, pleaded, subverted, baseless, competitor, surgery, alleged misrepresentation, state agency, 
governmental process, conspiracy, grounds, petitioning, purposes, conclusory allegation, bad faith, medical-
surgical, anticompetitive, circumstances, constituting, converted, Trucking"
Case 81,"retailers, termination, conspiracy, shoes, prices, instructions, distributors, cross-appeal, sufficient evidence, 
Sherman Act, antitrust, contends"
Case 82,"alleges, defendants', antitrust, terminated, reciprocal, rights, cause of action, contractor, plaintiff's claim, local 
government, anti trust law, seller, motion to dismiss, asserts, damages, soils, right of free speech, due process 
claim, tying arrangement, antitrust claim, state court, Clayton Act, deprivation, conspiracy, sanctions, interstate 
commerce, soils engineer, open meeting, pending case, state law"
Case 83,"termination, customers, distributor, franchise, Shares, contracts, distributorship, Floors, Gypsum, manufacturer, 
antitrust, substantial change, advertising, disclaimer, use of a product, prescribe, parties, unfair, former customer, 
applicators, notified, stock, right to terminate, construction site, quality control, marketing plan, franchisee, 
employees, relations, tortious"
Case 84,"trade secret, cvd, patent, antitrust, bad faith, anti trust law, secrets, royalties, damages, license, technology, no 
trade, manufacture, monopolize, hipping, zinc sulfide, licensee, license agreement, disclosure, zinc, chemical, 
restrain, selenide, vapor, district court, instructions, deposition, invention, district judge, jury verdict"
Case 85,"lawsuits, civil action, immune, antitrust, frivolous, cases, court concludes, allegations, conspired, anti trust law, 
Counts, federal jurisdiction, antitrust liability, absolute immunity, complaint alleges, judicial immunity, anti-
competitive, discovery, induced, federal judge, judicial act, additionally, corruption, diverse, parties, bias"
Case 86,"antitrust, industrial, bonds, revenue bond, anti trust law, entitlement, supervision, downtown business, defendants', 
deprived, Village, property interest, due process, competitor, exemption, issuance, compete"
Case 87,"government action, cause of action, poker, Cartwright Act, Sherman Act, allegations, public official, first amended 
complaint, zone, trial court, conspiracy, anti trust law, prosecute, legalize, effects, sham, anticompetitive, demurrers, 
coconspirator, defendants', unfair competition, initiation, ordinances, contends, asserts, genuine, italics, lease, 
sufficient to constitute, economic relations"
Case 88,"pricing, predatory, potato chip, variable, costs, total cost, incremental, long-run, space, barriers, shelf, products, 
sales, supermarket, markets, non-cost, supplier, levels, plant, profits, maximization, factors, utilization, snack food, 
cost-based, exceeded, regional, parties, summary judgment motion, production facility"
Case 89,"interrogatory, predatory, pricing, costs, Railroad, funds, relevance of evidence, scope of discovery, motion to 
compel, burdensome, oppressive, antitrust, discovery, alleges, borrow"
Case 90,"interstate commerce, defendants', patients, allegations, antitrust, district judge, nexus, subject matter jurisdiction, 
failure to state a claim, psychiatric services, motion to dismiss, Sherman Act, out-of-state, memoranda of law, 
privileges, suspension, staff, additional fact, travel, hospital privileges, Memorandum, anesthesia, interstate, 
inferred"
Case 91,"exclusive territory, membership, consent decree, final judgment, proposed modification, repossessor, modification, 
modify, public interest, decree, antitrust"
Case 92,"airport, taxicab, antitrust, local government, municipality, damages, Plaintiffs', Clayton Act, exemption, state action, 
immune, anti trust law, pending case, state policy, articulated, municipal airport, single-operator, supervision, district 
court, anticompetitive, defendants', contracts, discovery, entities, factors, cases, alternative relief, effective date, 
injunctive, regulated"
Case 93,"disposal, solid waste, bid, municipalities, district court, landfill, franchise, solid waste management, Ordinance, 
anticompetitive, state action, regulation, due process, deprivation, supervision, antitrust, displace, rights, pollution 
control, antitrust claim, state policy, state court, specifications, appellants', engaging, immunity, bidder"
