Case Index,Core Terms
Case 84,"bid, rigging, competitor, conspiracy, Sherman Act, instructions, appellants', district court, unilateral, antitrust, 
convicted, effects, knowingly, safe"
Case 85,"res judicata, cause of action, plaintiffs', courts, state court, antitrust, suits, prior suit, antitrust suit, anti trust law, 
bring suit, membership, merits, cases, federal court, malpractice, complaints, alleges, parties"
Case 86,"films, theaters, monopolization, hardtop, monopoly power, bid, antitrust, drive-in, leverage, distributor, clearances, 
exhibition, market share, argues, top-grossing, licensing, causal, substantial evidence, conspiracy to monopolize, 
district court, anticipated, general verdict, relevant market, conspiracy, pictures, damages, conspiracy claim, 
specific intent, monopolistic, acquisition"
Case 87,"Ordinance, rent, landlords, Sherman Act, prices, anti trust law, rent control, municipal, antitrust, exemption, 
anticompetitive, Stabilization, wine, unilaterally, rental, articulated, pre-emption, conspiracy, pre-empted, retailers, 
concerted action, levels, charter amendment, rent ceiling, residential, price competition, state statute, state policy, 
initiative, measures"
Case 88,"Memorial, Cemetery, amended complaint, motion to dismiss, conspiracy, improper venue, allegations, defendants', 
monopolize, venue, sanctions, Sherman Act, damages, costs, anti trust law, granite, memorandum, conspiracy to 
monopolize, attorney's fees, cause of action, specific intent, monopoly power, grounded, markers, dismissal with 
prejudice, attempt to monopolize, restraint of trade, tying arrangement, sufficient facts, relevant market"
Case 89,"municipalities, articulation, authorizes, state policy, water supply, anticompetitive, exemption, purposes, 
anticompetitive conduct, private company, construct, ordinance, corporate limits, statutory scheme, anti trust law, 
district court, eminent domain, public works, water well, provisions, Antitrust, monopoly, effects, sewage, sewers"
Case 90,"Blues, district court, providers, patients, prices, firms, plans, consumers, rivals, bid, negotiation, antitrust, market 
power, insurer, costs, financing, contracts, preliminary injunction, anti trust law, sales, market share, discount, 
cases, geographic, output, seller, healthcare, injunction, parties, merger"
Case 91,"Pines, damages, Court Act, questions, award damages, coercively, sheet, fact situation, unordered, type of vehicle, 
Practices, packaging, unwanted, desired, coerce, ship, anti trust law, motor vehicle, total amount, jury issue, 
difficult-to-market, antitrust, answered"
Case 92,"defendants', state action, plaintiffs', special master, Recommendation, partial summary judgment, immunity, rates, 
Telephone, commissions, regulated, doctrine of immunity, supervision, unregulated, anticompetitive conduct, 
misrepresentations, alarm, anti trust law, electricity, agencies, hearings, tariffs, state commission, state rate, 
proceedings, cases, antitrust, regulated activity, telephone company, private line"
Case 93,"bids, conspiracy, indictment, bid-rigging, rig, district court, conspirators, bidders, contractors, Sherman Act, facilities, 
lists, electrical, Steel, site, clearly erroneous, plants, competitors, compete, double jeopardy, overarching, 
undisputed, refinery, relevant market, defendants', jeopardy, restraint of trade, same offense, co-conspirators, 
circumstances"
Case 94,"games, television, telecasts, rights, network, Sports, football, package, competitors, college football, monopolize, 
factual dispute, restrictions, output, appearances, markets, season, relevant market, market power, effects, prices, 
pay-per-view, cooperation, condemned, programs, summary judgment, intrabrand, asserts, plans, rule of reason"
Case 95,"settlement, intervener, consumer, attorney general, class member, class action, trial court, notice, claimants, fluid 
recovery, refund, trust fund, percent, residue, distributed, damages, escheat, mailing, courts, funds, parens patriae, 
objectors, parties, purposes, proposed settlement, attorney's fees, fluid, estimated, purchases, cases"
Case 96,"plaintiffs', antitrust, cause of action, resale price, termination, allegations, antitrust violation, duress, injuries, 
damages, limitations, producers, retail, antitrust claim, conspiracy, fraudulent concealment, statute of limitations, 
sales representative, psychologists, defendants', proximity, prices, amend, prima facie tort, tolling statute, 
anticompetitive, pleadings, consumer, cases, defamation"
Case 97,"patent, retaining wall, monopolize, relevant market, sham, predation, monopoly, protest, rivals, district judge, 
highway, probability, proceedings, consisting, projects, Earth"
Case 98,"municipal, emergency, emergency medical services, antitrust, state policy, articulated, regulation, home rule, 
Sherman Act, anticompetitive, exemption, ordinance, displace, immunity, ambulance service, authorization, powers, 
state action, providers, fire department, transportation, sovereign"
Case 99,"competitors, Clayton Act, antitrust, broker, food, damages, anti trust law, anticompetitive, retail, treble damages, 
Robinson-Patman Act, discounts, prices, antitrust violation, apple juice, intermediary, commerce, consumer, price 
discrimination, district court, manufacturer, chain of distribution, Contractors, terminated, purchaser, injuries, 
factors, lessen, sales, suits"
Case 100,"prices, conspiracy, predatory, petitioners', losses, conspirators, summary judgment, profits, respondents', antitrust, 
motive, factfinder, monopoly, alleged conspiracy, district court, competitors, direct evidence, genuine issue, 
Sherman Act, anti trust law, company rule, predator, market price, below-cost, television, products, schemes, 
cases, drive, summary judgment motion"
