頁碼,內容類型,內容
13,Counsel,"Counsel: Assistant Attorney General Loevinger argued 
the cause for the United States.  With him on the briefs 
were Solicitor General Cox, Charles H. Weston, George 
D. Reycraft, Lionel Kestenbaum and Melvin Spaeth.
Philip Price and Arthur Littleton argued the cause for 
appellees.  With them on the brief were Ernest R. von 
Starck, Donald A. Scott, Carroll R. Wetzel, John J. 
Brennan and Minturn T. Wright III."
13,Judges,"Judges: Warren, Black, Clark, Harlan, Brennan, 
Stewart, Goldberg; White took no part in the 
consideration or decision of this case."
13,Opinion by,Opinion by: BRENNAN
