頁碼 ,內容類型   ,內容
  25 ,Counsel    ,"Counsel: Maxwell M. Blecher, James Robert Noblin, Matthew E. Hess, Blecher & Collins, Los Angeles, California;
                  and James A. Hennefer, Hennefer & Wood, San Francisco, California, attorneys for the plaintiffs-appellants.
                  Brad D. Brian and Joseph D. Lee, Munger, Tolles & Olson LLP, Los Angeles, California; attorneys for defendant-
                  appellee General Electric Corporation.
                  Alfred C. Pfeiffer, Jr., Holly A. House, Tyler B. Theis, Brian C. Rocca, Rachel Sommovilla, Bingham McCutchen
                  LLP, San Francisco, California, Attorneys for defendant-appellee, IKON Office Solutions, Inc.
                  513 F.3d 1038, *1038; 2008 U.S. App. LEXIS 1257, **1; 86 U.S.P.Q.2D (BNA) 1150, ***1150"
  25 ,Judges     ,"Judges: Before: Andrew J. Kleinfeld and Sidney R. Thomas, Circuit Judges, and Timothy M. Burgess, * District
                  Judge."
  26 ,Opinion by ,Opinion by: Sidney R. Thomas
  38 ,Counsel    ,"Counsel:  [*1] For ROBERT L. PUGH, Individually on his own behalf and as Executor of the Estates of Bonnie
                  Barnes Pugh and Malcolm R. Pugh, ANNE CAREY, Individually on her own behalf and as Executrix of the Estate of
                  Harvey Mills Coverley, DEBORAH VAUGHN SCHOOLING, Individually on her own behalf and as Executrix of the
                  Estate of James E. Turlington, Sr., JANA ELIZABETH TURLINGTON, JIMMY BRUCE TURLINGTON,
                  CHRISTOPHER DARWYN TURLINGTON, DAVID ONLEY TURLINGTON, JAMES ELDEE TURLINGTON, JR.,
                  EDDIE DON TURLINGTON, JOYCE WRIGHT, Individually on her own behalf and as Executrix of the Estate of
                  Elvee Turlington, RUSSELL TURLINGTON, MARY KATHRYN HASSETT, Individually on her own behalf and as
                  Executrix of the Estate of Margaret Elizabeth Schutzius, WILLIAM CARL SCHUTZIUS, CATHERINE ALEXANDRIA
                  SCHUTZIUS, CHRISTOPHER MATTHEW SCHUTZIUS, JOHN BENEDICT SCHUTZIUS, ERMINE HAILEY,
                  Individually on her own behalf and as Executrix of the Estate of Patrick Wayne Huff, JAN PATILLO, Individually on
                  her own behalf and as Executrix of the Estate of James E. Huff and Janice Huff, MICHAEL HUFF, AMANDA HILL,
                  JARED HILL, JANET WARNER, Individually on her own behalf and as Executrix of the Estate of Donald J. Warner
                  and Alvin Warner,  [*2] SUSAN WARNER, SHERRY WARNER, IOANA ALIMANESTIANU, Individually on her own
                  behalf and as Executrix of the Estate of Mihai Alimanestianu, IRINA ALIMANESTIANU, JOANNA
                  ALIMANESTIANU, NICHOLAS ALIMANESTIANU, ALEXANDER ALIMANESTIANU, SERBAN ALIMANESTIANU,
                  CALIN ALIMANESTIANU, PAULINE ALIMANESTIANO, As Executrix of the Estate of Constantin Alimanestiano,
                  CARLA J. MALKIEWICZ, Individually on her own behalf and as Executrix of the Estate of Mark E. Corder,
                  THERESE CODDINGTON, Individually on her own behalf and as Executrix of the Estate of Edward A. Corder,
                  MICHAEL J. CORDER, INTERLEASE, INC., SALLY CHISHOLM JOHNSON, Individually on her own behalf and as
                  Executrix of the Estate of Georgia Mae Chisholm, ALL PLAINTIFFS, Plaintiffs: Michael Lee Martinez, Stuart H.
                  Newberger, Shari Ross Lahlou, LEAD ATTORNEYS, CROWELL & MORING, L.L.P., Washington, DC.
                  For SOCIALIST PEOPLE'S LIBYAN ARAB JAMAHIRIYA, LIBYAN EXTERNAL SECURITY ORGANIZATION, also
                  known as JAMAHIRIYA SECURITY ORGANIZATION, MUAMMAR QADHAFI, ABDALLAH SENOUSSI, AHMED
                  ABDALLAH ELAZRAGH, IBRAHIM NAELI, ARBAS MUSBAH, ISSA ABDELSALAM SHIBANI, ABDELSALAM
                  
                  
                  HAMMOUDA EL AGELI, Defendants: Arman Dabiri, LEAD ATTORNEY, LAW OFFICES OF ARMAN DABIRI &
                  [*3] ASSOCIATES, P.L.L.C., Washington, DC.
                  For UNITED STATES OF AMERICA, Interested Party: Daniel Riess, LEAD ATTORNEY, U.S. DEPARTMENT OF
                  JUSTICE, Washington, DC.
                  For LA REUNION AERIENNE, Movant: Christopher Burgess Kende, LEAD ATTORNEY, New York, NY; Peter John
                  McHugh, LEAD ATTORNEY,John F. Keating, Jr., KEATING & MCHUGH, New York, NY."
  39 ,Judges     ,"Judges: Henry H. Kennedy, Jr. United States District Judge."
  39 ,Opinion by ,Opinion by: Henry H. Kennedy
  84 ,Counsel    ,"Counsel:  [*1] For DDS, MHA James F Ripley, Plaintiff: Stephen H Kline, LEAD ATTORNEY, KLINE LAW OFFICE,
                  Cheyenne, WY.
                  For Wyoming Medical Center Inc, a Wyoming Corporation, Defendant: Scott E Ortiz, LEAD ATTORNEY, Stuart R
                  Day, WILLIAMS PORTER DAY & NEVILLE, Casper, WY.
                  For MD James Anderson, individually, MD John D Bailey, individually, Steve Chadderdon, individually, MD Thomas
                  Cunningham, individually, MD Mark Dowell, individually, Ken Eickoff, individually, Pam Fulks, individually, Bill
                  McDowell, individually, MD Mark McGinley, individually, Susie McMurry, individually, MD Steven Orcutt, individually,
                  Diane Payne, individually, Mike Reid, individually, MD Craig Smith, individually, MD Louis Steplock, individually, MD
                  Werner Studer, individually, MD Jay A Swedberg, individually, Defendants: Scott E Ortiz, LEAD ATTORNEY,
                  WILLIAMS PORTER DAY & NEVILLE, Casper, WY."
  84 ,Judges     ,"Judges: ALAN B. JOHNSON, UNITED STATES DISTRICT JUDGE."
  84 ,Opinion by ,Opinion by: ALAN B. JOHNSON
