頁碼 ,內容類型   ,內容
 726 ,Counsel    ,"Counsel:  [**1] For Plaintiffs John Boyd, Veryl Switzer, Gillan Alexander, Rod Bradshaw, Wilburt Howard, and Pat
                  Dailey: Benjamin D. Brown, Michael D. Hausfeld, Hilary K. Ratway, Seth R. Gassman, and Michael P. Lehmann,
                  Cohen, Milstein, Hausfeld & Toll, PLLC, Washington, DC, New York, NY, and San Francisco, CA; L. Palmer Foret,
                  Esq., Washington, DC; Roderick E. Edmond and Craig T. Jones, Edmond & Jones, Atlanta, GA; Bruce L. Simon
                  and Esther Klisura, Pearson, Simon, Warshaw, Penny, LLP, San Francisco, CA; Roberta D. Liebenberg and
                  Donald L. Perelman, Fine, Kaplan & Black, RPC, Philadelphia, PA.
                  For Plaintiff Melvin Erb: Gerald J. Rodos, Mark R. Rosen, Jeffrey B. Gittleman, Chad A. Carder, A. Arnold Gershon,
                  and Gloria Kui, Barrack, Rodos & Bacine, Philadelphia, PA, and New York, NY; Anthony J. Bolognese and Joshua
                  H. Grabar, Bolognese & Associates, LLC, Philadelphia, PA.
                  For Plaintiff Dennis Brothers: Steven A. Asher and Mindee J. Rueben, Weinstein, Kitchenoff & Asher LLC,
                  Philadelphia, PA, and W. Joseph Bruckner, Richard A. Lockridge, and Lisa M. Pollard, Lockridge, Grindal, Nauen
                  PLLP, Minneapolis, MN; Joseph C. Kohn, Kohn, Swift & Graf, PC, Philadelphia, PA and Indik & McNamara, PC,
                  Philadelphia,  [**2] PA.
                  For Defendants AWB Limited and AWB (U.S.A.) Limited: Robert H. Baron and Timothy G. Cameron, Cravath,
                  Swaine & Moore LLP, New York, NY."
 727 ,Judges     ,"Judges: GERARD E. LYNCH, United States District Judge."
 727 ,Opinion by ,Opinion by: GERARD E. LYNCH
 744 ,Counsel    ,"Counsel:  [**1] For White Mule Company, An Ohio corporation, Plaintiff: Robert G. Cohen, Robert G. Schuler,
                  LEAD ATTORNEY, Teddy M. McKinniss, Kegler, Brown, Hill & Ritter - Columbus, Columbus, OH.
                  For Steve Ritchey, Deborah Ritchey, Plaintiffs: Robert G. Cohen, Robert G. Schuler, Teddy M. McKinniss, LEAD
                  ATTORNEYS, Kegler, Brown, Hill & Ritter - Columbus, Columbus, OH.
                  For ATC Leasing Company LLC, Automotive Carrier Services Co., LLC, Defendants: Kenneth J. Rubin, Robert N.
                  Webner, Vorys, Sater, Seymour & Pease - Columbus, Columbus, OH; William H. Oldach, III, LEAD ATTORNEY,
                  Vorys, Sater, Seymour & Pease - Washington, Washington, DC.
                  For JHT Holdings, Inc., Active Truck Transport, LLC, Unimark, LLC, Defendants: Kenneth J. Rubin, Robert N.
                  Webner, LEAD ATTORNEY, Vorys, Sater, Seymour & Pease - Columbus, Columbus, OH.
                  For Automotive Carrier Services Co., LLC, ATC Leasing Company LLC, Counter-Claimants: Kenneth J. Rubin,
                  Robert N. Webner, Vorys, Sater, Seymour & Pease - Columbus, Columbus, OH; William H. Oldach, III, LEAD
                  ATTORNEY, Vorys, Sater, Seymour & Pease - Washington, Washington, DC.
                  For White Mule Company, An Ohio corporation, Counter-Defendant: Robert G. Cohen, Robert G. Schuler, LEAD
                  ATTORNEY,  [**2] Teddy M. McKinniss, Kegler, Brown, Hill & Ritter - Columbus, Columbus, OH."
 745 ,Judges     ,"Judges: James G. Carr, Chief Judge."
 745 ,Opinion by ,Opinion by: James G. Carr
 772 ,Counsel    ,"Counsel:  [*1] For STEPHEN M. ORLOFSKY, Special Master: STEPHEN M. ORLOFSKY, LEAD ATTORNEY,
                  BLANK, ROME, LLP, PRINCETON, NJ.
                  For HIP HEALTH PLAN OF FLORIDA, INC., on behalf of itself and all others similarly situated, Plaintiff: DANIEL
                  BERGER, LEAD ATTORNEY, BERGER & MONTAGUE, PC, PHILADEPHIA, PA; LISA J. RODRIGUEZ, LEAD
                  ATTORNEY, TRUJILLO, RODRIGUEZ & RICHARDS, LLP, HADDONFIELD, NJ.
                  For Indirect Purchaser Plaintiffs, Plaintiff: SHELLY L. FRIEDLAND, COHEN, MILSTEIN, HUSFLD & TOLL,
                  P.L.L.C., NEW YORK, NY; THEODORE M. LIEVERMAN, SPECTOR, ROSEMAN & KODROFF, PC,
                  PHILADELPHIA, PA; ALLYN ZISSEL LITE, LITE, DEPALMA, GREENBERG & RIVAS, LLC, NEWARK, NJ.
                  For Direct Purchaser Plaintiffs, Plaintiff: BARRY L. REFSIN, LEAD ATTORNEY, HANGLEY, ARONCHICK, SEGAL
                  & PUDLIN, PHILADELPHIA, PA.
                  For AMY REICHERT, on behalf of herself and all others similarly situated, GREAT LAKES HEALTH PLAN, INC., on
                  behalf of itself and all others similarly situated, JOSEPH J. MORGAN, on behalf of himself and all others similarly
                  situated, CARL M. WALLACE, NORMA SEABROOK, ISRAEL REXACH, ELIAS HUSAMUDEEN, WILLIAM
                  WASNICKI, GUY ANDERSON, ROBERT SEABROOK, STEVEN ROBINSON, On behalf of Correction officers
                  benevolent association security benefits  [*2] fund, on behalf of themselves and all other similarly situated, Consol
                  Plaintiffs: LISA J. RODRIGUEZ, LEAD ATTORNEY, TRUJILLO, RODRIGUEZ & RICHARDS, LLP,
                  HADDONFIELD, NJ.
                  For JACQUELINE CUNDIFF, Consol Plaintiff: DAVID K. LIETZ, LEAD ATTORNEY, COUNSEL NOT ADMITTED
                  TO USDC-NJ BAR, COALE, COOLEY, LIETZ & MCINERNY, ESQS., WASHINGTON, DC; FREDERICK P.
                  FURTH, LEAD ATTORNEY, COUNSEL NOT ADMITTED TO USDC-NJ BAR, THE FURTH FIRM LLP, SAN
                  FRANCISCO, CA.
                  2008 U.S. Dist. LEXIS 71771, *71771
                  
                  
                  For ESTELLE TRAVERS, on Behalf of Herself and all Others Similarly Situated, Consol Plaintiff: GUIDO SAVERI,
                  RICHARD ALEXANDER SAVERI, LEAD ATTORNEYS, COUNSEL NOT ADMITTED TO USDC-NJ BAR, SAVERI
                  & SAVERI, INC., SAN FRANCISCO, CA.
                  For MECHANICAL CONTRACTORS-UA LOCAL 119 WELFARE PLAN, by and through its Trustees, Danny Price,
                  William Morrison, Phillip Holloway, J. Bradley Donaghey, Glen Reed Jr. and Stanley Small, IBEW-NECA LOCAL
                  505 HEALTH & WELFARE PLAN, by and through its Trustees, Donnie Adams, Terry N. Adams, Fred J. Moore,
                  Charles S. Belk, Charles Freeman and Larry Smith, A.F. OF L.-A.G.C. BUILDING TRADES WELFARE PLAN, by
                  and through its Trustees, Larry Fincher, Gordon Parmer, Charles Loftin, Gene Stokely, Jack Terry and Andy Joiner,
                  Consol  [*3] Plaintiffs: JOSEPH J. DEPALMA, LEAD ATTORNEY, LITE, DEPALMA, GREENBERG & RIVAS, LLC,
                  NEWARK, NJ.
                  For ESTATE OF STANLEY NEMSER, Consol Plaintiff: ALLYN ZISSEL LITE, LEAD ATTORNEY, LITE, DEPALMA,
                  GREENBERG & RIVAS, LLC, NEWARK, NJ; ANN D. WHITE, LEAD ATTORNEY, COUNSEL NOT ADMITTED TO
                  USDC-NJ BAR, ANN D. WHITE LAW OFFICES, P.C., JENKINTOWN, PA.
                  For CONSUMERS FOR AFFORDABLE HEALTHCARE COALITION, Consol Plaintiff: STEVEN J. PFEFFERLE,
                  LEAD ATTORNEY, COUNSEL NOT ADMITTED TO USDC-NJ BAR, TERHAAR ARCHIBALD PFEFFERLE &
                  GRIEBEL, MINNEAPOLIS, MN.
                  For WALGREEN CO., Consol Plaintiff: DEBORAH S. CORBISHLEY, LEAD ATTORNEY, KENNY, NACHWALTER,
                  SEYMOUR, ARNOLD, CRITCHLOW & SPECTOR, PA, MIAMI, FL; STACEY K. SUTTON, LEAD ATTORNEY,
                  KENNY NACHWALTER, PA, MIAMI, FL.
                  For ECKARD CORPORATION, THE KROGER CO., ALBERTSON'S INC., SAFEWAY, INC., HY-VEE, INC., Consol
                  Plaintiffs: STACEY K. SUTTON, LEAD ATTORNEY, KENNY NACHWALTER, PA, MIAMI, FL.
                  For NATALIE SUTIN, on behalf of herself and all others similarly situated, Consol Plaintiff: LIONEL Z GLANCY,
                  LEAD ATTORNEY, COUNSEL NOT ADMITTED TO USDC-NJ BAR, Los Angeles, CA.
                  For ROSE LIPSCOMB, NEW YORK STATE-WIDE SENIOR ACTION COUNCIL, INC., MASSACHUSETTS
                  SENIOR ACTION COUNCIL,  [*4] on behalf of themselves and all others similarly situated, Consol Plaintiffs:
                  ALLYN ZISSEL LITE, LEAD ATTORNEY, LITE, DEPALMA, GREENBERG & RIVAS, LLC, NEWARK, NJ.
                  For GEORGE BURNS, Individually and on behalf of all others similarly situated, Consol Plaintiff: ANDREW
                  ROBERT JACOBS, LEAD ATTORNEY, RAMSEY BERMAN, PC, MORRISTOWN, NJ.
                  For MILDRED GROSSMAN, on her own behalf and on behalf of all others similarly situated, Consol Plaintiff: C.
                  OLIVER BURT, III, LEAD ATTORNEY, COUNSEL NOT ADMITTED TO USDC-NJ BAR, BURT & PUCILLO, PC,
                  WEST PALM BEACH, FL.
                  For LOUISIANA WHOLESALE DRUG CO. INC, on behalf of itself and all others similarly situated, Consol Plaintiff:
                  PETER S. PEARLMAN, LEAD ATTORNEY, COHN, LIFLAND, PEARLMAN, HERRMANN & KNOPF, LLP,
                  SADDLE BROOK, NJ; REBEKAH R. CONROY, WALDER HAYDEN & BROGAN, ROSELAND, NJ.
                  For UNITED FOOD AND COMMERCIAL WORKERS LOCAL 56 HEALTH & WELFARE DEPARTMENT, on behalf
                  of itself and all others similarly situated, PATRICK J. LYNCH, Consol Plaintiffs: LISA J. RODRIGUEZ, LEAD
                  ATTORNEY, TRUJILLO, RODRIGUEZ & RICHARDS, LLP, HADDONFIELD, NJ; THEODORE M. LIEVERMAN,
                  SPECTOR, ROSEMAN & KODROFF, PC, PHILADELPHIA, PA.
                  For FRANCES IRENE STEADMAN, Consol Plaintiff: FREDERICK  [*5] T. KUYKENDALL, III, LEAD ATTORNEY,
                  COUNSEL NOT ADMITTED TO USDC-NJ BAR, GARDNER, MIDDLEBROOKS, FLEMING, GIBBONS &
                  KITTRELL, PC, BIRMINGHAM, AL; JAMES H MCFERRIN, LEAD ATTORNEY, COUNSEL NOT ADMITTED TO
                  USDC-NJ BAR, SOUTHEASTERN LEGAL GROUP, BIRMINGHAM, AL; S C MIDDLEBROOKS, III, LEAD
                  ATTORNEY, COUNSEL NOT ADMITTED TO USDC-NJ BAR, GARDNER, MIDDLEBROOKS, FLEMING &
                  GIBBONS, PC, MOBILE, AL.
                  For DAWN MAFFEI, Consol Plaintiff: MICHAEL G. NAST, LEAD ATTORNEY, COUNSEL NOT ADMITTED TO
                  USDC-NJ BAR, RODA & NAST, PC, LANCASTER, PA.
                  2008 U.S. Dist. LEXIS 71771, *2
                  
                  
                  For LEONARD BROWN, Consol Plaintiff: JENNIFER SHARON ABRAMS, JOSEPH J. TABACCO, JR., LEAD
                  ATTORNEYS, COUNSEL NOT ADMITTED TO USDC-NJ BAR, BERMAN, DEVALERIO, PEASE & TABACCO,
                  PC, SAN FRANCISCO, CA.
                  For ARKANSAS CARPENTERS HEALTH & WELFARE FUND, On its own behalf & on behalf of all others similarly
                  situated, Consol Plaintiff: GREG THOMPSON, LEAD ATTORNEY, COUNSEL NOT ADMITTED TO USDC-NJ
                  BAR, PROVOST & UMPHREY, BEAUMONT, TX.
                  For MARY MARGARET PIETSCH, individually and on behalf of a class of persons similarly situated, Consol
                  Plaintiff: BRITT L. TINGLUM, LYNN L. SARKO, LEAD ATTORNEYS, COUNSEL NOT ADMITTED TO USDC-NJ
                  BAR, KELLER & ROHRBACK, LLP, SEATTLE, WA; RON KILGARD, LEAD  [*6] ATTORNEY, COUNSEL NOT
                  ADMITTED TO USDC-NJ BAR, DALTON, GOTTO, SAMSON & KILGARD, PLC, PHOENIX, AZ.
                  For DONALD W. HANNU, on behalf of himself and all others similarly situated, Consol Plaintiff: NEIL A. MCEWEN,
                  LEAD ATTORNEY, COUNSEL NOT ADMITTED TO USDC-NJ BAR, INVER GROVE HEIGHTS, MN.
                  For BETTY SAAD, Consol Plaintiff: DIANE A. NYGAARD, LEAD ATTORNEY, COUNSEL NOT ADMITTED TO
                  USDC-NJ BAR, LEAWOOD, KS.
                  For EVELYN BARCZAK, ANTHONY DEBELLA, on behalf of himiself and others similiarly situated, Consol
                  Plaintiffs: MICHAEL J. FLANNERY, LEAD ATTORNEY, COUNSEL NOT ADMITTED TO USDC-NJ BAR, CAREY &
                  DANIS, ST. LOUIS, MO.
                  For AGATHA AGATHA ""NIKKI&quo MCCUTCHON, Consol Plaintiff: THOMAS M. SOBOL, LEAD ATTORNEY,
                  COUNSEL NOT ADMITTED TO USDC-NJ BAR, HAGENS BERMAN SOBOL SHAPIRO LLP, CAMBRIDGE, MA.
                  For RITE AID CORPORATION, Consol Plaintiff: BARRY L. REFSIN, LEAD ATTORNEY, HANGLEY, ARONCHICK,
                  SEGAL & PUDLIN, PHILADELPHIA, PA; JERRY L. TANENBAUM, LEAD ATTORNEY, SCHNADER HARRISON
                  SEGAL & LEWIS LLP, CHERRY HILL, NJ; STEVE D. SHADOWEN, COUNSEL NOT ADMITTED TO USDC-NJ
                  BAR, HANGLEY ARONCHICK SEGAL & PUDLIN, HARRISBURG, PA.
                  For COBALT CORP., Consol Plaintiff: CHARLES J. BARNHILL, JR., WILLIAM P. DIXON, LEAD ATTORNEYS,
                  [*7] COUNSEL NOT ADMITTED TO USDC-NJ BAR, MINER, BARNHILL & GALLAND, ESQS., MADISON, WI;
                  MARY C. NASH, LEAD ATTORNEY, COUNSEL NOT ADMITTED TO USDC-NJ BAR, COBALT CORPORATION,
                  MILWAUKEE, WI; RICHARD W. COHEN, LEAD ATTORNEY, COUNSEL NOT ADMITTED TO USDC-NJ BAR,
                  LOWEY, DANNENBERG, BEMPORAD & SELINGER, ESQS., WHITE PLAINS, NJ.
                  For CVS MERIDIAN, INC., Consol Plaintiff: BARRY L. REFSIN, LEAD ATTORNEY, HANGLEY, ARONCHICK,
                  SEGAL & PUDLIN, PHILADELPHIA, PA; STEVE D. SHADOWEN, LEAD ATTORNEY, COUNSEL NOT ADMITTED
                  TO USDC-NJ BAR, HANGLEY ARONCHICK SEGAL & PUDLIN, HARRISBURG, PA.
                  For ROBERT MITCHELL, Consol Plaintiff: DAVID J. SHEA, LEAD ATTORNEY, COUNSEL NOT ADMITTED TO
                  USDC-NJ BAR, MANTESE, MILLER & SHEA, PLLC, TROY, MI; KENNETH J. MCINTYRE, LEAD ATTORNEY,
                  COUNSEL NOT ADMITTED TO USDC-NJ BAR, DICKINSON WRIGHT, ESQS., DETROIT, MI; ROBERT L.
                  MICHELS, LEAD ATTORNEY, COUNSEL NOT ADMITTED TO USDC-NJ BAR, WINSTON & STRAWN LLP,
                  CHICAGO, IL."
 774 ,Judges     ,"Judges: STEPHEN M. ORLOFSKY, SPECIAL MASTER."
 774 ,Opinion by ,Opinion by: STEPHEN M. ORLOFSKY
 795 ,Counsel    ,"Counsel: William J. Kayatta, Jr. with whom Clifford H. Ruprecht, Pierce Atwood LLP, James C. Egan, Jr., Kirsten
                  A. Lockhart, Carrie M. Anderson, and Weil Gotshal & Manges were on brief for appellants Chrysler LLC, Chrysler
                  Motors LLC, Chrysler Canada Inc., and Mercedes-Benz USA LLC.
                  Richard C. Godfrey, P.C., David J. Zott, P.C., Daniel E. Laytin, and Kirkland & Ellis LLP were on brief for appellants
                  General Motors Corp. and General Motors of Canada, Ltd.
                  Margaret M. Zwisler, William R. Sherman, and Latham & Watkins LLP were on brief for appellants Ford Motor
                  Company and Ford Motor Company of Canada, Ltd.
                  John H. Rich III, Perkins Thompson, P.A., Robert A. Van Nest, Ragesh K. Tangri, Rachael E. Meny, Daniel Purcell,
                  and Keker & Van Nest, LLP were on brief for appellants American Honda and Honda Canada Inc.
                  Peter Sullivan, Joshua Lipton, Gibson Dunn & Crutcher LLP, Harold J. Friedman, Laurence H. Leavitt, and
                  Friedman Gaythwaite Wolf & Leavitt LLP were on brief for appellant Nissan North America, Inc.
                  522 F.3d 6, *6; 2008 U.S. App. LEXIS 6483, **1
                  
                  
                  Joseph J. Tabacco, Jr. with whom Glen DeValerio, Peter A. Pease, Todd A. Seaver, Matthew  [**2] D. Pearson,
                  Berman DeValerio Pease Tabacco Burt & Pucillo, Michael M. Buchman, J. Douglas Richards, Pomerantz Haudek
                  Block Grossman & Gross, LLP, Robert S. Frank, and Harvey & Frank were on brief for appellees."
 796 ,Judges     ,"Judges: Before Torruella, Circuit Judge, Selya, Senior Circuit Judge, and Lynch, Circuit Judge. TORRUELLA,
                  Circuit Judge, (Concurring in part, Dissenting in part)."
 796 ,Opinion by ,Opinion by: LYNCH
 817 ,Counsel    ,"Counsel:  [*1] For Heidelberg Web Systems, Inc., Plaintiff: Daniel E. Will, LEAD ATTORNEY, Devine Millimet &
                  Branch PA (Manchester), Manchester, NH; Hugh T. Lee, LEAD ATTORNEY, Lee Law Office, Derry, NH; Richard S.
                  Gresalfi, LEAD ATTORNEY, Kenyon & Kenyon, New York, NY.
                  For Goss International Americas, Inc., Plaintiff: Daniel E. Will, LEAD ATTORNEY, Devine Millimet & Branch PA
                  (Manchester), Manchester, NH; Georg C. Reitboeck, LEAD ATTORNEY, Kenyon & Kenyon, New York, NY; Hugh
                  T. Lee, LEAD ATTORNEY, Lee Law Office, Derry, NH; Mark A. Hannemann, Michael J. Lennon, Richard S.
                  Gresalfi, LEAD ATTORNEYS, Kenyon & Kenyon, New York, NY; T. Cy Walker, LEAD ATTORNEY, Kenyon &
                  Kenyon, Washington, DC; Jonathan M. Shirley, Devine Millimet & Branch PA (Manchester), Manchester, NH.
                  For Man Roland, Inc., Man Roland Druckmaschinen AG, Defendants: Alfred H. Hemingway, Jr., Martin B. Pavane,
                  Sidney R. Bresnick, Teodor J. Holmberg, Richard D. Margiano, LEAD ATTORNEYS, Cohen Pontani Lieberman &
                  Pavane, New York, NY; Irvin D. Gordon, LEAD ATTORNEY, Sulloway & Hollis, Concord, NH; Michael J. Songer,
                  Shari Ross Lahlou, LEAD ATTORNEYS, Crowell & Moring, Washington, DC.
                  For Goss International Americas, Inc., Counter Defendant:  [*2] Mark A. Hannemann, LEAD ATTORNEY, Kenyon &
                  Kenyon, New York, NY; Daniel E. Will, Devine Millimet & Branch PA (Manchester), Manchester, NH.
                  For Quad/Graphics, Inc., Intervenor: Russell Beck, LEAD ATTORNEY, Foley & Lardner LLP (Boston), Boston, MA.
                  For Man Roland Druckmaschinen AG, Counter Claimant: Michael J. Songer, Shari Ross Lahlou, LEAD
                  ATTORNEYS, Crowell & Moring, Washington, DC; Alfred H. Hemingway, Jr., Martin B. Pavane, Sidney R.
                  Bresnick, Teodor J. Holmberg, Richard D. Margiano, LEAD ATTORNEYS, Cohen Pontani Lieberman & Pavane,
                  New York, NY; Irvin D. Gordon, LEAD ATTORNEY, Sulloway & Hollis, Concord, NH.
                  For Man Roland, Inc., Counter Defendant: Michael J. Songer, Shari Ross Lahlou, LEAD ATTORNEYS, Crowell &
                  Moring, Washington, DC; Alfred H. Hemingway, Jr., Martin B. Pavane, Sidney R. Bresnick, Teodor J. Holmberg,
                  Richard D. Margiano, LEAD ATTORNEYS, Cohen Pontani Lieberman & Pavane, New York, NY; Irvin D. Gordon,
                  LEAD ATTORNEY, Sulloway & Hollis, Concord, NH.
                  For Heidelberg Web Systems, Inc., Counter Defendant: John F. Sweeney, Tony V. Pezzano, LEAD ATTORNEYS,
                  Morgan & Finnegan LLP, New York, NY.
                  For Heidelberger Druckmaschinen AG, Counter Defendant: Bruce W. Felmly, LEAD ATTORNEY,  [*3] McLane
                  Graf Raulerson & Middleton, Manchester, NH; John F. Sweeney, LEAD ATTORNEY, Morgan & Finnegan LLP,
                  New York, NY; Seth J. Atlas, Steven F. Meyer, LEAD ATTORNEYS, Morgan & Finnegan LLP, New York, NY."
 817 ,Judges     ,"Judges: Steven J. McAuliffe, Chief Judge."
 817 ,Opinion by ,Opinion by: Steven J. McAuliffe
