Case Index,Core Terms
Case 71,"conspiracy, defendants', late fee, allegations, pricing, plaintiffs', over-limit, punitive damages, credit card, banks, 
damages, Sherman Act, increases, Counts, motion to dismiss, cardholders, antitrust, levels, unjust enrichment, 
concentrated, issuers, fails, card, cause of action, good faith, state law, contractual, Consumers, awards, limits"
Case 72,"district court, tolling, fraudulent concealment, antitrust, voluntary dismissal, inquiry notice, injuries, statute of 
limitations, diligence, antitrust claim, final judgment, investigate, plaintiffs', clock, limitations period, consent decree, 
four year, manufacturers, equitable, trade secret, violations, concealed, licensing, software, accrues, appeals, 
rescind, merits, notice"
Case 73,"prices, class certification, class action, products, Plaintiffs', conspiracy, Defendants', labelstock, self-adhesive, class 
member, predominate, antitrust, labels, damages, Appointment, film-based, manufacturing, prerequisite, questions, 
alleged conspiracy, conspired, purchasers, subsidiary, customers, economic analysis, class-wide, regression, 
common question, calculate, producers"
Case 74,"tied product, foreclosure, Plaintiffs', cases, summary judgment, non-moving, zero, class member, commerce, 
motions, foreclosed, seller, volume, buyer, summary judgment motion, tying product, insubstantial, tied-product, 
depositions, antitrust, brokers, buy"
Case 75,"borrowers, reinsurer, mortgage, loans, equitable tolling, class certification, lenders, mortgage insurer, insurers, 
alleges, equitable estoppel, mortgage insurance, premiums, notice, settlement, putative class member, class 
member, concealment, third-party, disclosure, filed-rate, toll, reinsurance agreement, limitations, kickback, captive"
Case 76,"lawsuit, bid, antitrust, motion to dismiss, trial court, financing, real estate, public improvement, damages, leasing, 
bidder, municipal corporation, appraisal, asserting, preparing, garage"
Case 77,"counter-defendants, antitrust, licenses, counterclaims, alleges, music, retail, conspiracy, marks, quotation, digital, 
users, prices, filtering, competitors, hash-based, supplemental jurisdiction, record company, Sherman Act, 
monopolize, technology, mandatory, anti trust law, hashes, price-fixing, internet, state law claim, joint venture, 
distributors, conspired"
Case 78,"Bookstore, financial aid, allegations, tortious interference, antitrust, business relationship, civil conspiracy, statutory 
claim, injunction, ORDERS"
Case 79,"mattresses, discovery, antitrust, distributors, relevant market, defendants', prices, foam, motion to dismiss, rule of 
reason, anticompetitive, plaintiffs', resale"
Case 80,"ambulance, providers, conspiracy, antitrust, summary judgment motion, ambulance service, Undisputed, anti-
competitive, anti trust law, first priority, moratorium, immunity, summary judgment, fire chief, Sherman Act, restraint 
of trade, local government, secret meeting, monopoly"
Case 81,"counterclaim, arbitrable, illegality, terminalling, terminal, breach of contract, special defense, trial court, antitrust, 
summary judgment, matter of law, summary judgment motion, formation, violating, monopolize, parties, anti trust 
law, acquisition"
Case 82,"damages, certificates, summary judgment motion, summary judgment, Trusts, Servicer, certificate holder, 
Defendants', breach of fiduciary duty, loans, gross negligence, disgorgement, declaration, no evidence, calculating, 
cause of action, Mortgage, quantify, parties, motion to strike, fiduciary duty, plaintifff's, allegations, deposition, 
causation, Disclosures, certificate-holders, non-movant, gains, breach of contract claim"
Case 83,"non-compete, restoration, preliminary injunction, district court, dry cleaning, franchise agreement, customers, 
merits, franchisee, injunction, covenant, ambiguous, franchise, factors, evidentiary hearing, drycleaning, 
termination, engaging, issuance, courts, geographic, comity, strong likelihood, geographic area, first-to-file, 
provisions, unfair, confidential information, non-competition, duration"
Case 84,"allegations, cause of action, parties, motion to dismiss, franchise agreement, margin, exclusivity provision, leave to 
amend, purchasers, covenant, products, favored, courts, sales, grant a motion, gross profit, provisions, pricing, 
breach of contract claim, fair dealing, advertising, franchisees, punitive damages, choice of law, good faith, 
Robinson-Patman Act, Lanham Act, settlement, deception, franchise"
Case 85,"antitrust, injunctive relief, plaintiffs', Clayton Act, district court, actual injury, damages, equitable relief, Tire, 
Defendants', summary judgment, injunction, cases, price discrimination, anti trust law, Steel, treble damages, 
profits, claim for damages, pricing, threatened loss, arbitration, actual damage, expert report, Robinson-Patman 
Act, summary judgment motion, grant summary judgment, cognizable, injuries, vintage"
Case 86,"Seller's, short sale, Broker, Regulation, borrowing, anti trust law, securities law, transactions, Underwriters, 
antitrust, Buyers, motion to dismiss, locate, antitrust claim, conspiracy, state law claim, pricing, selling, Desk, hard-
to-borrow, delivery, alleges, supplemental jurisdiction, breach of fiduciary duty, securities market, serious conflict, 
incompatible, Purchaser, Factors, Markets"
Case 87,"sensors, generic, prices, purchasers, oximetry, pulse, damages, but-for, consumables, discounts, contracts, 
products, market-share, class-wide, average price, class member, sole-source, monitors, class certification, 
expiration, patent, technology, overcharged, customers, documents, practices, named plaintiff, class period, 
manufacturers, predictions"
Case 88,"erinMedia, contracts, anti-competitive, antitrust, television, networks, summary judgment, long-term, monopoly, 
argues, genuine issue of material fact, present evidence, cable company, competitor, financing, staggered"
Case 89,"technology, Manufacturers, markets, costs, latency, switching, monopoly power, patent, relevant market, market 
power, monopolized, substitutes, Guidelines, market share, licensed, expertise, argues, royalty rate, consumers, 
burst, clock, summary judgment, comprise, royalty, intellectual property, anticompetitive, assumptions, antitrust, 
estimate, summary judgment motion"
Case 90,"distributor, antitrust, summary judgment, relevant market, Defendants', prong, rule of reason, tracks, 
methodologies, reliable, vertical, summary judgment motion, expert testimony, antitrust claim, Sherman Act, 
anticompetitive, sanctioning, reasons, stock"
Case 91,"prima facie, anti trust law, weighting, technologies, patents, collateral estoppel, deception, Estoppel, collateral 
estoppel effect, defenses, Clayton Act, antitrust claim, fraud claim, equitable estoppel, Monopolization, FTC Act, 
proceedings, antitrust, reasons, patent application, preclusive effect, give rise, contesting, parties, precluding, 
denies"
Case 92,"proceedings, litigation privilege, courts, demurrer, sham exception, allegations, fraudulent, agencies, environmental 
impact report, immune, trial court, adjudicatory, purposes, administrative proceeding, unfair competition, 
government action, anticompetitive, corrected, sham, fraudulent conduct, government entity, timber harvest, amicus 
curiae, misrepresentations, quasi-judicial, competitor, harvesting, baseless, lobbying, second amended complaint"
Case 93,"customers, testing, contracts, laboratories, test kit, products, termination, pricing, counterclaim, diagnostic, 
monopolization, Sherman Act, technology, anticompetitive, competitors, no charge, marketing, reagents, Validation, 
clinical, patents, relevant market, buying, monopoly power, co-marketing, infringement, molecular, predatory, 
consists, selling"
Case 94,"cards, merchants, monopoly power, market share, network, allegations, prices, monopolization, consumers, 
interchange, motion to dismiss, credit card, products, percent, relevant market, Plaintiffs', customers, transactions, 
antitrust, purposes, Single-Brand, recommend, cases, supplier, banks, costs, circumstances, competitors, 
processing, acquire"
Case 95,"aircraft, helicopter, Buyer, summary judgment, regulations, military, manufactured, selling, Certificates, obligations, 
surplus, anti trust law, third party, sell part, antitrust, parties, heavy, implied preemption, immunity, third party 
beneficiary, product liability, monopolization, contends, monopoly, reasons, argues, coerce, contractual, disputed, 
words"
Case 96,"non competition agreement, compound, silicone, manufacture, silicone rubber, customers, sells, summary 
judgment, declaratory, summary judgment motion, declaratory judgment, finished product, producing, products, 
terms, counterclaim, non-moving, engaging, genuine, sponge, tape, material fact, purchasing, concedes, extruded"
Case 97,"antitrust, generic, relevant market, leflunomide, sham, alleges, manufacturers, baseless, motion to dismiss, 
Wholesale, immunity, Sherman Act, Defendants', patent, prices, brand, monopoly power, Pharmaceuticals, 
regulations, labeling"
Case 98,"Costs, attorney's fees, hourly rate, assumpsit, counterclaim, antitrust, expenses, computerized, confidential, meals, 
rates, courts, travel, cases"
Case 99,"catheters, urological, allegations, alteration, products, conspiracy, prices, market power, market share, contracts, 
competitor, purchases, motion to dismiss, relevant market, amend, monopoly power, class period, Sherman Act, 
anticompetitive, discounts, infection, second amended complaint, healthcare, monopolization, manufactured, 
rebates, quotations, barriers, Markets, interim"
Case 100,"arbitration, Trademark, covenant, arbitration award, compete, parties, comedy, license, district court, opening, in-
term, vacate, marks, arbitration agreement, injunctions, non-parties, courts, equitable claim, irrational, disputes, 
enjoined, partial, bind, equitable remedy, void, arbitration clause, confirming, non-Improv, antitrust, contracts"
