Case Index,Core Terms
Case 1,"Carbone, tolling, products, class action, electrical, motion to dismiss, antitrust, purchases, statute of limitations, 
Plaintiffs', commerce, conspiracy, prices, principal place of business, fraudulent concealment, limitations, domestic, 
Global, personal jurisdiction, allegations, contacts, Sherman Act, concealment, damages, cartel, federal claim, 
subject matter jurisdiction, plaintiff's claim, nationwide, notice"
Case 2,"domestic, Plaintiffs', allegations, amended complaint, prices, anti-competitive, effects, Sherman Act, conspiracy, 
antitrust, fraudulent concealment, chemicals, motion to dismiss, injuries, rubber, individual defendant, 
anticompetitive conduct, Defendants', give rise, price-fixing, damages, subject matter jurisdiction, due diligence, 
commerce, markets, causal, statute of limitations, but-for, abroad, comity"
Case 3,"casinos, tunica, district court, concerted action, competitors, horizontal, conspiracy, domain name, per se rule, 
cases, summary judgment, boycott, conspirators, group boycott, antitrust, lease, restraint of trade, concerted 
refusal, anticompetitive, advertise, per se violation, antitrust claim, website, email"
Case 4,"Purchaser, Bidder, Bidding, Prevailing, Lease, Notice, Cure, executory contract, Selling, Auction, parties, Dura, 
Affiliates, Liens, Landlord, Tenant, bankruptcy court, termination, transactions, obligations, consummate, terms, 
approving, Environmental, assign, warranties, documents, license, rights, Stalking"
Case 5,"plea agreement, movants, grand jury, carve, co-conspirators, grand jury investigation, employees, disclosure, 
injunction, unindicted, cooperate, press release, proceedings, provisions, accusations, Antitrust, ongoing, 
subsidiaries, Intervene"
Case 6,"conspiracy, antitrust, damaged, insurer, motion to dismiss, allegations, prices, repair, immovable property, 
calculating, horizontal, market price, price fixing, databases, anti-competitive, Defendants', price-fixing, adjuster, 
terms, breach of contract claim, insurance contract, repair service, homeowner's, injuries, payout, class action 
allegations, computer software, replacement cost, market value, fair market"
Case 7,"movants, plea agreement, co-conspirators, provisions, carve, Air, Antitrust, accusations, cooperation, wrongdoing, 
employees, seal, transportation, subsidiaries, unindicted"
Case 8,"arbitration, arbitration agreement, multiple damages, statute of limitations, consumer, severing, waivable, class 
action, damages, antitrust statute, parties, limitations period, treble damages, provisions, ambiguity, customers, 
contractually, four-year, one-year, statutory right, discretionary, vindicating, waived, remedies, compel arbitration, 
direct conflict, first instance, antitrust, willful, cable"
Case 9,"purchasers, indirect, antitrust, consumer protection, unfair, superior court, consumers, defendants', damages, bring 
suit, allegations, practices, pricing, injured person, plaintiffs', deceptive, tobacco, anticompetitive, persuasive, 
monopoly, indirectly, pleadings, parties, unfair methods of competition, plain language, actual damage, class action, 
commerce, injuries, purposes"
Case 10,"casket, monopolization, purchasers, anti trust law, indirect, antitrust, class certification, named plaintiff, Plaintiffs', 
motion to dismiss, allegations, lack standing, fraudulent concealment, cause of action, standing issue, standing to 
bring, federal court, state law, funeral, highest court, certification, parties"
Case 11,"medical group, cause of action, termination, trial court, plaintiffs', prospective economic advantage, defendants', 
anesthesiologists, corporate practice, medicine, termination notice, summary judgment, corporate practice doctrine, 
anesthesia, negotiate, summary judgment motion, grant summary judgment, documents, parties, unfair competition, 
Cartwright Act, anesthesiology, first amended complaint, judicial notice, anesthetist, antitrust, ban, discovery, 
injuries, triable issue of fact"
Case 12,"downtime, Inland, plaintiffs', summary judgment motion, inventory, conspiracy, opportunity cost, purchases, tolling, 
prejudgment interest, damages, machine, linerboard, antitrust, Defendants', prices, statute of limitations, 
Memorandum, Container, containerboard, corrugated, conspire, increased price, class member, tons, class period, 
direct-action, tends, act independently, class action"
Case 13,"allegations, motion to dismiss, Realtors, arbitration, Counts, expectancy, Antitrust, Sherman Act, tortious 
interference, conspiracy, parties, defamation, defendants', derogatory statement, ethics, interstate commerce, 
definite statement, interfered, non-profit, bylaws, code of ethics, anticompetitive, boycott, specific allegation, 
contends, reasonable expectation, encouragement, motion to compel arbitration, subject to arbitration, arbitration 
agreement"
Case 14,"insurers, conspiracy, brokers, Antitrust, contingent, incumbent, amended complaint, broker-centered, horizontal, 
commissions, plaintiff's claim, consolidated, allegations, global, alleged conspiracy, customers, premium, Plaintiffs', 
renewal, conspiring, disclosure, disclose, Particularity, competitors, exemption, practices, markets, motion to 
dismiss, anti trust law, Sherman Act"
Case 15,"purchaser, attorney general, indirect, parens patriae, plaintiffs', antitrust statute, Antitrust, defendants', natural 
person, allegations, consumer protection, Cartwright Act, damages, political subdivision, state agency, suits, 
government entity, intrastate, consumers, motion to dismiss, cases, bring suit, state law, residents, provisions, 
commerce, non-California, claim for relief, monetary damages, out-of-state"
Case 16,"technology, patent, chipset, monopolization, monopoly power, monopoly, deceptive, antitrust, markets, district 
court, license, anticompetitive conduct, standard-setting, terms, anticompetitive, competitors, relevant market, anti 
trust law, Sherman Act, acquisition, manufacturers, inclusion, consumers, practices, prices, market share, 
allegations, probability, proprietary, commerce"
Case 17,"discounts, bundled, pricing, products, costs, rival, price discrimination, insurers, secondary, predatory, 
anticompetitive, district court, competitor, monopolization, antitrust, seller, exclusionary, producer, tertiary, coercion, 
variable, cases, primary-line, preferred provider, anti trust law, below-cost, purchasing, package, rebates, consumer"
Case 18,"elevators, allegations, conspiracy, Sherman Act, anticompetitive, competitors, monopolize, antitrust, conspiracy 
claim, district court, unilaterally, prices, maintenance services, defendants', misconduct, markets"
Case 19,"cause of action, customer, alert, credit report, bureaus, affiliates, trade libel, barge, prospective economic 
advantage, damages, entity, Tug, third amended complaint, end user, demurrer, unfair competition, Cartwright Act, 
argues, leave to amend, do business, interfering, conspiracy, sufficient to constitute, trial court, allegations, prices, 
sells, contractual relationship, economic relations, competitor"
Case 20,"cause of action, soliciting, alleges, asserts, statute of limitations, promise, confidential information, motion to 
dismiss, fails, estoppel, parties, reasons, unfair, verbal"
Case 21,"Settlement, class plaintiff, interchange, notice, damages, fee increase, defendants', parties, merchants, 
transactions, card, network, banks, Plaintiffs', class member, credit card, motion to dismiss, anti trust law, debit 
card, notice of pendency, allegations, pleadings, class action, consolidated, bargain, debit, claim for damages, 
summary judgment, cases, anticompetitive"
Case 22,"clean-up, plenary, summary judgment, removal, technologies, conspiracy, working group, Network, e-mail, relevant 
market, no evidence, Requests, revised, specifications, summary judgment motion, antitrust, attend, state law 
claim, inclusion, features, damages, alleged conspiracy, restraint of trade, Coordination, genuine, session, phone"
Case 23,"patents, license, motion to dismiss, declaratory judgment, inequitable conduct, allegations, tortious interference, 
common law fraud, denies, third-party, merger, fraudulent transfer, counterclaims, affirmative defense, motion to 
strike, unenforceability, monopolization, assigned, failure to state a claim, good faith, Licensors, fair dealing, Notice, 
argues, breach of duty, fraudulent, prospective economic advantage, particularity, defenses, rights"
Case 24,"district court, antitrust, predominance, class representative, questions, member of the class, class action, class 
member, defendants', but-for, damages, injury-in-fact, certification, anti trust law, plaintiffs', assignees, legal 
question, price-fixing, issuer, conspiracy, adequacy, lawsuit, class certification, common question, formula, factual 
question, antitrust claim, prerequisites, underwriters, proceeds"
Case 25,"counterclaim, summary judgment, alleges, patent, replacement part, warranty, motion to dismiss, marking, antitrust 
claim, monopoly, cutting, parties, amend, tying arrangement, antitrust, products, Sherman Act, monopolization, 
consumables, contends, responds, relevant market, Counts, plasma, statute of limitations, res judicata, tied 
product, violations, packages"
Case 26,"squeeze, retail, customers, wholesale, Entities, pricing, internet, anti trust law, antitrust, anticompetitive, linkLine, 
allegations, competitor, amended complaint, pleadings, costs, retail market, retail price, district court, connections, 
regulated, regulated industry, market power, orders, antitrust liability, retail level, monopolist, predatory, antitrust 
claim, internet access"
Case 27,"stock, common law tort claim, cause of action, Sherman Act, alleges, amend, federal securities, motion to dismiss"
Case 28,"Counterclaims, state commission, network, rates, interconnection, violations, carriers, telecommunications, 
summary judgment, long-distance, arbitration, switching, orders, unbundled, argues, regulation, negotiate, alleges, 
resale, provisions, damages, private right of action, file a complaint, competitors, obligations, requesting, telephone, 
transport, asserts, parties"
Case 29,"transmission, electrical transmission, transmission facilities, Electric, wholesale, Join, motion to dismiss, energy, 
rates, filed rate doctrine, interstate commerce, preemption, compensating, facilities, district court, electric energy, 
deliver, Tariff, third party, non-jurisdictional, interfere, contends, federal law, state law, Resistance, charges, 
matters, counts"
Case 30,"Block, patent, license, patent misuse, manufacture, compete, non-compete, products, leverage, royalties, covenant, 
licensee, concrete block, district court, parties, rule of reason, courts, federal patent law, competing product, trade 
secret, confidential, technology, antitrust, marketing, unseal, cases, legitimate interest, termination, patentee's, 
documents"
Case 31,"rates, natural gas, filed rate doctrine, indices, market-based, first sale, sales, transactions, pipelines, claim for 
damages, wholesale, regulation, prices, damages, interstate, purchases, transportation, wellhead, retail, 
challenges, producers, district court, principles, antitrust, rate-setting, federal preemption, electricity, oversight, 
sellers, arena"
Case 32,"seed, purchasers, technology, Pioneer, soybean, patent, corn, traits, Counts, Defendants', anti trust law, 
genetically-modified, prices, unjust enrichment, injunctive relief, motion to dismiss, monopolize, allegations, alleged 
violation, Sherman Act, markets, parties, antitrust, indirect, antitrust claim, competitors, damages, grower, common 
law, license"
Case 33,"pricing, state-of-emergency, class action, unjust enrichment, plaintiffs', private right of action, violations, allegations, 
private action, gasoline, unfair, constructive trust, damages, cause of action, prohibitions, defendants', state law, 
practices, punitive damages, federal court, consumer, deceptive trade practices, legislative history, unconscionable, 
emergency, alleged violation, current version, provisions, settlement, diversity"
Case 34,"effects, allegations, subject matter jurisdiction, extraterritorial, Finance, oil, conduct test, proffers, lack of subject 
matter jurisdiction, securities law, investors, courts, alleged injury, direct cause, shareholders, motion to dismiss, 
imports, wire, beneficial owner, oil company, Hobbs Act, racketeering, preparatory, completion, antitrust, extortion, 
predicate, entities, takeover, exports"
Case 35,"termination, franchise, products, preliminary injunction, injunctive relief, anti-trust, modification, franchisees, 
goodwill, sales, tying arrangement, irreparable, conversations, parties, Sherman Act, customer, modified, asserts, 
merits, temporary restraining order, franchise agreement, irreparable injury, public interest, thirty days, employees, 
variation, contends, issuance, damages, factors"
Case 36,"Plans, Declaration, Defendants', antitrust, generic, unjust enrichment, summary judgment motion, discovery, 
summary judgment, Purchaser, prices, Indirect, branded, plan participant, consumers, state law, undisputed, 
Surreply, quantity, memoranda of law, non-moving, parties, summary judgment record, record evidence, material 
fact, prescriptions, per-pill, co-pay, costs, law of the case"
Case 37,"purchaser, antitrust, indirect, conspiracy, merchant, damages, plaintiffs', overcharge, allegations, complaints, card, 
cases, settlement, consumer, retail, costs, chargeback, customers, vertical, reasons, prices, concerted action, debit 
card, Sherman Act, interchange, dealers, class action, merchant-plaintiffs, calculation, defendants'"
Case 38,"immunity, prices, Sherman Act, cigarette, tobacco company, antitrust liability, settlement, tobacco, implementation 
of a statute, market share, cases, alleges, preempted, protects, private party, state action, negotiating, argues, 
sales, petitioning, hybrid, increased price, district court, Qualifying Act, anticompetitive, manufacturers, courts, anti 
trust law, Contraband Amendment, price-fixing"
Case 39,"class action, providers, state court, home state, courts, class member, plaintiffs', practices, defendants', federal 
jurisdiction, burden of proof, removal statute, unfair"
Case 40,"pricing, allegations, motion to dismiss, products, defendants', conspiracy, indirect, purchasers, attended, antitrust, 
plaintiffs', meetings, acquisition, Technology, announced, graphics, same time, cards, discovery, consumer, 
nationwide class, pleaded, alleged conspiracy, conclusory, unjust enrichment, new product, consumer-protection, 
deceptive, releasing, unfair"
Case 41,"Lease, Third-Party, damages, rent, tortious interference, summary judgment, Restaurant, summary judgment 
motion, unfair competition, unfair, fiduciary duty, Counterclaim, genuine issue of material fact, breach of fiduciary 
duty, contractual relationship, consumers, Premises, memorandum, parties, motion for leave, allegations, practices, 
punitive damages, new lease, renovations, potential investor, subject premises, attorney's fees, terminated, 
negotiate"
Case 42,"distributors, trade secret, Distributorship, allegations, Confidentiality, provisions, solicit, termination, void, 
covenants, motion to dismiss, non-compete, policies, injunctive relief, contracts, breached, breach of contract claim, 
confidential information, constructive trust, unfair competition, cause of action, customers, stricken, punitive 
damages, unenforceable, words, restraint of trade, mutual assent, Non-Disclosure, grounds"
Case 43,"coverage, insured, wrongful act, right of publicity, policy period, concert, class action, unfair competition, promotion, 
antitrust, duty to defend, infringement, summary judgment, allegations, privacy, Endorsement, suits, Sherman Act, 
violations, radio, anticompetitive conduct, appropriation, invasion, music, motion to dismiss, material fact, 
anticompetitive, ambiguous, construe, contends"
Case 44,"antitrust, conspiracy, buyers', seller, prices, pharmacies, cases, merger agreement, competitors, enrollees, cartel, 
allegations, merger, Sherman Act, consumers, anticompetitive, reimbursement rate, plans, contracts, pleaded, 
entity, Reply, motion to dismiss, proper plaintiff, managed care, subsidiary, restrain, lowered, firms"
Case 45,"network, provider, configuration, specialty, facilities, contracts, managed care, conspiracy, negotiated, 
circumstantial evidence, physician-owned, competitors, attended, freestanding, direct evidence, majority-owned, 
insureds, participating, communicated, summary judgment, Defendants', summary judgment motion, in-network, 
Dinners, clauses, organizations, e-mail, surgery center, amongst, parties"
Case 46,"environmental, customers, compliance, non-solicitation, marketing, rule of reason, unenforceable, geographic, 
covenant, employment agreement, restrictive covenant, summary judgment, relevant market, ban, restraint of trade, 
competitors, parties, solicitation, contacting, goodwill, former employer, material fact, trial court, regulations, 
appears"
Case 47,"building permit, class action, class certification, predominate, plaintiffs', quotation, marks, putative class member, 
antitrust, amended complaint, named plaintiff, purchasers, entities, damages, putative class, certification, 
memoranda of law, class member, cause of action, present case, indirect, individualized, Shoe, commonality, 
overcharge, alleged violation, question of law, common issue, permit fee, memorandum"
Case 48,"purchasers, Capture, products, bid, sales, Robinson-Patman Act, Antitrust, resellers, price discrimination, different 
price, commodities, fail to state a claim, commerce, unfair trade practice, motion to dismiss, allegations, bidders, 
injure, seller, grade"
Case 49,"distributors, discount, terminated, products, Robinson-Patman Act, defendants', customers, Ship, purchaser, 
intrabrand, Resale, Drop, price discrimination, favored, resellers, alleges, summary judgment motion, 
distributorship, secondary-line, territories, motion to dismiss, material fact, anticompetitive, interbrand"
Case 50,"antitrust, operating system, operating-system, markets, products, anti trust law, factors, consumer, office-
productivity, competitor, software, harmed, allegations, monopoly, damages, antitrust violation, barrier, compete, 
district court, tolling, browsers, cases, private plaintiff, direct victim, Clayton Act, quotations, argues, government 
action, tolling provision, monopolization"
Case 51,"purchases, domestic, motion to dismiss, high prices, manufacturers, prices, plaintiffs', allegations, defendants', 
module, negotiated, external, price-fixing, facilities, abroad, global, Sherman Act, antitrust, indirect, subsidiaries, 
delivery, assigned, subject matter jurisdiction, third party, affiliates, bankruptcy court, discovery, entities, effects, 
memory"
Case 52,"retailers, antitrust, prices, supplier, competitor, products, anti trust law, automotive, allegations, sandpaper, sales, 
consumers, multi-year, monopoly, up-front, predatory, discounts, offering, compete, profits, terms, customers, 
discovery, contracts, barriers, anticompetitive, abrasives, claimant, coated, eliminated"
Case 53,"generic, Defendants', purchasers, damages, Plaintiffs', class member, antitrust, branded, class certification, class 
action, overcharge, proposed class, predominate, prices, Products, Declaration, class-wide, courts, cases, drugs, 
putative class member, certifying, wholesalers, member of the class, motion to strike, absent class members, 
putative class, common issue, numerosity, defenses"
Case 54,"concerts, ticket, prices, artists, class certification, Plaintiffs', district court, class member, antitrust, promotion, 
damages, class action, predominate, rock, merits, Defendants', consumers, monopolization, cases, methodology, 
Region, courts, common issue, class-wide, cross-elasticity, calculating, relevant market, allegations, 
anticompetitive, purposes"
Case 55,"antitrust, anticompetitive, competitor, monopoly, monopolization, aggregate, vertical, monopolist, distributors, 
prices, customer, manufacturing, allegations, dealers, vertical integration, anti trust law, Sherman Act, 
programming, package, monopoly power, acquisition, terminated, mountain, retail, cases"
Case 56,"subcontract, monopoly, Sherman Act, tortious interference, conspiracy, antitrust, motion to dismiss, prime contract, 
allegations, contractual, dismissal with prejudice, antitrust claim, geographic, funds, government contract, restraint 
of trade, anti trust law, contract claim, qui tam, subcontractor, collusion, relations, parties, malice, prices, fails"
Case 57,"players, allegations, licensing, patents, competitors, anticompetitive, video, manufacture, antitrust, purportedly, 
consumers, submarket, restraint of trade, asserts, prices, technologies, licensees, second amended complaint, 
unreasonable restraint, motion to dismiss, announcement, logo, Sherman Act, defendants', relevant market, rule of 
reason, conspiracy, royalties, combined, contends"
Case 58,"preliminary injunction, anticompetitive, customers, water service, injunctive relief, irreparable harm, all-or-nothing, 
sewer service, articulated, foreseeable, political subdivision, antitrust, briefing, immunity, Reply, state action, merits, 
irreparable injury, authorities, substantial likelihood, water and sewer, service area, Temporary, quotation, movant, 
marks"
Case 59,"patent, price discrimination, preempted, preemption, innovation, regulation, drugs, prices, patent law, en banc, 
profits, pharmaceutical product, federal patent law, state law, pharmaceutical, confer, right to exclude, patent rights, 
Hatch-Waxman Act, invention, monopoly, patentee, products, purposes, price competition, field preemption, no 
conflict, correctly, holders, costs"
Case 60,"gates, airline, Terminal, Reform Act, Wright Amendment, defendants', plaintiffs', Airport, flights, lease, 
anticompetitive, conspiracy, obligations, antitrust, passenger service, competitors, repeal, antitrust claim, anti trust 
law, negotiations, demolish, parties, passenger, terms of the contract, conspiring, immunity, motion to dismiss, 
meetings, markets, divide"
Case 61,"patent, wet, Raman, ammonium, peaks, pounds, compound, invention, isomer, dry, heating, octamolybdate, 
producing, chemical, testing, declaration, spectral, invalid, spectra, plant, critical date, notations, shipment, 
samples, email, inequitable conduct, infringement, bag, manufacturers, unenforceable"
Case 62,"alleges, Phase, conspiracy, confidential, motion to dismiss, proprietary information, Misappropriation, promise, bid, 
anticompetitive, competitor, software, competitive bidding, amended complaint, trade secret, antitrust, expertise, 
amend"
Case 63,"League, NHL, team, new media, website, advertising, sports, Declaration, Internet, site, fans, relevant market, 
procompetitive, regulations, anticompetitive, hockey, merits, joint venture, exploit, migrate, marketing, rights, 
games, naked, preliminary injunction, intellectual property, adverse effect, anti trust law, rule of reason, 
newyorkrangers"
Case 64,"patent, Manufacturers, damages, attorney's fees, anti trust law, anticompetitive, antitrust, infringement, jury 
demand, cases, fraud claim, antitrust claim, allegations, withdraw, good faith, courts, anticompetitive conduct, 
antitrust liability, unlawful scheme, monopolization, competitors, suits, causal connection, nominal damages, 
patentee, sham, antitrust violation, technology, equitable, motion to strike"
Case 65,"settlement, service provider, affiliated, closing costs, Mortgage, discount, seller, overcharge, buyer, argues, HUD, 
providers, entities, charges, costs, prohibitions, regulations, obligated, offering, referral, alleges, asserts, exempt, 
cases, purchase agreement, real estate, consumers, rebates, fails"
Case 66,"purchasers, indirect, allegations, defendants', conspiracy, products, prices, plaintiffs', antitrust, graphics, card, 
consumer, pleaded, discovery, started, alleged conspiracy, motion to dismiss, nationwide class, press release, 
amended complaint, judicial notice, pleading stage, motion for leave, technology, finished, damages, unjust 
enrichment, prior order, proposed pleading, anti trust law"
Case 67,"tires, Warranty, consumer, Secret, unfair, run-flat, replacement, violations, plaintiffs', equipped, dealer, defense 
motion, manufacturer, unfair competition, unlawful conduct, unfair conduct, practices, wear, implied warranty of 
merchantability, alleged violation, motion to dismiss, express warranty, standing to sue, balancing test, new tire, 
fraudulent, premature, repairing, omission, courts"
Case 68,"cycle, plaintiffs', minimum payment, cardholder, defendants', credit limit, unfair, practices, deceit, overlimit, unfair 
competition, consumer, summary judgment motion, default, cards, deceptive, intermediate, incur, fraudulent, 
exceeded, charges, paying, named plaintiff, balancing test, opened, late fee, regulation, initiated, prong, credit card"
Case 69,"supermarket, Shop, geographic, antitrust, consumer, lease, competitors, anticompetitive, effects, anti trust law, 
Plaintiffs', sales, injuries, argues, preliminary injunction, Clayton Act, Sherman Act, calculations, hypothetical, 
monopolist, customers, closure, Defendants', grocery, prices, retail, relevant market, quotations, alleges, markets"
Case 70,"immunity, allegations, site plan, antitrust, anti trust law, municipality, motion to dismiss, sham, special use, zoning, 
misrepresentations, Defendants', meetings, Sherman Act, adjudicatory, property interest, private party, state action, 
city council, equal protection claim, ordinance, argues, cable, restraint of trade, effective, franchise, baseless, 
asserts, rights, procedural due process claim"
