Page,Core Terms
1235,"dealers, dealership, stations, rights, intervenor-plaintiff, settlement, contractual, gasoline, sales, anti trust law, 
terminate, gas station, customers, parties, retail, credit card, prevailing, believes, approve, clauses, costs, lease"
1245,"advertising, profits, parties, cost of goods sold, Sherman Act, calculation, merchandise, contends, joint venture, 
entities, damages, collaterally, termination, inducement, Franchise, sales, partial summary judgment, expert 
testimony, summary judgment, no proof, inventory, policies, opened"
1254,"trademark, insulation, economic power, franchise, tying product, patent, tying arrangement, attorney's fees, 
franchise agreement, defendant argues, possesses, prevailing party, competitors, fail to prove, provisions, assigns, 
cases, award of attorney's fees, unjust enrichment, anti trust law, tied product, presumed, courts, rights, seller, 
service mark, trial court, restitution, illegality, patentee"
1267,"pricing, defendants', anticompetitive, rates, interconnect, immunity, regulation, terminal, customers, predatory, 
lodestar, anti trust law, telephone, two-tier, damages, antitrust, practices, tariff, costs, monopolize, present case, 
relevant market, jury's verdict, calculations, anticompetitive conduct, payment plan, conspiracy, lost sales, 
incremental, payment option"
1289,"dealers, Lawn, franchise, vertical, Antitrust, rule of reason, per se rule, advertising, price-fixing, horizontal, 
restrictions, territorial, distributors, trial court, practices, franchisee, franchisor, tying arrangement, indictment, 
convictions, restraint of trade, manufacturer, dealership, criminal prosecution, chemicals, seeds, cooperative, 
coercion, products, franchise agreement"
1309,"tying arrangement, tying product, insubstantial, Antitrust, commerce, covenants, competitors, volume, lease, 
economic power, declaration, brokerage, seller"
1319,"disclosure, attorney general, antitrust, files, district court, grand jury, particularized, grand jury proceedings, parens 
patriae, secrecy, permitted by law, public interest, existing law, reasons"
1328,"church, license, delegation, liquor, veto, liquor license, ban, outlets, schools, religious, feet, anticompetitive, 
antitrust, exemption, secular, violates, parties, cases, clear statement, supervised, entities, immunity, religion"
1341,"releases, antitrust, parties, concealment, conspiracy, negotiations, general release, bids, parol evidence, antitrust 
claim, subcontract, disputes, fraudulent concealment, summary judgment, settlement, marine, cases, cause of 
action, conspirators, fraudulently, indictment, statute of limitations, separate trial, plaintiffs', assertions, counts, 
courts, summary judgment motion, due diligence, minute entry"
1359,"monopolize, market power, sauce, Sherman Act, allegations, price discrimination, spaghetti, discounts, unfair 
competition, market share, trial court, Robinson-Patman Act, allowances, non-price, markets, specific intent, 
percent, antitrust, related activity, monopoly power, anticompetitive, advertising, probability of success, introductory, 
Thick, Zesty, grant of summary judgment, summary judgment, price reduction, conspiracy"
1369,"proceedings, memorandum, Sherman Act, Electric, probative value, authorities, circumstances, antitrust, parties, 
anti trust law, in limine, customers, pretrial, stipulate, admission of evidence, determinations, presentation, 
evidentiary, proprietary, outweighed, recorded, reasons, regular, courts, proposed findings, enterprises, premised, 
tendered, defer, prejudicial"
1388,"shops, body shop, repair, customer, estimate, boycott, prices, insurance company, defendants', conspiracy, 
provider, price fixing, buyer, perform work, prevailing, adjusters, antitrust, pharmacy, seller, antitrust violation, 
Sherman Act, reimburse, discount, exempt"
1396,"attorney's fees, damages, district court, beer, percent, second trial, factors, cases, award damages, lead counsel, 
computing, markup, sales, antitrust violation, treble damages, fee award, distributor, territorial, antitrust, first trial, 
Sherman Act, itemized, district judge, price-fixing, customary, awarding, discount, profits, spent"
1409,"attorney's fees, costs, expenses, cases, antitrust, salaries, attorney general, deposition, allowance, reasonable 
attorney's fees, anti trust law, cost of a suit, defendants', copying, damages, lawyers, spent"
1417,"purchasers, sharing, objectors, indirect, settlement, plaintiffs', claimants, interclass, distributing, anti trust law, 
overcharges, government entity, settlement fund, consisting, broiler, parties, settle, share of the fund, dollar amount"
