Page,Core Terms
1178,"arbitration, antitrust claim, parties, termination, antitrust, arbitration clause, disputes, Dealer, anti trust law, 
nonarbitrable, Manufacturer, contends, state court, summary judgment motion, statutory claim, Counts"
1189,"Mall, lease, antitrust, conspiracy, grocery, grocery store, plaintiffs', antitrust violation, premises, consumer, 
sentence, injuries, retail, summary judgment, space, breach of lease, defendants', competitor, anti trust law, 
damages, tenants, retail shopping, Lessee, leased premises, listing service, relevant market, probable cause, 
anchor tenant, Sherman Act, monopolize"
1205,"instant case, antitrust, duress, parties, floor plan, summary judgment, terminate, Plaintiffs', conspiracy, settlement, 
floorplan, recision, invalid, lease, counterclaim, financing, theaters, pull, settlement agreement, general release, part 
and parcel, misrepresentation, allegations, Renewed"
1216,"lignite, tracts, Defendants', leases, Sherman Act, monopoly, antitrust, interstate commerce, conspiracy, mining, 
competitor, options, parties, damages, coal, sham, ratifications, seller, summary judgment, cause of action, price-
fixing, alleges, collateral estoppel, anti trust law, state court, monopolize, generating plant, conspired, motions, 
alleged conspiracy"
1237,"advertisement, preliminary injunction, antitrust, monopoly, yellow pages, injunction, appliance, lawsuit, repair, 
publish"
1242,"pleadings, district court, estoppel, election, cases, servant, notice, affirmative defense, unfair, tortious interference, 
motion for judgment"
1250,"sales, damages, new trial, distributorship, roofing, matter of law, remittitur, witnesses, argues, statute of frauds, 
terms, price discrimination, defense motion, good faith, calculated, antitrust, parties, custom"
1259,"license, customers, infringement, deposit, profits, district court, patent, equipment owner, exclusionary, consumers, 
settlement agreement, apportionment, monopolist's, unilateral, Skiing, copies, diagnostics, Copyright Act, damages, 
trade secret, registration, antitrust, misuse, summary judgment, support services, source code, software, proprietary 
information, repair, actual damage"
1323,"pricing, antitrust, appliances, predatory, anti trust law, competitors, consumers, summary judgment, summary 
judgment motion, fraudulent concealment, material fact, alleges, price discrimination, duty to disclose, Robinson-
Patman Act, nonmoving, dealer"
1333,"covenant, compete, trial court, summary judgment motion, antitrust, summary judgment, lost profits, unenforceable, 
tortious interference, instructed verdict, matter of law, interfered, contracts, employees, shoppers, Travel, 
calculated, promisee, damages"
1343,"Ridge, landfill, disposal, solid waste, injunction, Region, site, customers, transfer station, geographic, monopolize, 
municipal, preliminary injunction, Antitrust, prices, monopoly power, per ton, defendants', ordinances, vertical,"
1353,"Sand, district court, Aggregates, terminated, instructions, antitrust, constructive fraud, affirmative defense, argues, 
damages, statute of limitations, breach of fiduciary duty, products, prices, two-year, summary judgment, proven, 
breach of contract claim, sand and gravel, anti trust law, competitor, conversion, occurring, objected, percent, 
dealer, laches, costs, conversion claim, verdict form"
1365,"teams, public ownership, ownership, ownership interest, league, relevant market, cases, stock, public offering, rule 
of reason, benefits, involvement, antitrust, effects, district court, stock sale, franchises, offering, compete, matter of 
law, output, restraint of trade, Sherman Act, anticompetitive, instructions, football, prices, sports, procompetitive, 
restricting"
1386,"enterprise, conspiracy, employees, allegations, customers, pattern of racketeering activity, defendants', Passport, 
entities"
1395,"defendants', rates, antitrust, ban, transportation, crossover, regulated, natural gas, customers, monopoly, pipeline, 
squeeze, Sherman Act, immunity, alleges, motion to dismiss, anticompetitive, intrastate, state action doctrine, 
postage stamp, manipulation, northern, filed rate doctrine, competitors, shippers, cases, antitrust claim, anti trust 
law, petition for review, state action"
1414,"venue, convenience, factors, cages, judicial district, witnesses, reside, district court, antitrust, customers, parties, 
interest of justice, warehouse, lawsuit"
