Page,Core Terms
1243,"Plaintiffs', petitioning, court of appeals, immune, zoning variance, allegations, variance, motion to dismiss, 
pleadings, zoning, zoning ordinance, property value, Redevelopment, residential, antitrust, rights, entitled to 
immunity, motion for judgment, protected activity, petitioning party, billboards, conspiracy, conspired, construct, 
residents, damaged, constitutional right, alleged conspiracy, government action, storage facility"
1256,"boosted, patent, antitrust, effective, prices, moving party, administering, non-moving, preamble, ritonavir, dose, 
direct evidence, monooxygenase, cytochrome, anemia, argues, summary judgment motion, unjust enrichment, 
monopoly power, prior art, metabolized, discovery, patients, vitamin, cases, market power, market share, Sherman 
Act, macrocytic-megaloblastic, monopolization"
1269,"manufacturer, retailer, Baby, concerted action, products, relevant market, monopolization, prices, heft, monopoly 
power, anticompetitive, high-end, markets, sales, consumers, in-market, interchangeable, causal nexus, 
speculative, conspiracy, policies, Plaintiffs', injuries, specific intent, cross-elasticity, satisfaction, conditions, harmed, 
volume, anti trust law"
1299,"pleadings, public policy, antitrust, products, Cigarette, prong, unfair, tortious interference, alleges, motion to 
dismiss, anticompetitive, practices, argues"
1304,"dialysis, tying product, inpatient, geographic, patients, tied product, tying arrangement, market power, nephrology, 
summary judgment, physician's services, antitrust, conditioning, products, Bevan, exclusive contract, 
anesthesiological, parties, Counts, seller, buyer"
1312,"settlement, diamonds, Purchaser, class action, Indirect, Subclass, class member, damages, settlement fund, 
Plaintiffs', injunction, objectors, cases, Consumer, factors, Reimbursement, percent, settlement agreement, class 
certification, injunctive relief, Awards, attorney's fees, incentive award, parties, entities, expenses, Reseller, courts, 
discovery, notice"
1354,"state court, plaintiffs', abuse of process, campaign, defendants', ballot, sham exception, judgments, malicious 
prosecution claim, challenges, abuse-of-process, voter, motion to dismiss, baseless, election, malicious 
prosecution, injunctive relief, allegations, eligibility, motive, collateral, conspiracy, courts, moot, federal court, 
terminate, lawsuit, suits, judicial process, ulterior motive"
1379,"electronic, taxpayers, Plaintiffs', e-filing, immunity, Defendants', Network, returns, private right of action, tax 
preparation, antitrust, free service, Sherman Act, allegations, amended complaint, Appeals, motion to dismiss, 
software, domain name, registration, antitrust immunity, prudential standing, private entity, proposed class, federal 
tax, conduct-based, percent, thing of value, petitioning, regulated"
1424,"merger, plaintiffs', accrued, prices, allegations, tolling, motion to dismiss, statute of limitations, acquisition, 
consummated, complaints, markets, proceedings, healthcare, purchasers, pleaded"
1431,"products, sales, non-Trane, alleges, antitrust, counterclaims, bundled, parties, resale price, franchisees, franchise, 
tying arrangement, brand, tied product, manufacturer, termination, horizontal, franchise agreement, ancillary, 
controls, covenant, statute of limitations, tying product, good faith, motion to dismiss, anti trust law, entities, courts, 
market power, Sherman Act"
1448,"patent, Antitrust, declaratory judgment, infringement, defendants', asserting, motion to dismiss, Sherman Act, 
allegations, invalidity, Rental, rights, supplemental complaint, patent rights, non-infringement, anticompetitive, 
plaintiffs', competitor, business relationship, supplemental pleading, case or controversy, cause of action, monopoly 
power, supplemented, declaratory, specificity, issuance, unfair, cure"
1464,"milk, dairy, prices, farmers, Agriculture, cooperatives, complaints, defendants', bottling, plants, filed rate doctrine, 
plaintiffs', blend, rates, conspiracy, minimum price, pooled, allegations, marketing, producers, regulated, products, 
immunity, antitrust, counts, join, market forces, eliminated, premiums, motions"
1473,"federal claim, state court, Consolidate, district court, subject matter jurisdiction, supplemental jurisdiction, diversity 
jurisdiction, federal question, federal court, state claims, earlier-filed, terminated, violations, assigned, Motions, 
random"
1475,"district court, coaches, allegations, violations, antitrust, contends, Sherman Act, resigned, athletics, football, 
infractions, conspiracy, antitrust claim, obligations, sanctions, motion to dismiss, anticompetitive, promise, 
reasonable reliance, summary judgment, student athlete, anti trust law, contract claim, public policy, fraud claim, 
non-commercial, recruiting, void, commercial activity, breach of contract"
1486,"fragrance, license, Defendants', compete, alleges, antitrust, anticompetitive, group boycott, market power, 
appliances, motion to dismiss, bid, high prices, Wholesale, consumers, per se violation, manufacturers, 
competitors, products, brand, restraint of trade, business plan, do business, Sherman Act, distributors, conspiracy, 
concerted, suppliers, retailer, effects"
1495,"hiring, antitrust, alleges, employees, relevant market, stevedoring, monopoly power, monopolization, competitors, 
predatory, longshoremen, anticompetitive conduct, output, antitrust claim, leave to amend, motion to dismiss, 
prices, factual allegations, state law claim, alleged facts, lessening, argues, tortious interference, specific intent, 
Sherman Act, probability, violations, helping, survive, unfair"
1505,"patent, Counterclaim, royalties, relevant market, monopolization, expiration, contact lens, allegations, antitrust, 
Rights, post-expiration, affirmative defense, license agreement, leave to amend, patent misuse, competitor, 
technology, multifocal, STRICKEN, infringe, parties, prices, unenforceable, geographic, contends, license, market 
share, Sherman Act, argues, antitrust violation"
1514,"dealers, sales, truck, conspiracy, customer, prices, compete, distributors, out-of-AOR, matter of law, counterclaim, 
limitations period, present evidence, antitrust, argues, district manager, horizontal, conversation, misappropriation 
of trade secrets, Sherman Act, manufacturer, direct evidence, cross-checks, purchasers, discounts, vertical, 
markets, selling, bid, sufficient evidence"
1539,"newspaper, transactions, antitrust, editorial, anti trust law, joint venture, alleges, Sherman Act, advertising, 
defendants', integration, eliminated, monopoly, daily newspaper, reportorial, exemption, lessened, monopolization, 
Additionally, newspaper publication, Clayton Act, subscription, acquisition, commerce, attract, rates"
1555,"Food, pleadings, counterclaims, orders, antitrust, shipments"
1559,"bid, conspiracy, damages, defendants', bid-rigging, contracts, plaintiffs', collusion, estimate, profits, guilty plea, false 
claim, new trial, joint venture, knowingly, reliability, co-conspirators, bidders, documents, imputed, payoffs, 
probative value, memorandum, conspired, calculate, instructions, venture's, inflated, co-defendants, principles"
1623,"credit card, dealers, gasoline, sales, ink, machine, seller, processing, monopoly, card, tied product, competitors, 
antitrust, customers, franchise, monopoly power, market power, mimeograph, output, buy"
1629,"franchise, franchisees, Pizza, relevant market, Plaintiffs', antitrust, supplies, training, ingredients, franchisor, 
products, purposes, allegations, motion to dismiss, franchise agreement, antitrust claim, disability, employees, 
interchangeable, limited liability company, Sherman Act, psoriasis, substantial limitation, prices, major life activity, 
corporate veil, contractors, contractual, dealership, trademark"
1645,"allegations, prices, Plaintiffs', conspiracy, email, increased price, motion to dismiss, market share, restraint of trade, 
entitlement to relief, grounds, packaging, flexible, factual allegations, fair notice, Sherman Act, supra-competitive, 
conspired, discovery, producer, concerted action, Defendants', conclusory, antitrust, refrain, district court, oral 
argument, class action, heightened, resistance"
1661,"commerce, Air, conspiracy, Plaintiffs', Defendants', Sherman Act, passenger, import, travel, domestic, purchasers, 
price-fixing, allegations, flight, antitrust, prices, motion to dismiss, foreign nation, airline, tickets, fraudulent 
concealment, fuel, alleged conspiracy, price fixing, high prices, give rise, originating, air travel, fix prices, 
transportation"
