Page,Core Terms
1231,"polystyrene, products, recycling, producer, defendants', closed-loop, allegations, conspiracy, food service, trays, 
district court, school system, antitrust, schools, competitor, resin, manufacture, consumers, stages, complaint 
alleges, packaging, pleadings, percent, foam, factual allegations, concerted, customers, quotation, factors, e-mail"
1249,"power supply, consumer, alleges, warranty period, omission, motion to dismiss, malfunctions, advertising, 
fraudulent, quotation, marks, cause of action, warranty, manufacturer, unfair, amended complaint, concealed, 
express warranty, misleading, defects, puffery, leave to amend, customers, cure, affirmative misrepresentation, 
factual allegations, duty to disclose, misrepresentation, representations, recommended"
1263,"allegations, software, counterclaim, defamation, news release, relevant market, monopolization, anticompetitive 
conduct, trade secret, intentional interference, unfair, Sherman Act, customers, lawsuit, Server, costs, independent 
contractor, consulting services, market power, third party, misappropriated, probability, antitrust, asserts"
1270,"bone, electric, spinal, surgeries, pricing, fusion, arbitration, hand tools, disparagement, antitrust, sales, declaration, 
competitor, surgeons, selling, monopoly power, morselizing, disposable, undisputed, pneumatic, surgical"
1276,"labs, conspiracy, allegations, monopolize, laboratories, testing, patients, prices, insurers, markets, antitrust, in-
network, cause of action, Sherman Act, motion to dismiss, anticompetitive, competitors, vertical, diagnostic testing, 
market share, Plans, percent, effects, relevant market, monopoly power, market power, regional, anti trust law, 
leave to amend, Licensing"
1291,"insurance business, regulating, arbitration, insurer, arbitration agreement, preempted, state law, preemption, 
insurance contract, exempted, policyholders, health-care, healthcare, insurance company, state statute, cases, 
former resident, attorney-signature, Appeals, patient, motion to compel arbitration, malpractice insurance, 
requirement of notice, healthcare provider, regulate insurance, anti trust law, trial court, restrictions, boldface, 
commerce"
1306,"insurance business, regulating, arbitration, insurer, arbitration agreement, preempted, state law, preemption, 
insurance contract, exempted, policyholders, health-care, healthcare, insurance company, state statute, cases, 
former resident, attorney-signature, Appeals, patient, motion to compel arbitration, malpractice insurance, 
requirement of notice, healthcare provider, regulate insurance, anti trust law, trial court, restrictions, boldface, 
commerce"
1321,"motion to dismiss, merged, merger, reimbursement rate, anti trust law, antitrust, collusion, pharmacy, entity, retail, 
statement of reasons, amended complaint, legal theory, Clayton Act, allegations, unilateral, markets"
1324,"policies, allegations, secondary market, defendants', conspiracy, monopsony, policyholders, life insurance policy, 
individual defendant, enterprise, fraudulent, damages, antitrust, market power, motion to dismiss, plaintiff's claim, 
exclusionary, premiums, lapse, surrender, disclose, costs, mail, anticompetitive, purchasers, violations, coercion, 
void, death benefit, intimidation"
1337,"Plaintiffs', rental, Confirmation, prong, reservation, unfair, fraudulent, contracts, customers, breached, add-ons, 
charges, covenant, online, rent, motion to dismiss, extraterritoriality, pleadings, advertising, disclosures, practices, 
breach of contract claim, amended complaint, fair dealing, good faith, allegations, violations, tricking, pled, breach 
of contract"
1346,"photographs, alleges, brokers, listings, display, conspiracy, preliminary injunction, counterclaim, Sherman Act, 
license, member-brokers, quotation, argues, marks, contempt, effects, injunction, buyer, sham, anticompetitive, 
NeighborCity, per se rule, real estate, infringement, watermarks, website, petitioning activity, motion to dismiss, rule 
of reason, co-conspirators"
1372,"amended complaint, original complaint, alleges, deprivation, amend, Rights, customers, billing, deceptive, styled, 
misrepresentation, factual allegations, purports, fail to state a claim, screening, district court, asserts, utility 
services, recommendation, attachments, wrongdoing, motion to dismiss, pro se, antitrust, damages, constitutional 
right, false information, municipal utility, anticompetitive, retaliation"
1385,"GTL, alleges, inmates, bail bond, unfair, contends, terms and conditions, fails, false advertising, agencies, argues, 
asserts, consumers, reliable, bills, telephone service, implied contract, amended complaint, customers, express 
contract, telephone, limits, limitations period, telephone system, misleading, phones, Communications, disrupted, 
breached, fail to state a claim"
1403,"Apple, Publisher, e-books, prices, conspiracy, retail price, iBookstore, negotiations, Random, caps, windowing, 
retailers, Launch, agency agreement, wholesale, terms, iPad, Bestsellers, meetings, Releases, tiers, new release, 
titles, hardcover, consumers, Defendants', announced, customers, selling, e-mails"
1457,"arbitration, arbitration agreement, courts, class action, Card, compel arbitration"
1465,"steel, rolled, coil, hot, oiled, pickled, manufacturers, monopolize, bid, cross-elasticity, auction, steel-producing, 
monopoly, district court"
1471,"Skin, alleges, products, retail, conspiracy, antitrust, prices, Defendants', competitors, termination, motion to dismiss, 
selling, anti trust law, care products, Cartwright Act, emails, fixing, factual allegations, discount, vertical, fails"
1477,"antitrust, patients, staff, staffing, profit motive, allegations, medical care, state law claim, harmed"
1482,"prices, products, district court, manufacturer, competitors, buyer, Robinson-Patman Act, shipping, anticompetitive, 
discounts, brand, Sherman Act, exhaust, summary judgment, retailer, discriminatory, distributors, aftermarket, 
interbrand, duty to inquire, anti trust law, automotive, vertical, effects, muffler, argues, volume, actual knowledge, no 
evidence, interchangeable"
1492,"prices, products, district court, manufacturer, competitors, buyer, Robinson-Patman Act, shipping, anticompetitive, 
discounts, brand, Sherman Act, exhaust, summary judgment, retailer, discriminatory, distributors, aftermarket, 
interbrand, duty to inquire, anti trust law, automotive, vertical, effects, muffler, argues, volume, actual knowledge, no 
evidence, interchangeable"
