Page,Core Terms
21,"immunity, district court, Counts, records, proceedings, Sherman Act, antitrust, practice of law, bar admission, 
destruction, challenges, violations, subject matter jurisdiction, member in good standing, state court, disciplinary, 
decisions, destroyed, quotation, grounds, enjoin, cases"
30,"cause of action, alleges, tortious interference, unfair, restraint of trade, unjust enrichment, taxi cab driver, 
misrepresentation, violations, Fashions, policies, business relationship, no right, conspiracy, insurance 
commissioner, no cause of action, impoverishment, Misrepresents, monopolize, antitrust, intentional interference, 
competitors, defendants', enrichment, monopoly, insurer, taxicab, malice, trial court, horizontal"
46,"generators, wholesale, electricity, auction, energy, rates, consumer, plaintiffs', preemption, retail, wholesale market, 
nuclear, regulation, bid, Federal Power Act, preempted, prices, emission, plants, courts, clearing, interstate 
commerce, environmental, facilities, zero, state law, out-of-state, price adjustment, procurement, subsidizing"
65,"allegations, retail store, discounted, outlet, shoes, regular price, unfair, prong, advertised, prices, motion to dismiss, 
motion to strike, deny a motion, consumers, fails, products, on-line, shopped, website"
71,"increased price, prices, conspiracy, customers, cancellations, email, plaintiffs', announced, tier, employees, blood, 
reagents, interdependence, collusion, price list, summary judgment motion, antitrust, effective, price information, 
purchasing, summary judgment, communications, price-fixing, increases, presentation, Marketing, products, 
contracts, Reply, costs"
107,"bid, Defendants', allegations, motion to dismiss, conspiracy, Chemicals, alleged conspiracy, purchasers, Antitrust, 
pled, customers, damages, unfair trade practice, unjust enrichment, Deceptive, personal jurisdiction, collusion, 
resident, Consolidated, consumers, entities, general jurisdiction, further order, indirect, quotations, contacts, price-
fixing, prices, consumer protection, antitrust claim"
145,"confidential information, confidentiality, disqualified, generic, patent, consultant, confidential relationship, 
disqualification motion, Advisory, disclosure, Plaintiffs', Declaration, Memantine, Reply, recommend, parties, cases, 
proposed expert, confidence, documents"
154,"Demurrer, allegations, foreclosure, cause of action, Mortgage"
157,"cheerleaders, propose an amendment, conspiracy, poaching, allegations, antitrust, team, reply brief, no-poaching, 
fails, initial complaint, coaches, players, amend, anti-tampering, contradict, contracts, futility, tryout, factual 
allegations, anti trust law, employees, articles, courtesy, mobility, suppress, hire"
164,"exemption, nonstatutory, antitrust, district court, labor law, collective bargaining, counterclaim, anticompetitive, 
alleges, bargaining, reefer, wages, working conditions, final judgment, mandatory, partial, sham, alleged 
agreement, anti trust law, labor union, conspiracy, violating, parties, cases, antitrust liability, illegal agreement, 
bargaining unit, proceedings, baseless, contends"
180,"invoice, retailer, prices, alcoholic beverage, wholesalers, discount, regulations, calculated, products, quantity, gross 
profit, invalidated, delivery, prompt payment, predatory, arbitrary and capricious, minimum price, retail price, net 
cost, consumers, purchases"
192,"sham, plaintiffs', defendants', baseless, opposing, malicious abuse, supermarket, competitor, immunity, lawsuit, 
tortious interference, civil conspiracy, antitrust, shopping, alleges, filings, abuse of process, shopping complex, 
proceedings, injuring, merits"
203,"Products, factors, severance, parties, conspiracy, forum selection clause, containerboard, interest of justice, district 
court, antitrust, witnesses, convenience of the parties, plaintiff's claim, defendants', cases, alleges, lawsuit, judicial 
economy, class action, convenient, courts, forum selection, discovery, asserts, forum-selection, weigh, substantially 
similar, choice of forum, state law claim, circumstances"
215,"Dealers, trading, platforms, buy-side, all-to-all, conspiracy, clearing, allegations, plaintiffs', customers, entity, 
anonymous, swaps, antitrust, boycott, markets, electronic, buy, anti trust law, liquidity, plaintiff's claim, defendants', 
investors, conspired, class plaintiff, prices, motion to dismiss, give-up, pled, launched"
267,"driver, for-hire, municipalities, independent contractor, authorization, regulation, transit service, antitrust, 
anticompetitive, reliability, bargaining, preemption, transportation, employees, anti trust law, immunity, hire, state 
policy, coordinator, preempted, antitrust claim, state law, purposes, injunctive relief, Plaintiffs', courts, supervision, 
displace, private party, public record"
289,"allegations, patent, lock, inequitable conduct, asserts, pleads, relevant market, prior art, submarket, disclose, 
withheld, pled, monopolization, references, keypad, antitrust claim, antitrust, customers, products, lockers, slot, 
material information, amended complaint, motion to dismiss, specific intent, disclosure, electronic, assessing, 
quotation, deceive"
297,"announce, increased price, conspiracy, prices, competitors, Defendants', summary judgment, containerboard, firms, 
customers, meetings, trade association, collusion, conspire, decisions, fix prices, communications, reductions, 
alleged conspiracy, interdependent, colluding, Messaging, antitrust, Fructose, attended, trades, marks, quotation, 
anti trust law, phone call"
325,"antitrust, benchmark, rates, Plaintiffs', manipulation, consumer, prices, allegations, retail market, foreign currency, 
Defendants', enforcer, factors, conspiracy, restrained, pleads, Cartwright Act, Sherman Act, currency, trading, gold, 
retail price, correlation, injuries, markets, direct victim, spot market, participated, derivatives, transacted"
334,"immunity, sovereign immunity, waived, arm, federal court, argues, amend, district court, antitrust, contract claim, 
suits, constitutional claim, enter a judgment, money damages, court erred, correctly, entity"
345,"generic, patent, manufacturer, brand, bleeding, motion to dismiss, contraceptives, state law, tablets, breakthrough, 
Plaintiffs', estrogen, Complaints, settlement, hop, anticompetitive, Defendants', mcg, antitrust, regimen, invalidating, 
estradiol, preempted, omission, ethinyl, state law claim, allegations, monopoly, drugs, pharmaceutical"
392,"recorded, trust deed, judicial notice, Notice, foreclosure, alleges, mortgage, cause of action, Substitution, foreclose, 
void, notice of default, servicers, nonjudicial foreclosure, trustee sale, borrower, promissory note, courts, 
transferred, fraudulent, default, defunct, debt collector, preemptive, assigned, entity, motion to dismiss, initiated, 
argues, false representation"
407,"generic, patent, antitrust, infringement, launch, sham, settlement, lawsuit, manufacturer, district court, conspiracy, 
suits, certification, petitioning, license, indirect-purchaser, brand-name, anticompetitive, immunity, summary 
judgment, anti trust law, scenario, e-mail, baseless, prevail, no-AG, delayed, parties, serial, grant summary 
judgment"
436,"Defendants', rule of reason, joint venture, insurers, conspiracy, contracts, per se rule, Limitations, group boycott, 
managed care, procompetitive, network, rim, pricing, condemnation, horizontal, volume, anticompetitive, 
allegations, district court, competitors, provisions, summary judgment motion, patients, non-compete, ancillary, 
antitrust, plurality, Unple[d, summary judgment"
465,"inmates, commissions, phone, telephone, telecommunications, charges, welfare fund, contracts, taxes, defendants', 
purposes, parties, rebates, telephone company, Recipient, prison, constitutional right, municipality, collected, jail, 
unconstitutional condition, motion to dismiss, anti trust law, county jail, anticompetitive, communicate, plaintiffs', 
courts, state action doctrine, exclusive contract"
488,"allegations, filtering, studios, Counterclaims, conspiracy, Plaintiffs', editing, email, Sherman Act, misuse, license 
agreement, judicial notice, motion picture, antitrust, license, movie, fails, affirmative defense, market power, 
documents, argues, motion to dismiss, streaming, contends, vertical, partner, terms, prospective economic 
advantage, intentional interference, district court"
499,"Licensure, license, medical practice, preliminary injunction, injunction, patients, emergency order, alleges, merits, 
emergency, issuance, irreparable harm, impaired, regulations, suspension, licensee, alcohol, revoked, notice, 
recommendation, argues, anti trust law, instant action, due process, initiated, violates, movant, orders, likelihood of 
success, medical license"
510,"spectrometers, alleges, counterclaims, microscopes, trade secret, bad faith, antitrust, electron, motion to dismiss, 
non-compete, monopolize, patent, restraint of trade, anticompetitive, manufacturer, monopoly"
516,"hiQ, users, profiles, authorization, website, publicly, Internet, site, privacy, argues, accessing, preliminary injunction, 
trespass, serious question, networking, viewable, merits, block, irreparable harm, permission, violates, revoked, 
public forum, authentication, purposes, shopping, Web, public interest, anti-SLAPP, injunction"
535,"rates, small group, questionnaire, regulated, insurers, filed rate doctrine, immunity, conversion, plans, damages, 
summary judgment motion, health insurance, health status, policies, factors, summary judgment, underwriting, for-
profit, shipper, subscriber, products, carriers, rate charged, renewal, material fact, circumstances, conspiracy, 
argues, insurance company, Sherman Act"
564,"purchaser, trial court, lamps, summary judgment motion, summary judgment, indirect, products, assigned error, 
antitrust, alleges, Valentine Act, distributors, non-moving, genuine, pricing, motion for a protective order, antitrust 
claim, co-conspirator, damages"
572,"chiropractic, Plaintiffs', Insurers, patients, network, relevant market, antitrust claim, market power, chiropractors, 
conspiracy, motion to dismiss, purchasers, in-network, monopolize, antitrust, exemption, summary judgment, 
Providers, discovery, amended complaint, buyer, learned-profession, practices, markets, contracts, cases, 
violations, pleadings, private cause of action, fiduciary duty"
604,"patent, generic, allegations, settlement agreement, district court, settlement, antitrust, manufacturer, plaintiffs', 
patentee, infringed, no-AG, sham, immunity, parties, complaints, reissuance, implausible, anticompetitive, 
unjustified, launch, procurement, allegations of fraud, atorvastatin, pharmaceutical, sales, fraudulent, citizen's 
petition, invalid, consent decree"
640,"antitrust, Defendants', milk, prices, monopolization, cooperative, anti trust law, dairy, Plaintiffs', suppliers, aluminum, 
farmers, Grade, anticompetitive, monopsony, injuries, raw, motion to dismiss, buyers, competitor, Consumers, 
monopoly, markets, monopsonization, non-supplier, processors, enforcers, predatory, quotation, marks"
658,"advertising, prices, costs, print, sales, competitor, variable, meeting competition, damages, newspapers, affirmative 
defense, loss leader, summary adjudication, regression, allocated, sales below cost, argues, digital, Supplemental, 
opines, aggregated, undisputed, bundled, destroy the competition, display advertising, discounts, predatory, secret, 
motion to exclude, products"
690,"Carpenters, subcontracting, construction industry, exemption, proviso, practices, non-statutory, clauses, antitrust, 
collective bargaining, disputed, unfair labor practice, anti trust law, summary judgment, labor union, bargaining, 
immunities, mandatory, policies, contractors, affirmative defense, employees, parties, courts, construction manager, 
antitrust liability, labor organization, material fact, contracting, signatories"
708,"prices, regression, damages, antitrust, drywall, variables, conspiracy, purchasers, benchmark, Defendants', 
Plaintiffs', classwide, class member, increased price, measurement, class certification, eggs, econometric, effects, 
utilization, predominance, Chow, hydrogen peroxide, district court, class action, expert opinion, overcharge, argues, 
Reply, manufacturers"
760,"Settlement, Purchaser, Indirect, Notice, class member, settlement agreement, settlement fund, Packaged, 
Plaintiffs', final approval, proposed settlement, antitrust, bags, attorney's fees, conspiracy, sales, preliminary 
approval, blocks, Objector, subsidiaries, consumers, class action, claim form, predominance, nationwide, 
approving, injunctive relief, documentation, claimants, weighs"
789,"artists, Counterclaim, concerts, radius, clauses, antitrust, co-promotion, contracts, allegations, venues, festivals, 
unjust enrichment, argues, profits, music, competitors, anticompetitive, motion to dismiss, rule of reason, promoter, 
geographic, courts, prima facie case, effects, parties, featuring, market power, quotations, prices, waive"
804,"artists, Counterclaim, concerts, radius, clauses, antitrust, co-promotion, contracts, allegations, venues, festivals, 
argues, unjust enrichment, profits, music, competitors, anticompetitive, motion to dismiss, rule of reason, promoter, 
geographic, courts, prima facie case, effects, parties, featuring, market power, quotations, prices, waive"
819,"terminal, gasoline, pipeline, preliminary injunction, contracts, irreparable harm, throughput, transport, gathering, 
prices, customer, refinery, merits, lines, divestiture, assurances, investors, parties, storage"
827,"Dairies, Plaintiffs', prices, Declarants, misreporting, discovery, misrepresentations, documents, reporting, sales, dry 
milk, amend, deposition, allegations, milk, motion to amend, farmers, figures, parties, intentional misrepresentation, 
filed rate doctrine, leave to amend, joinder, weekly report, raw milk, diligence, deadline, motion to strike, delaying, 
statute of limitations"
847,"purchasers, ascertainability, drywall, predominance, class member, damages, antitrust, class certification, 
certification, manufactured, indirect, feasible, reliable, records, classwide, state law, Plaintiffs', Defendants', 
adequacy, membership, overcharge, anti trust law, certify, district court, class action, common issue, end user, 
contractor, questions, retailers"
866,"oil industry, pipeline, Defendants', oil, Plaintiffs', special relationship, claim for relief, economic loss, factors, 
shutdown, partial summary judgment, economic loss rule, cases, transportation, spill, damages, platforms, oil spill, 
foreseeability, courts, injunctive relief, offshore, contracted, injuries, parties, losses, corrosion, nuisance, strict 
liability, economic injury"
884,"bid, energy, municipalities, electricity, antitrust, consultant, natural gas, contracts, Plaintiffs', marks, piggyback, 
quotation, allegations, prices, conspiracy, retaliate, consumers, rates, competitors, motion to dismiss, anti trust law, 
anticompetitive, bidder, recommendations, Defendants', alteration, amend, do business, procurement, suppliers"
904,"antitrust, debates, presidential, Plaintiffs', candidates, campaign, anti trust law, redress, allegations, injuries, merits, 
grounds, cases, prudential, presidential election, antitrust claim, election, parties, rights"
914,"documents, Subpoena, generic, launch, plaintiffs', manufactured, deposition subpoena, records, plans, produce 
documents, deposition, Declaration, batches, patent, non-party, motion to compel, discovery, memantine, 
producing, scale-up, motion to quash, high level, allegations, preparation, compliance, validation, at-risk, settlement 
agreement, Inspection, Purchaser"
925,"Ordinance, signals, Village, monitoring, customers, fire alarm, contracts, central station, station, alarm, remote, 
supervising, municipalities, anticompetitive, public safety, transmission, connect, existing contract, terminate, 
powers, renew, fire protection district, local government, dispatch, notice, provider, immunity, succeed, articulated, 
expiration"
947,"Rooftops, baseball, bleacher, views, exemption, seating, video, games, non-disparagement, obstruct, parties, 
district court, misleading, block, amend, anti trust law, windscreens, barriers, royalty, untrue, government-approved, 
antitrust, sentence, watching, monopolization, disparagement, provisions, landmark, outfield, League"
959,"patent, license, injunction, anti-suit, global, royalties, enjoin, district court, anticompetitive, obligations, contractual, 
proceedings, rights, suits, infringement, argues, Technologies, practices, parties, terms, Manufacturers, 
declarations, duplicative, lawsuits, comity, antitrust, portfolio, chipset, worldwide, exhausted"
978,"body shop, shops, insurance company, allegations, repair, prices, tactics, market rate, unjust enrichment, insureds, 
tortious interference, factors, district court, complaints, steering, illegal agreement, conspiracy, antitrust, price fixing, 
divergent, bargain, reasonable expectation, discounts, quantum meruit, offers, boycott, infer, boycotting, 
misleading, customers"
1015,"audit, auditor, resignation, redemption, election, audit committee, communications, counterdefendants, 
classification, memorandum, impaired, engagement, preferred stock, termination, accounting, damages, board of 
directors, Senior, financial statement, lawsuit, terms, reasons, Counterclaim, dividends, letters, threat of litigation, 
long-term, questions, allegations, classified"
1056,"conspiracy, aiding and abetting, anti trust law, immunity, civil conspiracy, violations, entitled to immunity, underlying 
tort, petitioning, antitrust, courts, unfair, grain, Advertising, argues, antitrust claim, political arena, proscriptions, 
warehouse, contends, tailored, damages, business world, deceptive, asserts"
1074,"generic, tablets, film, allegations, citizen's petition, anticompetitive, manufacturers, Carrier, pharmaceutical, 
buprenorphine, hopping, anticompetitive conduct, patent, competitors, naloxone, substitution, switch, co-formulated, 
monopolize, conspiracy, withdrawal, antitrust, consumers, cooperate, class action, drugs, sales, baseless, branded, 
concerted action"
1113,"antitrust, cause of action, clinical trial, competitor, terminate, prospective economic advantage, tortious interference, 
wrongful act, pharmaceutical, neurological, at-will, drugs, intentional interference, third party, disruption"
1121,"increased price, announcements, conspiracy, prices, competitors, summary judgment, suppliers, email, 
interdependence, district court, manufacturers, factors, Chocolate, oligopoly, sales, circumstantial evidence, 
oligopolistic, meetings, titanium dioxide, market share, conspired, exchanged, anti trust law, fix prices, Glass, Flat, 
alleged conspiracy, cases, parallelism, antitrust"
1151,"prices, bottlers, alleges, products, concentrate, Pepsi, territories, retailers, Dollar, finished, customers, 
monopolization, bottling, trademark, brands, distributing, competitors, negotiated, predatory, suppliers, anti trust 
law, antitrust, motion to dismiss, market share, distributor, probability, conspiracy, monopoly, fiduciary relationship, 
relevant market"
1173,"loans, fraudulent, elder abuse, summary judgment, the will, contends, covenant, lapse, cash value, unfair, funds, 
partial summary judgment, summary judgment motion, dependent adult, fiduciary duty, terminated, reasons, fair 
dealing, good faith, appointed, diligence, aiding and abetting, death benefit, contractual, undisputed, lawsuits, 
secretes, parties"
1182,"enterprise, charges, motor carrier, entities, shipping, subsidiaries, corporate structure, incorporation, discounting, 
customers, rates, wholly-owned, allowances, consisting, employees, off-bill, racketeering activity, unified, district 
court, consciousness, regulations, misleading, reaffirmed, packages"
1195,"boxes, set-top, tie, tying arrangement, sellers, customers, tied product, products, set-top-box, cable, per se rule, 
foreclosed, manufacturers, commerce, consumers, condemnation, competitors, foreclosure, anticompetitive, 
technology, effects, rent, cable service, premium, buyer, courts, tying product, antitrust, rental, district court"
1219,"software, allegations, support services, customers, counterclaims, counter-defendants, licenses, alleged 
misrepresentation, advertising, copyright infringement, Lanham Act, inducing breach of contract, intentional 
interference, false statement, Copyright Act, parties, pled, prospective economic advantage, licensees, preempted, 
processes, ongoing, rights, motion to dismiss, unjust enrichment, misrepresentations, contractual relationship, 
contracts, infringe, exclusive right"
1234,"modification, alleges, asserts, foreclosure, borrower, recorded, lender, cause of action, circumstances, documents, 
original complaint, mortgage, Notice, argues, fraudulent, contends, pled, notice of default, plaintiff's claim, duty of 
care, evaluated, unfair, trust deed, prevention, violations, prong, breached, servicer, alleged violation, Default"
1250,"Trucks, warranty, alleges, defects, repairs, express warranty, leased, cause of action, disclaimers, purchasers, 
notice, unfair, buyer, merchant, implied warranty, particular purpose, drivers, implied warranty of merchantability, 
transactions, amended complaint, promise, seller, implied warranty of fitness, financial institution, manufacturer, 
funding, fuel, breach of express warranty, breach of implied warranty, privity of contract"
1264,"LIBOR, manipulation, CHF, derivatives, transactions, allegations, conspiracy, defendants', plaintiffs', antitrust, 
personal jurisdiction, traders, trading, collusion, prices, forwards, currency, banks, damages, contacts, interest rate, 
contracts, settlement, swaps, profits, class period, conspired, extraterritorial, bid-ask, spread"
1321,"conspiracy, allegations, products, containerboard, alleged conspiracy, defendants', motion to dismiss, co-
conspirator, district court, contracts, second amended complaint, prices, benefitted, cases, antitrust, partial, supra-
competitive, acquisitions, price-fixing, meetings, effects"
1330,"motion to dismiss, conspiracy, allegations, state law, consumer protection, purchasers, complaints, antitrust, tuna, 
alleged conspiracy, unjust enrichment, consumers, indirect, products, amended complaint, increased price, indirect-
purchaser, co-conspirator, Reply, prices, antitrust claim, prior order, subsidiary, discovery, non-tuna, packaged, 
agrees, front, injunctive relief, alter ego"
1358,"license, unfair competition, print, products, non-compete, trade dress, infringement, collateral estoppel, camouflage, 
summary judgment, expiration, Email, unenforceable, factors, argues, appearance, hardship, parties, likelihood of 
confusion, summary judgment motion, claim for breach, declaratory, duration, designs, samples, agrees, breach of 
contract claim, intellectual property, declaratory relief, district court"
1368,"res judicata, sale order, designee, bankruptcy court, documents, appoint, wholly owned subsidiary, subsidiary, 
motion to dismiss, nonparty, parties, merits, bankruptcy case, privies, argues, final order, litigate"
1375,"Buyers, cheese, Producers, butter, prices, class member, Herd, purchasers, conspiracy, products, class 
certification, antitrust, predominance, damages, methodology, certification, retail, raw milk, courts, output, 
wholesale, purposes, rebuttal, dairy, individual damage, anti trust law, commonality, class-wide, adequacy, 
responds"
1399,"allegations, real estate, motion to dismiss, Sherman Act, Violations, advisory services, monopolize, pleadings, 
pages, federal securities, commerce, amend, fails, contract of purchase, plaintiff's claim, monopoly, shotgun, 
Counts, real estate transaction, entitlement to relief, restraint of trade, relevant market, foreign nation, 
misrepresentations, probability, invested, parties, Realty, futile, notice"
1410,"import, Defendants', commerce, alleges, Drugs, domestic, biosimilars, antitrust, amended complaint, 
pharmaceutical, amend, plaintiff's claim, motion to dismiss, anticompetitive, preparedness, Robinson-Patman Act, 
effects, prices, Clayton Act, anti trust law, Sherman Act, quotation, marks, commodities, courts, steps, price 
discrimination, consumption, reasons, resale"
1422,"parties, spoliation, exhibits, substantially outweighed, deposition testimony, competing concerns, judicial admission, 
proposed testimony, motion to strike, present evidence, probative value, relevant market, cross-examination, 
persuasive, proposals, subtitles, entirety, binding, markets, opened, juror, renew, door"
1425,"monopolization, alleges, cause of action, providers, dealers, motion to dismiss, Sherman Act, conspiracy, 
competes, markets, asserts, leave to amend, monopoly power, programs, vendors, block, conspiracy to 
monopolize, anti trust law, integration, Antitrust, conspire"
1433,"arbitration, tribunal, parties, courts, confirm, arbitration award, argues, damages, contends, arbitration agreement, 
asserts, public policy, district court, documents, Additionally, briefing, refuse to enforce, post-hearing, primary 
jurisdiction, secondary, merger, limitation of liability, translation, grounds, termination, enforcing, disputes, cases, 
agreement to arbitrate, certified copy"
1453,"Cooper, electricity, immunity, service area, entity, supervision, antitrust claim, municipality, articulated, antitrust, 
prong, rates, state-action, sovereign, alleges, state policy, exemption, monopoly, argues, active market, Sherman 
Act, transmission, furnishing, customers, state law, out-of-state, purposes, prices, unfair, member of the board"
