Page,Core Terms
1463,"fuel, surcharge, shippers, damages, class certification, class period, overcharges, legacy, shipments, variable, 
defendants', pre-class, prices, alleged conspiracy, reliability, uninjured, class member, plaintiffs', costs, Merits, 
Reply, elasticity, conspiracy, predominance, coefficient, intermodal, formulas, rates, contracts, constant"
1559,"artist, venues, ticketing, presale, summary judgment, contracts, exclusive contract, anticompetitive, contractual, 
antitrust, fails, fan club, rule-of-reason, distribute, parties, rights"
1564,"generic, damages, class member, consumers, uninjured, brand, class certification, predominance, Defendants', 
antitrust, overcharges, class action, but-for, purchasers, putative class, putative class member, launched, 
calculating, certification, prescriptions, parties, aggregate, payors, factors, impracticable, scenarios, third-party, 
defeat, state law, certifying"
1589,"film, allegations, tablets, Sherman Act, monopolization, manufacture, generic, monopoly power, contacts, antitrust 
claim, anticompetitive, conspiracy, antitrust, entity, consumer protection, motion to dismiss, courts, personal 
jurisdiction, products, patents, anticompetitive conduct, cause of action, state law claim, Pharmaceuticals, 
subsidiary, quotations, consumer, antitrust statute, conspiracy claim, anti trust law"
1608,"cable, installation, allegations, amended complaint, termination, subcontractors, antitrust, plaintiffs', Defendants', 
conspiracy, motion to dismiss, diverse, competitors, firms, antitrust violation, anti trust law, anticompetitive, 
reduction, antitrust claim, market power, customers, practices, proximate, consumer, effects, service provider, co-
defendants, formalization, conclusory, monopsony"
1620,"prima facie tort, fair dealing, trespassing, bad faith, allegations, covenant of good faith, right of petition, building 
permit, state court, injunction, injunctive relief, attorney's fees, cause of action, good faith, complaints, motion to 
dismiss, intent to injure, Restraining, antitrust, posting, breach of covenant, defamation, handbills, Appeals, untrue, 
adequate remedy at law, stringent requirements, enjoined, immunity, pleaded"
1629,"advertising, Entities, district court, consumers, pled, unfair competition, Lanham Act, antitrust, structured settlement, 
future payments, anti trust law, indicates, asserts, compete, labeled"
1633,"antitrust, alleges, motion to dismiss, mortgage, monopolization, anti trust law, Defendants', borrowers, defaulted, 
foreclosure, foreclosed, banks, buy, anticompetitive, Amend, monopoly power, fails, antitrust violation, restraint of 
trade, conspiracy, servicers, lenders, survive, loans, short sale, bowling, centers, prices"
1640,"patent, generic, antitrust, no-AG, settlement, allegations, anticompetitive, launch, Sherman Act, purchasers, sham, 
brand, anti trust law, royalty rate, indirect, premised, conspiracy, settlement agreement, motion to dismiss, federal 
patent law, courts, unfair, violations, consumers, documents, infringement, anticompetitive conduct, Defendants', 
monopolize, monopoly"
1661,"rule of reason, noncompete, partial summary judgment, noncompete agreement, summary judgment, antitrust 
claim, antitrust, genuine, genuine issue of material fact, nonmoving party, anti trust law, material fact, moving party, 
year period, anticompetitive, uninterrupted, infringement, Restaurant, franchisee, geographic, Franchise, effects, 
courts, movant, cases, pizza"
1664,"motion to dismiss, allegations, report and recommendation, recommends, orders, reply, amend, factual basis, 
regulation"
1669,"patent, alleges, haulers, customers, infringement, chassis, manufacturers, competitors, truck, winch, soft-tie, 
dealers, Ratchet, antitrust, monopolization, prior art, baseless, anti trust law, disclose, selling, invention, immunity, 
letters, buying, motion to dismiss, exclusionary, products, argues, cease and desist, consumers"
1687,"prices, anticompetitive, summary judgment, manufacturer, defendants', tooling, seal, antitrust, customers, moves, 
documents, summary judgment motion, conspiracy, argues, procompetitive, price-fixing, distributor, conceal, 
parties, output, reasonable jury, participated, designated, violations, allocate"
1694,"district court, breach of contract claim, first time, raises"
1697,"domestic, injuries, district court, shares, alleged injury, extraterritoriality, bank account, misappropriation, Theft, 
schemes, funds, amended complaint, tangible property, resident, stolen, entities, bearer, economic loss, Dividend, 
safety deposit box, transferred, private right of action, motion to dismiss, prohibitions, allegations, finances, 
purposes, racketeering activity, place of residence, conflict-of-laws"
1715,"tablets, generic, film, antitrust, allegations, buprenorphine, naloxone, conspiracy, co-formulated, patent, motion to 
dismiss, pharmaceutical, manufacturers, citizen's petition, anticompetitive, relevant market, products, Sherman Act, 
opioid, withdrawal, delayed, participated, consumers, entities, interchangeable, monopolize, anti trust law, 
packaging, convert, new product"
1738,"petitions, baseless, monopolist, sham, filings, competitor, cases, antitrust, sham exception, license, courts, right of 
petition, immunity, objectively reasonable, petitioning activity, district court, anticompetitive, merits, incumbent, 
lawsuit, summary judgment, suits, win, antitrust liability, probable cause, infringement, convinced, frivolous, circuits, 
protects"
1748,"growers, cranberry, concentrate, Pool, auction, antitrust, summary judgment, plaintiffs', fruit, prices, cooperative, 
purchaser, Aluminum, partial summary judgment, antitrust violation, anti trust law, indirect, products, counts, 
summary judgment motion, monopsonization, damages, bids, material fact, anticompetitive, processes, factors, 
volume, juice, antitrust claim"
1763,"settlement, patent, patches, generic, launch, plaintiffs', products, cross-elasticity, antitrust, defendants', lidocaine, 
opine, manufacturing, but-for, motion to exclude, causation, parties, interchangeable, invalidity, won, summary 
judgment, drugs, infringement, at-risk, cases, pain, pharmaceutical, documents, estimate, hydrogel"
1814,"leagues, teams, soccer, asserts, waivers, standard-setting, recommendations, procompetitive, conspiracy, effects, 
votes, Reply, designation, benefits, annexed, markets, courts, preliminary injunction, irreparable harm, relevant 
market, anticompetitive, antitrust, zones, Sports, season, concerted action, sanctioning, fan, propose an 
amendment, adverse effect"
1839,"software, allegations, advertising, support services, websites, intentional interference, licenses, contractual 
relationship, contracts, third amended complaint, customers, termination, alleged misrepresentation, motion to 
dismiss, licensees, audits, deceptive trade practices, misuse, bait and switch, Lanham Act, disruption, declaratory 
judgment, lease, authorization, contends, pled, cause of action, consumers, false statement, misrepresentations"
1858,"patents, Patents-in-Suit, declaratory judgment, infringement, motion to dismiss, Manufacturers, iPhone, licensing, 
Counterclaims, consumer, unfair, charts, allegations, balancing test, royalties, parties, invalidity, weighs, 
noninfringement, competitor, legal relationship, supplier, asserts, portfolio, threatening, chipsets, products, license 
agreement, amended complaint, unscrupulous"
1884,"patent, license, royalty, sales, rates, unpacking, calculated, licensee, royalty rate, top, Rebuttal, aggregate, portfolio, 
projections, global, firms, parties, technology, balancing, expired, negotiations, handset, comparable, counting, 
terms, similarly situated, regional, floor, estimate, phones"
1944,"generic, manufacturer, products, consumers, capsule, Defendants', drugs, bioequivalence, class member, antitrust, 
pull, patients, Plaintiffs', damages, prices, switch, patents, testing, payors, third-party, tablet, named plaintiff, 
reformulation, mesalamine, dissolution, purchases, ulcerative colitis, certification, uninjured, anticompetitive"
1976,"Plaintiffs', conspiracy, Broiler, indirect, Defendants', prices, producers, cuts, allegations, purchasers, cut production, 
chicken, consumer protection, announced, antitrust, courts, damages, conspiracy claim, conspirators, competitors, 
meetings, public statement, factors, commodity, flocks, antitrust claim, class action, breeder, plant, price fixing"
