Page,Core Terms
1320,"fraudulent, documents, unfair, cause of action, judicial notice, allegations, motion to dismiss, citizenship, removal, 
notice, amount in controversy, foreclosure, diversity, recorded, joined, argues, Reply, factual allegations, amended 
complaint, business practice, courts, pages, prong, modification, consumers, purposes, nominal, cases, original 
complaint, nominal defendant"
1330,"luminaires, Lighting, bidding, anticompetitive, antitrust, alleges, manufacturers, proposals, rule of reason, market 
power, Sherman Act, anti trust law, specifications, Defendants', contractors, relevant market, purchaser, products"
1336,"insurance agency, marketing company, commissions, termination, cause of action, associates, arbitration, 
providers, insurance product, sales, damages, hierarchy, intentional interference, employees, contracts, 
independent contractor, promissory estoppel, Marketing, prospective economic advantage, promise, appointments, 
insurance agent, products, representations, unfair, unfair competition, compliance, unjust enrichment, licensed, 
entity"
1360,"antitrust, consumers, allegations, trial court, no cause of action, violations, third party, restrain, alleged conspiracy, 
antitrust claim, conspiracy, entity"
1367,"leases, moving party, allegations, monopolization, entities, numbers, motion to dismiss, conspiracy, Sherman Act, 
alleged facts, antitrust, customers, competitor, terminated, unilateral, relevant market, joined, conspiracy to 
monopolize, leave to amend, quotation, marks, motion for sanctions, alleged conspiracy, contracts, sanctions, 
restraint of trade, business decision, registry, parties, mobile"
1378,"Blue, negotiations, network, antitrust, conspiracy, summary judgment, conditions, patients, Skiing, damages, 
providers, regulations, Team, acquire, termination, rates, anticompetitive, parties, material modification, 
reimbursement rate, reasons, monopolize, contracts, email, conversations, subscribers, Counts, terms, healthcare, 
acquisition"
1418,"alcohol, federal law, federal issue, preempts, state law, implicates, regulation, state-law, argues, interstate, 
preemption, disputed, removal, liquor"
1421,"procompetitive, athletics, motion to exclude, student-athletes, proposed testimony, benefits, effects, relevant 
market, reliable, denies, amateurism, facilities, scientific, spending"
1432,"helmets, Defendants', helicopter, Handbook, Graphic, manufacturer, advertising, antitrust, unjust enrichment, 
antitrust claim, misleading, Damaged, venue, personal jurisdiction, motion to dismiss, allegations, defamation, 
military, drop"
1442,"probable cause, defendants', summary judgment, sham, petitioning activity, sham exception, zoning, cases, notice, 
allegations, immunity, vexatious litigation, antitrust, petitions, two-part, lawsuit, counts, second application, public 
hearing, superior court, circumstances, merits, motion to intervene, special exception, appellate court, intervene, 
courts, matter of law, non-petitioning, proceedings"
1467,"buydown, wholesalers, products, peremption, customers, courts, tortious interference, motion to dismiss, purchaser, 
consumers, invoices, alleges, sales, business competitor, cause of action, continuing tort, reimbursement, 
prescription, prescribed, terminated, retailers, right of action, acquisition, pleadings, contends, purposes, unfair, 
tobacco product, district court, cigarettes"
1477,"drivers, Ordinance, preemption, immunity, for-hire, regulation, state-action, coordinator, independent contractor, 
hire, municipalities, employees, preempted, transit service, authorization, supervision, ride-referral, price-fixing, 
entity, private party, clear-articulation, transportation, ride, anti trust law, state policy, active-supervision, 
anticompetitive, foreseeable, displace, anticompetitive conduct"
1505,"cause of action, gratuity, tips, suggestions, contends, servers, unfair, demurrer, prong, alleged violation, business 
practice, restitution, customer, alleges"
1509,"Plaintiffs', no-fault, Michigan, motion to dismiss, insurance policy, allegations, state actor, Progressive, rates, 
regulation, Sherman Act, insurers, entity, qualified immunity, insurance business, constitutional claim, antitrust 
claim, McCarran-Ferguson Act, insurance company, auto insurance, monopolize, antitrust, monopoly, federal court, 
pleadings, violates, parties, argues, cases, status conference"
1526,"dealers, vendors, Defendants', allegations, antitrust, integration, block, third-party, customers, prices, pleads, data-
integration, competitors, contracts, aftermarket, motion to dismiss, anticompetitive, anti trust law, authorization, 
purchaser, consumers, courts, costs, third party, accessing, providers, dealerships, licenses, Sherman Act, 
conspiracy"
1561,"cable, allegations, installation, subcontractors, antitrust, conspiracy, anticompetitive, competitors, terminated, 
Defendants', consumers, buyer, costs, anti trust law, provider, Regions, prices, rates, relevant market, metrics, 
motion to dismiss, monopsony, predatory, reduction, bidding, antitrust action, new allegation, conclusory, 
decreased, Internet"
1573,"license, shares, allegations, disciplinary proceeding, gambling, emergency order, conspiracy, settlement, 
proceedings, arbitration, revoked, violations, immunity, absolute immunity, asserts, parties, prosecutorial, emails, 
fair market value, motion to dismiss, cause of action, judicial notice, accusation, revocation, deprive, rights, issue 
preclusion, leave to amend, distributions, sham"
1587,"bid, commerce, enhancement, volume, Big, Sentencing, guidelines, calculation, auctions, co-conspirators, 
properties, cartel, conspiracy, payoffs, argues, bidders, volume-of-commerce, bid-rigging, buy, rigged, cases, price-
fixing, antitrust, agreeing, transactions, foreclosure, partnership, contends, harmed, sales"
1598,"Seafood, antitrust, geographic, markets, shrimp, discovery, summary judgment motion, groundfish, fishing, quotas, 
non-moving, fishermen, deliver, merger, vessel, Coast, processors, damages, prices, proposed acquisition, 
summary judgment, trawl-caught, acquisition, definitions, purchases, suppress, leasing, additional discovery, 
injunctive relief, relevant market"
1612,"act of state doctrine, beer, Brewers, defendants', packs, sovereign, Liquor Control Act, Retail, courts, liquor, 
packages, foreign government, public act, Sherman Act, Breweries, Brewing, foreign sovereign, antitrust claim, sell 
beer, conspiracy, regulation, practices, state law claim, Relations, Consumer, pack-up, pricing, motion to dismiss, 
allegations, challenging"
1625,"district court, antitrust, amend, summary judgment, exclusive contract, shareholders, tortious interference, 
employment contract, grievance committee, antitrust claim, anti trust law, anesthesiology, consumers, enforcer, 
patients, allegations, termination, contracts, motion to dismiss, asserts, damages, notice, fraudulent inducement, 
fair dealing, anesthesiologist, competitors, contractual, anesthesia, practicing, prices"
1639,"online, retailers, contact lens, prices, advertising, antitrust, consumers, Plaintiffs', tolling, parties, settlement 
agreement, customers, anticompetitive, Defendants', allegations, conspiracy, non-disclosure, courts, motion to 
dismiss, sellers, notice, terms, Sherman Act, factors, offline, fraudulent concealment, provisions, products, 
interchangeability, restrictions"
1654,"Antitrust, Provider, Compliance, Marketing, Communicate, healthcare, potential violation, employees, notice, 
provisions, documents, annually"
1661,"Ironworkers, Carpenters, clauses, rule of reason, antitrust, horizontal, anti trust law, vertical, subcontracting, 
competitors, exemption, non-statutory, prices, summary judgment, boycott, adverse effect, group boycott, 
anticompetitive, contractors, per se rule, analyzed, summary judgment motion, relevant market, distributors, 
bargaining, nonmoving, market power, Sherman Act, associations, Electrical"
1676,"Dealers, trading, platform, discovery, plaintiffs', allegations, all-to-all, negotiations, clearing, conspiracy, buy-side, 
deadline, parties, restore, anonymous, swaps, production of documents, electronic, pled, class plaintiff, launched, 
new allegation, entities, boycott, revive, amend, firms, discovery dispute, notice, substantial completion"
1706,"district court, Patent, invalidity, ongoing, infringement, parties, collateral estoppel, estoppel, royalty rate, royalty, 
willfulness, breached, sorting, cells, Termination, antitrust, Fluid, continuing conspiracy, breach of contract, 
circumstances, sperm, summary judgment, Freezing, damages, license, moot, jury's finding, verdict form, 
calculating, affirmance"
