Page,Core Terms
21,"Nutrition, preliminary injunction, restitution, disgorgement, demurrer, unfair, false advertising, misleading, trial court, 
injunctive relief, advertising, profits, unfair competition, cause of action, leave to amend, damages, first amended 
complaint, fluid recovery, marketing, modulators, consumers, androgen, receptor, class action, restitutionary, 
violations, practices, products, moot, deceptive"
30,"patent, relevant market, antitrust, license, sham, portfolio, collateral estoppel, immunity, parties, anti trust law, 
technology, banks, infringement, baseless, monopoly power, monopolization, relitigation, litigate, markets, merits, 
summary judgment, cluster, patent infringement, counterclaims, cases, antitrust claim, allegations, competitor, 
lawsuit, proceedings"
67,"alleges, Products, Grid, Platform, customers, real time, software, markets, competitors, antitrust, relevant market, 
suppliers, Sherman Act, facilities, historian, sells, end-user, reasons, audit, market share, monitoring, foreclose, 
anticompetitive, announcement, harmed, monopolization, sellers, bundle, de facto, Infrastructure"
89,"certification, patients, Boards, restraint of trade, medical staff, recertification, allegations, competitors, output, 
prices, Sherman Act, medical care, specialty, negligent misrepresentation, relevant market, anticompetitive, 
nationwide, licensed, effects, anti trust law, consumers, medicine"
97,"purchaser, futile, enoxaparin, indirect, Defendants', amended complaint, allegations, unjust enrichment, consumers, 
amend, fraudulent concealment, personal jurisdiction, antitrust, motion to dismiss, entities, damages, proposed 
amended complaint, district court, proposed class, deny a motion, class member, reside, class certification, 
indirectly, discovery, accruing, generic, merits, propose an amendment, cause of action"
112,"merger, provider, proposed transaction, patients, adult, healthcare, insurers, post-merger, network, relevant market, 
effects, leverage, pediatricians, service line, health insurance plan, general surgeon, Guidelines, buyer, bargaining, 
substitutes, negotiate, reimbursement rate, anticompetitive, plaintiffs', savings, consummated, geographic, 
employees, clinic, concentration"
142,"antitrust, monopolize, Electric, alleges, conspiracy, Island, termination, wholesale, Merger, energy, power plant, 
competitor, qualifying, motion to dismiss, power generation, monopoly, electric utility, anti trust law, facilities, 
cancellation, consumers, fuel, restraint of trade, generation, plant, state-law, damages, prices, costs, fails"
159,"alleges, rebates, asserts, payors, third-party, prices, market share, antitrust, formularies, anticompetitive conduct, 
deceptive, Sherman Act, contends, offering, competitor, monopolization, anti trust law, exclusionary, block, motion 
to dismiss, consumers, customers, launch, anticompetitive, price-cost, discounts, patients, factors, costs, 
epinephrine"
182,"dental, manufacturers, antitrust, alleges, defendants', products, dentists, distributors, websites, boycott, damages, 
tortious interference, anticompetitive, enforcer, conspiracy, supplies, anticompetitive conduct, anti trust law, civil 
conspiracy, sites, sales, aiding and abetting, trade show, quotations, parties, calculating, remote, business 
relationship, boycotting, competitor"
195,"Non-Solicitation, License, rule of reason, software, restraint of trade, motion to dismiss, employees, solicitation, 
violates, declaratory judgment, relevant market, per se rule, allegations, profession, specialized, e-Bay, competes, 
hardware, purposes, parties, courts, hiring"
203,"prices, increased price, conspiracy, products, plaintiffs', documents, employees, email, Declaration, competitors, 
defendants', export, sales, discovery rule, Deposition, Ramen, confirmed, hearsay, summary judgment, price 
support, raw material, disputes, argues, authenticity, antitrust, exchanged, imported, subsidiaries, domestic, comity"
239,"Taxi, drivers, unfair competition, regulations, motion to dismiss, licensed, pricing, business relationship, 
Transportation, passengers, unfair, personal jurisdiction, plaintiffs', hire, individual defendant, common law, 
ordinance, courts, civil conspiracy, antitrust, cases, aiding and abetting, municipalities, allegations, defendants', 
hackney, taxicab, TNC Act, monopolize, cause of action"
257,"infectious disease, privileges, patients, alternate, provider, Defendants', antitrust, allegations, private practice, 
antitrust claim, enforcer, interstate commerce, anti trust law, subject matter jurisdiction, motion to dismiss, 
competitors, practiced, Sherman Act, practitioner, conspiracy, on-call, prices"
264,"Beverages, products, tortious interference, Bottling, customers, expectancy, territorial, exclusive territory, soft drink, 
bottler, alleges, distribute, interfered, manufacture, trademark, licensing, provisions, contracts, asserts, sales, third 
party, transshipping, tortiously, private right of action, false advertising, Brands, anti trust law, Lanham Act, 
consumers, licensee"
279,"Hosting, Web, customer, notice, terminate, unfair, alleges, business practice, disruptions, website, cancel, unjust 
enrichment, consumers, breach of contract, fraudulent, omission, email, prong, motion to dismiss, particularity, 
verification, disclose, fails"
286,"dealers, products, alleges, export, concerted action, relevant market, antitrust, purchasers, unjust enrichment, 
consulting, consumer, resale, fails, rule of reason, manufacturers, No-Export, markets, motion to dismiss, reasons, 
restraint of trade, anti trust law, interchangeable, cognizable, Counts, luxury"
292,"Sherman Act, motions, pending appeal, per se rule, price fixing, Pretrial, prices, bail, bid"
296,"notice, class member, restaurants, surcharge, Defendants', class action, ascertainable, card, Cartwright Act, 
damages, customers, records, class certification, certification, member of the class, conspiracy, questions, 
Adequacy, parties, Reply, staff, self-identify, predominate, employees, benefits, defenses, courts, individual class 
member, personal notice, common issue"
306,"advertisements, consumers, endorsement, courts, deception, consumer confusion, punitive damages, trademark, 
allegations, recommends, trademark infringement, motion to dismiss, non-consumers, images, appears, consumer 
protection, consumer-oriented, decisions, cause of action, featuring, Practices, damages, cases, media, deceptive 
practices, public interest, celebrities, photograph, products, prayer"
328,"benefits, plans, alleges, undersigned, provider, motion to dismiss, fiduciary duty, disclosure statement, reservation, 
promissory estoppel, claim for breach, recommend, unpaid, preemption, insured, breach of fiduciary duty, 
preempted, statutory penalty, documents, patients, Counts, terms, negligent misrepresentation, cause of action, 
benefit plan, coverage, argues, insurance company, confirmation, district court"
346,"antitrust, monopolize, Electric, alleges, conspiracy, Island, termination, wholesale, Merger, energy, power plant, 
competitor, qualifying, motion to dismiss, power generation, monopoly, electric utility, anti trust law, facilities, 
cancellation, consumers, fuel, restraint of trade, generation, plant, state-law, damages, prices, costs, fails"
367,"auction, redeem, properties, class member, bids, antitrust, Purchaser, class certification, certification, conspiracy, 
proposed class, predominance, parcel, sales, percent, bidder, property owner, class action, tax year, adequacy, 
damages, statute of limitations, alleged conspiracy, real estate tax, tax sale, redemption, grounds, discovery rule, 
commonality, numerosity"
376,"antitrust, non-compete, tortious interference, rule of reason, terminate, unfair competition, allegations, speculative, 
induced, harms, Unfairness"
381,"installation, landlord, injunction, consumers, dishes, class certification, injunctive relief, ascertainable, preliminary 
injunction, class action, class member, Plaintiffs', predominate, permission, documents, roof, unfair, satellite, merits, 
tenant, installation of equipment, authorization, questions, damages, courts, class representative, likely to suffer, 
satellite dish, certification, permanently"
400,"rights, television, Tournament, Plaintiffs', Sports, Defendants', alteration, bribery, conspiracy, bribes, bids, 
consumers, allegations, wire fraud, Sherman Act, quotation, marks, proximate cause, soccer, predicate act, 
domestic, fraudulent, tortious interference, antitrust claim, Counts, offers, commercial bribery, damages, parties, 
business relationship"
425,"classixx, Plaintiffs', sweater, argues, trademark, musical, apparel, likelihood of confusion, artistic, misappropriation, 
motion to dismiss, consumer, allegations, infringing, clothing, fails, marks, trademark infringement, restitution, 
garments, likeness, factors, selling, courts, common law misappropriation, unfair business practice, injunctive, 
similarity, message, unfair"
433,"Advisory, promise, motion to dismiss, Deadline, antitrust, counts, promissory estoppel, alleges, induce, restraint of 
trade, parties, argues, assign, fiduciary duty, unjust enrichment, particularity, commerce, loyalty, buyer, breach of 
contract, definite statement, statute of frauds, alleged breach, purchaser, terminate, warehouse, grounds, terms, 
pled, team"
444,"attorney general, documents, exemption, circuit court, merger, disclosure, Antitrust, Assurance, bid, Compliance, 
confidentiality, investigations, anti trust law, public record, orders, cooperative, unsealing, e-mails, proposed 
merger, certificate, bidding process, provisions, purposes, appeals, parties, moot"
459,"faculty, non-faculty, damages, no-hire, antitrust, class member, predominate, suppression, lateral, common 
question, faculty member, class-wide, defendants', hiring, medical school, class action, seniority, increases, 
asserts, proposed class, calculating, structures, questions, returns, certification, regression, salary, spread, class 
certification, individual issues"
471,"patch, pricing, predatory, barriers, amended complaint, argues, costs, leave to amend, allegations, amend, 
acquisition, entrants, supplier, variable, district court, monopolist, competitor, monopoly, plywood, repair, undercut, 
cases, factual allegations, consumers, discovery, discount, recoup, anticompetitive conduct, manufacturer, 
geographic"
481,"distributors, ceiling tile, alleges, argues, anti-competitive, monopoly power, products, business relationship, 
manufacturers, foreclosure, antitrust, tortious interference, Sherman Act, consumers, commerce, monopolization, 
foreclose, pleads, prices, competitors, domestic commerce, market share, contractors, effects, relevant market, 
probability, building materials, channels, domestic, fails"
493,"doorskins, Acquisition, antitrust, prices, summary judgment, damages, parties, manufacturers, lost profits, 
termination, anticompetitive, ripeness, plant, merger, molded, interior, door, claim for damages, laches, anti trust 
law, quotations, suppliers, asserts, effects, divestiture, speculative, conspiracy, injuries, notice, future damage"
507,"patent, license, patent misuse, licensees, pool, infringement, misuse, anticompetitive, equitable defense, rule of 
reason, damages, effects, obligations, briefing, Parties, royalty, negotiations, tying arrangement, injunctions, 
worldwide, Wideband, district court, convincing, principles, broadened, package, terms, procompetitive, equitable, 
inventors"
522,"emissions, Plaintiffs', consumers, engine, enterprise, allegations, regulations, fraudulent, diesel, defeat, damages, 
Polluting, omissions, argues, Defendants', preempted, clean, advertisements, consolidated, words, amended 
complaint, misrepresentations, premised, overpayment, courts, cases, mail, customers, wire, technology"
569,"league, conspiracy, district court, soccer, procompetitive, designation, preliminary injunction, anticompetitive, 
concerted action, direct evidence, antitrust, quotation, courts, merits, season, status quo, promulgation, stability, 
argues, adverse effect, divisional, benefits, top-tier, annual, marks, circumstantial evidence, restrictive alternative, 
likelihood of success, mandatory injunction, heightened standard"
583,"conspiracy, antitrust claim, antitrust, counterclaim, franchisee, franchise agreement, anti trust law, motion to 
dismiss, discounts, franchise, products, partial, pricing, counts, marks, unreasonable restraint, memorandum 
opinion, sell product, wholesaling, Unilateral, franchisor, quotation, steep"
586,"LIBOR, manipulation, plaintiffs', initial report, prices, class member, suppression, Rebuttal, artificiality, damages, 
models, traders, trading, trader-based, class certification, predominance, changes, rates, methodology, calculated, 
class action, but-for, banks, named plaintiff, Reply, reliability, transactions, Lender, opines, swap"
754,"sequencing, motion to dismiss, alleges, amended complaint, customers, intentional interference, declaratory 
judgment, argues, site, license fee, software, antitrust, probability, market power, monopolization, monopoly, 
license, survive, Counts, pled, factual allegations, motion to strike, relevant market, Sherman Act, sales, 
anticompetitive, expectancy, potential customer, place of business, false statement"
763,"PDFfiller, Software, Parties, zipForm, website, users, products, tied product, documents, third-party, counterclaims, 
commerce, allegations, competitors, consumers, monopoly power, relevant market, interchangeability, 
monopolization, antitrust, zipLogix, cases, market power, license, markets, pleadings, fillable, edit, pled, real estate"
787,"anticompetitive, sheriffs, immunity, displace, state action, antitrust, civil process, municipality, effects, government 
entity, motion to dismiss, articulation, delegate"
792,"Fiber, Lease, sites, non-circumvention, assign, Cellular, parties, summary judgment, Route, obligations, carriers, 
rights, asserts, customers, network, notice, provide a service, attorney's fees, Covenants, Compete, fiberoptic, 
Telephone, licensed, novation, restrictive covenant, Antitrust, binding, declare, obligor, unambiguous"
802,"Inline, patents, email, punitive damages, sleeve, deliberate, drawings, rights, invention, microwave, expert report, 
susceptor, asserts, amend, employees, designs, Hot, high probability, deposition, Packaging, state law, motion to 
amend, invalid, portions, argues, claim for punitive damages, present motion, bids, development agreement, federal 
court"
834,"state law, anti trust law, damages, antitrust claim, preempt, treble damages, federal law, state antitrust law, motion 
to dismiss, alleged violation, antitrust, lack of subject matter jurisdiction, conflict preemption, subject matter 
jurisdiction, joint and several, state law claim, antitrust case, grant a motion, civil action, participated, recoverable, 
conflicted, provisions, Leniency, amnesty, courts, divest, terms"
838,"consumer, dealership, motion to dismiss, parties, antitrust, products, consumer protection, security agreement, 
violations, distribution agreement, breach of contract, termination, geographic, indirect, terms, contractual, 
provisions, purchasers, fails"
844,"conspiracy, allegations, broiler, particularity, cuts, antitrust, prices, eggs, misleading, co-conspirators, defendants', 
misleading statement, motion to dismiss, falsity, circumstantial evidence, cut production, class period, price-fixing, 
competitors, heightened, indices, securities fraud, conspirators, omission, chicken, plant, pled, manipulation, 
coordinated, disclose"
854,"pleadings, alleges, outpatient, contracts, exclusionary, payors, partial judgment, Antitrust, surgical services, non-
written, insurers, exclusivity provision, summary judgment, HealthCare, buyer, tying arrangement, anti trust law, 
provider, argues, notice, exclusive contract, written contract, tied product, competitors, provisions, reimbursed, 
inpatient, monopoly"
863,"Plaintiffs', antitrust, factors, allegations, customers, proximate cause, anti trust law, prices, damages, fails, 
exchange rate, purchasers, broker, antitrust claim, Defendants', enforcer, indirect, trades, alleged conspiracy, 
motion to dismiss, consumer protection, state law claim, spot market, manipulate, currency, injuries, remote, 
injunctive relief, foreign currency, causal chain"
874,"enoxaparin, patent, generic, antitrust, Pharmaceuticals, alleges, antitrust claim, motion to dismiss, defendants', 
Collaboration, manufacturers, documents, deceived, restraint of trade, infringement, judicial notice, material cause, 
counterclaim, mandatory, monopoly, misuse"
882,"antitrust, Steel's, unfair act, unfair methods of competition, importation, Clayton Act, anti trust law, antitrust claim, 
Sherman Act, district court, articles, standing requirement, pricing, federal court, allegations, practices, antitrust 
violation, matter of law, parties, Notice, unfair trade practice, domestic, competitors, limitations, conspiracy, private 
party, trade secret, misappropriation, investigations, commerce"
913,"termination, immunity, alleges, Sherman Act, antitrust, supervision, dental, issue preclusion, conspiracy, motion to 
dismiss, patients, state action, articulated, providers, anti trust law, Defendants', contracts, contends, reasons, 
stems, anticompetitive conduct, antitrust violation, factual allegations, medical assistance, Additionally, conclusory, 
violations, dentists, Ethics, advice"
924,"discovery, premiums, discovery request, costs, purchaser, insureds, products"
928,"alleges, argues, privileges, fails, conspiracy, contends, motion to dismiss, craniofacial, pediatric, relevant market, 
patients, defamatory statement, Sherman Act, restraint of trade, defamation, tortious interference, cause of action, 
antitrust, reply, plastic surgery, immunity, private right of action, geographic, peer review, quasi-judicial, 
proceedings, conspired, prospective economic relations, administrative remedy, peer review process"
951,"patent, personal jurisdiction, amended complaint, antitrust, allegations, relevant market, Technology, hose, 
Products, geographic, anti trust law, competitors, monopolize, Defendants', manufacture, fraudulently obtain, 
motion to dismiss, non-disclosure, infringement, contacts, interchangeability, pleaded, transferred, immune, prong, 
antitrust violation, specific intent, anticompetitive, probability, prototypes"
969,"seafood, Trident, antitrust, processing, plant, relevant market, competitor, acquire, conspiracy, conspired, Protein, 
negotiations, crewmembers, subsidiary, markets, fish, management group, fishmeal, processing facility, anti trust 
law, infrastructure, groundfish, waterfront, shrimp, alleged injury, vessel owner, Sherman Act, fishermen, processor, 
tuna"
981,"antitrust, medallion, taxicab, monopolization, drivers, anti trust law, anticompetitive, anticompetitive conduct, 
probability, competitors, monopoly power, allegations, consumers, specific intent, market share, taxicab company, 
regulations, harms, achieving, prices, Sherman Act, predatory, alleys, rival, taxis, lower price, vehicles-for-hire, 
certificates, convenience, barriers"
996,"Plaintiffs', costs, attorney's fees, purchase order, matter of law, unfair, Supplier, damages, new trial, margins, 
Defendants', misrepresentation, conversion, courts, jury instructions, deceptive trade practices, prejudgment 
interest, conspiracy, employees, products, parties, contracts, taxable costs, concealment, overcharges, invoices, 
subsequent contract, deceptive, ownership, proximate"
1019,"rebate, alleges, misleading, drugs, generic, anticompetitive, investor, scienter, markets, misclassified, prices, 
misclassification, fail to disclose, products, disclosure, classification, calculations, Rates, pharmaceutical, antitrust, 
Annual, competitors, inflated, disclose, stock, securities law, generic drug, manufacturers, price-fixing, decisions"
1046,"student-athletes, athletic, procompetitive, restrictive alternative, Plaintiffs', benefits, effects, schools, summary 
judgment, attendance, basketball, football, amateurism, conferences, res judicata, expenses, relevant market, 
incidental, moving party, anticompetitive, purposes, consolidated, grant-in-aid, injunction, non-moving, educational 
expenses, collateral estoppel, tethered, summary judgment motion, financial aid"
1065,"purchaser, bids, auctions, conspiracy, Properties, redeemed, antitrust, rates, summary judgment, redemption, 
antitrust claim, indirect, bidder, civil conspiracy, tax year, anticompetitive, exemption, damages, monopoly power, 
tax sale, certificates, breach of fiduciary duty, money had and received, statute of limitations, redeem property, 
property owner, deposition, real estate tax, anti trust law, genuine"
1077,"printer, cartridges, ink, update, firmware, allegations, third-party, authorization, consumer, disabling, unfair, 
accesses, messages, non-HP, permission, omission, Knowingly, contends, box, replace, computer system, 
intentionally, compatible, violations, trespass, fraudulent, installed, warranty, damaged, business practice"
1091,"Agencies, intentional interference, third amended complaint, district court, allegations, talent, amend"
1097,"carrier, transport, network, termination, alleges, cards, third-party, telecommunications, customers, common carrier, 
affirmative defense, monopoly power, switching, offers, argues, transit service, anticompetitive, monopolization, 
enterprise, antitrust, monopoly, entity, transmission, charges, antitrust claim, counterclaims, motion to dismiss, 
Communications, wireless, minute"
1112,"Plans, blue cross, Marks, licenses, blue shield, service area, provider, license agreement, trademark, brand, 
licensees, Sherman Act, horizontal, products, health insurance, allocations, competitors, rule of reason, best efforts, 
antitrust, territorial, single entity, price fixing, entities, benefits, uncoupling, prices, insurers, compete, output"
1140,"alleges, borrower, motion to dismiss, amended complaint, servicer, mortgage, modification, injunctive, declaration, 
pleadings, damages, motion to strike, cause of action, recorded, default, Notice, unfair"
1145,"allegations, prices, consumer, products, advertising, Outlet, price tag, discount, tags, deceptive, plaintiff's claim, 
unfair, misleading, motion to dismiss, restitution, equitable relief, signage, cases, misrepresentations, bag, 
purchasers, in-store, courts, injunctive relief, marks, labeling, challenges, prevailing, violations, purported"
1165,"attend, dental, convention, defendants', communications, manufacturers, competitors, conspiracy, announced, 
dentists, email, associations, summary judgment, distributors, antitrust, boycott, summary judgment motion, 
Sherman Act, inter-firm, conspire, plans, deposition, Supplies, team, business relationship, tortious interference, 
aiding and abetting, pulling, Perks, partnerships"
1182,"damages, district court, actual damage, state law"
1187,"no right, no cause of action, purchaser, indirect, right of action, attorney general, cause of action, Monopolies, 
unjust enrichment, trial court, sustaining, partial, antitrust, asserts, manufacturers, commerce, raising, belong, 
peremptory, violations, damages, funds, operative fact, partial judgment, bring an action, civil penalty, bring suit, 
pharmaceutical, alleges, unfair"
1199,"bid, auction, Basin, bidders, Entities, damages, confidentiality agreement, competitor, no evidence, 
communications, participating, exploration, carbonate, basal, antitrust, contacted, partial, parties, acquisition, 
conspiracy, valuation, prospective business relationship, bid-rigging, confirmed, submit a bid, negotiate, entirety, 
drilled, Non-Circumvention, costs"
1242,"License, cause of action, alleges, Trademarks, registrations, restitution, breached, products, unfair, exclusive 
license, Counterclaim, disgorgement, estoppel, promise, fails, terms"
1248,"manufacturers, prices, extraterritoriality, dormant, drugs, out-of-state, commerce, regulation, generic, increased 
price, consumers, prescription drug, transactions, generic drug, borders, sales, majority opinion, distributors, 
violates, milk, wholesale, interstate commerce, in-state, stream, unconscionable, district court, strike down, 
affirmation, gouging, products"
1276,"patents, injunction, license, parties, infringement, injunctive relief, anti-suit, comity, enjoin, terms, seal, obligations, 
domestic, declarations, negotiations, insists, district court, contractual, terms and conditions, bifurcation, enforcing, 
factors, global, offers, breach of contract claim, injunction order, cross-license, vexatious, complied, royalty"
1290,"Farm, Plans, false claim, farming operations, alleges, spouse, statute of limitations, ownership interest, plaintiffs', 
limitations period, motion to dismiss, pled, defendants', conspiracy, private plaintiff, unjust enrichment, intervene, 
farm subsidies, ownership, interpreting, documents, district court, civil action, entities, minutes, intracorporate 
conspiracy doctrine, eligibility, fraudulent, amend, cases"
1312,"alleges, conversion, written contract, sweep, funds, terms, Counterclaims, Authorization, unfair, leave to amend, 
fraudulent, documents, Dining, prong, contractual relationship, negligence claim, deposit account, fails, breach of 
contract claim, unfair competition, claim for relief, quotation, argues, marks"
