Page,Core Terms
1615,"retailers, district court, products, discount, luggage, predominance, damaged, prices, class member, factors, 
purchases, commonality, questions, suggested retail price, pricing policy, class action, percent, sellers, decertify, 
antitrust, class certification, restraint of trade, rigorous, answers, bought, sales, summary judgment, consumers, 
inflated, modified"
1626,"license, cards, statute of limitations, manufacturers, damages, limitations period, formats, anti trust law, continuing 
violation, overt act, antitrust, restart, memory, antitrust action, district court, anti-competitive, equitable, royalty, 
accrue, flash"
1633,"purchaser, fraudulent concealment, due process, allegations, take place, time-barred, amend"
1644,"Equate, Migraine, packaging, unfair, consumer, website, red, misleading, omission, color, deceptive, active 
ingredient, misrepresentation, allegations, cases, advertising, effective, premised, fails, motion to dismiss, 
covenant, pricing, Online, prong, unjust enrichment, regulation, Purchaser, courts, dismissal with prejudice, 
restitution"
1658,"Purchasers, foam, increased price, prices, customers, Indirect, products, models, Defendants', damages, flexible, 
underlay, letters, antitrust, percent, conspiracy, regression, overcharge, slabstock, estimates, coefficients, billing, 
costs, manufacturers, scrap, announcements, variable, class member, class period, calculation"
1714,"allegations, substitutes, employees, products, relevant market, Trademark, motion to dismiss, Licensing, insurance 
agent, anticompetitive, commissions, labor market, defamation, argues, partial performance, cross-elasticity, 
defamatory, invested, parties, broker dealer, single-brand, Counts, pled, written agreement, rule of reason, 
ambiguous, antitrust, asserts, vested, brand"
1739,"arbitration, Coalition, arbitration clause, Banks, meetings, consumer, in-house, class action, attended, conspiracy, 
antitrust, cardholders, card, competitors, class-action-barring, credit card, collusion, invited, communications, 
clauses, agenda, conference call, arbitration provision, Plaintiffs', noticed, email, firms, infer, public relations, factors"
1781,"documents, communications, advice of counsel, attorney-client, advice, waived, discovery, donut, cooperatives, 
disclosure, asserting, parties, affirmative defense, withheld, marketing, privileged document, motion to compel, 
privilege log, legal advice, good faith, reflecting, antitrust"
1792,"student-athletes, broadcast, licensing, athletic, football, sports, likenesses, images, class certification, videogames, 
schools, games, procompetitive, footage, rights, summary judgment, basketball, antitrust, teams, right-of-publicity, 
reconsideration, promotes, right of publicity, highlight, cases, amateurism, players, courts, commercial speech, 
moving party"
1817,"Apple, parens patriae, damages, prudential standing, antitrust, e-books, redressability, publishers, class action, 
conspiracy, consumers, lawsuit, class certification, anti trust law, prices, federal court, injunction, causation, 
concrete, motion to dismiss, procedural right, recover damages, injury in fact, lack standing, price fixing, due 
process, articulated, contends, injuries, cases"
1831,"machines, customers, technologies, resin, district court, substitutes, products, prices, antitrust, locked, summary 
judgment, antitrust claim, licensing, argues, switch, tortious interference, contends, models, rapid-prototyping, 
manufacturer, submarket, grant summary judgment, increased price, aftermarket, patent, differentiated, purchasers, 
indicia, laser, relevant market"
1847,"clauses, titanium dioxide, forum-selection, district court, severance, newly, transferred, factors, purchases, prices, 
antitrust, parties"
1853,"merger, patients, effects, relevant market, secondary, products, market share, provider, tertiary, markets, rates, 
consumers, network, merging, concentrated, conditions, cluster, package, parties, prices, substitutes, competitor, 
antitrust, anticompetitive, analyzing, geographic, unilateral, firms, negotiating, enhance"
1868,"Defendants', trademark, unfair competition, misrepresentation, motion to dismiss, purchase order, allegations, 
conversion, footage, unfair, business practice, judicial notice, sponsorship, Temporary, documents, promoting, 
stations, notice, false designation, registered, television, consumer, trademark infringement, television show, 
common law, fraudulent, quotation, damages, agrees, famous"
1880,"allegations, trademark, unfair competition, motion to dismiss, argues, misrepresentation, conversion, agrees, 
contractual relationship, judicial notice, footage, notice, unfair, false designation, duty of care, sponsorship, 
damages, pleaded, induce, prospective economic advantage, intentional misrepresentation, intentional interference, 
negligent interference, trademark infringement, business practice, cause of action, intentional act, television show, 
third party, common law"
1899,"trademark, motion to dismiss, unfair competition, conversion, allegations, television, trademark infringement, 
distribute, registered, stations, unfair, business practice, false designation, deceive, agrees, judicial notice, 
ownership, pleadings, damages, argues, famous, marks, common law, quotation, consumer, dilution"
1908,"contractual relationship, unfair competition, allegations, conversion, motion to dismiss, judicial notice, trademark, 
negligent interference, false designation, common law, pleaded, unfair, prospective economic advantage, 
intentional interference, trademark infringement, cause of action, contracts, practices, dilution, damages, parties"
1916,"motion to dismiss, contractual relationship, allegations, intentional interference, conversion, contracts, ego, 
Declaration, pleaded, unfair, prospective economic advantage, negligent interference, judicial notice, Trademark, 
documents, disruption, ownership, agrees, intentional misrepresentation, business practice, judicially notice, 
intentional act, third party, misrepresentation, fraudulent, REQUESTS, damages, induce, negligent 
misrepresentation, unfair competition"
1927,"trademark, allegations, pleaded, motion to dismiss, damages, argues, contractual relationship, unfair competition, 
contracts, unfair, conversion, registered, stations, negligent interference, trademark infringement, 
misrepresentation, satisfactorily, distribute, television, requests, deceive, agrees, induce, notice, marks, prospective 
economic advantage, intentional misrepresentation, intentional interference, breach of contract, business practice"
1940,"Divestiture, final judgment, slots, Airport, gates, Acquirer, airlines, Facilities, merger, settlement, divested, 
Monitoring, consultation, carriers, comments, legacy, lease, Tunney Act, public interest, calendar days, predictions, 
routes, Antitrust, amici, remedies, merged, amicus brief, accomplished, compliance, fares"
1968,"patent, bad faith, district court, baseless, exceptional case, infringement, misconduct, prevailing party, 
circumstances, fee-shifting, vexatious, immunity, machines, cases"
1983,"Taxpayers, public works, renovation, Antitrust, trial court, bidding, public bidding, summary judgment, contracts, 
damages, contractor, entity, antitrust violation, antitrust claim, Defendants'"
1992,"Display, manufacturer, products, panels, personal jurisdiction, consumers, sales, due process, forum state, 
electronics, conspiracy, courts, stream of commerce, distributed, targeted, regular, prices, nationwide, chargers, 
contacts, marketed, battery, exercise of jurisdiction, attorney's fees, minimum contact, plurality, retailers, machine, 
percent, original equipment"
2013,"provider, cause of action, tutoring, rights, alleges, defendants', trial court, immune, federal regulation, regulations, 
reasons, funds, entity, constitutional right, demurrer, incomplete, provisions, violates, private right of action, unfair 
competition, plaintiff's claim, leave to amend, achievement, schools, fail to state a cause of action, rules and 
regulations, business practice, school district, state agency, discretionary"
2025,"costs, federal law, damages, attorney's fees, recommendation, non-taxable, expert witness fees"
