Page,Core Terms
21,"advertising, counterclaim, unfair, anti trust law, defamation, prong, motion to dismiss, networking, diligence, amend, 
allegations, competitors, collected, user, deadline, leave to amend, market power, Third-Party, antitrust, violates, 
scheduling order, analytics, privacy, courts, media, relevant market, market share, implicated, permission, platforms"
32,"Lyme, disease, guidelines, IDSA, asserts, argues, antitrust, insurance company, antitrust claim, conspiracy, no 
evidence, summary judgment, antibiotic, patients, genuine, coverage, health insurance company, monopolization, 
long-term, contends, nonmovant, discovery, panelists, replies, summary judgment motion, alleged conspiracy, 
present evidence, relevant market, material fact, allegations"
44,"allegations, listings, websites, Buyer, display, motion to dismiss, Lanham Act, consumers, misleading, real estate, 
antitrust, tab, relevant market, anticompetitive, licensed, complaint alleges, customers, labeling, harmed, Agent 
Commission Rule, Segregation, commissions, Offers, courts, false advertising, asserted claim, deceptive act, 
market power, implemented, conspiracy"
59,"Products, venue, Defendants', sales, witnesses, give rise, infringing, trademark infringement, motion to dismiss, 
proper venue, parties, reside, personal jurisdiction, improper venue, passing off, convenience, factors, unfair 
competition, common law claim, Lanham Act, deference, distributed, Coconut, occurs, importation, favors, weigh, 
lack of personal jurisdiction, choice of forum, inconvenient"
80,"Games, developers, platforms, consumers, users, mobile, transactions, in-app, purchases, Switch, restrictions, 
prices, effects, customers, console, market power, players, digital, costs, streaming, market share, provisions, 
features, markets, anticompetitive, products, substitution, aftermarket, download, intellectual property"
240,"cause of action, conversion, in-person, promise, demurrer, leave to amend, unfair, Policies, tuition, unjust 
enrichment, contract claim, lectures, online, integration clause, final examination, catalogue, courts, amend"
245,"antitrust, anesthesiologists, pricing, anesthesiology, reimbursement rate, alleges, patients, consumers, predatory, 
insureds, providers, network, output, competitors, conspiracy, artificially, buyer, practices, anti trust law, 
anticompetitive, factors, conversion factor, depressed, harmed, health insurer, reimbursement, facilities, Shield, 
inputs, district court"
263,"beer, wholesalers, brands, distributor, alleges, market power, manufacturers, products, prices, monopolization, 
monopoly power, retailers, market share, distribute, antitrust, adverse effect, Sherman Act, competitors, argues, 
relevant market, courts, fails, anticompetitive, contractual, horizontal, vertical, promotion, declaratory judgment, 
consumers, high-end"
278,"Defendants', cattle, motion to dismiss, beef, Purchaser, Plaintiffs', slaughter, Indirect, consumer protection, prices, 
conspiracy, Producer, volumes, per head, allegations, antitrust, unjust enrichment, margins, packers, reductions, 
Approve, Practices, email, anticompetitive, coordinated, factors, courts, claim for damages, fourth quarter, 
unconscionable"
299,"alleges, landfills, personal jurisdiction, customers, prices, defendants', subsidiaries, competitors, motion to dismiss, 
market share, antitrust, contracts, monopolization, predatory, disposal, owns, anticompetitive conduct, monopoly 
power, residential, Recycling, quotation, marks, amended complaint, plaintiff's claim, waste disposal, ownership, 
barriers, monopoly, lock, vertical integration"
311,"press release, allegations, blog, aircraft, lawsuit, cases, posts, public interest, incidental, contractual relationship, 
trade secret, Reply, argues, patent, communications, quotation, criminal investigation, confidential, disruption, 
appears, designs, marks, eVTOL, misappropriated, privileged, campaign, website, intellectual property, substantial 
interest, third party"
330,"registration, trademark, counterclaims, fraudulent, allegations, Lanham Act, cross-appeal, procure, antitrust, patent, 
lamp, Sherman Act, Recommendation, monopolization, cause of action, immunity, allege fraud, trade dress, 
damages, sham, statute of limitations, fraud claim, cancellation, argues, anti-competitive, notice, motion to dismiss, 
functionality, registered, grounds"
346,"patent, Shuffle, prior art, antitrust, Shuffler, reexamination, infringement, invalid, statute of limitations, summary 
judgment, lawsuit, accrued, settle, settlement agreement, inequitable conduct, allegations, pre-filing, settlement, 
discovery, reason to know, unenforceable, proceedings, initiation, references, undermines, four-year, parties"
353,"antitrust, supplements, consumers, nutritional, geographic, monopolization, relevant market, products, summary 
judgment, television programming, genuine dispute, material fact, Sherman Act, customers, purposes, vendors, 
direct response, matter of law, competitors, substitutes, practices, submarket, monopoly, parties, prices, unfair"
361,"website, Google, Plaintiffs', users, internet, trespass to chattel, advertising, conversion, display, domain name, 
rights, unjust enrichment, phone, superimposed, screens, homepage, tangible, prong, preemption, unfair, web, 
implied-in-law, Carpet, click, intangible property, subject matter, competitors, obscured, software, browser"
374,"antitrust, conspiracy, allegations, cooperate, funding, medical school, Sherman Act, anticompetitive, anticompetitive 
conduct, competitor, communicated, motion to dismiss, entities, demands, meeting of the minds, anti trust law, 
monopoly power, healthcare, pleadings, argues, monopolization, exclusionary, contends, restrain, survive, 
conclusory allegation, antitrust violation, restraint of trade, referrals, coercion"
396,"merchants, class member, injunctive relief, class action, class certification, settlement, class representative, 
Plaintiffs', equitable relief, Defendants', opt-out, certification, proposed class, injunctive, courts, adequacy, opt out, 
interchange, mandatory, rights, cohesion, certify, ascertainability, damages, notice, due process, commonality, 
cases, claim for damages, honor-all-cards"
503,"patents, aggregation, markets, complementary, substitutes, pricing, supracompetitive, allegations, anti-SLAPP, 
anticompetitive, infringement, assertions, effects, output, protected activity, parties, suits, patent infringement, right 
of petition, antitrust claim, market power, free speech, target, cause of action, complements, royalties, serial, motion 
to dismiss, relevant market, antitrust"
517,"cause of action, demurrer, unauthorized practice of law, grounds, leave to amend, demur, tortious interference, 
probate, inheritance, sustain a demurrer, motion to strike, disruption, appears, unfair, unfair business practice, 
business practice, allegations, purported, prospective economic advantage, lack standing, sustaining, defects, 
confer, reasonable possibility, grant leave to amend, third party, benefits, damages, notice, fails"
528,"district court, antitrust, non-repealer, choice of law, purchasers, damages, consumers, license, predominance, 
cellphones, indirect, class certification, state law, Sherman Act, residents, patents, certification, violations, in-state, 
anti trust law, class action, class member, practices, suppliers, vacate, governmental interest, place of wrong, 
anticompetitive, injunctive, commerce"
546,"commercial activity, satellite, antitrust claim, domestic, offset, import, antitrust, commerce, military, Sherman Act, 
allegations, effects, four year, sovereign, gravamen, foreign sovereign immunities, statute of limitations, competitor, 
purchaser, asserts, powers, remote, subject matter jurisdiction, expropriation, exercises, Space, cases"
559,"cy pres, funds, Foods, designee, Consolidated, settlement, tomato, antitrust, Consumer"
564,"Defendants', motion to dismiss, antitrust, personal jurisdiction, conspiracy, antitrust claim, manipulation, assigned, 
transactions, lack of personal jurisdiction, Traded, convey, lack of subject matter jurisdiction, allegations, Sherman 
Act, non-defendants, derivatives, instruments, contacts, domestic, extraterritorial, substituted, entities, damages, 
lawsuit, prices, cases, factual allegations, alleged conspiracy, speculative"
580,"software, customers, alleges, Supplemental, contracts, deferred tax, antitrust, competitor, technological, markets, 
innovation, products, consumers, anticompetitive, mattresses, stranger, tortious interference, monopoly, prices, 
output, consulting, antitrust violation, preparedness, anti trust law, compete, trade secret, courts, entity, utility 
customer, visco-elastic"
606,"Purchasers, credit bureau, scores, indirect, consolidated, appointed, Interim, antitrust, monopoly, damages, bought, 
cases, team, treble damages, conspiracy, consumers, includes, prices, Reply, motion to dismiss, related action, 
state law"
615,"designation, Counterclaims, complex business, mandatory, deceptive trade practices, anti trust law, Notice, unfair, 
breach of contract, material issue, pleaded, invoke"
617,"conspiracy, restraint of trade, summary judgment, res judicata, law firm, homeowners, antitrust claim, final 
judgment, rental, entities, mobile, nonmoving, conspire, monopolize, splitting, parties, purposes, genuine, legal 
theory, mobile home, standardized, antitrust, monopoly, merits, cases, same cause of action, concerted action, 
personal stake, rent increase, allegations"
628,"retailers, alleges, motion to dismiss, distributors, amended complaint, RECOMMENDS, commissions, 
counterclaims, tortious interference, terminate, affirmative defense, pled, unjust enrichment, sales, motion to strike, 
defamation, reasons, promissory estoppel, Antitrust, fails, leads, economic loss rule, third party, respectfully, 
competitors, conversion, network, parties, courts, civil conspiracy"
654,"Insured, successor, wholly owned, coverage, named insured, grantee, limited partnership, ambiguous, deed, 
argues, summary judgment, Entity, convey, general partner, subsidiary, assisted living facility, dissolution, parties, 
holds, time of conveyance, limited partner, merger, vacant, terms, summary judgment motion, title insurance policy, 
matter of law, bad faith, reorganization, consolidation"
667,"concealed, settlement agreement, unfair, cause of action, conspiracy, material fact, induced, fraudulent, rights, 
relinquished, alleges, attorney's fees, suppressed, Damages"
672,"concealed, settlement agreement, unfair, cause of action, conspiracy, material fact, induced, fraudulent, rights, 
relinquished, alleges, attorney's fees, suppressed, Damages"
677,"printers, cartridges, updates, firmware, allegations, transmission, consumers, argues, toner, motion to dismiss, 
judicial notice, message, authorization, damages, contends, unfair, prong, permission, non-HP, accessed, 
webpages, dynamic, notice, collecting, computer system, intentionally, third-party, printing, courts, incorporate by 
reference"
691,"N Law, timeshare, lawsuit, preliminary injunction, counterclaim, exit, anticompetitive, courts, Vacations, conspiracy, 
quotation, marks, injunction, antitrust, anti trust law, allegations, prong, customers, sham, asserts, movant, 
consumers, parties, injunctive relief, cause of action, competitors, contracts, avers, trade association, 
demonstrating"
710,"Patient, unfair, misrepresentation, verification, out-of-network, Plaintiffs', benefits, pre-authorization, allegations, 
scheduled, consumers, promise, rates, leave to amend, fee claim, reimburses, coverage, billing, priced, negligent 
misrepresentation, out-of-pocket, particularity, providers, eligible, estoppel, courts"
717,"platforms, trading, pricing, allegations, investors, dealers, odd-lot, conspiracy, Bonds, corporate bond, retail, 
Plaintiffs', spreads, boycott, Defendants', electronic, group boycott, odd, non-Defendant, antitrust, transparency, 
communications, round, traders, transactions, market share, alleged conspiracy, invested, concentrated, round lot"
753,"patent, Counterclaim, patents-in-suit, inequitable conduct, affirmative defense, products, biasing, contacts, pleaded, 
allegations, motion to dismiss, mismarking, magnetic, deceive, license, cradle, expectancy, antitrust, inventor, 
patent application, co-inventor, accusation, contends, reasonable inference, relevant market, leave to amend, 
anticompetitive, monopolization, competitors, cognizable"
766,"Global, registration, allegations, agrees, brand, fraudulent, fraudulent inducement, unfair competition, promised, 
website, Media, trademark, rebranding, trademark infringement, intellectual property, announcement, advertising, 
Profile, damages, prong, registered, argues, false advertising, false designation, cause of action, procurement, 
domain, unfair, motion to dismiss, cancellation"
779,"alteration, rule of reason, Plaintiffs', discovery, amend, leave to amend, undue delay, deadline, new theory, 
antitrust, email, undue prejudice, new claim, marks, relevant market, district court, italicization, allegations, 
quotation, litigate"
790,"elasticity, generic, cross-price, relevant market, ezetimibe, prices, drugs, medications, anti-trust, products, 
cholesterol-lowering, cholesterol, formulary, RECOMMENDS, settlement agreement, patent, anti-competitive, 
manufacturers, reliable, material fact, market power, substitutes, statins, sales, placement, genuine, summary 
judgment, experiments, disputed, patients"
812,"terminate, Merger, succeed, covenants, anti trust law, assign, Counterclaims, specific performance, antitrust, 
breached, acquire, inhibitor, parties, allosteric, preliminary injunction, pharmaceutical company, argues, acquisition, 
notice, assignment provision, cooperate, rights, injunction, purported, prevail, merits, anticompetitive, 
deucravacitinib, unilaterally, entitles"
836,"forum non conveniens, antitrust, venue provision, courts, anticompetitive, acquire, lawsuit, district court, Sherman 
Act, factors, convenience, manufacturers, subsidiary, suppliers, alleges, grounds, venue, choice of forum, 
violations, deference, domestic, cases"
845,"database, trade secret, cubes, abstract idea, customers, asserts, products, processing, Reply, documents, 
inventive, analytical, contends, mapping, marks, confidential, enterprises, methodology, license, software, Batched, 
conventional, argues, Merge, motion to exclude, responds, patent, cross-elasticity, routine, summary judgment"
883,"overcharge, retailers, tanks, regression, pricing, propane, Plaintiffs', customers, pass-through, predominance, class-
wide, purchaser, class period, individualized, class certification, estimate, indirect, reduction, averages, studies, 
spare, fill, retail customer, variables, wholesale price, aggregated, negotiated, masking, class member, reliable"
898,"attorney's fees, costs, damages, good faith, final judgment, undersigned, hourly rate, parties, offers, Plaintiffs', 
punitive damages, particularity, Defendants', settlement, partial, anti trust law, pre-empted, antitrust, expenses, 
settle, claim for punitive damages, nontaxable, discovery, billing, counts"
906,"trading, alteration, Clearing, Brokerage, restrictions, Investors, conspiracy, quotation, marks, positions, collateral, 
communications, allegations, firms, stock, email, prices, Retail, orders, shares, Introducing, broker, buy, 
transactions, Defendants', purchasing, motive, market volatility, coconspirators, conspire"
935,"regulated, insurer, insurance business, insurance industry, state law, anti trust law, antitrust, prong, Uniformity Rule, 
pharmacies, telemetry, entities, argues, exempt, horizontal, subscriber, spread"
942,"anti-SLAPP, citizen's petition, petitions, commercial speech, investors, Patent, cause of action, prior art, probable 
cause, diazepam, argues, defamation, patients, nasal, comments, litigation privilege, pharmaceuticals, audience, 
prevail, exemption, products, spray, malicious prosecution claim, lack of probable cause, superior court, drugs, 
malicious prosecution, reasonable likelihood, second prong, new drug"
975,"alleges, engine, fuse block, unfair, stalling, warranty, motion to dismiss, contends, prong, manufacturer, Song-
Beverly Act, terminal, repairs, motor vehicle safety, express warranty, consumers, Bulletin, implied warranty, 
regulations, relay, displayed, emissions, predicate, message"
982,"generic, damages, issue preclusion, tentative approval, plaintiffs', brand, manufacturers, defendants', antitrust, 
prices, drugs, purchasers, preclusion, monopoly power, material fact, letters, parties, prior litigation, summary 
judgment, relevant market, injuries, courts, anticompetitive, asserting, delayed, burden of proof, genuine dispute, 
pharmaceuticals, relitigating, overcharges"
997,"antitrust, merchants, damages, cards, Anti-Steering, appellants', district court, anti trust law, efficient-enforcer, 
antitrust violation, proximate cause, speculative, steering, factors, first step, enforcers, umbrella, cardholders, 
networks, prices, competitors, indirect, injuries, credit card company, credit card, proximately, first-step, customers, 
duplicate, Non-Amex"
1010,"SCU, parking, promise, in-person, implied-in-fact, motion to dismiss, prong, on-campus, unfair, moot, law student, 
refund, credits, fair dealing, allegations, semester, contract claim, law school, tuition, exempt, facilities, breached, 
campus, Reply, first amended complaint, parking permit, argues, judicial notice, bulletins, fails"
1032,"Indictment, price-fixing, non-prosecution, price fixing, Sherman Act, conspiracy, declaration, alleges, oral 
agreement, buyers, terms, per se violation, essential terms, per se rule, antitrust, courts, parol evidence rule, wage 
fixing, cooperate, lenity, prices, motion to dismiss, horizontal, interview, parties, sellers, fix prices, quotations, 
ambiguity, argues"
1050,"markets, developers, smartphone, relevant market, antitrust, allegations, motion to dismiss, antitrust claim, 
aftermarket, consumers, single-brand, products, foremarket, two-sided, downstream, platform, marketplace, 
software, users, stamps, enhanced, transactions, suppression, userbase, brand, enterprise, onboarding, internet, 
preliminary injunction, cross-elasticity"
1070,"cases, appointed counsel, fee award, incentive award, settlement, expenses, declining, named plaintiff, auction, 
antitrust, bid, sophisticated, entities, class action, settlement fund, market rate, one-third, class member, courts"
1087,"suppliers, seat, alleges, forum non conveniens, domestic, boycott, courts, lawsuit, motion to dismiss, antitrust, 
contracts, commerce, covers, termination, affiliates, automotive, witnesses, subsidiaries, defendants', grounds, anti 
trust law, manufactured, litigating, delivery, adequate alternative, antitrust claim, convenient, documents, effects, 
reasons"
1104,"immunity, parte, plaintiffs', subject matter jurisdiction, entity, motion to dismiss, state action, court reporting"
1109,"cases, appointed counsel, fee award, incentive award, settlement, expenses, declining, named plaintiff, auction, 
antitrust, bid, sophisticated, entities, class action, settlement fund, market rate, one-third, class member, courts"
1124,"team, antitrust, group boycott, speculative, alleges, host, price-fixing, prices, relocation, franchises, Defendants', 
hypothetical, stadium, consumer, horizontal, output, alleged injury, supracompetitive, league, anti trust law, district 
court, traceability, attractive, contends, boycott, causal chain, damages, competitive market, anticompetitive, factors"
1145,"Destination, consumers, alleges, motion to dismiss, unfair, omission, misleading, disclosure, deceptive, disclose, 
shipping, prong, unjust enrichment, average consumer, misrepresentation, manufacturers, dealer, label, actual cost, 
fraudulent, prohibits, stickers, violates"
1151,"telescope, district court, manufacturing, damages, conspiracy, monopolize, competitor, antitrust, prices, email, 
acquisition, acquire, jury's verdict, conspired, bid, Entities, buy, relevant market, monopoly power, market share, 
overcharges, percent, terms, injunction, calculate, injunctive relief, specific intent, anti trust law, anticompetitive, 
parties"
1172,"Fuel, generic, injunction, settlement, regulates, dormant, merits, preliminary injunction, settlement agreement, 
declaration, patent, ripeness, sales, public interest, pharmaceutical, litigating, violates, asserts, argues, irreparable 
harm, economic injury, manufacturers, brand-name, parties, likelihood of success, civil penalty, extraterritoriality, 
contends, succeed, interstate commerce"
1183,"customers, alleges, counterclaims, products, software, networking, misrepresentation, antitrust, markets, 
competitors, purchasers, fails, secondary market, reseller, pleaded, secondary-market, misleading, license, 
package, genuine, consumers, switches, declaratory judgment, counterfeit, violates, harmed, maintenance 
services, motion to dismiss, leave to amend, channels"
1197,"immunity, rebates, state-action, anti-rebate, supervision, policies, articulated, customers, restrain, state policy, anti-
competitive, alleges, Sherman Act, antitrust, buyers, rights, real estate licensee, regulation, broker, member of the 
board, real estate license, state agency, state law, recommendations, conspiracy, license, motion to dismiss, official 
capacity, active market, appointed"
1211,"allegations, micro-irrigation, geographic, firms, growers, Defendants', Irrigation, markets, manufacturers, 
acquisition, antitrust, design services, relevant market, consumers, warranty, tubing, market power, customers, 
products, merger, sales, market share, zip code, recycled, deceive, anti trust law, conclusory, motion to dismiss, 
local market, storefronts"
1226,"generic, brand, class member, Decertify, Surreply, seal, antitrust, argues, damages, plaintiffs', consumers, updated, 
loyalists, class certification, overcharges, sustain an injury, class action, asserts, Reply, purchases, class 
representative, uninjured, but-for, leave to file, prices, named plaintiff, reimbursed, contends, switched, certification"
1259,"discovery, purchasers, downstream, overcharge, turkey, indirect, Defendants', antitrust, pass-through, Reply, 
motion to compel, products, cases, damages, requests, pricing"
1267,"purchaser, racketeering, indirect, civil conspiracy, motion to dismiss, civil action, courts, antitrust statute, antitrust, 
highest court, state law, state-law, predict, cause of action, federal court, violations, survives, underlying claim, 
interpreting, consumers, insulin, consumer fraud, provisions, damages, drug manufacturer, construing, products, 
factual allegations, anti trust law, allegations"
1288,"antitrust, donations, synthetic, programs, manufacturing, prescribing, acquisition, co-pay, post-petition, 
prescriptions, patients, prices, funds, license, contributions, policies, sales, alleged injury, rights, Pharmaceuticals, 
competitor, compliance, products, induce, regulatory scheme, antitrust claim, long-acting, but-for, disease, 
proximate cause"
1311,"Player, Arbitration, Regulations, argues, certification, antitrust, motion to dismiss, anti trust law, exemption, 
allegations, bargaining, basketball player, negotiating, exam, Hurley's Sherman Act, anticompetitive, nonstatutory"
1320,"pharmacy, patients, medical treatment, Codey Law, pharmacists, practitioner, medical practice, tests, drugs, 
equitable estoppel, pharmaceutical, collaborative, anti-competitive, healthcare services, drug therapy, prescriptions, 
regulations, dispensing, licensed, ordering, argues, disease, beneficial interest, supervision, laboratory, includes, 
physician-owned, monitoring, modifying, clinical"
1329,"conspiracy, communications, summary judgment, boycott, terminate, website, dealers, heavy construction, antitrust, 
used equipment, no evidence, Defendants', summary judgment motion, alleged conspiracy, threats, tortious 
interference, independent action, direct evidence, manufacturers, inferred, speculation, auction, email, business 
relationship, amended complaint, negotiations, parallelism, asserting, conscious, consign"
1345,"interest rate, injunction, variable, plaintiffs', loans, consumer, merits, preliminary injunction, price fixing, banks, 
defendants', likelihood of success, contracts, formula, price-fixing, irreparable, conspiracy, antitrust, parties"
1355,"antitrust, horses, racetracks, Defendants', motion to dismiss, relevant market, anticompetitive, Sur-Reply, alleges, 
racing, anti trust law, compete, tracks, harness racing, enforcers, group boycott, stable, ban, interchangeability, 
competitors, train, rule of reason, actual injury, courts, state law claim, horse owner, violations, boycott, damages, 
factors"
1401,"generic, conspiracy, settlement agreement, patents, personal jurisdiction, manufacturer, direct evidence, alleges, 
launching, output, pleads, brand, motion to dismiss, generic drug, competitors, antitrust, discovery, infringed, 
selling, collapse, contacts, conspirators, permission, pharmacy, invalid, license, argues, amend, fails, monopolize"
1433,"antitrust, district court, Banks, conspiracy, third party, Bondholder, antitrust claim, personal jurisdiction, bonds, co-
conspirator, marks, suppression, quotation, transactions, allegations, enforcer, factors, contacts, damages, 
minimum contact, anti trust law, purchases, cases, manipulate, alleged conspiracy, overt act, Defendants', 
products, parties, injuries"
