Page,Core Terms
1452,"equitable relief, damages, entity, costs, enterprise, expenses, private plaintiff, restraining order, attorney's fees, 
alleges, monetary damages, treble damages, legislative history, courts, uncontested, equitable remedy, 
documentation, violations, cases, wire, abuse of process, promissory note, investors, remedies, Default, redress, 
motion for default, default judgment, interim relief, gap"
1467,"district court, privileges, terminated, state-law, administrative remedy, allegations, admitting, exhausted, argues, 
cases, supplemental jurisdiction, private right of action, hospital administrator, discrimination claim, review 
committee, antitrust claim, anti trust law, federal claim, two year, Health Care Quality Improvement Act, right-to-sue, 
correctly, surgeon, notice, refile, tolled"
1471,"allegations, relevant market, antitrust, developers, antitrust claim, fails, markets, Guidelines, products, users, single-
brand, removal, distributing, quotation, marks, cross-elasticity, anticompetitive, brand, motion to dismiss, anti trust 
law, leave to amend, alleged facts, interchangeability, threshold, remedies, reasons, substitutes, geographic, 
violations, consumers"
1481,"allegations, Redacted, acquisitions, networking, users, monopoly power, market share, consumers, barriers, 
anticompetitive, Platform, policies, competitors, monopoly, antitrust, Chair, metrics, courts, time spent, contends, 
recusal, relevant market, authorize, switching, views, monopolist's, quotation, effects, marks, anticompetitive 
conduct"
1508,"iPic, theater, clearance, conspiracy, film, distributors, requests, antitrust, alleges, summary judgment, conspire, 
Studio, clearing, email, movie, zone, self-interest, communicated, day-and-date, act independently, first-run, factors, 
opened, plans, exhibitor's, implausible, competitor, megaplex, license, alleged conspiracy"
1529,"Shkreli, pyrimethamine, generic, manufacturing, bottles, supplier, pharmaceutical, sales, generic drug, pharmacy, 
patient, testing, customers, distributors, drugs, competitors, acquire, relevant market, products, specialty, 
pharmaceutical company, toxoplasmosis, disgorgement, compounded, anticompetitive, tablet, launch, branded, 
profits, prices"
1574,"Facebook, Advertisers, Consumers, users, network, media, developers, Acquire, online, allegations, gaming, 
mobile, competitors, Kill, products, interchangeable, Markets, privacy, data privacy, Platform, third party, antitrust, 
false representation, friends, motion to dismiss, anticompetitive, prices, monopoly power, acquisition, sharing"
1636,"subsidiaries, unfair, removal, monopolization, cases, prong, citizenship, federal law, competitors, state court, 
diversity jurisdiction, federal court, federal issue, consumer, parties, district court, assigned, anti trust law, state law, 
assignor, courts, allegations, personal jurisdiction, federal question, violates, motion to dismiss, assignee, asserts, 
subject matter jurisdiction, state law claim"
1654,"Manufacturer, alleges, prices, negotiations, antitrust, conspiracy, rebates, insulin, medications, unjust enrichment, 
increased price, courts, money had and received, civil conspiracy, misrepresentations, oligopolists, price-fixing, 
motion to dismiss, health plan, purchaser, market share, formulary, consumer, statute of limitations, placement, 
compete, factors, chain, cause of action, give rise"
1667,"damages, dealers, Defendants', prices, conspiracy, vendors, calculate, antitrust, providers, queries, factors, opines, 
prompt, integration, dealership, methodology, overcharges, unilateral, estimate, Profile, switching, third-party, 
reasons, technological, costs, alleged conspiracy, Plaintiffs', reliability, blocking, summary judgment"
1718,"marks, infringement, alleges, registered, secondary meaning, motion to dismiss, counterfeiting, photographs, 
trademark, products, quotations, abbreviation, tags, registration, advertising, consumer, factors, rebut, likelihood of 
confusion, trademark infringement, district court, sophistication, incontestable, similarity, imitation, display, cases, 
purchasers, discovery, in-store"
1734,"Plaintiffs', sheets, labeled, thread count, counts, Defendants', thread, futile, warranty, notice, written warranty, 
named plaintiff, promise, amended complaint, unjust enrichment, allegations, negligent misrepresentation claim, 
misrepresentation, cases, particularized, manufactured, consumer, Textiles, products, motion to amend, concrete, 
tested, motion to dismiss, claim for breach, implied warranty"
1750,"cemeteries, interstate commerce, preliminary injunction, tours, argues, Defendants', guides, subject-matter, 
antitrust, nexus, tourists, voucher, irreparable injury, motion to dismiss, out-of-state, irreparable harm, monetary 
damages, supplemented, injunction, visitors, tourism, movant, general public, Gulf, golf"
1762,"non-solicitation, allocate, horizontal, co-conspirator, employees, indictment, naked, no-hire, allegations, 
defendants', soliciting, conspiracy, procompetitive, new category, courts, senior employee, price fixing, competitors, 
terms of the agreement, motion to dismiss, anticompetitive, ancillary, customers, falls, per se violation, legal 
argument, rule of reason, inappropriate, Violations, compliance"
1771,"patent, Antitrust, Pharmaceuticals, anti-VEGF, terms, tortious interference, antitrust claim, parties, vial, syringe, 
motion to dismiss, products, alleges, cases, interchangeability, inter partes, equitable estoppel, monopolization, 
prefilled, courts, inventor, words, statute of limitations, contributions, infringement, competitors, proceedings, 
simplified, consumers, discovery"
1793,"trader, conspiracy, spreads, chat room, banks, responded, Defendants', widen, antitrust, currency, wider, 
competitors, prices, interdependence, conspirator, trading, participated, summary judgment, encouraged, alleged 
conspiracy, co-conspirators, quotation, global, pairs, common goal, sharing, venture, motive, marks, circumstantial 
evidence"
1810,"generic, patent, manufacturer, Purchaser, settlement, allegations, brand, Plaintiffs', unjustified, settlement 
agreement, motion to dismiss, Defendants', anticompetitive, expiration, reverse-payment, antitrust, Retailer, 
products, litigation costs, term sheet, pleaded, anti trust law, parties, nebivolol, fair value, Complaints, side 
agreement, competitors, negotiate, terms"
1845,"alleges, motion to dismiss, quotation, marks, tolled, state-law, leave to amend, Defendants', discovery rule, 
kickbacks, immunity, sovereign immunity, absolute immunity, accrual, patient, cause of action, statute of limitations, 
limitations period, antitrust claim, peer review, overt act, violations, antitrust, accrues, parties, suits, disciplinary, 
courts, discover, dismissal with prejudice"
1862,"fraudulent concealment, summary judgment, Partial, Steel, statute of limitations, antitrust, give rise, indictment, 
diligence, tolled, downsizing, email, tuna, triable issue of fact, limitations period, antitrust claim, material fact, 
moving party, documents, nonmoving, genuine, notice, prices, constructive knowledge, federal claim, conspiracy, 
excite, summary judgment motion, affirmative act, state law claim"
1884,"cause of action, unfair, parties, demurrer, loans, Deed, concealed, alleges, contractual, consumer, Foreclosure, 
leave to amend, disclose, Notice, courts, defendant's conduct, business practice, unjust enrichment, tentative 
ruling, restitution, suppressed, frustrate, recorded, tethered, fails"
1892,"Manufacturer, alleges, prices, conspiracy, pharmacy, antitrust, purchaser, diabetes, medications, motion to dismiss, 
Insulin, co-conspirator, unjust enrichment, formulary, drugs, consumers, indirect, conspired, price-fixing, payors, 
inflated price, at-issue, civil conspiracy, courts, proximate causation, money-had-and-received, intermediaries, 
overcharge, rebates, amended complaint"
1906,"deposition, subpoena, discovery, documents, notice, motion to compel, Chicken"
1922,"Align, dentists, patents, plaintiffs', consumers, dentist-directed, motion to dismiss, interoperability, cooperative, 
Cartwright Act, direct-to-consumer, allegations, termination, compete, reasonably necessary, infringement, scanner, 
selling, procompetitive, ancillary, naked, anti trust law, rule of reason, horizontal, concerted, covenant, customer"
1930,"Steel, slab, domestic, tariffs, antitrust, requests, imported, conspiracy, alleges, Defendants', motion to dismiss, 
manufacturing, producer, argues, national security, plate, steel products, contracts, conspire, products, 
creditworthiness, announced, state-law, finished, meetings, sham, tortious interference, alleged conspiracy, anti 
trust law, self-interest"
