Case Index,Core Terms
Case 77,"transmission, asserts, Station, rates, rights, proceedings, Interim, electric, damages, energy, state law, Substation, 
preemption, argues, courts, filed rate doctrine, motion to dismiss, refund, terms, hypothetical, allegations, delivery, 
contract claim, retroactive, generating, primary jurisdiction, field preemption, contracts, deliver, notice"
Case 78,"antitrust, Counterclaim, trademark, leave to amend, sham, asserts, affirmative defense, unfair competition, 
monopolization, notice, intentional misrepresentation, motion to strike, patent, allegations, lose money, litigation-
related, anticompetitive, infringement, tentatively, immunity"
Case 79,"antitrust, Counterclaim, trademark, leave to amend, sham, asserts, affirmative defense, unfair competition, 
monopolization, notice, intentional misrepresentation, motion to strike, patent, allegations, lose money, litigation-
related, anticompetitive, infringement, tentatively, immunity"
Case 80,"tire, sanctioning, racing, track, antitrust, supplier, bodies, dirt, contracts, promoters, Racer, anti trust law, distributor, 
oval, bid, exclusive contract, sprint car, manufacturer, drivers, summary judgment motion, monopolize, Speciality, 
alleges, Sports, sprint, summary judgment record, anticompetitive, demonstrates, Modified, relevant market"
Case 81,"pricing, advertising, anticompetitive conduct, predatory, discounts, competitor, customers, allegations, secret, 
antitrust, probability, unearned, destroy the competition, cases, costs, pled, motion to dismiss, anticompetitive, 
monopolize, monopoly, specific intent, monopoly power, directory, predation, losses, recoup, rivals, false and 
misleading, yellow pages, bay area"
Case 82,"motion to amend, amend, affirmative defense, counterclaim, cause of action, tortious interference, guarantor, rights, 
futile, independent contractor, Provider, session, motion to dismiss, Noerr-Pennington Doctrine, petitioning, 
shareholder, supplementation, Entities, join, allegations, retaliation, courts, proposed amended complaint, early 
intervention, public employee, bad faith, permission, discovery, redress, terms"
Case 83,"patent, Cartwright Act, Sherman Act, settlement, generic, antitrust, effects, anticompetitive, infringement, 
ciprofloxacin, baseless, settlement agreement, antitrust violation, inequitable conduct, anti trust law, rule of reason, 
cases, exclusionary, marketing, courts, summary judgment motion, cause of action, allegations, restraint of trade, 
parties, restrained, material fact, patent holder, federal law, invalidity"
Case 84,"Manufacturing, wholesalers, alleges, pharmaceutical product, monopolization, Sherman Act, pharmaceutical, 
conspiracy, competitor, monopoly, plaintiff's claim, monopoly power, secondary, asserts, fails, motion to dismiss, 
reasons, Donnelly Act, damages, relevant market, anticompetitive, compete, Counts, orders, market share, 
distributors, Defendants', pedigree, products, cause of action"
Case 85,"licenses, cause of action, preempted, allegations, preemption, second amended complaint, defendants', terminated, 
regulation, cancelled, state claims, spectrum, warehousing, stations, auctions, rates, wireless, plaintiffs', 
automatically, bidding, mobile, site-based, coverage, terms and conditions, state law claim, geographic, consumer, 
state law, challenging, demurrers"
Case 86,"natural gas, intermediaries, summary judgment, antitrust, Energy, conspirator, discovery, Trading, genuine issue of 
material fact, void"
Case 87,"Ordinance, ambulance, immunity, summary judgment, damages, factual allegations, antitrust claim, patient, official 
capacity, local government, regulating, Antitrust, pleadings, tort liability, money damages, ultra vires, municipality, 
nonemergency, allegations, transport, enact"
Case 88,"Ordinance, ambulance, immunity, summary judgment, damages, factual allegations, antitrust claim, patient, official 
capacity, local government, regulating, Antitrust, pleadings, tort liability, money damages, ultra vires, municipality, 
nonemergency, allegations, transport, enact"
Case 89,"inmate, alleges, Sherman Act, motion to dismiss, medical services, subject to dismissal, antitrust, consumers,"
Case 90,"casino, promissory estoppel, compact, Cartwright Act, slot machine, costs, anti-competitive, tortious interference, 
territories, gaming, brand, cause of action, tribe, general council, special verdict, negotiations, customers, allocate, 
parties, intentional interference, wrongful conduct, new trial, promise, prospective economic relations, trial court, 
common law, dividing, minutes, inconsistency, instructions"
Case 91,"wages, suppression, damages, wedge, estimate, plaintiffs', regression, defendants', nurses, class certification, 
conspiracy, class member, Declaration, percent, variation, predominate, antitrust, calculate, class-wide, averages, 
methodology, proposed class, econometric, analyses, explains, factors, alleged conspiracy, demonstrating, reliable, 
reasons"
Case 92,"catheters, products, purchases, contracts, urological, manufacturer, prices, distributor, sole source, buy, rebates, 
sales, tier, infection, antitrust, discounts, silicone, anticompetitive, competitors, supplier, clinical, intermittent, 
negotiations, Sherman Act, multi-source, effects, dual, market share, clinicians, anti trust law"
Case 93,"nephrology, patients, ski, facilities, staff, tribe, monopoly, nephrologists, antitrust, dialysis, anti trust law, 
monopolization, anticompetitive conduct, district court, privileges, consumers, prices, staff member, health plan, 
competitor, consulting, monopolist, monopoly power, bylaws, rival, inpatient, physician's services, summary 
judgment, anticompetitive, outpatient"
Case 94,"restrictive covenant, amended complaint, bakery, motion to dismiss, cause of action, premises, deed, abandoned, 
settle"
Case 95,"Island, tying product, tied product, real estate, market power, membership, purchasers, tying arrangement, 
summary judgment, antitrust, buy, summary judgment motion, antitrust claim, products, geographic, relevant 
market, anti trust law, aftermarket, locked-in, economic power, supplemental jurisdiction, material fact, 
monopolization, possesses, monopoly, genuine, seller"
Case 96,"enterprise, allegations, appraisals, mail, brokers, fraudulent, wire, mortgage broker, tortious interference, facilities, 
interstate, particularized, subsidiaries, leave to amend, wire fraud, Plaintiffs', motion to dismiss, mortgage lender, 
racketeering, entities, unfair"
Case 97,"prices, natural gas, conspiracy, defendants', levels, conspired, average price, summary judgment, increased price, 
communications, antitrust, genuine, natural gas production, independent action, quotation, costs, marks, material 
fact, competitors, reserves, oil, concerted action, coordination, projections, conscious, factors, tends, economic 
interest, decisions, decreased"
Case 98,"election, Acquisition, merger, machines, voting, prices, preliminary injunction, competitors, concentrated, 
customers, anti trust law, antitrust, irreparable harm, anti-competitive, injunctive relief, prima facie case, market 
share, post-merger, Guidelines, profits, voting precinct, Defendants', mandatory, temporary, requests, firms"
