Case Index,Core Terms
Case 75,"Zoom, Plaintiffs', user, immunity, allegations, motion to dismiss, publisher, argues, unfair, meetings, video, third 
party, interactive, computer service, prong, declaration, analyzes, implied contract, Internet, provider, third-party, 
encryption, moderation, accesses, privacy, iPhone, conferencing, messaging, agrees, consumers"
Case 76,"airport, Plaintiffs', fuel, lease, statute of limitations, parcel, sale agreement, master lease, motion to dismiss, 
antitrust, accrue, ground lease, Sherman Act, monopoly, sections, continuing violation, allegations, damages, 
argues"
Case 77,"advertising, patent, designs, products, infringement, competitors, disparaging, spray, guns, allegations, paint, 
ordinary observer, prior art, entities, dissimilar, restrain, codes"
Case 78,"personal jurisdiction, letters, cease and desist, trade dress, infringement, declaratory judgment, trademark, color, 
forum state, baseless, contacts, teal, enforcement activity, motion to dismiss, products, Sugar, blue, lid, peanut 
butter, allegations, lawsuit, merits, rights, sham, tortious interference, unfair competition, extra-judicial, courts, 
launch, cause of action"
Case 79,"bid, indictment, rigging, vertical, horizontal, rule of reason, competitors, Sherman Act, projects, manufacturer, 
distributor, conspiracy, antitrust, district court, submit a bid, per se rule, retailers, co-conspirators, complementary, 
rotation, bidder, prices, cases, motion to dismiss, price-fixing, dealer, per se violation, price fixing, submitting, 
aluminum"
Case 80,"removal, motion to dismiss, plaintiffs', misrepresentation, allegations, Notice, amount in controversy, bad faith, 
benefits, factual allegations, fraudulent, damages, state court, covenant, prong, punitive damages, leave to amend, 
reformation, thirty-day, diversity, ratified, terms, unfair business practice, district court, fair dealing, fraud claim, 
insured, covenant of good faith, insurance policy, wrongful conduct"
Case 81,"immunity, rates, insurers, title insurance, provisions, charging, regulation, articles, title insurer, consumer, 
ratemaking, unfiled, confer authority, restitution, proceedings, antitrust, argues, anti trust law, entities, extends, 
cases, concerted, supplying, exempt, offers, noninsurance, workers' compensation, trial court, commencing, 
aggrieved"
Case 82,"suppliers, acquiring, acquisition, plaintiffs', antitrust, courts, forum non conveniens, contracts, alleges, Target, 
lawsuit, block, litigating, headquartered, subsidiaries, automotive, choice of forum, Purchasing, documents, delivery, 
public interest factors, adequate alternative, convenient, terminated, deference, weigh, Trim, seat, private interest 
factors, alternative forum"
Case 83,"divestiture, Acquirer, health plan, Personnel, divested, healthcare provider, calendar days, terminate, Contracts, 
sole discretion, provider, documents, Holdings, notice, confidentiality, accomplished, consultants, Antitrust, expire, 
terms, best efforts, transition, employees, rates, written notice, hired, authorized representative, appointment, 
compliance, benefits"
Case 84,"entertainment, allegations, geographic, journalists, membership, horizontal, reporting, talent, competitors, antitrust, 
studios, relevant market, market power, interviews, effective, anti trust law, outlets, movies, anticompetitive, 
interchangeable, consumers, amended complaint, group boycott, correspondent, courts, per se violation, antitrust 
claim, per se rule, Sherman Act, condemnation"
Case 85,"salmon, prices, alterations, Defendants', conspiracy, spot market, allegations, quotation, marks, subsidiaries, spot, 
purchasers, farmed, producers, Seafood, coordinated, cooperation, competitors, anticompetitive conduct, antitrust, 
meetings, increased price, communications, investigations, ban, products, charts, motion to dismiss, collusion, 
wholesale price"
Case 86,"Ham, unfair, competitors, consumers, brand, allegations, customers, cases, spiral-sliced, intrabrand, pleadings, 
courts, prong, antitrust, threatens, website, online, harms"
Case 87,"antitrust, patents, allegations, technology, license, motion to dismiss, Sherman Act, terms, arbitration, patent 
infringement, anti trust law, monopoly power, anticompetitive, cellular, royalty, courts, offers, compulsory 
counterclaim, relevant market, infringement, obligations, holders, concerted"
Case 88,"alleges, federal claim, state law claim, due process, equal protection, retaliation, motion to dismiss, gift of public 
funds, equal protection claim, conspired, Defendants', Deprivation, references, rights, color of state law, in forma 
pauperis, matter of law, conspiracy, first amended complaint, constitutional right, adverse action, right to vote, clean 
water, no facts, documents, employees, contends, Safe, vexatious litigant, federal statute"
Case 89,"Vendors, alleges, fast, clothing, retailers, tortious interference, online, Sherman Act, orders, relevant market, 
conspiracy, horizontal, competitors, cancelled, business relationship, fail to state a claim, interchangeability, 
merchandise, prevailing, products, trends, reasonable inference, purchaser, boycott, motion to dismiss, retail 
market, do business, customers, vertical, sourced"
Case 90,"allegations, trademark, marks, products, cause of action, infringement, registered, consumer, trademark 
infringement, motion to dismiss, meat, registration, unfair competition, factors, likelihood of confusion, Lanham Act, 
argues, likely to cause, Additionally, contaminated, imitation, foods, district court, common law, packaged, false 
designation, cancellation, advertising, photographs, proceedings"
Case 91,"Plaintiffs', gasoline, trades, allegations, Cartwright Act, discovery, prices, motion to dismiss, antitrust, unjust 
enrichment, tolling, injunctive relief, Sherman Act, remedies, conspiracy, contracts, discovery rule, federal action, 
equitable, cases, motion to stay, restitution, quotation, refinery, courts, marks, fraudulent concealment, joint 
venture, state action, manipulation"
Case 92,"patients, Plaintiffs', mail, provider, state law claim, rates, wires, misrepresentation, reimbursement, billed, 
allegations, antitrust, plans, wire fraud, preemption, benefits, sufficient facts, particularity, repriced, representations, 
enterprise, fraudulent, preempted, terms, behavioral health, antitrust claim, predicate act, subscribers, coverage, 
subject to dismissal"
Case 93,"kitchens, wooden, Sherman Act, monopolization, antitrust, summary judgment, relevant market, material fact, 
anticompetitive, genuine, selling, concerted refusal, parties, monopoly power, consumers, terminate, mountain, 
non-moving, products"
Case 94,"alleges, antitrust, Reseller, Defendants', customers, software, anticompetitive, Post-Trade, termination, renew, 
Platform, Accounting, Portfolio, damages, motion to dismiss, anti trust law, funds, anticompetitive conduct, 
competitors, Rights, relevant market, license, antitrust claim, enforcer, marketing, products, supplier, Parties, 
speculative, conclusory"
Case 95,"alleges, statute of limitations, judicial notice, Antitrust, enterprise, motion to dismiss, stalking, violations, courts, 
rights, obstruction, asserts, motions, preclusion, appears, records, dismissal with prejudice, failure to state a claim, 
state law, defendants', pleadings, accrues, arrest, futile, notice, plaintiff's claim, claim preclusion, res judicata, time 
barred, documents"
Case 96,"Settlement, class member, final approval, Notice, Plaintiffs', Communications, Participating, class action, Opt-In, 
Parties, mediation, costs, employees, meal, cases, Antitrust, awards, workweeks, documents, attorney's fees, 
district court, preparation, damages, mail, approving, lawsuit, collective action, hours worked, estimated, declare"
Case 97,"Settlement, class member, final approval, Notice, Plaintiffs', Communications, class action, Participating, Opt-In, 
Parties, costs, mediation, employees, cases, meal, awards, approving, collective action, Declaration, workweeks, 
lodestar, antitrust, documents, district court, failure to provide, attorney's fees, preparation, damages, estimated, 
etal"
Case 98,"Settlement, class member, Communications, final approval, Notice, class action, Plaintiffs', Participating, Opt-In, 
Parties, costs, mediation, employees, cases, meal, approving, awards, collective action, Declaration, workweeks, 
antitrust, documents, lodestar, district court, failure to provide, attorney's fees, preparation, damages, mail, 
estimated"
Case 99,"anticompetitive conduct, drugs, referral, anticompetitive, monopolization, patients, district court, summary judgment, 
joint venture, antitrust, pharmacy, argues, monopoly power, practices, Oncology, provider, plans, Sherman Act, 
leveraging, unilateral, profits, amicus, implemented, nonmoving, surgeons, alleges, asserts, genuine, amici, save"
Case 100,"predominance, class member, district court, Plaintiffs', uninjured, class certification, Defendants', antitrust, 
damages, price-fixing, certifying, regression, classwide, tuna, certification, statistical evidence, overcharge, 
averaging, assumptions, statistical, conspiracy, calculate, questions, question of law, class action, packaged, 
preponderance of evidence, individualized, methodology, reliable"
