頁碼,內容類型,內容
342,Counsel,"Counsel:  [**1] For FTC Capital GMBH, on behalf of themselves and all others similarly situated, FTC Futures 
Fund SICAV, on behalf of themselves and all others similarly situated, Gary Francis, Plaintiffs: Daniel Hume, David 
E Kovel, Roger W Kirby, Surya Palaniappan, Kirby McInerney LLP, New York, NY; Samuel Howard Rudman, 
Robbins Geller Rudman & Dowd LLP(LI), Melville, NY.
For FTC Futures Fund PCC Ltd, on behalf of themselves and all others similarly situated, Atlantic Trading USA, 
LLC, Nathaniel Haynes, Plaintiffs: Daniel Hume, David E Kovel, Roger W Kirby, Surya Palaniappan, Kirby 
McInerney LLP, New York, NY; Merrill G Davidoff, Berger & Montague, P.C, Philadelphia, PA; Samuel Howard 
Rudman, Robbins Geller Rudman & Dowd LLP(LI), Melville, NY.
For Carpenters Pension Fund of West Virginia, Plaintiff: Daniel Hume, David E Kovel, Roger W Kirby, Surya 
Palaniappan, Kirby McInerney LLP, New York, NY; Darren J. Robbins, PRO HAC VICE, David W. Mitchell, Lucas 
F. Olts, Robbins Geller Rudman & Dowd LLP (SANDIEGO), San Diego, CA; Samuel Howard Rudman, Robbins 
Geller Rudman & Dowd LLP(LI), Melville, NY.

 
For City of Dania Beach Police & Firefighters' Retirement System, Individually and on behalf of all others similarly 
 [**2] situated, Plaintiff: Daniel Hume, David E Kovel, Roger W Kirby, Surya Palaniappan, Kirby McInerney LLP, 
New York, NY; Darren J. Robbins, PRO HAC VICE, David W. Mitchell, Lucas F. Olts, Robbins Geller Rudman & 
Dowd LLP (SANDIEGO), San Diego, CA; George E. Barrett, Barrette, Johnsn & Parsley, Nashville, TN; Samuel 
Howard Rudman, Robbins Geller Rudman & Dowd LLP(LI), Melville, NY. Timothy L. Miles, Barrett, Johnston & 
Parsley, Nashville, TN.
For Ravan Investments, LLC, Plaintiff: Daniel Hume, David E Kovel, Roger W Kirby, Surya Palaniappan, Kirby 
McInerney LLP, New York, NY; Jay W. Eisenhofer, Linda P. Nussbaum, Peter Anthony Barile, III, Grant & 
Eisenhofer P.A. (NY), New York, NY; John D. Radice, Grant & Eisenhofer, PA, New York, NY; Kevin Bruce Love, 
Hanzman and Criden, Coral Gables, FL; Michael E. Criden, Hanzman, Criden, Korge, Chaykin, Ponce & Heise, 
P.A., Miami, FL; Samuel Howard Rudman, Robbins Geller Rudman & Dowd LLP(LI), Melville, NY.
For Mayor and City Council of Baltimore, Plaintiff: Arun Srinivas Subramanian, Susman Godfrey LLP (NYC), New 
York, NY; Daniel Hume, David E Kovel, Roger W Kirby, Surya Palaniappan, Kirby McInerney LLP, New York, NY; 
Drew D Hansen, PRO HAC VICE, Susman  [**3] Godfrey LLP (Seattle), Seattle, WA; Hilary K Scherrer, Nathaniel 
C. Giddings, William P. Butterfield, PRO HAC VICE, Hausfeld LLP, Washington, DC. Marc M. Seltzer, PRO HAC 
VICE, SUSMAN GODFRYE L.L.P., Los Angeles, CA; Ralph Johnson Bunche, III, Hausfeld, LLP (DC), Washington, 
DC; Samuel Howard Rudman, Robbins Geller Rudman & Dowd LLP(LI), Melville, NY. Seth D. Ard, Susman 
Godfrey LLP (NYC), New York, NY.
For Richard Hershey, Jeffrey Laydon, on behalf of himself and all others similarly situated, Plaintiffs: Daniel Hume, 
David E Kovel, Roger W Kirby, Surya Palaniappan, Kirby McInerney LLP, New York, NY; Douglas Mason 
Chalmers, Douglas M. Chalmers P.C., Chicago, IL; Geoffrey Milbank Horn, Lowey Dannenberg Cohen & Hart, P.C., 
White Plains, NY; Robert F. Coleman, PRO HAC VICE, Coleman Law Firm, Chicago, IL; Samuel Howard Rudman, 
Robbins Geller Rudman & Dowd LLP(LI), Melville, NY; Steve R. Jakubowski, Coleman Law Firm, Chicago, IL; 
Vincent Briganti, Lowey Dannenberg Cohen & Hart, P.C., White Plains, NY.
For Schwab Short-Term Bond Market Fund, Schwab Total Bond Market Fund, Schwab U.S. Dollar Liquid Assets 
Fund, Plaintiffs: Brendan Patrick Glaskin, LEAD ATTORNEY, Lieff, Cabraser, Heimann &  [**4] Bernstein LLP, San 
Francisco, CA; Brendan Patrick Glackin, Lieff Cabraser Heimann & Bernstein, LLP, San Francisco, NY; Daniel 
Hume, David E Kovel, Roger W Kirby, Surya Palaniappan, Kirby McInerney LLP, New York, NY; Eric B. Fastiff, 
PRO HAC VICE, Lieff, Cabraser, Heimann & Bernstein, LLP, San Francisco, CA; Joseph Richard Saveri, PRO 
HAC VICE, Lieff, Cabraser, Heimann & Bernstein, LLP, San Francisco, CA; Lowell Harry Haky, PRO HAC VICE, 
Charles Schwab and Co., Inc., Office of Corporate Counsel, San Francisco, CA; Richard M. Heimann, Lieff, 
Cabraser, Heimann & Bernstein, L.L.P., San Francisco, CA; Samuel Howard Rudman, Robbins Geller Rudman & 
Dowd LLP(LI), Melville, NY; Steven E. Fineman, Lieff Cabraser Heimann & Bernstein, LLP, New York, NY.
For Schwab Money Market Fund, Schwab Value Advantage Money Fund, Schwab Retirement Advantage Money 
Fund, Schwab Investor Money Fund, Schwab Cash Reserves, Schwab Advisor Cash Reserves, Schwab Yieldplus 
Fund, Schwab Yieldplus Fund Liquidation Trust, Charles Schwab Bank, N.A., Charles Schwab & Co., Inc., The 
Charles Schwab Corporation, Plaintiffs: Andrew Scirica Kingsdale, Lieff Cabraser Heimann & Bernstein, LLP (SF), 
San Francisco, CA; Brendan Patrick  [**5] Glaskin, LEAD ATTORNEY, Lieff, Cabraser, Heimann & Bernstein LLP, 
San Francisco, CA; Brendan Patrick Glackin, Lieff Cabraser Heimann & Bernstein, LLP, San Francisco, NY; Daniel 
Hume, David E Kovel, Roger W Kirby, Surya Palaniappan, Kirby McInerney LLP, New York, NY; Eric B. Fastiff, 
PRO HAC VICE, Lieff, Cabraser, Heimann & Bernstein, LLP, San Francisco, CA; Joseph Richard Saveri, PRO 
HAC VICE, Lieff, Cabraser, Heimann & Bernstein, LLP, San Francisco, CA; Lowell Harry Haky, PRO HAC VICE, 
Charles Schwab and Co., Inc., Office of Corporate Counsel, San Francisco, CA; Michael Joseph Miarmi, Leiff, 
Cabrasser, Heimann & Bernstein LLP, New York, NY; Richard M. Heimann, Lieff, Cabraser, Heimann & Bernstein, 
L.L.P., San Francisco, CA; Samuel Howard Rudman, Robbins Geller Rudman & Dowd LLP(LI), Melville, NY; 
Steven E. Fineman, Lieff Cabraser Heimann & Bernstein, LLP, New York, NY.
For Metzler Investment GmbH, on behalf of itself and all others similarly situated, Plaintiff: Roger W Kirby, LEAD 
ATTORNEY, Daniel Hume, David E Kovel, Surya Palaniappan, Kirby McInerney LLP, New York, NY; Deborah M. 
Sturman, Milberg LLP (NYC), New York, NY; Joseph F. Rice, PRO HAC VICE, Motley Rice LLC (SC), Mount 

 
 [**6] Pleasant, SC; Samuel Howard Rudman, Robbins Geller Rudman & Dowd LLP(LI), Melville, NY; William H. 
Narwold, Motley Rice LLC (CT), Hartford, CT.
Roberto E. Calle Gracey, Plaintiff: Daniel Hume, David E Kovel, Roger W Kirby, Surya Palaniappan, Kirby 
McInerney LLP, New York, NY; Lori Ann Fanning, Marvin Alan Miller, Matthew E Van Tine, Miller Law LLC, 
Chicago, IL; Samuel Howard Rudman, Robbins Geller Rudman & Dowd LLP(LI), Melville, NY.
For City of New Britain Firefighters' and Police Benefit Fund, on behalf of itself and all others similarly situated, 
Plaintiff: Christopher William Madel, PRO HAC VICE; Robins, Kaplan, Miller & Ciresi L.L.P. (MN); Minneapolis, MN; 
Daniel Hume, David E Kovel, Roger W Kirby, Surya Palaniappan, Kirby McInerney LLP, New York, NY; David R. 
Scott, Scott & Scott, LLC(CT), Colchester, CT; K. Craig Wildfang, PRO HAC VICE, Robins, Kaplan, Miller & Ciresi 
L.L.P., Minneapolis, MN; Max Raphael Schwartz, Scott Scott, L.L.P. (NYC), New York, NY; Richard A. Mescon, 
Robins, Kaplan, Miller & Ciresi, LLP (NYC), New York, NY; Samuel Howard Rudman, Robbins Geller Rudman & 
Dowd LLP(LI), Melville, NY; Stacey Paige Slaughter, PRO HAC VICE, Robins, Kaplan, Miller & Ciresi L.L.P., 
 [**7] Minneapolis, MN; Thomas J. Undlin, PRO HAC VICE, Robins Kaplan Miller & Ciresi(MN), Minneapolis, MN.
For AVP Properties, LLC, Plaintiff: Daniel Hume, David E Kovel, Roger W Kirby, Surya Palaniappan, Kirby 
McInerney LLP, New York, NY; Richard A. Lockridge, Lockridge, Grindal, Nauen, P.L.L.P., Minneapolis, MN; 
Samuel Howard Rudman, Robbins Geller Rudman & Dowd LLP(LI), Melville, NY; W. Joseph Bruckner, Lockridge, 
Grindal, Nauen & Holstein, P.L.L.P., Minneapolis, MN.
For 303030 Trading LLC, Plaintiff: Daniel Hume, David E Kovel, Roger W Kirby, Surya Palaniappan, Kirby 
McInerney LLP, New York, NY; Merrill G Davidoff, Berger & Montague, P.C, Philadelphia, PA; Samuel Howard 
Rudman, Robbins Geller Rudman & Dowd LLP(LI), Melville, NY.
For Ellen Gelboim, on behalf of herself and all others similarly situated, Plaintiff: Daniel Hume, David E Kovel, 
Roger W Kirby, Surya Palaniappan, Kirby McInerney LLP, New York, NY; David Haym Weinstein, Jeremy S. 
Spiegel, PRO HAC VICE, Steven A. Asher, Weinstein Kitchenoff & Asher LLC, Philadelphia, PA; Karen L. Morris, 
Morris & Morris, LLC, Wilmington, DE; Patrick F Morris, Morris and Morris LLC Counselors at Law, Wilmington, DE; 
Robert S. Kitchenoff, PRO HAC  [**8] VICE, Weinstein, Kitchenoff, Scarlato & Goldman, Ltd., Philadelphia, PA; 
Samuel Howard Rudman, Robbins Geller Rudman & Dowd LLP(LI), Melville, NY.
For Community Bank & Trust, Plaintiff: Lesley Elizabeth Weaver, PRO HAC VICE, Los Angeles, CA; Patrick 
Anthony Klingman, Shepherd, Finkelman, Miller & Shah, LLC, Chester, CT; Thomas V. Urmy, Shapiro, Haber & 
Urmy, L.L.P., Boston, MA.
For The Berkshire Bank, Individually and On Behalf of All Others Similarly Situated, Government Development 
Bank for Puerto Rico, Plaintiffs: Jeremy Alan Lieberman, Marc Ian Gross, Michael Morris Buchman, Patrick Vincent 
Dahlstrom, Pomerantz Haudek Block Grossman & Gross LLP, New York, NY; Joshua B. Silverman, One North 
LaSalle Street, Chicago, IL.
Elizabeth Lieberman, Plaintiff, Pro se.
For 33-35 Green Pond Road Associates, LLC, on behalf of itself and all others similarly situated, Plaintiff: Dylan J. 
McFarland, Vincent J. Esades, Heins Mills & Olson, P.L.C., Minneapolis, MN; Joseph J. DePalma, PRO HAC VICE, 
Lite DePalma Greenberg & Rivas, L.L.C., Newark, NJ; Mayra Velez Tarantino, Lite DePalma Greenberg & Rivas, 
L.L.C. (NJ), Newark, NJ; Steven Joesph Greenfogel, PRO HAC VICE, Lite DePalma Greenberg, LLC, 
 [**9] Philadelphia, PA; Steven A. Kanner, Much, Shelist, Freed, Denenberg, Ament & Rubenstein, P.C., Chicago, 
IL; William H. London, PRO HAC VICE, Freed Kanner London & Millen LLC, Bannockburn, IL.
For Elizabeth Lieberman, on behalf of themselves and all other similarly situated, Todd Augenbaum, on behalf of 
themselves and all others similarly situated, Plaintiffs: Brian Philip Murray, Glancy Binkow & Goldberg LLP (NYC2), 
New York, NY; Gregory Bradley Linkh, Glancy Binkow & Goldberg LLP (NYC2), New York, NY; Jeffrey Simon 
Abraham, Abraham Fruchter & Twersky LLP, New York, NY; Lionel Z. Glancy, PRO HAC VICE, Glancy & Binkow 
Goldberg LLP, Los Angeles, CA.

 
For Courtyard at Amwell II, LLC, Greenwich Commons II, LLC, Jill Court Associates II, LLC, Maidencreek Ventures 
II LP, Raritan Commons, LLC, Lawrence W. Gardner, on behalf of themselves and all others similarly situated, 
Plaintiffs: Jason Allen Zweig, Hagens Berman Sobol Shapiro LLP (NYC), New York, NY.
For Annie Bell Adams, on behalf of herself and all others similarly situated, Dennis Paul Fobes, on behalf of himself 
and all others similarly situated, Leigh E. Fobes, on behalf of herself and all others similarly situated, Margaret 
Lambert,  [**10] on behalf of herself and all others similarly situated, Betty L. Gunter, on behalf of herself and all 
others similarly situated, Plaintiffs: John Walter Sharbrough, John W. Sharbrough, III, PC, Mobile, AL; Stephen 
George Stim, Stimconsul Ltd., Mill Neck, NY.
For Carl A. Payne, individually, and on behalf of other members of the general public similarly situated, Kenneth W. 
Coker, individually, and on behalf of other members of the general public similarly situated, Plaintiff: Daniel 
Alberstone, Roland Karim Tellis, PRO HAC VICE, Baron Budd, P.C., Encino, CA; Mark Philip Pifko, PRO HAC 
VICE, Baron & Budd, P.C., Encino, CA; Peter Francis Smith, PRO HAC VICE, Baron and Budd, P.C., Encino, CA.
For City of Riverside, The Riverside Public Financing Authority, Plaintiffs: Daniel R. Sterrett, PRO HAC VICE, 
Cotchett, Pitre & McCarthy, LLP, Brulingame, CA; Frank Cadmus Damrell, Jr, Cotchett Pitre and McCarthy LLp, 
Sacramento, CA; Gregory P Priamos, Nanci E. Nishimura, Richard A Milligan, PRO HAC VICE, Riverside City 
Attorney, Riverside, CA; Joseph Winters Cotchett, Cotchett Pitre and McCarthy, Burlingame, CA.
For East Bay Municipal Utility District, Plaintiff: Craig Stephen Spencer, Office of General  [**11] Counsel, East Bay 
Municipal Utility District, Oakland, CA; Daniel R. Sterrett, PRO HAC VICE, Cotchett, Pitre & McCarthy, LLP, 
Brulingame, CA; Frank Cadmus Damrell, Jr, Cotchett Pitre and McCarthy LLp, Sacramento, CA; Joseph Winters 
Cotchett, Cotchett Pitre and McCarthy, Burlingame, CA; Jylana Collins, City of Richmond, Office of City Attorney, 
Richmond, CA; Nanci E. Nishimura, Riverside City Attorney, Riverside, CA.
For County of San Mateo, Plaintiff: Nanci E. Nishimura, LEAD ATTORNEY, Riverside City Attorney, Riverside, CA; 
Bert Shinji Nishimura, Eng & Nishimura, Los Angeles, CA; Daniel R. Sterrett, PRO HAC VICE, Cotchett, Pitre & 
McCarthy, LLP, Brulingame, CA; Eugene Whitlock, John C. Beiers, San Mateo County Counsel's Office, Redwood 
City, CA; Frank Cadmus Damrell, Jr, Cotchett Pitre and McCarthy LLp, Sacramento, CA; Joseph Winters Cotchett, 
Cotchett Pitre and McCarthy, Burlingame, CA; Lee Andrew Thompson, San Mateo County Counsel, Redwood City, 
CA.
For San Mateo Couty Joint Powers Financing Authority, Plaintiff: Nanci E. Nishimura, LEAD ATTORNEY, PRO 
HAC VICE, Riverside City Attorney, Riverside, CA; Bert Shinji Nishimura, Eng & Nishimura, Los Angeles, CA; 
Daniel R. Sterrett, PRO  [**12] HAC VICE, Cotchett, Pitre & McCarthy, LLP, Brulingame, CA; Eugene Whitlock, San 
Mateo, John C. Beiers, San Mateo County Counsel's Office, Redwood City, CA; Frank Cadmus Damrell, Jr, 
Cotchett Pitre and McCarthy LLp, Sacramento, CA; Joseph Winters Cotchett, Cotchett Pitre and McCarthy, 
Burlingame, CA; Lee Andrew Thompson, San Mateo County Counsel, Redwood City, CA.
For City of Richmond, Successor Agency to the Richmond Community Redevelopment Agency, Plaintiff: Bruce 
Reed Goodmiller, City Attorney's Office, City of Richmond, Richmond, CA; Daniel R. Sterrett, PRO HAC VICE, 
Cotchett, Pitre & McCarthy, LLP, Brulingame, CA; Everett Jenkins, Office of the City attorney, Richmond, CA; Frank 
Cadmus Damrell, Jr, Cotchett Pitre and McCarthy LLp, burlingame, CA; Joseph Winters Cotchett, Cotchett Pitre 
and McCarthy, Burlingame, CA; Nanci E. Nishimura, Riverside City Attorney, Riverside, CA.
For The Richmond Joint Powers Financing Authority, Plaintiff: Bruce Reed Goodmiller, City Attorney's Office, City of 
Richmond, Richmond, CA; Daniel R. Sterrett, PRO HAC VICE, Cotchett, Pitre & McCarthy, LLP, Brulingame, CA; 
Everett Jenkins, Office of the City attorney, Richmond, CA; Frank Cadmus Damrell, Jr, Cotchett  [**13] Pitre and 
McCarthy LLp, burlingame, CA; Joseph Winters Cotchett, Cotchett Pitre and McCarthy, Burlingame, CA; Nanci E. 
Nishimura, PRO HAC VICE, Riverside City Attorney, Riverside, CA.
For County of San Diego, Plaintiff: Daniel R. Sterrett, LEAD ATTORNEY, Cotchett, Pitre & McCarthy, LLP, 
Brulingame, CA; Nanci E. Nishimura, Riverside City Attorney, Riverside, CA.
For Guaranty Bank & Trust Company, Individually and on behalf of all others similarly situated, Plaintiff: Andrew C. 
Shen, Joseph Solomon Hall, Michael John Guzman, Kellogg, Huber, Hansen, Todd, Evans & Figel, PLLC (DC), 
Washington, DC; Caitlin Sinclair Hall, PRO HAC VICE, Kellogg, Huber, Hansen, Todd, Evans & Figel, P.L.L.C, 

 
Washington, DC; R. Bryant McCulley, PRO HAC VICE, McCulley McCluer PLLC, Birmingham, AL; Stuart Halkett 
McCluer, McCulley Mccluer PLLC, Oxford, MS; W. Percy Badham, Badham & Buck LLC, Birmingham, AL.
For Heather M. Earle, on behalf of themselves and all others similarly situated, Henryk Malinowski, on behalf of 
themselves and all others similarly situated, Linda Carr, on behalf of themselves and all others similarly situated, 
Eric Friedman, on behalf of themselves and all others similarly situated, Plaintiffs:  [**14] Elana Katcher, Gregory 
Keith Arenson, Richard Jo Kilsheimer, Kaplan Fox & Kilsheimer LLP (NYC), New York, NY; Jeffrey Craig Block, 
Whitney Erin Street, Block & Leviton LLP, New York, NY.
For County of Riverside, Plaintiff: Benjamin Galdston, PRO HAC VICE, Bernstein Litowitz Berger & Grossmann LLP 
(San Diego), San Diego, CA; Blair A Nicholas, Bernstein Litowitz Berger and Grossmann LLP, San Diego, CA.
For Jerry Weglarz, Nathan Weglarz, on behalf of plaintiffs and a class, Plaintiff: Cathleen M. Combs, Daniel A. 
Edelman, PRO HAC VICE, Edelman, Combs, Latturner & Goodwin, LLC, Chicago, IL; James O. Latturner, 
Edelman, Combs & Latturner, Chicago, IL; Tiffany Nicole Hardy, Edelman, Combs, Latturner & Goodwin, LLC, 
Chicago, IL.
For Direcors Financial Group, individually and on behalf of all others similarly situated, Plaintiff: Jeremy Alan 
Lieberman, Marc Ian Gross, Pomerantz Haudek Block Grossman & Gross LLP, New York, NY.
For SEIU Pension Plans Master Trust, individually and on behalf of all others similarly situated, Plaintiff: David W. 
Mitchell, Robbins Geller Rudman & Dowd LLP (SANDIEGO), San Diego, CA; Patrick W. Daniels, Lerach, Coughlin, 
Stoia Geller, Rudman & Robbins, San Diego, CA;  [**15] Samuel Howard Rudman, Robbins Geller Rudman & 
Dowd LLP(LI), Melville, NY.
For Maxwell Van De Velde, Movant: Patrick Anthony Klingman, LEAD ATTORNEY, Shepherd, Finkelman, Miller & 
Shah, LLC, Chester, CT; Thomas V. Urmy, Shapiro, Haber & Urmy, L.L.P., Boston, MA.
For Brian McCormick, Vito Spillone, individually and on behalf of all others similarly situated, Movants: Elizabeth A. 
Fegan, Hagens Berman Sobol Shapiro LLP, Oak Park, IL; Karl P. Barth, Hagens Berman Sobol Shapiro LLP, 
Seattle, WA; Steve W. Berman, PRO HAC VICE, Hagens Berman Sobol Shapiro LLP (Seattle), Seattle, WA.
For Bank of America Corporation, Defendant: Arthur J. Burke, Davis Polk & Wardwell, New York, NY; Robert Frank 
Wise, Jr, Davis Polk & Wardwell L.L.P., New York, NY.
For Barclays Bank Plc, Defendant: Alanna Cyreeta Rutherford, Boies, Schiller & Flexner, LLP(NYC), New York, NY; 
David R. Boyd, PRO HAC VICE, Boies, Schiller & Flexner LLP (D.C.), Washington, DC; David Harold Braff, Jeffrey 
T. Scott, Sullivan and Cromwell, LLP(NYC), New York, NY; James Brian Meadows, PRO HAC VICE, Boies, Schiller 
& Flexner LLP, New York, NY; Jonathan David Schiller, Boies Schiller & Flexner LLP, New York, NY; Joshua Seth 
Kyle, Sullivan &  [**16] Cromwell, LLP(NYC), New York, NY; Robert B Silver, Boies, Schiller & Flexner 
LLP(Westchester), Armonk, NY; Yvonne Susan Quinn, Sullivan & Cromwell, LLP(NYC), New York, NY.
For Citibank NA, Defendant: Alan M. Wiseman, PRO HAC VICE, Covington & Burling, L.L.P. (DC), Washington, 
DC; Andrew Arthur Ruffino, Covington & Burling LLP(NYC), New York, NY; David Marx, McDermott, Will & Emery 
LLP (Chicago), Chicago, IL; Jonathan James Gimblett, Thomas A. Isaacson, PRO HAC VICE, Covington & Burling 
LLP, Washington, DC; Mark Jacob Altschul, PRO HAC VICE, McDermott Will & Emery LLP, Chicago, IL; Robert 
Frank Wise, Jr, Davis Polk & Wardwell L.L.P., New York, NY.
For Credit Suisse Group AG, Defendant: Elai E. Katz, Herbert Scott Washer, Joel Laurence Kurtzberg, Cahill 
Gordon & Reindel LLP, New York, NY; Robert Frank Wise, Jr, Davis Polk & Wardwell L.L.P., New York, NY.
For Deutsche Bank AG, Defendant: Andrew Corydon Finch, LEAD ATTORNEY, Paul Weiss Rifkind Wharton & 
Garrison LLP, New York, NY; Moses Silverman, LEAD ATTORNEY, Paul, Weiss, Rifkind, Wharton & Garrison LLP 
(NY), New York, NY; Jessica Lillian Brach, Paul, Weiss, Rifkind, Wharton & Garrison LLP (NY), New York, NY; 
Robert Frank Wise, Jr, Davis  [**17] Polk & Wardwell L.L.P., New York, NY.
For HSBC Holdings plc., Defendant: Edwin R Deyoung, Locke Lord Bissell & Liddell LLP (NYC), New York, NY; 
Gregory Thomas Casamento, Locke Lord LLP (NYC), New York, NY; Robert Frank Wise, Jr, Davis Polk & 
Wardwell L.L.P., New York, NY; Roger Brian Cowie, PRO HAC VICE, Locke, Liddell & Sapp, L.L.P., Dallas, TX.

 
For J.P. Morgan Chase & Co., Defendant: Dana Ashley Jupiter, Simpson Thacher & Bartlett, New York, NY; Juan 
Alberto Arteaga, Simpson Thacher & Bartlett LLP (NY), New York, NY; Lawrence H. Heftman, Schiff Hardin LLP, 
Chicago, IL; Matthew Charles Crowl, Schiff Hardin LLP, Chicago, IL; Robert Frank Wise, Jr, Davis Polk & Wardwell 
L.L.P., New York, NY; Thomas C. Rice, Simpson Thacher & Bartlett LLP (NY), New York, NY.
For Lloyds Banking Group plc, Defendant: Eric Jonathan Stock, Marc Joel Gottridge, Hogan Lovells US LLP (nyc), 
New York, NY; Megan Polly Davis, Flemming Zulack Williamson Zauderer, LLP, New York, NY; Robert Frank Wise, 
Jr, Davis Polk & Wardwell L.L.P., New York, NY.
For Royal Bank of Scotland Group plc, Defendant: Robert G. Houck, LEAD ATTORNEY, Clifford Chance US, LLP 
(NYC), New York, NY; James Drew Miller, Clifford Chance US, LLP (NYC),  [**18] New York, NY; Robert Frank 
Wise, Jr, Davis Polk & Wardwell L.L.P., New York, NY.
For The Norinchukin Bank, Defendant: Andrew W. Stern, Thomas Andrew Paskowitz, Sidley Austin LLP (NY), New 
York, NY; Robert Frank Wise, Jr, Davis Polk & Wardwell L.L.P., New York, NY; William J. Nissen, Sidley Austin, 
LLP (Chicago), Chicago, IL.
For UBS AG, Defendant: Peter Sullivan, LEAD ATTORNEY, Gibson, Dunn & Crutcher, LLP (NY), New York, NY; 
David Jarrett Arp, PRO HAC VICE, Gibson, Dunn & Crutcher, LLP (DC), Washington, DC; Gary R. Spratling, PRO 
HAC VICE, Lawrence Jay Zweifach, Gibson, Dunn & Crutcher, LLP, New York, NY; Rachel Alden Lavery, Gibson, 
Dunn & Crutcher, LLP (NY), New York, NY.
For WestLB AG, Defendant: Christopher Martin Paparella, Ethan Edward Litwin, Hughes Hubbard & Reed LLP 
(NY), New York, NY; Morgan Jessen Feder, Hughes Hubbard & Reed LLP, New York, NY; Robert Frank Wise, Jr, 
Davis Polk & Wardwell L.L.P., New York, NY.
For Rabobank Group, Defendant: David Robert Gelfand, Milbank, Tweed, Hadley & McCloy LLP, New York, NY; 
Melanie Westover, Milbank, Tweed, Hadley & McCloy LLP (NYC), New York, NY; Sean Miles Murphy, Milbank, 
Tweed, Hadley & McCloy LLP (NYC), New York, NY.
For Credit Suisse  [**19] Group, NA, Credit Suisse Securities (USA) LLC, Defendants: Elai E. Katz, Herbert Scott 
Washer, Joel Laurence Kurtzberg, Cahill Gordon & Reindel LLP, New York, NY.
For HBOS PLC, Defendant: Marc Joel Gottridge, LEAD ATTORNEY, Hogan Lovells US LLP (nyc), New York, NY; 
Eric Jonathan Stock, Hogan Lovells US LLP (nyc), New York, NY; Robert Frank Wise, Jr, Davis Polk & Wardwell 
L.L.P., New York, NY.
For Bank of Tokyo-Mitsubishi UFJ Ltd, Defendant: Christopher Michael Viapiano, Daryl Andrew Libow, LEAD 
ATTORNEY, Sullivan & Cromwell LLP (Washington DC), Washington, DC; Robert Frank Wise, Jr, Davis Polk & 
Wardwell L.L.P., New York, NY.
For Royal Bank of Canada, Defendant: Arthur W. Hahn, Brian J. Poronsky, Katten Muchin Rosenman LLP, 
Chicago, Il; Christian T. Kemnitz, Katten Muchin Rosenman LLP (Chicago), Chicago, IL; Robert Frank Wise, Jr, 
Davis Polk & Wardwell L.L.P., New York, NY.
For Deutsche Bank Financial LLC, Deutsche Bank Securities Inc., Defendants: Andrew Corydon Finch, LEAD 
ATTORNEY, Paul Weiss Rifkind Wharton & Garrison LLP, New York, NY; Moses Silverman, LEAD ATTORNEY, 
Paul, Weiss, Rifkind, Wharton & Garrison LLP (NY), New York, NY; Jessica Lillian Brach, Paul, Weiss, Rifkind, 
Wharton  [**20] & Garrison LLP (NY), New York, NY.
For Barclays Capital Inc., Barclays U.S. Funding LLC, Defendants: Alanna Cyreeta Rutherford, Boies, Schiller & 
Flexner, LLP(NYC), New York, NY; David R. Boyd, PRO HAC VICE, Boies, Schiller & Flexner LLP (D.C.), 
Washington, DC; David Harold Braff, Jeffrey T. Scott, Sullivan and Cromwell, LLP(NYC), New York, NY; James 
Brian Meadows, PRO HAC VICE, Boies, Schiller & Flexner LLP, New York, NY; Jonathan David Schiller, Boies 
Schiller & Flexner LLP, New York, NY; Joshua Seth Kyle, Sullivan & Cromwell, LLP(NYC), New York, NY; Robert B 
Silver, Boies, Schiller & Flexner LLP(Westchester), Armonk, NY; Jeffrey T. Scott, Sullivan and Cromwell, 
LLP(NYC), New York, NY.

 
For Citiigroup Global Markets Inc., Defendant: Alan M. Wiseman, PRO HAC VICE, Covington & Burling, L.L.P. 
(DC), Washington, DC; Andrew Arthur Ruffino, Covington & Burling LLP(NYC), New York, NY; Jonathan James 
Gimblett, Thomas A. Isaacson, PRO HAC VICE, Covington & Burling LLP, Washington, DC.
For Bank of America, N.A., Defendant: Robert Frank Wise, Jr, LEAD ATTORNEY, Davis Polk & Wardwell L.L.P., 
New York, NY.
For HSBC Bank PLC, Citigroup Inc, JPMorgan Chase Bank, National Association, Defendants: Robert [**21] Frank 
Wise, Jr, Davis Polk & Wardwell L.L.P., New York, NY.
For Cooperatieve Centrale Raiffeisen-Boerenleenbank B.A., Defendant: David Robert Gelfand, Milbank, Tweed, 
Hadley & McCloy LLP, Los Angeles, CA; Melanie Westover, Milbank, Tweed, Hadley & McCloy LLP (NYC), Robert 
Frank Wise, Jr, Davis Polk & Wardwell L.L.P., New York, NY; Sean Miles Murphy, Milbank, Tweed, Hadley & 
McCloy LLP (NYC), New York, NY.
For JPMorgan Chase & Co, Defendant: Chet Alan Kronenberg, Simpson Thacher & Bartlett LLP (NY), New York, 
NY; Thomas C. Rice, Simpson Thacher & Bartlett LLP (NY), New York, NY.
For Barklays Bank Plc, Barclays PLC, Defendants: Alanna Cyreeta Rutherford, Boies, Schiller & Flexner, 
LLP(NYC), New York, NY; David R. Boyd, PRO HAC VICE, Boies, Schiller & Flexner LLP (D.C.), Washington, DC; 
James Brian Meadows, PRO HAC VICE, Boies, Schiller & Flexner LLP, New York, NY; Jonathan David Schiller, 
Boies Schiller & Flexner LLP, New York, NY; Robert B Silver, Boies, Schiller & Flexner LLP(Westchester), Armonk, 
NY.
For JP Morgan Chase & Co., Defendant: Joan Eileen Flaherty, Simpson Thacher & Bartlett LLP (NY), New York, 
NY.
For Barclays Bank PLC, Defendant: Alanna Cyreeta Rutherford, Boies, Schiller &  [**22] Flexner, LLP(NYC), New 
York, NY; David R. Boyd, PRO HAC VICE, Boies, Schiller & Flexner LLP (D.C.), Washington, DC; James Brian 
Meadows, PRO HAC VICE, Boies, Schiller & Flexner LLP, New York, NY; Jonathan David Schiller, Boies Schiller & 
Flexner LLP, New York, NY; Matthew Joseph Porpora, Sullivan & Cromwell, LLP(NYC), New York, NY; Robert B 
Silver, Boies, Schiller & Flexner LLP(Westchester), Armonk, NY.
For JPMorgan Chase Bank N.A., Defendant: Joan Eileen Flaherty, Simpson Thacher & Bartlett LLP (NY), New 
York, NY."
