Case Index,Core Terms
Case 74,"Non-Compete, summary judgment, attorney's fees, Non-Solicitation, discovery, costs, sales, salesperson, 
covenants, parties, broker, amended complaint, motion for leave, franchise, renewed, notice, orders, unfair


Page 2 of 11"
Case 75,"beer, defendants', boycott, group boycott, six-pack, allegations, court of appeals, Sherman Act, subsidiaries, act of 
state doctrine, anticompetitive, causation, practices, antitrust, immunity, antitrust violation, quotation, marks, 
restraint of trade, antitrust claim, reconsideration, conspiracy, brewers, sales, cooperative, challenges, marketing, 
motion to dismiss, unjust enrichment, Breweries"
Case 76,"Align, scanner, iTero, anticompetitive conduct, anticompetitive, monopoly, antitrust, bundled, dental, discounts, 
scans, allegations, leveraging, rival, monopolization, manufacturers, termination, orders, competitors, digital, prices, 
impression, Recommendation, patient's, parties, fails, teeth, motion to dismiss, general rule, circumstances"
Case 77,"wages, depressed, alleges, antitrust, no-hire, statute of limitations, defendants', employees, buyers', cartel, prices, 
affirmative defense, anti trust law, anticompetitive, damages"
Case 78,"ambulances, motion to dismiss, interchangeable, relevant market, antitrust, factual allegations, allegations, 
purchasers, buy, substitutes, consumers, customers, encompass"
Case 79,"overtime, imputed, overtime work, Memorandum, unpaid, policies, apparent authority, agency principles, summary 
judgment, forty hour, Reconsider, deposition, instruct, courts, overtime hours, prior approval, work overtime, 
conversation, plaintiffs', timekeeping, supervised, clock, genuine dispute, employees, recorded, cases, actual 
authority, material fact, work hours, timesheets"
Case 80,"civil penalty, equitable, jury trial, cause of action, advertising, injunctive relief, right to a jury trial, consumer, unfair, 
cases, misleading, gist, common law, decisions, business practice, endorsements, trial court, unfair competition, 
restitution, injunction, civil action, deceptive, practices, remedies, provisions, violates, factors, equitable issues, 
equitable relief, court of equity"
Case 81,"merchant, Plaintiffs', Anti-Steering, antitrust, consumers, card, factors, anti trust law, networks, credit card, 
allegations, resident, purchasers, competitors, indirect, damages, redressability, traceability, cardholders, 
speculative, Non-Amex, two-sided, steering, parties, antitrust violation, named plaintiff, anticompetitive, provisions, 
customers, argues"
Case 82,"summary judgment, material fact, genuine, breach-of-contract, cancelled"
Case 83,"allergy, testing, immunotherapy, provider, patients, credentialing, antitrust, allergist, reimbursement, pleaded, skin, 
Recommendation, announced, lawsuit, tortious interference, emailed, motion to dismiss, policies, network, 
limitations period, allegations, Asthma, antitrust claim, contends, statute of limitations, civil conspiracy, relevant 
market, authorization, declaratory, limitations"
Case 84,"generic, consumers, brand, damages, class member, uninjured, predominance, class certification, but-for, class 
action, plaintiffs', antitrust, percent, prescriptions, methodology, drugs, individualized, classwide, purchases, 
predicted, aggregate, argues, penetration, forecasts, questions, calculations, overcharge, retention, insured, 
consumer protection"
Case 85,"Plaintiffs', Defendants', recording, interception, motion to dismiss, Consolidated, Privacy, conversations, allegations, 
users, Wiretap, electronic communication, wire, disclosure, warranty, communications, intrusion, judicial notice, 
AMEND, accepts, courts, electronic, unfair, third party, circumstances, damages, pleaded, oral communication, 
contents, cable"
Case 86,"patent, alleges, competitors, antitrust, immunity, counterclaims, customers, lawsuit, acquisitions, discovery, motion 
to dismiss, patent infringement, unfair competition, tortious interference, geographic, argues, anticompetitive, 
software, sham, Clayton Act, Sherman Act, monopolization, Enterprise, business relationship, antitrust claim, 
baseless, infringe, monopoly, communications, technology"
Case 87,"consumer protection, motion to dismiss, notice, compliance, notice and demand, Consolidated, Counts, 
requirement of notice, alleged violation"
Case 88,"damages, travel, healthcare, retaliatory, nurses, staffing, non-solicitation, agencies, provisions, markets, 
termination, antitrust, summary judgment, argues, contract provision, exclusionary, prices, market power, 
monopolization, market share, Sherman Act, customers, employees, proffered, competitors, rivals, output, 
placements, platforms, Skiing"
Case 89,"student-athletes, district court, athletic, procompetitive, benefits, amateurism, limits, education-related, sports, 
injunction, effects, awards, anticompetitive, consumer demand, consumer, expenses, schools, graduation, 
professional sports, conferences, above-COA, antitrust, unrelated, football, courts, attendance, salaries, anti trust 
law, cap, cash payment"
Case 90,"Align, scanner, dental, discount, amended complaint, alleges, relevant market, iTero, anticompetitive conduct, 
scans, prices, monopoly power, antitrust, bundled, competitors, cases, monopolization, anticompetitive, ordering, 
markets, digital, sales, manufacture, products, argues, braces, sells, geographic, patient's, teeth"
Case 91,"interstate commerce, allegations, patients, antitrust claim, amended complaint, antitrust, steering, leave to amend, 
discovery, motion to dismiss, hospice care, benefits, futile, unjust enrichment, diversity, facially, hospice"
Case 92,"leases, permits, drilling, Defendants', immunity, antitrust, state-action, monopoly, mineral, geographic, relevant 
market, acquisition, anticompetitive conduct, supervision, rights, private party, anticompetitive, terms, oil and gas, 
intracompany, monopolize, sections, oil, state policy, exploration, royalty, pooling, motion to dismiss, royalty rate,"
Case 93,"damages, Post-Trial, new trial, interlocutory appeal, apportionment, motions, district court, certification, principles, 
cases, remittitur, question of law, reconsideration, controlling question, tort principles, challenges, antitrust, argues, 
burden of proof, causation, materially affect, matter of law, second trial, interlocutory review, pretrial ruling, anti trust 
law, termination, factors, prevail, reconsideration motion"
Case 94,"tyntec, antitrust"
Case 95,"Petroleum, venue, relevant market, antitrust, reliable, Defendants', geographic, damages, personal jurisdiction, 
Clayton Act, service-of-process, markets, expert testimony, summary judgment, regression, yardstick, waived, 
summary judgment motion, consumers, wholesale, factors, terminals, gasoline, exchange agreement, nationwide, 
variables, fails, anti trust law, inadmissible, methodology"
Case 96,"purchasers, settlement agreement, subsidiary, indirect, Rubber, settlements, class representative, named plaintiff, 
final judgment, entities, replacement part, allegations, antitrust, damages, courts"
Case 97,"generic, class member, brand, purchasers, consumers, defendants', uninjured, ascertainability, Reply, class 
certification, antitrust, predominance, methodology, overcharge, feasible, damages, records, reliable, state law, 
pharmaceutical, Plaintiffs', motion to exclude, variations, prescriptions, co-payment, class period, loyalists, 
reimbursement, plans, expert testimony"
Case 98,"traffic school, schools, unfair, monopolization, alleges, competitors, online, consumers, barriers, market share, 
conspiring, antitrust, relevant market, conspiracy, prices, teams, unity of interest, prong, quotation, balancing test, 
market power, licensed, marketplace, factors, website, argues, output, flood, factual allegations, decisionmaking"
Case 99,"trading, prices, personal jurisdiction, hubs, natural gas, manipulation, allegations, contacts, entity, swaps, traders, 
restitution, contracts, derivatives, antitrust, bidweek, state law claim, alter ego, anticompetitive, authorizes, unjust 
enrichment, minimum contact, ego, lose money, counterparties, purposes, courts, unfair, fails, complaint alleges"
Case 100,"patents, biosimilar, settlements, antitrust, infringement, manufacturers, plaintiffs', unfair, competitors, baseless, 
invalid, launch, monopoly, prices, lawsuit, antitrust claim, anticompetitive, petitioning, consumers, anti trust law, 
patentee, sham, settlement agreement, allegations, asserts, consumer protection, purchasers, expiration, 
immunized, unconscionable"
