Case Index,Core Terms
Case 74,"patent, infringement, surface area, district court, citizen's petition, antitrust, temazepam, generic, temperature, 
sham, outgassing, measurement, baseless, antitrust liability, invalidity, dose, anti trust law, immunity, testing, prior 
art, counterclaims, bioequivalence, Certification, manufacturer, summary judgment, patentee, routine, burden of 
production, colleagues, competitor"
Case 75,"collateral estoppel, fact finding, Cartwright Act, district court, CONSUMERS, monopoly, Internet, monopolize, 
talking, conclusions of law, operating system, Sherman Act, causation, browser, conspiracy, Windows, 
anticompetitive, litigated, proceedings, unilateral, government's case, parties, preclusion, DAMAGES, Plaintiffs', 
exclusionary, competitor, software, legal conclusion, combinations"
Case 76,"settlement, anti-solicitation, employees, Plaintiffs', recruiting, salary, hire, class certification, email, class member, 
salary range, conspiracy, antitrust, damages, collaborations, competitors, grade, preliminary approval, bilateral 
agreement, Facebook, Senior, human resources, overarching, benchmark, talent, Vice, team, terminated, 
documents, responded"
Case 77,"student-athletes, schools, football, licensing, athletic, basketball, likenesses, images, recruits, teams, compete, 
sports, videogames, restrictions, rights, conferences, amateurism, telecasts, leagues, submarket, attendance, 
procompetitive, buyers, license to use, Plaintiffs', consumer, footage, consumer demand, grant-in-aid, sellers"
Case 78,"antitrust, alleges, argues, relevant market, competitor, speculative, market power, monopolization, documents, 
clinical, fails, judicial notice, anti trust law, therapeutic, pleadings, barriers, motion to dismiss, acquired rights, 
monopoly power, Cartwright Act, discovery, courts, business justification, manufacture, foreclosed, compete"
Case 79,"beer, wholesaler, interstate commerce, retailer, products, deliveries, competitors, supplier, sales, Beverage, Email, 
Sherman Act, customers, Distributing, commerce, brands, contends, in limine, prices, antitrust, licensed, territory, 
asserts, deny a motion, light wine, monopolization, facilities, seller, space, purchaser"
Case 80,"distributors, purchaser, license, adenosine, district court, overcharge, injunctive, tying arrangement, patented, 
healthcare provider, implied license, declaratory relief, damages, indirect, products, certify, drugs, class certification, 
claim for damages, declaratory, moot, injunctive relief, manufacturers, consumers, tying product, tied product, 
software, generic, recover damages, purposes"
Case 81,"DFA, cheese, barrels, block, trading, spread, loads, purchases, milk, pounds, prices, manipulation, e-mail, markets, 
commodity, spot, Plaintiffs', inventory, Dairy, conspiracy, sellers, customers, employees, communications, buyer, 
bids, buy, futures contract, cheddar cheese, broker"
Case 82,"allegations, Associates, wire fraud, predicate act, Defendants', defamation, violations, extraterritorial, conspiracy, 
personal jurisdiction, domicile, Travel, general jurisdiction, civil conspiracy, enterprise, relatedness, intracorporate 
conspiracy doctrine, predicates, reputation, bribery, cause of action, pleaded, alleged conspiracy, contracts, 
domestic, conclusory, defamatory, discovery, lawsuit, false information"
Case 83,"damages, umbrella, speculative, purchaser, Cartwright Act, antitrust, prices, Defendants', overcharge, indirect, 
summary judgment, non-conspirators, calculation, conspiracy, products, albumin, matter of law, anti trust law, 
chain, multi-tiered, therapies, estimate, Plasma, cartel, courts, reasonable probability, nonmoving party, lack 
standing, moving party, federal law"
Case 84,"preemption, preempted, leave to amend, trust deed, securitization, allegations, Mortgage, judicial notice, unfair, 
regulation, notice, motion to dismiss, quiet title, quotation, marks, declaratory relief, trustee sale, state law, 
consumers, diversity, federal savings association, originated, default, merged, sufficient facts, home mortgage, 
national bank, citizenship, supervision, fraudulent"
Case 85,"allegations, patients, Defendants', monopoly power, monopolization, market share, private health, oncology, 
HealthCare, competitors, antitrust, provider, drugs, percent, proximate cause, unfair competition, insurance market, 
anticompetitive, anticompetitive conduct, consumers, alleged facts, predatory, prices, pharmaceutical company, 
reimbursement rate, improper means, monopoly, monopsony, referrals, chemotherapy"
Case 86,"allegations, camera, patent, infringing, unfair, leave to amend, defendants', unfair competition, Sherman Act, 
monopolization, motion to dismiss, conspiracy, fraudulent, Practices, antitrust, restraint of trade, amended 
complaint, prior order, unlawfully, consumers, destroy, avers"
Case 87,"non-competition, employees, unfair competition, unfair, declaratory, products, invalid, injunctive relief, motion to 
dismiss, choice-of-law, costs, asserting, amount in controversy, parties, declaratory judgment, argues, actual 
controversy, alleged facts, Non-Compete, allegations, injunction, courts, hire, economic injury, damages, facial, 
moot, principal place of business, business practice, cause of action"
Case 88,"Amazon, alleges, website, pleadings, summary judgment, publisher, discovery, libel, tying arrangement, seller, 
customer, provider, shipping, consumers, authors, defamation, defamatory, print, entitled to judgment, tied product, 
immunity, posted, interactive, antitrust, referral, links, summary judgment motion, cause of action, booksellers, 
asserts"
Case 89,"aluminum, warehouses, Mag, antitrust, allegations, Premium, traders, load-out, Users, conspiracy, prices, plaintiffs', 
Consumer, trading, purchases, storage, defendants', relevant market, complaints, competitors, conspired, 
contracts, chain, metals, delays, inventories, warrants, producers, products, motion to dismiss"
Case 90,"Bearings, conspiracy, allegations, prices, antitrust, guilty plea, investigations, automotive, Purchaser, Defendants', 
conspire, collusion, customers, co-conspirators, manufacturers, cartel, fraudulent concealment, factual allegations, 
industrial, discovery, damages, parties, alleged conspiracy, price-fixing, plaintiffs', tolled, sales, wrongful 
concealment, injunctive relief, motion to dismiss"
Case 91,"alleges, depression, efficacy, diligence, placebo, consumer, delayed discovery rule, clinical trial, investigate, label, 
advertisements, misleading, notice, pleads, misrepresentations, prescribed, effective, antidepressants, discovery, 
quotation, treating, statute of limitations, motion to dismiss, omissions, ingest, marks, healthcare professional, 
cause of action, ineffective, clinical"
Case 92,"patent, infringement, bad faith, baseless, cease and desist order, preemption, costs, summary judgment motion, 
summary judgment, attorney's fees, enforcement activity, injunction, patentee, letters, showing of bad faith, rights, 
preliminary injunction, permanent injunction, state law claim, federal law, state law, prevailing, asserting, 
preempted, genuine, enjoin, moot"
Case 93,"licenses, Cooper, plaintiffs', auction, geographic, site-based, spectrum, conspiracy, Communications, stations, 
bidding, block, concerted action, licensees, entities, competitors, defendants', contour, frequencies, conversation, 
anticompetitive, sites, Sherman Act, leases, regions, conspirator, regulations, Wireless, construct, Maritime"
Case 94,"extortion, advertising, Dogs, business owner, allegations, rating, user, authored, induce, manipulated, unfair, stars, 
Hobbs Act, threats, district court, extortionate, posted, economic harm, unfair competition, competitor, violations, 
reasons, removal, website, sales representative, business practice, wrongful use, pre-existing, employees, 
threatens"
Case 95,"alleges, modification, promise, unfair, motion to dismiss, Parties, cause of action, argues, lower amount, 
documents, fails, business practice, promissory estoppel, judicial notice, fraudulent, mortgage, verbal, terms, 
misleading statement, factual allegations, Rosenthal Act, foreclosure, Notice, sufficient facts, monthly payment, oral 
agreement, good faith, paperwork, covenant, modify"
Case 96,"generic, patent, settlements, manufacturer, antitrust, brand, infringe, non-cash, profits, rule of reason, patentee, 
Hatch-Waxman Act, pharmaceutical, consumers, monopoly, dollars, effects, expired, certification, contraceptive, 
competitor, assess, courts, cash settlement, district court, cash payment, prices, settle, Sherman Act, 
anticompetitive"
Case 97,"generic, settlement, Causation, conspiracy, manufacturer, Purchaser, launch, patents, Retailer, summary judgment 
motion, Plaintiffs', summary judgment, damages, brand, antitrust, Reconsideration, infringement, negotiated, 
competitors, settlement agreement, overarching, End-Payor, lawsuit, filer, Reply, reconsideration motion, Toys, 
royalty, Undisputed, reasonable inference"
Case 98,"pricing, predatory, newspaper, public policy, unfair, antitrust, quotation, monopoly, marks, cause of action, 
practices, media, marketplace, consumers, antitrust violation, motion to strike, advertising, allegations, 
ascertainable, competitors, violates, argues"
Case 99,"Settlement, Notice, proposed settlement, class member, purchases, class action, Documents, approve, branded, 
calendar days, Indirect, joinder, settlement fund, Certification, impracticable, preliminarily, antitrust, Requests, mail, 
final approval, entities, generic, Escrow, papers"
Case 100,"end-payor, plaintiffs', generic, patent, motion to dismiss, antitrust, defendants', unjust-enrichment, purchasers, 
manufacturer, allegations, infringement, indirect, launch, consumer-protection, unjust enrichment, judicial notice, 
settlement, invalid, brand-name, lawsuits, anticompetitive, Consolidated, settlement agreement, cause of action, 
courts, consumer protection, sales, limitations period, Co-Promotion"
