Case Index,Core Terms
Case 82,"prices, gasoline, market power, antitrust, predatory, stations, marketers, Sherman Act, competitors, consumer, 
retail, barriers, monopolization, predator, rivals, market share, output, self-serve, full-serve, wholesale, dealers, 
supracompetitive, oligopoly, district court, summary judgment, Clayton Act, primary-line, cash-only, contends, price 
discrimination"
Case 83,"antitrust, Recommendation, employees, sham, allegations, commencement, resignations, negotiate, immunity, 
genuine, notice, employment contract, anticompetitive, sham exception, violations, frivolous, baseless, lawsuit, 
amend, amended complaint, antitrust claim, monopolization, assertions"
Case 84,"antitrust, Healthcare, termination, Sherman Act, anticompetitive, relevant market, competitor, summary judgment, 
anti trust law, group boycott, consumers, provider, partial summary judgment, rule of reason, per se rule, prices, 
deposition, memorandum, concerted refusal, east bank, illegality, nonmovant, vertical, present case, no evidence, 
participating, manufacturer, geographic, horizontal, price fixing"
Case 85,"franchisees, tie-in, coercion, distributor, region, proofs, alternate, buyer, plaintiffs', products, franchise, class 
certification, tied product, advertising, individual proof, tie, cases, seller, logoed, franchise agreement, lease, class 
member, defendants', suppliers, tying arrangement, class action, supplies, contractual, certify, prices"
Case 86,"machines, patent, summary judgment, Robinson-Patman Act, counterclaim, antitrust, Sherman Act, entitled to 
summary judgment, contends, lease, Lanham Act, pricing, allegations, machinery, abuse of process, argues, 
genuine issue of material fact, invention, commerce, anti trust law, infringement, conspiracy, predatory, declaratory 
judgment, commodities, memorandum, purchasing, violations, customers, employees"
Case 87,"dogs, purebred, monopoly, registration, membership, wrongful interference, fair procedure, monopolization"
Case 88,"district court, supplemental jurisdiction, plaintiffs', class member, attorney's fees, class representative, class action, 
abstention, diversity jurisdiction, federal court, state court, unnamed, novel, antitrust, absurd"
Case 89,"Settlement, elects, Antitrust, Products, notify, filing of the complaint, designates, Dealer, notice, consumers, 
advertise, terms, funded, parties, costs, lead counsel, resale price, distributed, MAIL, state antitrust law, monetary, 
retail, opt, prices, final approval, pricing policy, injunctive, void, administrative costs, natural person"
Case 90,"damages, compensatory damages, district court, matter of law, relevant market, comparable, golf, trade show, 
calculating, antitrust, grant a judgment, monopolization, profits, Sherman Act, reasonable certainty, fail to prove, lost 
profits, gross revenue, conspiring, sufficient evidence to support, award of punitive damages, breach of contract 
claim, estimated, relations, expenses, purposes, Counts, proven"
Case 91,"commerce, interstate commerce, regulation, schools, manufacturing, cases, commercial power, guns, federal 
government, interstate, violence, matters, Skills, substantial effect, intrastate, wheat, agriculture, federal power, 
Training, limits, powers, power of congress, Resources, gun possession, deference, power to regulate, rational 
basis, violent crime, school zone, principles"
Case 92,"taxicabs, regular, antitrust, defendants', relevant market, monopolization, regulations, alleges, competitors, 
passengers, motion to dismiss, counterclaims, Transportation, licensed, Lanham Act, misleading, restraint of trade, 
transit service, conspiracy, licensure, anti trust law, lower price, anticompetitive, advertising, verifiably, pleadings, 
violates, state law claim, customers, pick"
Case 93,"advertising, treble damages, partnership, antitrust, state court, anti trust law, Sherman Act, competitors, cartel, 
partnership dissolution, per se violation, summary judgment, district court, collusion, compete, markets"
Case 94,"privileges, recommendation, cases, reappointment, surgery, antitrust, conspiracy, immunity, peer review, 
restrictions, defendants', orthopedic, competitors, expire, Staff, voted, reasonable belief, reasonable effort, 
concerted action, negotiations, damages, peer review process, quality health care, provisional, patients, reasons, 
summary judgment, purposes, argues, entity"
Case 95,"prices, summary judgment, terminated, milk, defendants', monopolization, invoices, antitrust, Dairy, counterclaim, 
supplier, parties, alleges, summary judgment motion, products, monopoly power, overcharges, relevant market, 
customers, Sherman Act, Declaration, premium, duress, asserts, dealer, monopoly, plant, breach of contract, put 
forward, anti-competitive"
Case 96,"allegations, charges, Telephone, long distance, fraudulent, Counts, customer, pay telephone, antitrust, motion to 
dismiss, carrier, tariff, billing, practices, rates, regulation, blocking, Telegraph, immune, phones, market power, 
common carrier, state policy, calls made, Communications, lines, articulated, state action doctrine, anti trust law, 
operator-assisted"
Case 97,"antitrust, brokers, conspiracy, allegations, competitors, monopolize, sales agent, Sherman Act, residential real 
estate, anticompetitive, Counterclaim, sham, anti trust law, horizontal, franchisees, conspiracy to monopolize, 
Clayton Act, Plaintiffs', buyers', splits, relevant market, partial summary judgment, recruitment, damages, restraint 
of trade, pleadings, consumer, Defendants', conspirators, private enforcement"
Case 98,"Carrier, Steel, transport, termination, conspiracy, antitrust, plaintiffs', freight, conspire, Commerce, trucks, staff, 
contract carrier, Sherman Act, haul, wholly owned subsidiary, notice, employees, shipper, motor carrier, Elkins Act, 
subsidiary, parties, summary judgment motion, district court, acquisition, defendants', enterprise, concerted, 
incapable"
Case 99,"patent, antitrust, unfair competition, infringement, notice, motion to dismiss, Lanham Act, alleges, sham, malicious 
prosecution, abuse of process, prima facie tort, documents, Donnelly Act, judicata, argues, provisional remedy, 
plaintiff's claim, antitrust claim, district court, probable cause, invalidity, defending, immunity, lawsuit"
