Case Index,Core Terms
Case 78,"Contraband, discovery, magistrate judge, Escrow, antitrust, Sherman Act, restraint of trade, negotiation, drafting, 
clearly erroneous, state action doctrine, manufacturers, dormant, per se violation, cigarettes, precluding"
Case 79,"generic, tablet, manufacturers, dose, label, leflunomide, loading, bioequivalence, specifications, sham, summary 
judgment, regulations, responses, cluster, dosage, expert testimony, non-movant, baseless, immunity, merits"
Case 80,"affirmative defense, tortious interference, unclean hands, Pleadings, courts, tortfeasor's, Restatement, employees, 
campaign, immune, motive, plant"
Case 81,"patent, generic, district court, manufacturers, anticompetitive, exclusionary, effects, antitrust, rule of reason, 
settlement, settlement agreement, anti trust law, infringement, zone, summary judgment, patent holder, Sherman 
Act, ciprofloxacin, invalid, challenges, sham, appellant's contention, appellants assert, antitrust claim, Hatch-
Waxman Act, validity of the patent, circuits, unreasonable restraint, federal patent law, right to exclude"
Case 82,"card, posting, restitution, programming, subscription, satellite, signal, actual damage, piracy, Communications, 
unfair, hack, intercepted, pirated, competitor, injunction, oppression, consumers, equitable, channels, provider, 
Network, box, gain access, lose money, methodology, Violations, damages, set-top, testing"
Case 83,"REDACTED, license, patents, map, market power, declaration, manufacturer, contracts, summary judgment, 
navigation, supplier, appears, summary judgment motion, email, suggests, license agreement, argues, expert 
report, disclosure, customer, case management, patent license, rebuttal, tying arrangement, technology, effective, 
anti trust law, rule of reason, negotiations, presentation"
Case 84,"Station, restrictive covenant, default judgment, default, covenant, meritorious defense, petroleum product, motion to 
vacate, assignor, courts, lease assignment, brand, culpable, gasoline, factors, cases"
Case 85,"conspiracy, technology, clean-up, emails, summary judgment, plenary, removal, circumstantial evidence, 
communications, conspirators, attend, motive, individual member, ANTITRUST, dislike"
Case 86,"district court, prejudgment interest, breach of contract action, protected interest, instructions, wrongful withholding, 
tortious interference, parties, negotiations, immunity, business relationship, probable cause, cases, letter of intent, 
matter of law, damages, lawsuit, courts, summary judgment motion, interfered, rights, judicial opinion, summary 
judgment, antitrust, disputes, binding, mindset, motion for a new trial, terms, contract of purchase"
Case 87,"discrete, relevant market, products, alleges, integrated, Sherman Act, digital, Licensing, consumer, functionality, 
subsidiary, purposes, manufacture, substitutes, contends, motion to dismiss, markets, testing, prices"
Case 88,"patent, discovery, bifurcation, antitrust, damages, infringement, documents, willfulness, machines, overlap, motion 
to dismiss, circumstances, defendants', antitrust claim, state law claim, technology, cases, motion to bifurcate, 
customer, resin"
Case 89,"patent, Amend, pleadings, inequitable conduct, unfair competition, leave to amend, patent misuse, monetary 
damages, antitrust, regional"
Case 90,"antitrust, mortgages, lenders, defendants', plaintiffs', damages, antitrust statute, unjust enrichment, motion to 
dismiss, consumer, purchaser, consumer protection, injuries, factors, injunctive relief, class action, antitrust claim, 
anti trust law, state law, antitrust violation, allegations, conforming, originated, indirect, courts, Brick, common law, 
Clayton Act, intermediary, speculative"
Case 91,"natural gas, rates, filed rate doctrine, Trading, indices, Purchasers, sales, motion to dismiss, principles, wholesale, 
federal preemption, trial court, first sale, market-based, transactions, interstate, antitrust, prices, anti trust law, 
Marketing, resale, retail, challenging, Practices, preempted, commerce, utility company, preemption, inflated, 
lawsuits"
Case 92,"products, relevant market, tobacco product, allegations, franchise, contractual, motion to dismiss, antitrust claim, 
interchangeability, aftermarket, antitrust"
Case 93,"Ticket, sponsorship, summary judgment, monopolization, motion to dismiss, declaration, coercion, products, 
argues, freely, attested, contends, material fact, allegations, negotiating, undisputed, financing, hearsay, tie, alleged 
violation, Sherman Act, tying arrangement, genuine issue, deposition, monopoly, unsworn, funds, tying product, 
ticket sales, tied product"
Case 94,"baseless, lawsuits, summary judgment, patent, antitrust, sham, immunity, merits, cases, patent infringement, 
infringement, settlements, license, probable cause, counterclaims, proceedings, argues, courts, prong, patents-in-
suit, suits, genuine issue of material fact, motion to strike, matter of law, patent holder, fax-to-email, allegations"
Case 95,"shipment, carrier, shipper, shipping, insurer, package, allegations, parcels, tariff, cargo, transportation, common 
law, Interstate, domestic, limitation of liability, insurance coverage, unjust enrichment, tied product, antitrust, 
purchases, Commerce, contends, customer, insurance contract, Carmack Amendment, bundled, parties"
Case 96,"conspiracy, class member, predominate, class action, class certification, Defendants', negotiations, alleged 
conspiracy, Plaintiffs', class-wide, subclass, commission rate, real estate, affiliates, antitrust, questions, common 
question, damages, merits, prices, real estate broker, commissions, individual issues, common issue, conspired, 
inflated, individualized, price-fixing, certify, Courts"
Case 97,"vitamin, Ministry, export, prices, manufacturers, Chamber, cartel, defendants', compulsion, chamber of commerce, 
coordination, motion to dismiss, foreign sovereign, regulations, complaints, conspiracy, Products, Importers, 
antitrust, kilogram, Customs, charter, Pharmaceutical, notice, Chop, documents, sovereign, percent, comity, fix 
prices"
Case 98,"fuel, surcharge, allegations, conspiracy, railroads, plaintiffs', transportation, defendants', meetings, restraint of trade, 
motion to dismiss, freight, costs, escalation, conspired, prices, antitrust, coordinated, factual allegations, alleged 
conspiracy, profits"
Case 99,"unfair competition, deadline, discovery, punitive damages, amend, amend a pleading, good cause, diligence, 
scheduling order"
Case 100,"antitrust, overdraft, amended complaint, allegations, conspiracy, motion to dismiss, Sherman Act, banks, predicate 
act, antitrust claim, mail fraud, amend, pro se, racketeering, monopoly, antitrust violation, Hobbs Act, factual 
allegations, alleged conspiracy, monopoly power, anticompetitive, speculative, extortion, asserts"
